ID	RowID	LTARSite.Code	Category	DataSetVariableName	AttributeDescription	Units	TemporalResolution	TemporalResolutionStandard	StartDate	StartDateStandard	StartDateAgCROS	EndDate	EndDateStandard	EndDateAgCros	DateDif_yrs	ResponsiblePersons	StorageFormat	URLdataAccess	LocationIDoutsideNetwork	SpatialRepeats	SpatialDescription	PublicAccess	Network.Category	AgCROS.Table	AgCROS.VarName	NALT.Keywords	subsite	Repo.Name	Model.Name	NALT.Subject	ISO.Topic	Common.Experiment
GB3042	3042	GB	METEOROLOGY	l1_orc1_climate_wnd3dr	resultant wind direction	°N	15 minute	15 minute	3/16/98	1998-03-16	1998-03-16	1/28/19	2019-01-28	2019-01-28	21	Marks	SAS V9			1	point	Open	Biodiversity	WeatherDaily, WeatherStation	Wind direction air, daily, mean					Natural Resources, Earth and Environmental Sciences	climatologyMeteorologyAtmosphere	no
GB3043	3043	GB	LAND-ATMOSPHERE FLUXES (EC)	qmbsecflux_shf_3	soil heat flux	W/m2	30 minute	30 minute	7/31/14	2014-07-31	2014-07-31	10/27/17	2017-10-27	2017-10-27	3	Flerchinger	SAS V9	Ameriflux	US-Rms	1	point	Open	Eddy Covariance	AmeriFlux	Soil Heat Flux 	Meteorology, Eddy Covariance				Research, Technology and Engineering	climatologyMeteorologyAtmosphere	no
GB3044	3044	GB	LAND-ATMOSPHERE FLUXES (EC)	qmbsecflux_ir_tc	infrared surface temperature	°C	30 minute	30 minute	5/6/15	2015-05-06	2015-05-06	3/24/19	2019-03-24	2019-03-24	4	Flerchinger	SAS V9	Ameriflux	US-Rms	1	point	Open	Eddy Covariance	AmeriFlux	unresolved	Meteorology, Eddy Covariance				Research, Technology and Engineering	climatologyMeteorologyAtmosphere	
GB3045	3045	GB	LAND-ATMOSPHERE FLUXES (EC)	qmbsecflux_par	photosynthetically active radiation	photons/m2/s	30 minute	30 minute	5/6/15	2015-05-06	2015-05-06	3/24/19	2019-03-24	2019-03-24	4	Flerchinger	SAS V9	Ameriflux	US-Rms	1	point	Open	Eddy Covariance	AmeriFlux	unresolved	Meteorology, Eddy Covariance				Research, Technology and Engineering	climatologyMeteorologyAtmosphere	
GB3046	3046	GB	LAND-ATMOSPHERE FLUXES (EC)	qlosecflux_ir_tc	infrared surface temperature	°C	30 minute	30 minute	4/30/15	2015-04-30	2015-04-30	3/24/19	2019-03-24	2019-03-24	4	Flerchinger	SAS V9	Ameriflux	US-Rls	1	point	Open	Eddy Covariance	AmeriFlux	unresolved	Meteorology, Eddy Covariance				Research, Technology and Engineering	climatologyMeteorologyAtmosphere	
GB3047	3047	GB	LAND-ATMOSPHERE FLUXES (EC)	qwbsecflux_ir_tc	infrared surface temperature	°C	30 minute	30 minute	4/30/15	2015-04-30	2015-04-30	3/24/19	2019-03-24	2019-03-24	4	Flerchinger	SAS V9	Ameriflux	US-Rws	1	point	Open	Eddy Covariance	AmeriFlux	unresolved	Meteorology, Eddy Covariance				Research, Technology and Engineering	climatologyMeteorologyAtmosphere	
GB3048	3048	GB	LAND-ATMOSPHERE FLUXES (EC)	q138h08ecflux_par	photosynthetically active radiation	photons/m2/s	30 minute	30 minute	4/30/15	2015-04-30	2015-04-30	3/24/19	2019-03-24	2019-03-24	4	Flerchinger	SAS V9			1	point	Open	Eddy Covariance	AmeriFlux	unresolved	Meteorology, Eddy Covariance				Research, Technology and Engineering	climatologyMeteorologyAtmosphere	
GB3049	3049	GB	LAND-ATMOSPHERE FLUXES (EC)	qlosecflux_par	photosynthetically active radiation	photons/m2/s	30 minute	30 minute	4/30/15	2015-04-30	2015-04-30	3/24/19	2019-03-24	2019-03-24	4	Flerchinger	SAS V9	Ameriflux	US-Rls	1	point	Open	Eddy Covariance	AmeriFlux	unresolved	Meteorology, Eddy Covariance				Research, Technology and Engineering	climatologyMeteorologyAtmosphere	
GB3050	3050	GB	LAND-ATMOSPHERE FLUXES (EC)	qwbsecflux_par	photosynthetically active radiation	photons/m2/s	30 minute	30 minute	4/30/15	2015-04-30	2015-04-30	3/24/19	2019-03-24	2019-03-24	4	Flerchinger	SAS V9	Ameriflux	US-Rws	1	point	Open	Eddy Covariance	AmeriFlux	unresolved	Meteorology, Eddy Covariance				Research, Technology and Engineering	climatologyMeteorologyAtmosphere	
GB3051	3051	GB	LAND-ATMOSPHERE FLUXES (EC)	qmbsecflux_shf_1	soil heat flux	W/m2	30 minute	30 minute	8/18/14	2014-08-18	2014-08-18	10/9/18	2018-10-09	2018-10-09	4	Flerchinger	SAS V9	Ameriflux	US-Rms	1	point	Open	Eddy Covariance	AmeriFlux	Soil Heat Flux 	Meteorology, Eddy Covariance				Research, Technology and Engineering	climatologyMeteorologyAtmosphere	no
GB3052	3052	GB	LAND-ATMOSPHERE FLUXES (EC)	qmbsecflux_shf_6	soil heat flux	W/m2	30 minute	30 minute	8/18/14	2014-08-18	2014-08-18	1/19/19	2019-01-19	2019-01-19	4	Flerchinger	SAS V9	Ameriflux	US-Rms	1	point	Open	Eddy Covariance	AmeriFlux	Soil Heat Flux 	Meteorology, Eddy Covariance				Research, Technology and Engineering	climatologyMeteorologyAtmosphere	no
GB3053	3053	GB	LAND-ATMOSPHERE FLUXES (EC)	qwbsecflux_albedo	average albedo	dimensionless	30 minute	30 minute	9/16/14	2014-09-16	2014-09-16	3/24/19	2019-03-24	2019-03-24	5	Flerchinger	SAS V9	Ameriflux	US-Rws	1	point	Open	Eddy Covariance	AmeriFlux	unresolved	Meteorology, Eddy Covariance				Research, Technology and Engineering	climatologyMeteorologyAtmosphere	
GB3054	3054	GB	LAND-ATMOSPHERE FLUXES (EC)	qwbsecflux_co2_cr	CO2 concentration	mg/m2/s	30 minute	30 minute	9/16/14	2014-09-16	2014-09-16	3/24/19	2019-03-24	2019-03-24	5	Flerchinger	SAS V9	Ameriflux	US-Rws	1	point	Open	Eddy Covariance	AmeriFlux	unresolved	Meteorology, Eddy Covariance				Research, Technology and Engineering	climatologyMeteorologyAtmosphere	
GB3055	3055	GB	LAND-ATMOSPHERE FLUXES (EC)	qwbsecflux_fc_un_cr	CO2 flux	mg/m2	30 minute	30 minute	9/16/14	2014-09-16	2014-09-16	3/24/19	2019-03-24	2019-03-24	5	Flerchinger	SAS V9	Ameriflux	US-Rws	1	point	Open	Eddy Covariance	AmeriFlux	unresolved	Meteorology, Eddy Covariance				Research, Technology and Engineering	climatologyMeteorologyAtmosphere	
GB3056	3056	GB	LAND-ATMOSPHERE FLUXES (EC)	qwbsecflux_h2o_cr	water vapor density	g/m2	30 minute	30 minute	9/16/14	2014-09-16	2014-09-16	3/24/19	2019-03-24	2019-03-24	5	Flerchinger	SAS V9	Ameriflux	US-Rws	1	point	Open	Eddy Covariance	AmeriFlux	unresolved	Meteorology, Eddy Covariance				Research, Technology and Engineering	climatologyMeteorologyAtmosphere	
GB3057	3057	GB	LAND-ATMOSPHERE FLUXES (EC)	qwbsecflux_h_un_cr	sensible heat flux	W/m2	30 minute	30 minute	9/16/14	2014-09-16	2014-09-16	3/24/19	2019-03-24	2019-03-24	5	Flerchinger	SAS V9	Ameriflux	US-Rws	1	point	Open	Eddy Covariance	AmeriFlux	unresolved	Meteorology, Eddy Covariance				Research, Technology and Engineering	climatologyMeteorologyAtmosphere	
GB3058	3058	GB	LAND-ATMOSPHERE FLUXES (EC)	qwbsecflux_le_un_cr	latent heat flux	W/m2	30 minute	30 minute	9/16/14	2014-09-16	2014-09-16	3/24/19	2019-03-24	2019-03-24	5	Flerchinger	SAS V9	Ameriflux	US-Rws	1	point	Open	Eddy Covariance	AmeriFlux	unresolved	Meteorology, Eddy Covariance				Research, Technology and Engineering	climatologyMeteorologyAtmosphere	
GB3059	3059	GB	LAND-ATMOSPHERE FLUXES (EC)	qwbsecflux_press_cr	air pressure	kPa	30 minute	30 minute	9/16/14	2014-09-16	2014-09-16	3/24/19	2019-03-24	2019-03-24	5	Flerchinger	SAS V9	Ameriflux	US-Rws	1	point	Open	Eddy Covariance	AmeriFlux	unresolved	Meteorology, Eddy Covariance				Research, Technology and Engineering	climatologyMeteorologyAtmosphere	
GB3060	3060	GB	LAND-ATMOSPHERE FLUXES (EC)	qwbsecflux_rl_dwnwell	incoming thermal radiation	W/m2	30 minute	30 minute	9/16/14	2014-09-16	2014-09-16	3/24/19	2019-03-24	2019-03-24	5	Flerchinger	SAS V9	Ameriflux	US-Rws	1	point	Open	Eddy Covariance	AmeriFlux	unresolved	Meteorology, Eddy Covariance				Research, Technology and Engineering	climatologyMeteorologyAtmosphere	
GB3061	3061	GB	LAND-ATMOSPHERE FLUXES (EC)	qwbsecflux_rl_upwell	outgoing thermal radiation	W/m2	30 minute	30 minute	9/16/14	2014-09-16	2014-09-16	3/24/19	2019-03-24	2019-03-24	5	Flerchinger	SAS V9	Ameriflux	US-Rws	1	point	Open	Eddy Covariance	AmeriFlux	unresolved	Meteorology, Eddy Covariance				Research, Technology and Engineering	climatologyMeteorologyAtmosphere	
GB3062	3062	GB	LAND-ATMOSPHERE FLUXES (EC)	qwbsecflux_rs_dwnwell	incoming thermal radiation	W/m2	30 minute	30 minute	9/16/14	2014-09-16	2014-09-16	3/24/19	2019-03-24	2019-03-24	5	Flerchinger	SAS V9	Ameriflux	US-Rws	1	point	Open	Eddy Covariance	AmeriFlux	unresolved	Meteorology, Eddy Covariance				Research, Technology and Engineering	climatologyMeteorologyAtmosphere	
GB3063	3063	GB	LAND-ATMOSPHERE FLUXES (EC)	qwbsecflux_rs_upwell	outgoing solar radiation	W/m2	30 minute	30 minute	9/16/14	2014-09-16	2014-09-16	3/24/19	2019-03-24	2019-03-24	5	Flerchinger	SAS V9	Ameriflux	US-Rws	1	point	Open	Eddy Covariance	AmeriFlux	unresolved	Meteorology, Eddy Covariance				Research, Technology and Engineering	climatologyMeteorologyAtmosphere	
GB3064	3064	GB	LAND-ATMOSPHERE FLUXES (EC)	qwbsecflux_shf_1	soil heat flux	W/m2	30 minute	30 minute	9/16/14	2014-09-16	2014-09-16	3/24/19	2019-03-24	2019-03-24	5	Flerchinger	SAS V9	Ameriflux	US-Rws	1	point	Open	Eddy Covariance	AmeriFlux	Soil Heat Flux 	Meteorology, Eddy Covariance				Research, Technology and Engineering	climatologyMeteorologyAtmosphere	no
GB3065	3065	GB	LAND-ATMOSPHERE FLUXES (EC)	qwbsecflux_shf_2	soil heat flux	W/m2	30 minute	30 minute	9/16/14	2014-09-16	2014-09-16	3/24/19	2019-03-24	2019-03-24	5	Flerchinger	SAS V9	Ameriflux	US-Rws	1	point	Open	Eddy Covariance	AmeriFlux	Soil Heat Flux 	Meteorology, Eddy Covariance				Research, Technology and Engineering	climatologyMeteorologyAtmosphere	no
GB3066	3066	GB	LAND-ATMOSPHERE FLUXES (EC)	qwbsecflux_shf_3	soil heat flux	W/m2	30 minute	30 minute	9/16/14	2014-09-16	2014-09-16	3/24/19	2019-03-24	2019-03-24	5	Flerchinger	SAS V9	Ameriflux	US-Rws	1	point	Open	Eddy Covariance	AmeriFlux	Soil Heat Flux 	Meteorology, Eddy Covariance				Research, Technology and Engineering	climatologyMeteorologyAtmosphere	no
GB3067	3067	GB	LAND-ATMOSPHERE FLUXES (EC)	qwbsecflux_shf_4	soil heat flux	W/m2	30 minute	30 minute	9/16/14	2014-09-16	2014-09-16	3/24/19	2019-03-24	2019-03-24	5	Flerchinger	SAS V9	Ameriflux	US-Rws	1	point	Open	Eddy Covariance	AmeriFlux	Soil Heat Flux 	Meteorology, Eddy Covariance				Research, Technology and Engineering	climatologyMeteorologyAtmosphere	no
GB3068	3068	GB	LAND-ATMOSPHERE FLUXES (EC)	qwbsecflux_shf_5	soil heat flux	W/m2	30 minute	30 minute	9/16/14	2014-09-16	2014-09-16	3/24/19	2019-03-24	2019-03-24	5	Flerchinger	SAS V9	Ameriflux	US-Rws	1	point	Open	Eddy Covariance	AmeriFlux	Soil Heat Flux 	Meteorology, Eddy Covariance				Research, Technology and Engineering	climatologyMeteorologyAtmosphere	no
GB3069	3069	GB	LAND-ATMOSPHERE FLUXES (EC)	qwbsecflux_shf_6	soil heat flux	W/m2	30 minute	30 minute	9/16/14	2014-09-16	2014-09-16	3/24/19	2019-03-24	2019-03-24	5	Flerchinger	SAS V9	Ameriflux	US-Rws	1	point	Open	Eddy Covariance	AmeriFlux	Soil Heat Flux 	Meteorology, Eddy Covariance				Research, Technology and Engineering	climatologyMeteorologyAtmosphere	no
GB3070	3070	GB	LAND-ATMOSPHERE FLUXES (EC)	qlosecflux_co2_cr	CO2 concentration	mg/m2/s	30 minute	30 minute	9/10/14	2014-09-10	2014-09-10	3/24/19	2019-03-24	2019-03-24	5	Flerchinger	SAS V9	Ameriflux	US-Rls	1	point	Open	Eddy Covariance	AmeriFlux	unresolved	Meteorology, Eddy Covariance				Research, Technology and Engineering	climatologyMeteorologyAtmosphere	
GB3071	3071	GB	LAND-ATMOSPHERE FLUXES (EC)	qlosecflux_fc_un_cr	CO2 flux	mg/m2	30 minute	30 minute	9/10/14	2014-09-10	2014-09-10	3/24/19	2019-03-24	2019-03-24	5	Flerchinger	SAS V9	Ameriflux	US-Rls	1	point	Open	Eddy Covariance	AmeriFlux	unresolved	Meteorology, Eddy Covariance				Research, Technology and Engineering	climatologyMeteorologyAtmosphere	
GB3072	3072	GB	LAND-ATMOSPHERE FLUXES (EC)	qlosecflux_h2o_cr	water vapor density	g/m2	30 minute	30 minute	9/10/14	2014-09-10	2014-09-10	3/24/19	2019-03-24	2019-03-24	5	Flerchinger	SAS V9	Ameriflux	US-Rls	1	point	Open	Eddy Covariance	AmeriFlux	unresolved	Meteorology, Eddy Covariance				Research, Technology and Engineering	climatologyMeteorologyAtmosphere	
GB3073	3073	GB	LAND-ATMOSPHERE FLUXES (EC)	qlosecflux_h_un_cr	sensible heat flux	W/m2	30 minute	30 minute	9/10/14	2014-09-10	2014-09-10	3/24/19	2019-03-24	2019-03-24	5	Flerchinger	SAS V9	Ameriflux	US-Rls	1	point	Open	Eddy Covariance	AmeriFlux	unresolved	Meteorology, Eddy Covariance				Research, Technology and Engineering	climatologyMeteorologyAtmosphere	
GB3074	3074	GB	LAND-ATMOSPHERE FLUXES (EC)	qlosecflux_le_un_cr	latent heat flux	W/m2	30 minute	30 minute	9/10/14	2014-09-10	2014-09-10	3/24/19	2019-03-24	2019-03-24	5	Flerchinger	SAS V9	Ameriflux	US-Rls	1	point	Open	Eddy Covariance	AmeriFlux	unresolved	Meteorology, Eddy Covariance				Research, Technology and Engineering	climatologyMeteorologyAtmosphere	
GB3075	3075	GB	LAND-ATMOSPHERE FLUXES (EC)	qlosecflux_press_cr	air pressure	kPa	30 minute	30 minute	9/10/14	2014-09-10	2014-09-10	3/24/19	2019-03-24	2019-03-24	5	Flerchinger	SAS V9	Ameriflux	US-Rls	1	point	Open	Eddy Covariance	AmeriFlux	unresolved	Meteorology, Eddy Covariance				Research, Technology and Engineering	climatologyMeteorologyAtmosphere	
GB3076	3076	GB	LAND-ATMOSPHERE FLUXES (EC)	qmbsecflux_shf_2	soil heat flux	W/m2	30 minute	30 minute	8/18/14	2014-08-18	2014-08-18	3/24/19	2019-03-24	2019-03-24	5	Flerchinger	SAS V9	Ameriflux	US-Rms	1	point	Open	Eddy Covariance	AmeriFlux	Soil Heat Flux 	Meteorology, Eddy Covariance				Research, Technology and Engineering	climatologyMeteorologyAtmosphere	no
GB3077	3077	GB	LAND-ATMOSPHERE FLUXES (EC)	qmbsecflux_shf_5	soil heat flux	W/m2	30 minute	30 minute	8/18/14	2014-08-18	2014-08-18	3/24/19	2019-03-24	2019-03-24	5	Flerchinger	SAS V9	Ameriflux	US-Rms	1	point	Open	Eddy Covariance	AmeriFlux	Soil Heat Flux 	Meteorology, Eddy Covariance				Research, Technology and Engineering	climatologyMeteorologyAtmosphere	no
GB3078	3078	GB	LAND-ATMOSPHERE FLUXES (EC)	qmbsecflux_fc_un_cr	CO2 flux	mg/m2	30 minute	30 minute	7/31/14	2014-07-31	2014-07-31	3/23/19	2019-03-23	2019-03-23	5	Flerchinger	SAS V9	Ameriflux	US-Rms	1	point	Open	Eddy Covariance	AmeriFlux	unresolved	Meteorology, Eddy Covariance				Research, Technology and Engineering	climatologyMeteorologyAtmosphere	
GB3079	3079	GB	LAND-ATMOSPHERE FLUXES (EC)	qmbsecflux_h_un_cr	sensible heat flux	W/m2	30 minute	30 minute	7/31/14	2014-07-31	2014-07-31	3/23/19	2019-03-23	2019-03-23	5	Flerchinger	SAS V9	Ameriflux	US-Rms	1	point	Open	Eddy Covariance	AmeriFlux	unresolved	Meteorology, Eddy Covariance				Research, Technology and Engineering	climatologyMeteorologyAtmosphere	
GB3080	3080	GB	LAND-ATMOSPHERE FLUXES (EC)	qmbsecflux_le_un_cr	latent heat flux	W/m2	30 minute	30 minute	7/31/14	2014-07-31	2014-07-31	3/23/19	2019-03-23	2019-03-23	5	Flerchinger	SAS V9	Ameriflux	US-Rms	1	point	Open	Eddy Covariance	AmeriFlux	unresolved	Meteorology, Eddy Covariance				Research, Technology and Engineering	climatologyMeteorologyAtmosphere	
GB3081	3081	GB	LAND-ATMOSPHERE FLUXES (EC)	qmbsecflux_albedo	average albedo	dimensionless	30 minute	30 minute	7/31/14	2014-07-31	2014-07-31	3/24/19	2019-03-24	2019-03-24	5	Flerchinger	SAS V9	Ameriflux	US-Rms	1	point	Open	Eddy Covariance	AmeriFlux	unresolved	Meteorology, Eddy Covariance				Research, Technology and Engineering	climatologyMeteorologyAtmosphere	
GB3082	3082	GB	LAND-ATMOSPHERE FLUXES (EC)	qmbsecflux_co2_cr	CO2 concentration	mg/m2/s	30 minute	30 minute	7/31/14	2014-07-31	2014-07-31	3/24/19	2019-03-24	2019-03-24	5	Flerchinger	SAS V9	Ameriflux	US-Rms	1	point	Open	Eddy Covariance	AmeriFlux	unresolved	Meteorology, Eddy Covariance				Research, Technology and Engineering	climatologyMeteorologyAtmosphere	
GB3083	3083	GB	LAND-ATMOSPHERE FLUXES (EC)	qmbsecflux_h2o_cr	water vapor density	g/m2	30 minute	30 minute	7/31/14	2014-07-31	2014-07-31	3/24/19	2019-03-24	2019-03-24	5	Flerchinger	SAS V9	Ameriflux	US-Rms	1	point	Open	Eddy Covariance	AmeriFlux	unresolved	Meteorology, Eddy Covariance				Research, Technology and Engineering	climatologyMeteorologyAtmosphere	
GB3084	3084	GB	LAND-ATMOSPHERE FLUXES (EC)	qmbsecflux_press_cr	air pressure	kPa	30 minute	30 minute	7/31/14	2014-07-31	2014-07-31	3/24/19	2019-03-24	2019-03-24	5	Flerchinger	SAS V9	Ameriflux	US-Rms	1	point	Open	Eddy Covariance	AmeriFlux	unresolved	Meteorology, Eddy Covariance				Research, Technology and Engineering	climatologyMeteorologyAtmosphere	
GB3085	3085	GB	LAND-ATMOSPHERE FLUXES (EC)	qmbsecflux_rl_dwnwell	incoming thermal radiation	W/m2	30 minute	30 minute	7/31/14	2014-07-31	2014-07-31	3/24/19	2019-03-24	2019-03-24	5	Flerchinger	SAS V9	Ameriflux	US-Rms	1	point	Open	Eddy Covariance	AmeriFlux	unresolved	Meteorology, Eddy Covariance				Research, Technology and Engineering	climatologyMeteorologyAtmosphere	
GB3086	3086	GB	LAND-ATMOSPHERE FLUXES (EC)	qmbsecflux_rl_upwell	outgoing thermal radiation	W/m2	30 minute	30 minute	7/31/14	2014-07-31	2014-07-31	3/24/19	2019-03-24	2019-03-24	5	Flerchinger	SAS V9	Ameriflux	US-Rms	1	point	Open	Eddy Covariance	AmeriFlux	unresolved	Meteorology, Eddy Covariance				Research, Technology and Engineering	climatologyMeteorologyAtmosphere	
GB3087	3087	GB	LAND-ATMOSPHERE FLUXES (EC)	qmbsecflux_rs_dwnwell	incoming thermal radiation	W/m2	30 minute	30 minute	7/31/14	2014-07-31	2014-07-31	3/24/19	2019-03-24	2019-03-24	5	Flerchinger	SAS V9	Ameriflux	US-Rms	1	point	Open	Eddy Covariance	AmeriFlux	unresolved	Meteorology, Eddy Covariance				Research, Technology and Engineering	climatologyMeteorologyAtmosphere	
GB3088	3088	GB	LAND-ATMOSPHERE FLUXES (EC)	qmbsecflux_rs_upwell	outgoing solar radiation	W/m2	30 minute	30 minute	7/31/14	2014-07-31	2014-07-31	3/24/19	2019-03-24	2019-03-24	5	Flerchinger	SAS V9	Ameriflux	US-Rms	1	point	Open	Eddy Covariance	AmeriFlux	unresolved	Meteorology, Eddy Covariance				Research, Technology and Engineering	climatologyMeteorologyAtmosphere	
GB3089	3089	GB	LAND-ATMOSPHERE FLUXES (EC)	qmbsecflux_shf_4	soil heat flux	W/m2	30 minute	30 minute	7/31/14	2014-07-31	2014-07-31	3/24/19	2019-03-24	2019-03-24	5	Flerchinger	SAS V9	Ameriflux	US-Rms	1	point	Open	Eddy Covariance	AmeriFlux	Soil Heat Flux 	Meteorology, Eddy Covariance				Research, Technology and Engineering	climatologyMeteorologyAtmosphere	no
GB3090	3090	GB	LAND-ATMOSPHERE FLUXES (EC)	qlosecflux_albedo	average albedo	dimensionless	30 minute	30 minute	7/29/14	2014-07-29	2014-07-29	3/24/19	2019-03-24	2019-03-24	5	Flerchinger	SAS V9	Ameriflux	US-Rls	1	point	Open	Eddy Covariance	AmeriFlux	unresolved	Meteorology, Eddy Covariance				Research, Technology and Engineering	climatologyMeteorologyAtmosphere	
GB3091	3091	GB	LAND-ATMOSPHERE FLUXES (EC)	qlosecflux_rl_dwnwell	incoming thermal radiation	W/m2	30 minute	30 minute	7/29/14	2014-07-29	2014-07-29	3/24/19	2019-03-24	2019-03-24	5	Flerchinger	SAS V9	Ameriflux	US-Rls	1	point	Open	Eddy Covariance	AmeriFlux	unresolved	Meteorology, Eddy Covariance				Research, Technology and Engineering	climatologyMeteorologyAtmosphere	
GB3092	3092	GB	LAND-ATMOSPHERE FLUXES (EC)	qlosecflux_rl_upwell	outgoing thermal radiation	W/m2	30 minute	30 minute	7/29/14	2014-07-29	2014-07-29	3/24/19	2019-03-24	2019-03-24	5	Flerchinger	SAS V9	Ameriflux	US-Rls	1	point	Open	Eddy Covariance	AmeriFlux	unresolved	Meteorology, Eddy Covariance				Research, Technology and Engineering	climatologyMeteorologyAtmosphere	
GB3093	3093	GB	LAND-ATMOSPHERE FLUXES (EC)	qlosecflux_rs_dwnwell	incoming thermal radiation	W/m2	30 minute	30 minute	7/29/14	2014-07-29	2014-07-29	3/24/19	2019-03-24	2019-03-24	5	Flerchinger	SAS V9	Ameriflux	US-Rls	1	point	Open	Eddy Covariance	AmeriFlux	unresolved	Meteorology, Eddy Covariance				Research, Technology and Engineering	climatologyMeteorologyAtmosphere	
GB3094	3094	GB	LAND-ATMOSPHERE FLUXES (EC)	qlosecflux_rs_upwell	outgoing solar radiation	W/m2	30 minute	30 minute	7/29/14	2014-07-29	2014-07-29	3/24/19	2019-03-24	2019-03-24	5	Flerchinger	SAS V9	Ameriflux	US-Rls	1	point	Open	Eddy Covariance	AmeriFlux	unresolved	Meteorology, Eddy Covariance				Research, Technology and Engineering	climatologyMeteorologyAtmosphere	
GB3095	3095	GB	LAND-ATMOSPHERE FLUXES (EC)	qlosecflux_shf_1	soil heat flux	W/m2	30 minute	30 minute	7/29/14	2014-07-29	2014-07-29	3/24/19	2019-03-24	2019-03-24	5	Flerchinger	SAS V9	Ameriflux	US-Rls	1	point	Open	Eddy Covariance	AmeriFlux	Soil Heat Flux 	Meteorology, Eddy Covariance				Research, Technology and Engineering	climatologyMeteorologyAtmosphere	no
GB3096	3096	GB	LAND-ATMOSPHERE FLUXES (EC)	qlosecflux_shf_2	soil heat flux	W/m2	30 minute	30 minute	7/29/14	2014-07-29	2014-07-29	3/24/19	2019-03-24	2019-03-24	5	Flerchinger	SAS V9	Ameriflux	US-Rls	1	point	Open	Eddy Covariance	AmeriFlux	Soil Heat Flux 	Meteorology, Eddy Covariance				Research, Technology and Engineering	climatologyMeteorologyAtmosphere	no
GB3097	3097	GB	LAND-ATMOSPHERE FLUXES (EC)	qlosecflux_shf_3	soil heat flux	W/m2	30 minute	30 minute	7/29/14	2014-07-29	2014-07-29	3/24/19	2019-03-24	2019-03-24	5	Flerchinger	SAS V9	Ameriflux	US-Rls	1	point	Open	Eddy Covariance	AmeriFlux	Soil Heat Flux 	Meteorology, Eddy Covariance				Research, Technology and Engineering	climatologyMeteorologyAtmosphere	no
GB3098	3098	GB	LAND-ATMOSPHERE FLUXES (EC)	qlosecflux_shf_4	soil heat flux	W/m2	30 minute	30 minute	7/29/14	2014-07-29	2014-07-29	3/24/19	2019-03-24	2019-03-24	5	Flerchinger	SAS V9	Ameriflux	US-Rls	1	point	Open	Eddy Covariance	AmeriFlux	Soil Heat Flux 	Meteorology, Eddy Covariance				Research, Technology and Engineering	climatologyMeteorologyAtmosphere	no
GB3099	3099	GB	LAND-ATMOSPHERE FLUXES (EC)	qlosecflux_shf_5	soil heat flux	W/m2	30 minute	30 minute	7/29/14	2014-07-29	2014-07-29	3/24/19	2019-03-24	2019-03-24	5	Flerchinger	SAS V9	Ameriflux	US-Rls	1	point	Open	Eddy Covariance	AmeriFlux	Soil Heat Flux 	Meteorology, Eddy Covariance				Research, Technology and Engineering	climatologyMeteorologyAtmosphere	no
GB3100	3100	GB	LAND-ATMOSPHERE FLUXES (EC)	qlosecflux_shf_6	soil heat flux	W/m2	30 minute	30 minute	7/29/14	2014-07-29	2014-07-29	3/24/19	2019-03-24	2019-03-24	5	Flerchinger	SAS V9	Ameriflux	US-Rls	1	point	Open	Eddy Covariance	AmeriFlux	Soil Heat Flux 	Meteorology, Eddy Covariance				Research, Technology and Engineering	climatologyMeteorologyAtmosphere	no
GB3101	3101	GB	LAND-ATMOSPHERE FLUXES (EC)	q138h08ecflux_shf_1	soil heat flux	W/m2	30 minute	30 minute	8/16/05	2005-08-16	2005-08-16	9/11/18	2018-09-11	2018-09-11	13	Flerchinger	SAS V9			1	point	Open	Eddy Covariance	AmeriFlux	Soil Heat Flux 	Meteorology, Eddy Covariance				Research, Technology and Engineering	climatologyMeteorologyAtmosphere	no
GB3102	3102	GB	LAND-ATMOSPHERE FLUXES (EC)	q138h08ecflux_ir_tc	infrared surface temperature	°C	30 minute	30 minute	1/26/06	2006-01-26	2006-01-26	3/24/19	2019-03-24	2019-03-24	13	Flerchinger	SAS V9			1	point	Open	Eddy Covariance	AmeriFlux	unresolved	Meteorology, Eddy Covariance				Research, Technology and Engineering	climatologyMeteorologyAtmosphere	
GB3103	3103	GB	LAND-ATMOSPHERE FLUXES (EC)	q138h08ecflux_albedo	average albedo	dimensionless	30 minute	30 minute	8/16/05	2005-08-16	2005-08-16	3/24/19	2019-03-24	2019-03-24	14	Flerchinger	SAS V9			1	point	Open	Eddy Covariance	AmeriFlux	unresolved	Meteorology, Eddy Covariance				Research, Technology and Engineering	climatologyMeteorologyAtmosphere	
GB3104	3104	GB	LAND-ATMOSPHERE FLUXES (EC)	q138h08ecflux_co2_cr	CO2 concentration	mg/m2/s	30 minute	30 minute	8/16/05	2005-08-16	2005-08-16	3/24/19	2019-03-24	2019-03-24	14	Flerchinger	SAS V9			1	point	Open	Eddy Covariance	AmeriFlux	unresolved	Meteorology, Eddy Covariance				Research, Technology and Engineering	climatologyMeteorologyAtmosphere	
GB3105	3105	GB	LAND-ATMOSPHERE FLUXES (EC)	q138h08ecflux_fc_un_cr	CO2 flux	mg/m2	30 minute	30 minute	8/16/05	2005-08-16	2005-08-16	3/24/19	2019-03-24	2019-03-24	14	Flerchinger	SAS V9			1	point	Open	Eddy Covariance	AmeriFlux	unresolved	Meteorology, Eddy Covariance				Research, Technology and Engineering	climatologyMeteorologyAtmosphere	
GB3106	3106	GB	LAND-ATMOSPHERE FLUXES (EC)	q138h08ecflux_h2o_cr	water vapor density	g/m2	30 minute	30 minute	8/16/05	2005-08-16	2005-08-16	3/24/19	2019-03-24	2019-03-24	14	Flerchinger	SAS V9			1	point	Open	Eddy Covariance	AmeriFlux	unresolved	Meteorology, Eddy Covariance				Research, Technology and Engineering	climatologyMeteorologyAtmosphere	
GB3107	3107	GB	LAND-ATMOSPHERE FLUXES (EC)	q138h08ecflux_h_un_cr	sensible heat flux	W/m2	30 minute	30 minute	8/16/05	2005-08-16	2005-08-16	3/24/19	2019-03-24	2019-03-24	14	Flerchinger	SAS V9			1	point	Open	Eddy Covariance	AmeriFlux	unresolved	Meteorology, Eddy Covariance				Research, Technology and Engineering	climatologyMeteorologyAtmosphere	
GB3108	3108	GB	LAND-ATMOSPHERE FLUXES (EC)	q138h08ecflux_le_un_cr	latent heat flux	W/m2	30 minute	30 minute	8/16/05	2005-08-16	2005-08-16	3/24/19	2019-03-24	2019-03-24	14	Flerchinger	SAS V9			1	point	Open	Eddy Covariance	AmeriFlux	unresolved	Meteorology, Eddy Covariance				Research, Technology and Engineering	climatologyMeteorologyAtmosphere	
GB3109	3109	GB	LAND-ATMOSPHERE FLUXES (EC)	q138h08ecflux_press_cr	air pressure	kPa	30 minute	30 minute	8/16/05	2005-08-16	2005-08-16	3/24/19	2019-03-24	2019-03-24	14	Flerchinger	SAS V9			1	point	Open	Eddy Covariance	AmeriFlux	unresolved	Meteorology, Eddy Covariance				Research, Technology and Engineering	climatologyMeteorologyAtmosphere	
GB3110	3110	GB	LAND-ATMOSPHERE FLUXES (EC)	q138h08ecflux_rl_dwnwell	incoming thermal radiation	W/m2	30 minute	30 minute	8/16/05	2005-08-16	2005-08-16	3/24/19	2019-03-24	2019-03-24	14	Flerchinger	SAS V9			1	point	Open	Eddy Covariance	AmeriFlux	unresolved	Meteorology, Eddy Covariance				Research, Technology and Engineering	climatologyMeteorologyAtmosphere	
GB3111	3111	GB	LAND-ATMOSPHERE FLUXES (EC)	q138h08ecflux_rl_upwell	outgoing thermal radiation	W/m2	30 minute	30 minute	8/16/05	2005-08-16	2005-08-16	3/24/19	2019-03-24	2019-03-24	14	Flerchinger	SAS V9			1	point	Open	Eddy Covariance	AmeriFlux	unresolved	Meteorology, Eddy Covariance				Research, Technology and Engineering	climatologyMeteorologyAtmosphere	
GB3112	3112	GB	LAND-ATMOSPHERE FLUXES (EC)	q138h08ecflux_rs_dwnwell	incoming thermal radiation	W/m2	30 minute	30 minute	8/16/05	2005-08-16	2005-08-16	3/24/19	2019-03-24	2019-03-24	14	Flerchinger	SAS V9			1	point	Open	Eddy Covariance	AmeriFlux	unresolved	Meteorology, Eddy Covariance				Research, Technology and Engineering	climatologyMeteorologyAtmosphere	
GB3113	3113	GB	LAND-ATMOSPHERE FLUXES (EC)	q138h08ecflux_rs_upwell	outgoing solar radiation	W/m2	30 minute	30 minute	8/16/05	2005-08-16	2005-08-16	3/24/19	2019-03-24	2019-03-24	14	Flerchinger	SAS V9			1	point	Open	Eddy Covariance	AmeriFlux	unresolved	Meteorology, Eddy Covariance				Research, Technology and Engineering	climatologyMeteorologyAtmosphere	
GB3114	3114	GB	LAND-ATMOSPHERE FLUXES (EC)	q138h08ecflux_shf_2	soil heat flux	W/m2	30 minute	30 minute	8/16/05	2005-08-16	2005-08-16	3/24/19	2019-03-24	2019-03-24	14	Flerchinger	SAS V9			1	point	Open	Eddy Covariance	AmeriFlux	Soil Heat Flux 	Meteorology, Eddy Covariance				Research, Technology and Engineering	climatologyMeteorologyAtmosphere	no
GB3115	3115	GB	LAND-ATMOSPHERE FLUXES (EC)	q138h08ecflux_shf_3	soil heat flux	W/m2	30 minute	30 minute	8/16/05	2005-08-16	2005-08-16	3/24/19	2019-03-24	2019-03-24	14	Flerchinger	SAS V9			1	point	Open	Eddy Covariance	AmeriFlux	Soil Heat Flux 	Meteorology, Eddy Covariance				Research, Technology and Engineering	climatologyMeteorologyAtmosphere	no
GB3116	3116	GB	LAND-ATMOSPHERE FLUXES (EC)	q138h08ecflux_shf_4	soil heat flux	W/m2	30 minute	30 minute	8/16/05	2005-08-16	2005-08-16	3/24/19	2019-03-24	2019-03-24	14	Flerchinger	SAS V9			1	point	Open	Eddy Covariance	AmeriFlux	Soil Heat Flux 	Meteorology, Eddy Covariance				Research, Technology and Engineering	climatologyMeteorologyAtmosphere	no
GB3117	3117	GB	LAND-ATMOSPHERE FLUXES (EC)	q138h08ecflux_shf_5	soil heat flux	W/m2	30 minute	30 minute	8/16/05	2005-08-16	2005-08-16	3/24/19	2019-03-24	2019-03-24	14	Flerchinger	SAS V9			1	point	Open	Eddy Covariance	AmeriFlux	Soil Heat Flux 	Meteorology, Eddy Covariance				Research, Technology and Engineering	climatologyMeteorologyAtmosphere	no
GB3118	3118	GB	LAND-ATMOSPHERE FLUXES (EC)	q138h08ecflux_shf_6	soil heat flux	W/m2	30 minute	30 minute	8/16/05	2005-08-16	2005-08-16	3/24/19	2019-03-24	2019-03-24	14	Flerchinger	SAS V9			1	point	Open	Eddy Covariance	AmeriFlux	Soil Heat Flux 	Meteorology, Eddy Covariance				Research, Technology and Engineering	climatologyMeteorologyAtmosphere	no
GB3119	3119	GB	GREENHOUSE GAS FLUX	q177co2_cfx007p	CO2 concentration	ppm	15 minute	15 minute	1/25/18	2018-01-25	2018-01-25	3/24/19	2019-03-24	2019-03-24	1	Seyfried	SAS V9			1	point	Open	Greenhouse Gas Emissions	MeasGHGFlux	Carbon dioxide, air, daily, mean or single measurement	Greenhouse Gas Emissions				Physical and Chemical Sciences	climatologyMeteorologyAtmosphere	
GB3120	3120	GB	GREENHOUSE GAS FLUX	q177co2_cfx031p	CO2 concentration	ppm	15 minute	15 minute	1/25/18	2018-01-25	2018-01-25	3/24/19	2019-03-24	2019-03-24	1	Seyfried	SAS V9			1	point	Open	Greenhouse Gas Emissions	MeasGHGFlux	Carbon dioxide, air, daily, mean or single measurement	Greenhouse Gas Emissions				Physical and Chemical Sciences	climatologyMeteorologyAtmosphere	
GB3121	3121	GB	GREENHOUSE GAS FLUX	q177co2_cfx010i	CO2 concentration	ppm	15 minute	15 minute	10/21/16	2016-10-21	2016-10-21	3/24/19	2019-03-24	2019-03-24	2	Seyfried	SAS V9			1	point	Open	Greenhouse Gas Emissions	MeasGHGFlux	Carbon dioxide, air, daily, mean or single measurement	Greenhouse Gas Emissions				Physical and Chemical Sciences	climatologyMeteorologyAtmosphere	
GB3122	3122	GB	GREENHOUSE GAS FLUX	q177co2_cfx010s	CO2 concentration	ppm	15 minute	15 minute	10/21/16	2016-10-21	2016-10-21	3/24/19	2019-03-24	2019-03-24	2	Seyfried	SAS V9			1	point	Open	Greenhouse Gas Emissions	MeasGHGFlux	Carbon dioxide, air, daily, mean or single measurement	Greenhouse Gas Emissions				Physical and Chemical Sciences	climatologyMeteorologyAtmosphere	
GB3123	3123	GB	GREENHOUSE GAS FLUX	q177co2_cfx024	CO2 concentration	ppm	15 minute	15 minute	10/21/16	2016-10-21	2016-10-21	3/24/19	2019-03-24	2019-03-24	2	Seyfried	SAS V9			1	point	Open	Greenhouse Gas Emissions	MeasGHGFlux	Carbon dioxide, air, daily, mean or single measurement	Greenhouse Gas Emissions				Physical and Chemical Sciences	climatologyMeteorologyAtmosphere	
GB3124	3124	GB	GREENHOUSE GAS FLUX	q177co2_cfx025	CO2 concentration	ppm	15 minute	15 minute	10/21/16	2016-10-21	2016-10-21	3/24/19	2019-03-24	2019-03-24	2	Seyfried	SAS V9			1	point	Open	Greenhouse Gas Emissions	MeasGHGFlux	Carbon dioxide, air, daily, mean or single measurement	Greenhouse Gas Emissions				Physical and Chemical Sciences	climatologyMeteorologyAtmosphere	
GB3125	3125	GB	GREENHOUSE GAS FLUX	q177co2_cfx042	CO2 concentration	ppm	15 minute	15 minute	10/21/16	2016-10-21	2016-10-21	3/24/19	2019-03-24	2019-03-24	2	Seyfried	SAS V9			1	point	Open	Greenhouse Gas Emissions	MeasGHGFlux	Carbon dioxide, air, daily, mean or single measurement	Greenhouse Gas Emissions				Physical and Chemical Sciences	climatologyMeteorologyAtmosphere	
GB3126	3126	GB	GREENHOUSE GAS FLUX	q177co2_cfx043	CO2 concentration	ppm	15 minute	15 minute	10/21/16	2016-10-21	2016-10-21	3/24/19	2019-03-24	2019-03-24	2	Seyfried	SAS V9			1	point	Open	Greenhouse Gas Emissions	MeasGHGFlux	Carbon dioxide, air, daily, mean or single measurement	Greenhouse Gas Emissions				Physical and Chemical Sciences	climatologyMeteorologyAtmosphere	
GB3127	3127	GB	GREENHOUSE GAS FLUX	q177co2_cfx070	CO2 concentration	ppm	15 minute	15 minute	10/21/16	2016-10-21	2016-10-21	3/24/19	2019-03-24	2019-03-24	2	Seyfried	SAS V9			1	point	Open	Greenhouse Gas Emissions	MeasGHGFlux	Carbon dioxide, air, daily, mean or single measurement	Greenhouse Gas Emissions				Physical and Chemical Sciences	climatologyMeteorologyAtmosphere	
GB3128	3128	GB	GREENHOUSE GAS FLUX	q177co2_cfx071	CO2 concentration	ppm	15 minute	15 minute	10/21/16	2016-10-21	2016-10-21	3/24/19	2019-03-24	2019-03-24	2	Seyfried	SAS V9			1	point	Open	Greenhouse Gas Emissions	MeasGHGFlux	Carbon dioxide, air, daily, mean or single measurement	Greenhouse Gas Emissions				Physical and Chemical Sciences	climatologyMeteorologyAtmosphere	
GB3129	3129	GB	GREENHOUSE GAS FLUX	q177o2_ofx009	absolute O2 concentration	kPa	15 minute	15 minute	10/21/16	2016-10-21	2016-10-21	3/24/19	2019-03-24	2019-03-24	2	Seyfried	SAS V9			1	point	Open	Greenhouse Gas Emissions	MeasGHGFlux	Carbon dioxide, air, daily, mean or single measurement	Greenhouse Gas Emissions				Physical and Chemical Sciences	climatologyMeteorologyAtmosphere	no
GB3130	3130	GB	GREENHOUSE GAS FLUX	q177o2_ofx024	absolute O2 concentration	kPa	15 minute	15 minute	10/21/16	2016-10-21	2016-10-21	3/24/19	2019-03-24	2019-03-24	2	Seyfried	SAS V9			1	point	Open	Greenhouse Gas Emissions	MeasGHGFlux	Carbon dioxide, air, daily, mean or single measurement	Greenhouse Gas Emissions				Physical and Chemical Sciences	climatologyMeteorologyAtmosphere	no
GB3131	3131	GB	GREENHOUSE GAS FLUX	q177o2_ofx040	absolute O2 concentration	kPa	15 minute	15 minute	10/21/16	2016-10-21	2016-10-21	3/24/19	2019-03-24	2019-03-24	2	Seyfried	SAS V9			1	point	Open	Greenhouse Gas Emissions	MeasGHGFlux	Carbon dioxide, air, daily, mean or single measurement	Greenhouse Gas Emissions				Physical and Chemical Sciences	climatologyMeteorologyAtmosphere	no
GB3132	3132	GB	GREENHOUSE GAS FLUX	q177o2_ofx070	absolute O2 concentration	kPa	15 minute	15 minute	10/21/16	2016-10-21	2016-10-21	3/24/19	2019-03-24	2019-03-24	2	Seyfried	SAS V9			1	point	Open	Greenhouse Gas Emissions	MeasGHGFlux	Carbon dioxide, air, daily, mean or single measurement	Greenhouse Gas Emissions				Physical and Chemical Sciences	climatologyMeteorologyAtmosphere	no
GB3133	3133	GB	GREENHOUSE GAS FLUX	q127eco2_cfx004i	CO2 concentration	ppm	15 minute	15 minute	9/6/16	2016-09-06	2016-09-06	3/24/19	2019-03-24	2019-03-24	3	Seyfried	SAS V9			1	point	Open	Greenhouse Gas Emissions	MeasGHGFlux	Carbon dioxide, air, daily, mean or single measurement	Greenhouse Gas Emissions				Physical and Chemical Sciences	climatologyMeteorologyAtmosphere	
GB3134	3134	GB	GREENHOUSE GAS FLUX	q127eco2_cfx004s	CO2 concentration	ppm	15 minute	15 minute	9/6/16	2016-09-06	2016-09-06	3/24/19	2019-03-24	2019-03-24	3	Seyfried	SAS V9			1	point	Open	Greenhouse Gas Emissions	MeasGHGFlux	Carbon dioxide, air, daily, mean or single measurement	Greenhouse Gas Emissions				Physical and Chemical Sciences	climatologyMeteorologyAtmosphere	
GB3135	3135	GB	GREENHOUSE GAS FLUX	q127eco2_cfx018	CO2 concentration	ppm	15 minute	15 minute	9/6/16	2016-09-06	2016-09-06	3/24/19	2019-03-24	2019-03-24	3	Seyfried	SAS V9			1	point	Open	Greenhouse Gas Emissions	MeasGHGFlux	Carbon dioxide, air, daily, mean or single measurement	Greenhouse Gas Emissions				Physical and Chemical Sciences	climatologyMeteorologyAtmosphere	
GB3136	3136	GB	GREENHOUSE GAS FLUX	q127eco2_cfx023	CO2 concentration	ppm	15 minute	15 minute	9/6/16	2016-09-06	2016-09-06	3/24/19	2019-03-24	2019-03-24	3	Seyfried	SAS V9			1	point	Open	Greenhouse Gas Emissions	MeasGHGFlux	Carbon dioxide, air, daily, mean or single measurement	Greenhouse Gas Emissions				Physical and Chemical Sciences	climatologyMeteorologyAtmosphere	
GB3137	3137	GB	GREENHOUSE GAS FLUX	q127eco2_cfx079	CO2 concentration	ppm	15 minute	15 minute	9/6/16	2016-09-06	2016-09-06	3/24/19	2019-03-24	2019-03-24	3	Seyfried	SAS V9			1	point	Open	Greenhouse Gas Emissions	MeasGHGFlux	Carbon dioxide, air, daily, mean or single measurement	Greenhouse Gas Emissions				Physical and Chemical Sciences	climatologyMeteorologyAtmosphere	
GB3138	3138	GB	GREENHOUSE GAS FLUX	q127eco2_cfx085	CO2 concentration	ppm	15 minute	15 minute	9/6/16	2016-09-06	2016-09-06	3/24/19	2019-03-24	2019-03-24	3	Seyfried	SAS V9			1	point	Open	Greenhouse Gas Emissions	MeasGHGFlux	Carbon dioxide, air, daily, mean or single measurement	Greenhouse Gas Emissions				Physical and Chemical Sciences	climatologyMeteorologyAtmosphere	
GB3139	3139	GB	GREENHOUSE GAS FLUX	q127eco2_cfx113	CO2 concentration	ppm	15 minute	15 minute	9/6/16	2016-09-06	2016-09-06	3/24/19	2019-03-24	2019-03-24	3	Seyfried	SAS V9			1	point	Open	Greenhouse Gas Emissions	MeasGHGFlux	Carbon dioxide, air, daily, mean or single measurement	Greenhouse Gas Emissions				Physical and Chemical Sciences	climatologyMeteorologyAtmosphere	
GB3140	3140	GB	GREENHOUSE GAS FLUX	q127eco2_cfx114	CO2 concentration	ppm	15 minute	15 minute	9/6/16	2016-09-06	2016-09-06	3/24/19	2019-03-24	2019-03-24	3	Seyfried	SAS V9			1	point	Open	Greenhouse Gas Emissions	MeasGHGFlux	Carbon dioxide, air, daily, mean or single measurement	Greenhouse Gas Emissions				Physical and Chemical Sciences	climatologyMeteorologyAtmosphere	
GB3141	3141	GB	GREENHOUSE GAS FLUX	q127eo2_ofx004s	absolute O2 concentration	kPa	15 minute	15 minute	9/6/16	2016-09-06	2016-09-06	3/24/19	2019-03-24	2019-03-24	3	Seyfried	SAS V9			1	point	Open	Greenhouse Gas Emissions	MeasGHGFlux	Carbon dioxide, air, daily, mean or single measurement	Greenhouse Gas Emissions				Physical and Chemical Sciences	climatologyMeteorologyAtmosphere	no
GB3142	3142	GB	GREENHOUSE GAS FLUX	q127eo2_ofx019	absolute O2 concentration	kPa	15 minute	15 minute	9/6/16	2016-09-06	2016-09-06	3/24/19	2019-03-24	2019-03-24	3	Seyfried	SAS V9			1	point	Open	Greenhouse Gas Emissions	MeasGHGFlux	Carbon dioxide, air, daily, mean or single measurement	Greenhouse Gas Emissions				Physical and Chemical Sciences	climatologyMeteorologyAtmosphere	no
GB3143	3143	GB	GREENHOUSE GAS FLUX	q127eo2_ofx082	absolute O2 concentration	kPa	15 minute	15 minute	9/6/16	2016-09-06	2016-09-06	3/24/19	2019-03-24	2019-03-24	3	Seyfried	SAS V9			1	point	Open	Greenhouse Gas Emissions	MeasGHGFlux	Carbon dioxide, air, daily, mean or single measurement	Greenhouse Gas Emissions				Physical and Chemical Sciences	climatologyMeteorologyAtmosphere	no
GB3144	3144	GB	GREENHOUSE GAS FLUX	q127eo2_ofx116	absolute O2 concentration	kPa	15 minute	15 minute	9/6/16	2016-09-06	2016-09-06	3/24/19	2019-03-24	2019-03-24	3	Seyfried	SAS V9			1	point	Open	Greenhouse Gas Emissions	MeasGHGFlux	Carbon dioxide, air, daily, mean or single measurement	Greenhouse Gas Emissions				Physical and Chemical Sciences	climatologyMeteorologyAtmosphere	no
GB3145	3145	GB	GREENHOUSE GAS FLUX	h098fco2_cfx006i	CO2 concentration	ppm	1 hour	1 hour	7/17/15	2015-07-17	2015-07-17	3/24/19	2019-03-24	2019-03-24	4	Seyfried	SAS V9			1	point	Open	Greenhouse Gas Emissions	MeasGHGFlux	Carbon dioxide, air, daily, mean or single measurement	Greenhouse Gas Emissions				Physical and Chemical Sciences	climatologyMeteorologyAtmosphere	
GB3146	3146	GB	GREENHOUSE GAS FLUX	h098fco2_cfx006s	CO2 concentration	ppm	1 hour	1 hour	7/17/15	2015-07-17	2015-07-17	3/24/19	2019-03-24	2019-03-24	4	Seyfried	SAS V9			1	point	Open	Greenhouse Gas Emissions	MeasGHGFlux	Carbon dioxide, air, daily, mean or single measurement	Greenhouse Gas Emissions				Physical and Chemical Sciences	climatologyMeteorologyAtmosphere	
GB3147	3147	GB	GREENHOUSE GAS FLUX	h098fco2_cfx026i	CO2 concentration	ppm	1 hour	1 hour	7/17/15	2015-07-17	2015-07-17	3/24/19	2019-03-24	2019-03-24	4	Seyfried	SAS V9			1	point	Open	Greenhouse Gas Emissions	MeasGHGFlux	Carbon dioxide, air, daily, mean or single measurement	Greenhouse Gas Emissions				Physical and Chemical Sciences	climatologyMeteorologyAtmosphere	
GB3148	3148	GB	GREENHOUSE GAS FLUX	h098fco2_cfx026s	CO2 concentration	ppm	1 hour	1 hour	7/17/15	2015-07-17	2015-07-17	3/24/19	2019-03-24	2019-03-24	4	Seyfried	SAS V9			1	point	Open	Greenhouse Gas Emissions	MeasGHGFlux	Carbon dioxide, air, daily, mean or single measurement	Greenhouse Gas Emissions				Physical and Chemical Sciences	climatologyMeteorologyAtmosphere	
GB3149	3149	GB	GREENHOUSE GAS FLUX	h098fco2_cfx041s	CO2 concentration	ppm	1 hour	1 hour	7/17/15	2015-07-17	2015-07-17	3/24/19	2019-03-24	2019-03-24	4	Seyfried	SAS V9			1	point	Open	Greenhouse Gas Emissions	MeasGHGFlux	Carbon dioxide, air, daily, mean or single measurement	Greenhouse Gas Emissions				Physical and Chemical Sciences	climatologyMeteorologyAtmosphere	
GB3150	3150	GB	GREENHOUSE GAS FLUX	h098fco2_cfx044i	CO2 concentration	ppm	1 hour	1 hour	7/17/15	2015-07-17	2015-07-17	3/24/19	2019-03-24	2019-03-24	4	Seyfried	SAS V9			1	point	Open	Greenhouse Gas Emissions	MeasGHGFlux	Carbon dioxide, air, daily, mean or single measurement	Greenhouse Gas Emissions				Physical and Chemical Sciences	climatologyMeteorologyAtmosphere	
GB3151	3151	GB	GREENHOUSE GAS FLUX	h098fco2_cfx063i	CO2 concentration	ppm	1 hour	1 hour	7/17/15	2015-07-17	2015-07-17	3/24/19	2019-03-24	2019-03-24	4	Seyfried	SAS V9			1	point	Open	Greenhouse Gas Emissions	MeasGHGFlux	Carbon dioxide, air, daily, mean or single measurement	Greenhouse Gas Emissions				Physical and Chemical Sciences	climatologyMeteorologyAtmosphere	
GB3152	3152	GB	GREENHOUSE GAS FLUX	h098fco2_cfx063s	CO2 concentration	ppm	1 hour	1 hour	7/17/15	2015-07-17	2015-07-17	3/24/19	2019-03-24	2019-03-24	4	Seyfried	SAS V9			1	point	Open	Greenhouse Gas Emissions	MeasGHGFlux	Carbon dioxide, air, daily, mean or single measurement	Greenhouse Gas Emissions				Physical and Chemical Sciences	climatologyMeteorologyAtmosphere	
GB3153	3153	GB	HYDROLOGY	bkpt15min_sme_streamflow_qcms	discharge	m3/s	15 minute	15 minute	1/1/08	2008-01-01	2008-01-01	1/1/14	2014-01-01	2014-01-01	6	Pierson	SAS V9			1	point	Open	Hydrology	STEWARDS	unresolved					Natural Resources, Earth and Environmental Sciences	inlandWaters	no
GB3154	3154	GB	HYDROLOGY	bkpt15min_smf_streamflow_qcms	discharge	m3/s	15 minute	15 minute	1/1/08	2008-01-01	2008-01-01	1/1/14	2014-01-01	2014-01-01	6	Pierson	SAS V9			1	point	Open	Hydrology	STEWARDS	unresolved					Natural Resources, Earth and Environmental Sciences	inlandWaters	no
GB3155	3155	GB	HYDROLOGY	bkpt15min_smg_streamflow_qcms	discharge	m3/s	15 minute	15 minute	1/1/08	2008-01-01	2008-01-01	1/1/14	2014-01-01	2014-01-01	6	Pierson	SAS V9			1	point	Open	Hydrology	STEWARDS	unresolved					Natural Resources, Earth and Environmental Sciences	inlandWaters	no
GB3156	3156	GB	HYDROLOGY	bkpt15min_smm_streamflow_qcms	discharge	m3/s	15 minute	15 minute	1/1/08	2008-01-01	2008-01-01	1/1/14	2014-01-01	2014-01-01	6	Pierson	SAS V9			1	point	Open	Hydrology	STEWARDS	unresolved					Natural Resources, Earth and Environmental Sciences	inlandWaters	no
GB3157	3157	GB	HYDROLOGY	bkpt15min_125b_streamflow_qcms	discharge	m3/s	15 minute	15 minute	3/17/03	2003-03-17	2003-03-17	1/1/18	2018-01-01	2018-01-01	15	Pierson	SAS V9			1	point	Open	Hydrology	STEWARDS	unresolved					Natural Resources, Earth and Environmental Sciences	inlandWaters	no
GB3158	3158	GB	HYDROLOGY	bkpt15min_138x34_streamflow_qcms	discharge	m3/s	15 minute	15 minute	2/20/70	1970-02-20	1970-02-20	6/22/93	1993-06-22	1993-06-22	23	Pierson	SAS V9			1	point	Open	Hydrology	STEWARDS	unresolved					Natural Resources, Earth and Environmental Sciences	inlandWaters	no
GB3159	3159	GB	HYDROLOGY	bkpt15min_046x84_streamflow_qcms	discharge	m3/s	15 minute	15 minute	3/13/64	1964-03-13	1964-03-13	1/1/91	1991-01-01	1991-01-01	27	Pierson	SAS V9			1	point	Open	Hydrology	STEWARDS	unresolved					Natural Resources, Earth and Environmental Sciences	inlandWaters	no
GB3160	3160	GB	HYDROLOGY	bkpt15min_138012_streamflow_qcms	discharge	m3/s	15 minute	15 minute	2/20/70	1970-02-20	1970-02-20	1/1/12	2012-01-01	2012-01-01	42	Pierson	SAS V9			1	point	Open	Hydrology	STEWARDS	unresolved					Natural Resources, Earth and Environmental Sciences	inlandWaters	no
GB3161	3161	GB	HYDROLOGY	bkpt15min_098_streamflow_qcms	discharge	m3/s	15 minute	15 minute	12/20/71	1971-12-20	1971-12-20	1/1/15	2015-01-01	2015-01-01	43	Pierson	SAS V9			1	point	Open	Hydrology	STEWARDS	unresolved					Natural Resources, Earth and Environmental Sciences	inlandWaters	no
GB3162	3162	GB	HYDROLOGY	bkpt15min_057_streamflow_qcms	discharge	m3/s	15 minute	15 minute	1/15/72	1972-01-15	1972-01-15	1/1/16	2016-01-01	2016-01-01	44	Pierson	SAS V9			1	point	Open	Hydrology	STEWARDS	unresolved					Natural Resources, Earth and Environmental Sciences	inlandWaters	no
GB3163	3163	GB	HYDROLOGY	bkpt15min_135_streamflow_qcms	discharge	m3/s	15 minute	15 minute	1/1/73	1973-01-01	1973-01-01	1/1/18	2018-01-01	2018-01-01	45	Pierson	SAS V9			1	point	Open	Hydrology	STEWARDS	unresolved					Natural Resources, Earth and Environmental Sciences	inlandWaters	no
GB3164	3164	GB	HYDROLOGY	bkpt15min_046_streamflow_qcms	discharge	m3/s	15 minute	15 minute	1/29/64	1964-01-29	1964-01-29	10/27/14	2014-10-27	2014-10-27	51	Pierson	SAS V9			1	point	Open	Hydrology	STEWARDS	unresolved					Natural Resources, Earth and Environmental Sciences	inlandWaters	no
GB3165	3165	GB	HYDROLOGY	bkpt15min_117_streamflow_qcms	discharge	m3/s	15 minute	15 minute	3/7/66	1966-03-07	1966-03-07	1/1/17	2017-01-01	2017-01-01	51	Pierson	SAS V9			1	point	Open	Hydrology	STEWARDS	unresolved					Natural Resources, Earth and Environmental Sciences	inlandWaters	no
GB3166	3166	GB	HYDROLOGY	bkpt15min_043_streamflow_qcms	discharge	m3/s	15 minute	15 minute	1/1/67	1967-01-01	1967-01-01	11/12/17	2017-11-12	2017-11-12	51	Pierson	SAS V9			1	point	Open	Hydrology	STEWARDS	unresolved					Natural Resources, Earth and Environmental Sciences	inlandWaters	no
GB3167	3167	GB	HYDROLOGY	bkpt15min_036_streamflow_qcms	discharge	m3/s	15 minute	15 minute	1/1/63	1963-01-01	1963-01-01	1/1/17	2017-01-01	2017-01-01	54	Pierson	SAS V9			1	point	Open	Hydrology	STEWARDS	unresolved					Natural Resources, Earth and Environmental Sciences	inlandWaters	no
GB3168	3168	GB	HYDROLOGY	bkpt15min_166_streamflow_qcms	discharge	m3/s	15 minute	15 minute	1/1/63	1963-01-01	1963-01-01	11/15/17	2017-11-15	2017-11-15	55	Pierson	SAS V9			1	point	Open	Hydrology	STEWARDS	unresolved					Natural Resources, Earth and Environmental Sciences	inlandWaters	no
GB3169	3169	GB	HYDROLOGY	bkpt15min_043_streamflow_handconc	suspended sediment concentration	mg/l	sporadic		1/7/16	2016-01-07	2016-01-07	7/12/17	2017-07-12	2017-07-12	2	Pierson	SAS V9			1	point	Open	Meteorology	STEWARDS						Natural Resources, Earth and Environmental Sciences	climatologyMeteorologyAtmosphere	
GB3170	3170	GB	HYDROLOGY	bkpt15min_043_streamflow_msconc	suspended sediment concentration	mg/l	sporadic		1/7/16	2016-01-07	2016-01-07	7/12/17	2017-07-12	2017-07-12	2	Pierson	SAS V9			1	point	Open	Meteorology	STEWARDS						Natural Resources, Earth and Environmental Sciences	climatologyMeteorologyAtmosphere	
GB3171	3171	GB	HYDROLOGY	bkpt15min_043_streamflow_pumpconc	suspended sediment concentration	mg/l	sporadic		1/1/16	2016-01-01	2016-01-01	7/11/17	2017-07-11	2017-07-11	2	Pierson	SAS V9			1	point	Open	Meteorology	STEWARDS						Natural Resources, Earth and Environmental Sciences	climatologyMeteorologyAtmosphere	
GB3172	3172	GB	HYDROLOGY	bkpt15min_116b_streamflow_qcms	discharge	m3/s	15 minute	15 minute	3/29/66	1966-03-29	1966-03-29	10/17/18	2018-10-17	2018-10-17	53	Pierson	SAS V9			1	point	Open	Meteorology	STEWARDS	unresolved					Natural Resources, Earth and Environmental Sciences	climatologyMeteorologyAtmosphere	no
GB3173	3173	GB	METEOROLOGY	l1_jdt3_climate_wnd3s	wind speed	m/s	15 minute	15 minute	11/14/18	2018-11-14	2018-11-14	12/7/18	2018-12-07	2018-12-07	1	Marks	SAS V9			1	point	Open	Meteorology	WeatherDaily, WeatherStation	Wind speed, air, daily, mean					Natural Resources, Earth and Environmental Sciences	climatologyMeteorologyAtmosphere	no
GB3174	3174	GB	METEOROLOGY	l1_urt_climate_hum2a	relative humidity	%	15 minute	15 minute	8/31/04	2004-08-31	2004-08-31	10/17/04	2004-10-17	2004-10-17	1	Marks	SAS V9			1	point	Open	Meteorology	WeatherDaily, WeatherStation	Relative humidity, air, daily, mean					Natural Resources, Earth and Environmental Sciences	climatologyMeteorologyAtmosphere	no
GB3175	3175	GB	METEOROLOGY	l1_jdt3b_climate_wnd3s	wind speed	m/s	15 minute	15 minute	8/21/18	2018-08-21	2018-08-21	12/7/18	2018-12-07	2018-12-07	1	Marks	SAS V9			1	point	Open	Meteorology	WeatherDaily, WeatherStation	Wind speed, air, daily, mean					Natural Resources, Earth and Environmental Sciences	climatologyMeteorologyAtmosphere	no
GB3176	3176	GB	METEOROLOGY	l1_167b_climate_wnd3s	wind speed	m/s	15 minute	15 minute	2/16/05	2005-02-16	2005-02-16	6/15/05	2005-06-15	2005-06-15	1	Marks	SAS V9			1	point	Open	Meteorology	WeatherDaily, WeatherStation	Wind speed, air, daily, mean					Natural Resources, Earth and Environmental Sciences	climatologyMeteorologyAtmosphere	no
GB3177	3177	GB	METEOROLOGY	l1_rmsp3_climate_wnd3r	wind run	km	15 minute	15 minute	9/22/04	2004-09-22	2004-09-22	5/25/05	2005-05-25	2005-05-25	1	Marks	SAS V9			1	point	Open	Meteorology	WeatherDaily, WeatherStation	wind run					Natural Resources, Earth and Environmental Sciences	climatologyMeteorologyAtmosphere	no
GB3178	3178	GB	METEOROLOGY	l1_095_climate_tmp3ij	air temperature	°C	15 minute	15 minute	10/5/01	2001-10-05	2001-10-05	6/11/02	2002-06-11	2002-06-11	1	Marks	SAS V9			1	point	Open	Meteorology	WeatherDaily, WeatherStation	Temperature, air, daily, mean	Meteorology				Natural Resources, Earth and Environmental Sciences	climatologyMeteorologyAtmosphere	no
GB3179	3179	GB	METEOROLOGY	l1_176b_climate_wnd15r	wind run	km	15 minute	15 minute	2/4/04	2004-02-04	2004-02-04	10/12/04	2004-10-12	2004-10-12	1	Marks	SAS V9			1	point	Open	Meteorology	WeatherDaily, WeatherStation	wind run					Natural Resources, Earth and Environmental Sciences	climatologyMeteorologyAtmosphere	no
GB3180	3180	GB	METEOROLOGY	l1_176b_climate_wnd15s	wind speed	m/s	15 minute	15 minute	2/4/04	2004-02-04	2004-02-04	10/12/04	2004-10-12	2004-10-12	1	Marks	SAS V9			1	point	Open	Meteorology	WeatherDaily, WeatherStation	Wind speed, air, daily, mean					Natural Resources, Earth and Environmental Sciences	climatologyMeteorologyAtmosphere	no
GB3181	3181	GB	METEOROLOGY	l1_176b_climate_wnd3r	wind run	km	15 minute	15 minute	2/4/04	2004-02-04	2004-02-04	10/12/04	2004-10-12	2004-10-12	1	Marks	SAS V9			1	point	Open	Meteorology	WeatherDaily, WeatherStation	wind run					Natural Resources, Earth and Environmental Sciences	climatologyMeteorologyAtmosphere	no
GB3182	3182	GB	METEOROLOGY	l1_176b_climate_wnd3s	wind speed	m/s	15 minute	15 minute	2/4/04	2004-02-04	2004-02-04	10/12/04	2004-10-12	2004-10-12	1	Marks	SAS V9			1	point	Open	Meteorology	WeatherDaily, WeatherStation	Wind speed, air, daily, mean					Natural Resources, Earth and Environmental Sciences	climatologyMeteorologyAtmosphere	no
GB3183	3183	GB	METEOROLOGY	l1_176b_climate_wnd9r	wind run	km	15 minute	15 minute	2/4/04	2004-02-04	2004-02-04	10/12/04	2004-10-12	2004-10-12	1	Marks	SAS V9			1	point	Open	Meteorology	WeatherDaily, WeatherStation	wind run					Natural Resources, Earth and Environmental Sciences	climatologyMeteorologyAtmosphere	no
GB3184	3184	GB	METEOROLOGY	l1_176b_climate_wnd9s	wind speed	m/s	15 minute	15 minute	2/4/04	2004-02-04	2004-02-04	10/12/04	2004-10-12	2004-10-12	1	Marks	SAS V9			1	point	Open	Meteorology	WeatherDaily, WeatherStation	Wind speed, air, daily, mean					Natural Resources, Earth and Environmental Sciences	climatologyMeteorologyAtmosphere	no
GB3185	3185	GB	METEOROLOGY	l1_095_climate_hum3a	relative humidity	%	15 minute	15 minute	9/26/01	2001-09-26	2001-09-26	6/11/02	2002-06-11	2002-06-11	1	Marks	SAS V9			1	point	Open	Meteorology	WeatherDaily, WeatherStation	Relative humidity, air, daily, mean					Natural Resources, Earth and Environmental Sciences	climatologyMeteorologyAtmosphere	no
GB3186	3186	GB	METEOROLOGY	l1_095_climate_hum3i	relative humidity	%	15 minute	15 minute	9/26/01	2001-09-26	2001-09-26	6/11/02	2002-06-11	2002-06-11	1	Marks	SAS V9			1	point	Open	Meteorology	WeatherDaily, WeatherStation	Relative humidity, air, daily, mean					Natural Resources, Earth and Environmental Sciences	climatologyMeteorologyAtmosphere	no
GB3187	3187	GB	METEOROLOGY	l1_095_climate_sol	incoming shortwave solar radiation	W/m2	15 minute	15 minute	9/26/01	2001-09-26	2001-09-26	6/11/02	2002-06-11	2002-06-11	1	Marks	SAS V9			1	point	Open	Meteorology	WeatherDaily, WeatherStation	ave_incoming_shortwave radiation					Natural Resources, Earth and Environmental Sciences	climatologyMeteorologyAtmosphere	no
GB3188	3188	GB	METEOROLOGY	l1_095_climate_tmp3a	air temperature	°C	15 minute	15 minute	9/26/01	2001-09-26	2001-09-26	6/11/02	2002-06-11	2002-06-11	1	Marks	SAS V9			1	point	Open	Meteorology	WeatherDaily, WeatherStation	Temperature, air, daily, mean	Meteorology				Natural Resources, Earth and Environmental Sciences	climatologyMeteorologyAtmosphere	no
GB3189	3189	GB	METEOROLOGY	l1_095_climate_tmp3i	air temperature	°C	15 minute	15 minute	9/26/01	2001-09-26	2001-09-26	6/11/02	2002-06-11	2002-06-11	1	Marks	SAS V9			1	point	Open	Meteorology	WeatherDaily, WeatherStation	Temperature, air, daily, mean	Meteorology				Natural Resources, Earth and Environmental Sciences	climatologyMeteorologyAtmosphere	no
GB3190	3190	GB	METEOROLOGY	l1_095_climate_wnd3r	wind run	km	15 minute	15 minute	9/26/01	2001-09-26	2001-09-26	6/11/02	2002-06-11	2002-06-11	1	Marks	SAS V9			1	point	Open	Meteorology	WeatherDaily, WeatherStation	wind run					Natural Resources, Earth and Environmental Sciences	climatologyMeteorologyAtmosphere	no
GB3191	3191	GB	METEOROLOGY	l1_095_climate_wnd3s	wind speed	m/s	15 minute	15 minute	9/26/01	2001-09-26	2001-09-26	6/11/02	2002-06-11	2002-06-11	1	Marks	SAS V9			1	point	Open	Meteorology	WeatherDaily, WeatherStation	Wind speed, air, daily, mean					Natural Resources, Earth and Environmental Sciences	climatologyMeteorologyAtmosphere	no
GB3192	3192	GB	METEOROLOGY	l1_095_climate_wnd3sx	maximum wind speed	m/s	15 minute	15 minute	9/26/01	2001-09-26	2001-09-26	6/11/02	2002-06-11	2002-06-11	1	Marks	SAS V9			1	point	Open	Meteorology	WeatherDaily, WeatherStation	wind speed, air, daily, max					Natural Resources, Earth and Environmental Sciences	climatologyMeteorologyAtmosphere	no
GB3193	3193	GB	METEOROLOGY	l1_urt_climate_irt1	infrared plant canopy temperature	°C	15 minute	15 minute	11/14/03	2003-11-14	2003-11-14	10/17/04	2004-10-17	2004-10-17	1	Marks	SAS V9			1	point	Open	Meteorology	WeatherDaily, WeatherStation	Solar radiation, vegetated ground, no media, daily, total					Natural Resources, Earth and Environmental Sciences	climatologyMeteorologyAtmosphere	no
GB3194	3194	GB	METEOROLOGY	l1_urt_climate_tmp2a	air temperature	°C	15 minute	15 minute	11/14/03	2003-11-14	2003-11-14	10/17/04	2004-10-17	2004-10-17	1	Marks	SAS V9			1	point	Open	Meteorology	WeatherDaily, WeatherStation	Temperature, air, daily, mean	Meteorology				Natural Resources, Earth and Environmental Sciences	climatologyMeteorologyAtmosphere	no
GB3195	3195	GB	METEOROLOGY	l1_urt_climate_tmp2ij	air temperature	°C	15 minute	15 minute	11/14/03	2003-11-14	2003-11-14	10/17/04	2004-10-17	2004-10-17	1	Marks	SAS V9			1	point	Open	Meteorology	WeatherDaily, WeatherStation	Temperature, air, daily, mean	Meteorology				Natural Resources, Earth and Environmental Sciences	climatologyMeteorologyAtmosphere	no
GB3196	3196	GB	METEOROLOGY	l1_urt_climate_vap2a	vapor pressure	kPa	15 minute	15 minute	11/14/03	2003-11-14	2003-11-14	10/17/04	2004-10-17	2004-10-17	1	Marks	SAS V9			1	point	Open	Meteorology	WeatherDaily, WeatherStation	vapor pressure, mean					Natural Resources, Earth and Environmental Sciences	climatologyMeteorologyAtmosphere	no
GB3197	3197	GB	METEOROLOGY	l1_166b_climate_wnd3s	wind speed	m/s	15 minute	15 minute	10/2/03	2003-10-02	2003-10-02	9/20/04	2004-09-20	2004-09-20	1	Marks	SAS V9			1	point	Open	Meteorology	WeatherDaily, WeatherStation	Wind speed, air, daily, mean					Natural Resources, Earth and Environmental Sciences	climatologyMeteorologyAtmosphere	no
GB3198	3198	GB	METEOROLOGY	l1_166b_climate_wnd3r	wind run	km	15 minute	15 minute	10/2/03	2003-10-02	2003-10-02	5/25/05	2005-05-25	2005-05-25	2	Marks	SAS V9			1	point	Open	Meteorology	WeatherDaily, WeatherStation	wind run					Natural Resources, Earth and Environmental Sciences	climatologyMeteorologyAtmosphere	no
GB3199	3199	GB	METEOROLOGY	l1_138j10_climate_wnd3r	wind run	km	15 minute	15 minute	7/17/03	2003-07-17	2003-07-17	6/29/05	2005-06-29	2005-06-29	2	Marks	SAS V9			1	point	Open	Meteorology	WeatherDaily, WeatherStation	wind run					Natural Resources, Earth and Environmental Sciences	climatologyMeteorologyAtmosphere	no
GB3200	3200	GB	METEOROLOGY	l1_138j10_climate_wnd3s	wind speed	m/s	15 minute	15 minute	7/17/03	2003-07-17	2003-07-17	6/29/05	2005-06-29	2005-06-29	2	Marks	SAS V9			1	point	Open	Meteorology	WeatherDaily, WeatherStation	Wind speed, air, daily, mean					Natural Resources, Earth and Environmental Sciences	climatologyMeteorologyAtmosphere	no
GB3201	3201	GB	METEOROLOGY	l1_138l21_climate_wnd3s	wind speed	m/s	15 minute	15 minute	7/16/03	2003-07-16	2003-07-16	3/30/06	2006-03-30	2006-03-30	3	Marks	SAS V9			1	point	Open	Meteorology	WeatherDaily, WeatherStation	Wind speed, air, daily, mean					Natural Resources, Earth and Environmental Sciences	climatologyMeteorologyAtmosphere	no
GB3202	3202	GB	METEOROLOGY	l1_095b_climate_wnd3s	wind speed	m/s	15 minute	15 minute	5/14/03	2003-05-14	2003-05-14	2/27/06	2006-02-27	2006-02-27	3	Marks	SAS V9			1	point	Open	Meteorology	WeatherDaily, WeatherStation	Wind speed, air, daily, mean					Natural Resources, Earth and Environmental Sciences	climatologyMeteorologyAtmosphere	no
GB3203	3203	GB	METEOROLOGY	l1_124_climate_wnd3s	wind speed	m/s	15 minute	15 minute	7/1/02	2002-07-01	2002-07-01	7/7/05	2005-07-07	2005-07-07	3	Marks	SAS V9			1	point	Open	Meteorology	WeatherDaily, WeatherStation	Wind speed, air, daily, mean					Natural Resources, Earth and Environmental Sciences	climatologyMeteorologyAtmosphere	no
GB3204	3204	GB	METEOROLOGY	l1_125_climate_wnd3s	wind speed	m/s	15 minute	15 minute	6/26/02	2002-06-26	2002-06-26	7/7/05	2005-07-07	2005-07-07	3	Marks	SAS V9			1	point	Open	Meteorology	WeatherDaily, WeatherStation	Wind speed, air, daily, mean					Natural Resources, Earth and Environmental Sciences	climatologyMeteorologyAtmosphere	no
GB3205	3205	GB	METEOROLOGY	l1_043b_climate_hum3	relative humidity	%	15 minute	15 minute	11/23/15	2015-11-23	2015-11-23	1/29/19	2019-01-29	2019-01-29	3	Marks	SAS V9			1	point	Open	Meteorology	WeatherDaily, WeatherStation	Relative humidity, air, daily, mean					Natural Resources, Earth and Environmental Sciences	climatologyMeteorologyAtmosphere	no
GB3206	3206	GB	METEOROLOGY	l1_043b_climate_sol	incoming shortwave solar radiation	W/m2	15 minute	15 minute	11/23/15	2015-11-23	2015-11-23	1/29/19	2019-01-29	2019-01-29	3	Marks	SAS V9			1	point	Open	Meteorology	WeatherDaily, WeatherStation	ave_incoming_shortwave radiation					Natural Resources, Earth and Environmental Sciences	climatologyMeteorologyAtmosphere	no
GB3207	3207	GB	METEOROLOGY	l1_043b_climate_tmp3	air temperature	°C	15 minute	15 minute	11/23/15	2015-11-23	2015-11-23	1/29/19	2019-01-29	2019-01-29	3	Marks	SAS V9			1	point	Open	Meteorology	WeatherDaily, WeatherStation	Temperature, air, daily, mean	Meteorology				Natural Resources, Earth and Environmental Sciences	climatologyMeteorologyAtmosphere	no
GB3208	3208	GB	METEOROLOGY	l1_043b_climate_wnd3d	wind direction	°N	15 minute	15 minute	11/23/15	2015-11-23	2015-11-23	1/29/19	2019-01-29	2019-01-29	3	Marks	SAS V9			1	point	Open	Meteorology	WeatherDaily, WeatherStation	Wind direction air, daily, mean					Natural Resources, Earth and Environmental Sciences	climatologyMeteorologyAtmosphere	no
GB3209	3209	GB	METEOROLOGY	l1_043b_climate_wnd3dr	resultant wind direction	°N	15 minute	15 minute	11/23/15	2015-11-23	2015-11-23	1/29/19	2019-01-29	2019-01-29	3	Marks	SAS V9			1	point	Open	Meteorology	WeatherDaily, WeatherStation	Wind direction air, daily, mean					Natural Resources, Earth and Environmental Sciences	climatologyMeteorologyAtmosphere	no
GB3210	3210	GB	METEOROLOGY	l1_043b_climate_wnd3sa	average wind speed	m/s	15 minute	15 minute	11/23/15	2015-11-23	2015-11-23	1/29/19	2019-01-29	2019-01-29	3	Marks	SAS V9			1	point	Open	Meteorology	WeatherDaily, WeatherStation	Wind speed, air, daily, mean					Natural Resources, Earth and Environmental Sciences	climatologyMeteorologyAtmosphere	no
GB3211	3211	GB	METEOROLOGY	l1_043b_climate_wnd3sr	resultant wind speed	m/s	15 minute	15 minute	11/23/15	2015-11-23	2015-11-23	1/29/19	2019-01-29	2019-01-29	3	Marks	SAS V9			1	point	Open	Meteorology	WeatherDaily, WeatherStation	Wind speed, air, daily, mean					Natural Resources, Earth and Environmental Sciences	climatologyMeteorologyAtmosphere	no
GB3212	3212	GB	METEOROLOGY	l1_012_climate_wnd3s	wind speed	m/s	15 minute	15 minute	8/15/02	2002-08-15	2002-08-15	2/27/06	2006-02-27	2006-02-27	4	Marks	SAS V9			1	point	Open	Meteorology	WeatherDaily, WeatherStation	Wind speed, air, daily, mean					Natural Resources, Earth and Environmental Sciences	climatologyMeteorologyAtmosphere	no
GB3213	3213	GB	METEOROLOGY	l1_167_climate_wnd3s	wind speed	m/s	15 minute	15 minute	10/3/01	2001-10-03	2001-10-03	7/6/05	2005-07-06	2005-07-06	4	Marks	SAS V9			1	point	Open	Meteorology	WeatherDaily, WeatherStation	Wind speed, air, daily, mean					Natural Resources, Earth and Environmental Sciences	climatologyMeteorologyAtmosphere	no
GB3214	3214	GB	METEOROLOGY	l1_163_climate_wnd3s	wind speed	m/s	15 minute	15 minute	10/2/01	2001-10-02	2001-10-02	7/6/05	2005-07-06	2005-07-06	4	Marks	SAS V9			1	point	Open	Meteorology	WeatherDaily, WeatherStation	Wind speed, air, daily, mean					Natural Resources, Earth and Environmental Sciences	climatologyMeteorologyAtmosphere	no
GB3215	3215	GB	METEOROLOGY	l1_145_climate_wnd3s	wind speed	m/s	15 minute	15 minute	10/2/01	2001-10-02	2001-10-02	7/7/05	2005-07-07	2005-07-07	4	Marks	SAS V9			1	point	Open	Meteorology	WeatherDaily, WeatherStation	Wind speed, air, daily, mean					Natural Resources, Earth and Environmental Sciences	climatologyMeteorologyAtmosphere	no
GB3216	3216	GB	METEOROLOGY	l1_144_climate_wnd3s	wind speed	m/s	15 minute	15 minute	9/20/01	2001-09-20	2001-09-20	7/7/05	2005-07-07	2005-07-07	4	Marks	SAS V9			1	point	Open	Meteorology	WeatherDaily, WeatherStation	Wind speed, air, daily, mean					Natural Resources, Earth and Environmental Sciences	climatologyMeteorologyAtmosphere	no
GB3217	3217	GB	METEOROLOGY	l1_174_climate_wnd3s	wind speed	m/s	15 minute	15 minute	9/18/01	2001-09-18	2001-09-18	7/6/05	2005-07-06	2005-07-06	4	Marks	SAS V9			1	point	Open	Meteorology	WeatherDaily, WeatherStation	Wind speed, air, daily, mean					Natural Resources, Earth and Environmental Sciences	climatologyMeteorologyAtmosphere	no
GB3218	3218	GB	METEOROLOGY	l1_138i23_climate_wnd4_5sa	average wind speed	m/s	15 minute	15 minute	11/25/04	2004-11-25	2004-11-25	11/15/08	2008-11-15	2008-11-15	4	Marks	SAS V9			1	point	Open	Meteorology	WeatherDaily, WeatherStation	Wind speed, air, daily, mean					Natural Resources, Earth and Environmental Sciences	climatologyMeteorologyAtmosphere	no
GB3219	3219	GB	METEOROLOGY	l1_098c_climate_wnd3sx	maximum wind speed	m/s	15 minute	15 minute	8/27/11	2011-08-27	2011-08-27	8/19/15	2015-08-19	2015-08-19	4	Marks	SAS V9			1	point	Open	Meteorology	WeatherDaily, WeatherStation	wind speed, air, daily, max					Natural Resources, Earth and Environmental Sciences	climatologyMeteorologyAtmosphere	no
GB3220	3220	GB	METEOROLOGY	l1_098c_climate_vap3	vapor pressure	kPa	15 minute	15 minute	8/24/11	2011-08-24	2011-08-24	8/19/15	2015-08-19	2015-08-19	4	Marks	SAS V9			1	point	Open	Meteorology	WeatherDaily, WeatherStation	vapor pressure, mean					Natural Resources, Earth and Environmental Sciences	climatologyMeteorologyAtmosphere	no
GB3221	3221	GB	METEOROLOGY	l1_031_climate_wnd3s	wind speed	m/s	15 minute	15 minute	11/7/01	2001-11-07	2001-11-07	2/27/06	2006-02-27	2006-02-27	4	Marks	SAS V9			1	point	Open	Meteorology	WeatherDaily, WeatherStation	Wind speed, air, daily, mean					Natural Resources, Earth and Environmental Sciences	climatologyMeteorologyAtmosphere	no
GB3222	3222	GB	METEOROLOGY	l1_spt_climate_wnd3r	wind run	km	15 minute	15 minute	9/27/00	2000-09-27	2000-09-27	5/25/05	2005-05-25	2005-05-25	5	Marks	SAS V9			1	point	Open	Meteorology	WeatherDaily, WeatherStation	wind run					Natural Resources, Earth and Environmental Sciences	climatologyMeteorologyAtmosphere	no
GB3223	3223	GB	METEOROLOGY	l1_138i23_climate_irt4_5	infrared plant canopy temperature	°C	15 minute	15 minute	11/2/04	2004-11-02	2004-11-02	9/23/09	2009-09-23	2009-09-23	5	Marks	SAS V9			1	point	Open	Meteorology	WeatherDaily, WeatherStation	Solar radiation, vegetated ground, no media, daily, total					Natural Resources, Earth and Environmental Sciences	climatologyMeteorologyAtmosphere	no
GB3224	3224	GB	METEOROLOGY	l1_138i23_climate_wnd4_5dr	resultant wind direction	°N	15 minute	15 minute	11/2/04	2004-11-02	2004-11-02	9/23/09	2009-09-23	2009-09-23	5	Marks	SAS V9			1	point	Open	Meteorology	WeatherDaily, WeatherStation	Wind direction air, daily, mean					Natural Resources, Earth and Environmental Sciences	climatologyMeteorologyAtmosphere	no
GB3225	3225	GB	METEOROLOGY	l1_138i23_climate_wnd4_5r	wind run	km	15 minute	15 minute	11/2/04	2004-11-02	2004-11-02	9/23/09	2009-09-23	2009-09-23	5	Marks	SAS V9			1	point	Open	Meteorology	WeatherDaily, WeatherStation	wind run					Natural Resources, Earth and Environmental Sciences	climatologyMeteorologyAtmosphere	no
GB3226	3226	GB	METEOROLOGY	l1_138i23_climate_wnd4_5sr	resultant wind speed	m/s	15 minute	15 minute	11/2/04	2004-11-02	2004-11-02	9/23/09	2009-09-23	2009-09-23	5	Marks	SAS V9			1	point	Open	Meteorology	WeatherDaily, WeatherStation	Wind speed, air, daily, mean					Natural Resources, Earth and Environmental Sciences	climatologyMeteorologyAtmosphere	no
GB3227	3227	GB	METEOROLOGY	l1_138i23_climate_wnd4_5sx	maximum wind speed	m/s	15 minute	15 minute	11/2/04	2004-11-02	2004-11-02	9/23/09	2009-09-23	2009-09-23	5	Marks	SAS V9			1	point	Open	Meteorology	WeatherDaily, WeatherStation	wind speed, air, daily, max					Natural Resources, Earth and Environmental Sciences	climatologyMeteorologyAtmosphere	no
GB3228	3228	GB	METEOROLOGY	l1_jdt2b_climate_wnd3dr	resultant wind direction	°N	15 minute	15 minute	5/17/12	2012-05-17	2012-05-17	5/26/17	2017-05-26	2017-05-26	5	Marks	SAS V9			1	point	Open	Meteorology	WeatherDaily, WeatherStation	Wind direction air, daily, mean					Natural Resources, Earth and Environmental Sciences	climatologyMeteorologyAtmosphere	no
GB3229	3229	GB	METEOROLOGY	l1_jdt4b_climate_wnd3dr	resultant wind direction	°N	15 minute	15 minute	5/17/12	2012-05-17	2012-05-17	5/26/17	2017-05-26	2017-05-26	5	Marks	SAS V9			1	point	Open	Meteorology	WeatherDaily, WeatherStation	Wind direction air, daily, mean					Natural Resources, Earth and Environmental Sciences	climatologyMeteorologyAtmosphere	no
GB3230	3230	GB	METEOROLOGY	l1_jdt2b_climate_wnd3sr	resultant wind speed	m/s	15 minute	15 minute	5/17/12	2012-05-17	2012-05-17	5/26/17	2017-05-26	2017-05-26	5	Marks	SAS V9			1	point	Open	Meteorology	WeatherDaily, WeatherStation	Wind speed, air, daily, mean					Natural Resources, Earth and Environmental Sciences	climatologyMeteorologyAtmosphere	no
GB3231	3231	GB	METEOROLOGY	l1_jdt4b_climate_wnd3sr	resultant wind speed	m/s	15 minute	15 minute	5/17/12	2012-05-17	2012-05-17	5/26/17	2017-05-26	2017-05-26	5	Marks	SAS V9			1	point	Open	Meteorology	WeatherDaily, WeatherStation	Wind speed, air, daily, mean					Natural Resources, Earth and Environmental Sciences	climatologyMeteorologyAtmosphere	no
GB3232	3232	GB	METEOROLOGY	l1_13803_climate_wnd3s	wind speed	m/s	15 minute	15 minute	1/1/01	2001-01-01	2001-01-01	3/20/06	2006-03-20	2006-03-20	5	Marks	SAS V9			1	point	Open	Meteorology	WeatherDaily, WeatherStation	Wind speed, air, daily, mean					Natural Resources, Earth and Environmental Sciences	climatologyMeteorologyAtmosphere	no
GB3233	3233	GB	METEOROLOGY	l1_nich_climate_wnd3sa	average wind speed	m/s	15 minute	15 minute	10/23/12	2012-10-23	2012-10-23	8/9/18	2018-08-09	2018-08-09	6	Marks	SAS V9			1	point	Open	Meteorology	WeatherDaily, WeatherStation	Wind speed, air, daily, mean					Natural Resources, Earth and Environmental Sciences	climatologyMeteorologyAtmosphere	no
GB3234	3234	GB	METEOROLOGY	l1_nich_climate_vap3	vapor pressure	kPa	15 minute	15 minute	10/23/12	2012-10-23	2012-10-23	12/19/18	2018-12-19	2018-12-19	6	Marks	SAS V9			1	point	Open	Meteorology	WeatherDaily, WeatherStation	vapor pressure, mean					Natural Resources, Earth and Environmental Sciences	climatologyMeteorologyAtmosphere	no
GB3235	3235	GB	METEOROLOGY	l1_jdt2b_climate_hum3	relative humidity	%	15 minute	15 minute	3/4/11	2011-03-04	2011-03-04	5/26/17	2017-05-26	2017-05-26	6	Marks	SAS V9			1	point	Open	Meteorology	WeatherDaily, WeatherStation	Relative humidity, air, daily, mean					Natural Resources, Earth and Environmental Sciences	climatologyMeteorologyAtmosphere	no
GB3236	3236	GB	METEOROLOGY	l1_jdt4b_climate_hum3	relative humidity	%	15 minute	15 minute	3/4/11	2011-03-04	2011-03-04	5/26/17	2017-05-26	2017-05-26	6	Marks	SAS V9			1	point	Open	Meteorology	WeatherDaily, WeatherStation	Relative humidity, air, daily, mean					Natural Resources, Earth and Environmental Sciences	climatologyMeteorologyAtmosphere	no
GB3237	3237	GB	METEOROLOGY	l1_jdt2b_climate_vap3	vapor pressure	kPa	15 minute	15 minute	3/4/11	2011-03-04	2011-03-04	5/26/17	2017-05-26	2017-05-26	6	Marks	SAS V9			1	point	Open	Meteorology	WeatherDaily, WeatherStation	vapor pressure, mean					Natural Resources, Earth and Environmental Sciences	climatologyMeteorologyAtmosphere	no
GB3238	3238	GB	METEOROLOGY	l1_jdt4b_climate_vap3	vapor pressure	kPa	15 minute	15 minute	3/4/11	2011-03-04	2011-03-04	5/26/17	2017-05-26	2017-05-26	6	Marks	SAS V9			1	point	Open	Meteorology	WeatherDaily, WeatherStation	vapor pressure, mean					Natural Resources, Earth and Environmental Sciences	climatologyMeteorologyAtmosphere	no
GB3239	3239	GB	METEOROLOGY	l1_jdt2b_climate_vap3s	vapor pressure	kPa	15 minute	15 minute	3/4/11	2011-03-04	2011-03-04	5/26/17	2017-05-26	2017-05-26	6	Marks	SAS V9			1	point	Open	Meteorology	WeatherDaily, WeatherStation	vapor pressure, mean					Natural Resources, Earth and Environmental Sciences	climatologyMeteorologyAtmosphere	no
GB3240	3240	GB	METEOROLOGY	l1_jdt4b_climate_vap3s	vapor pressure	kPa	15 minute	15 minute	3/4/11	2011-03-04	2011-03-04	5/26/17	2017-05-26	2017-05-26	6	Marks	SAS V9			1	point	Open	Meteorology	WeatherDaily, WeatherStation	vapor pressure, mean					Natural Resources, Earth and Environmental Sciences	climatologyMeteorologyAtmosphere	no
GB3241	3241	GB	METEOROLOGY	l1_cbte_climate_wnd3sa	average wind speed	m/s	15 minute	15 minute	10/25/12	2012-10-25	2012-10-25	1/29/19	2019-01-29	2019-01-29	6	Marks	SAS V9			1	point	Open	Meteorology	WeatherDaily, WeatherStation	Wind speed, air, daily, mean					Natural Resources, Earth and Environmental Sciences	climatologyMeteorologyAtmosphere	no
GB3242	3242	GB	METEOROLOGY	l1_cbte_climate_vap3	vapor pressure	kPa	15 minute	15 minute	10/23/12	2012-10-23	2012-10-23	1/29/19	2019-01-29	2019-01-29	6	Marks	SAS V9			1	point	Open	Meteorology	WeatherDaily, WeatherStation	vapor pressure, mean					Natural Resources, Earth and Environmental Sciences	climatologyMeteorologyAtmosphere	no
GB3243	3243	GB	METEOROLOGY	l1_orc1_climate_vap3	vapor pressure	kPa	15 minute	15 minute	10/23/12	2012-10-23	2012-10-23	1/29/19	2019-01-29	2019-01-29	6	Marks	SAS V9			1	point	Open	Meteorology	WeatherDaily, WeatherStation	vapor pressure, mean					Natural Resources, Earth and Environmental Sciences	climatologyMeteorologyAtmosphere	no
GB3244	3244	GB	METEOROLOGY	l1_guard_climate_vap3	vapor pressure	kPa	15 minute	15 minute	10/17/12	2012-10-17	2012-10-17	1/29/19	2019-01-29	2019-01-29	6	Marks	SAS V9			1	point	Open	Meteorology	WeatherDaily, WeatherStation	vapor pressure, mean					Natural Resources, Earth and Environmental Sciences	climatologyMeteorologyAtmosphere	no
GB3245	3245	GB	METEOROLOGY	l1_guard_climate_wnd3sa	average wind speed	m/s	15 minute	15 minute	10/17/12	2012-10-17	2012-10-17	1/29/19	2019-01-29	2019-01-29	6	Marks	SAS V9			1	point	Open	Meteorology	WeatherDaily, WeatherStation	Wind speed, air, daily, mean					Natural Resources, Earth and Environmental Sciences	climatologyMeteorologyAtmosphere	no
GB3246	3246	GB	METEOROLOGY	l1_jdt2b_climate_wnd3d	wind direction	°N	15 minute	15 minute	12/22/10	2010-12-22	2010-12-22	5/26/17	2017-05-26	2017-05-26	6	Marks	SAS V9			1	point	Open	Meteorology	WeatherDaily, WeatherStation	Wind direction air, daily, mean					Natural Resources, Earth and Environmental Sciences	climatologyMeteorologyAtmosphere	no
GB3247	3247	GB	METEOROLOGY	l1_jdt4b_climate_wnd3d	wind direction	°N	15 minute	15 minute	12/22/10	2010-12-22	2010-12-22	5/26/17	2017-05-26	2017-05-26	6	Marks	SAS V9			1	point	Open	Meteorology	WeatherDaily, WeatherStation	Wind direction air, daily, mean					Natural Resources, Earth and Environmental Sciences	climatologyMeteorologyAtmosphere	no
GB3248	3248	GB	METEOROLOGY	l1_jdt4b_climate_wnd3sa	average wind speed	m/s	15 minute	15 minute	12/17/10	2010-12-17	2010-12-17	5/26/17	2017-05-26	2017-05-26	6	Marks	SAS V9			1	point	Open	Meteorology	WeatherDaily, WeatherStation	Wind speed, air, daily, mean					Natural Resources, Earth and Environmental Sciences	climatologyMeteorologyAtmosphere	no
GB3249	3249	GB	METEOROLOGY	l1_jdt4b_climate_wnd3sx	maximum wind speed	m/s	15 minute	15 minute	12/17/10	2010-12-17	2010-12-17	5/26/17	2017-05-26	2017-05-26	6	Marks	SAS V9			1	point	Open	Meteorology	WeatherDaily, WeatherStation	wind speed, air, daily, max					Natural Resources, Earth and Environmental Sciences	climatologyMeteorologyAtmosphere	no
GB3250	3250	GB	METEOROLOGY	l1_jdt2b_climate_tmp3	air temperature	°C	15 minute	15 minute	12/13/10	2010-12-13	2010-12-13	5/26/17	2017-05-26	2017-05-26	6	Marks	SAS V9			1	point	Open	Meteorology	WeatherDaily, WeatherStation	Temperature, air, daily, mean	Meteorology				Natural Resources, Earth and Environmental Sciences	climatologyMeteorologyAtmosphere	no
GB3251	3251	GB	METEOROLOGY	l1_jdt4b_climate_tmp3	air temperature	°C	15 minute	15 minute	12/13/10	2010-12-13	2010-12-13	5/26/17	2017-05-26	2017-05-26	6	Marks	SAS V9			1	point	Open	Meteorology	WeatherDaily, WeatherStation	Temperature, air, daily, mean	Meteorology				Natural Resources, Earth and Environmental Sciences	climatologyMeteorologyAtmosphere	no
GB3252	3252	GB	METEOROLOGY	l1_jdt2b_climate_wnd3sa	average wind speed	m/s	15 minute	15 minute	12/13/10	2010-12-13	2010-12-13	5/26/17	2017-05-26	2017-05-26	6	Marks	SAS V9			1	point	Open	Meteorology	WeatherDaily, WeatherStation	Wind speed, air, daily, mean					Natural Resources, Earth and Environmental Sciences	climatologyMeteorologyAtmosphere	no
GB3253	3253	GB	METEOROLOGY	l1_jdt2b_climate_wnd3sx	maximum wind speed	m/s	15 minute	15 minute	12/13/10	2010-12-13	2010-12-13	5/26/17	2017-05-26	2017-05-26	6	Marks	SAS V9			1	point	Open	Meteorology	WeatherDaily, WeatherStation	wind speed, air, daily, max					Natural Resources, Earth and Environmental Sciences	climatologyMeteorologyAtmosphere	no
GB3254	3254	GB	METEOROLOGY	l1_jdt3b_climate_wnd3dr	resultant wind direction	°N	15 minute	15 minute	5/17/12	2012-05-17	2012-05-17	12/7/18	2018-12-07	2018-12-07	7	Marks	SAS V9			1	point	Open	Meteorology	WeatherDaily, WeatherStation	Wind direction air, daily, mean					Natural Resources, Earth and Environmental Sciences	climatologyMeteorologyAtmosphere	no
GB3255	3255	GB	METEOROLOGY	l1_jdt3b_climate_wnd3sr	resultant wind speed	m/s	15 minute	15 minute	5/17/12	2012-05-17	2012-05-17	12/7/18	2018-12-07	2018-12-07	7	Marks	SAS V9			1	point	Open	Meteorology	WeatherDaily, WeatherStation	Wind speed, air, daily, mean					Natural Resources, Earth and Environmental Sciences	climatologyMeteorologyAtmosphere	no
GB3256	3256	GB	METEOROLOGY	l1_124_climate_vap3	vapor pressure	kPa	15 minute	15 minute	7/7/05	2005-07-07	2005-07-07	9/23/12	2012-09-23	2012-09-23	7	Marks	SAS V9			1	point	Open	Meteorology	WeatherDaily, WeatherStation	vapor pressure, mean					Natural Resources, Earth and Environmental Sciences	climatologyMeteorologyAtmosphere	no
GB3257	3257	GB	METEOROLOGY	l1_jdt3b_climate_vap3s	vapor pressure	kPa	15 minute	15 minute	3/4/11	2011-03-04	2011-03-04	7/3/18	2018-07-03	2018-07-03	7	Marks	SAS V9			1	point	Open	Meteorology	WeatherDaily, WeatherStation	vapor pressure, mean					Natural Resources, Earth and Environmental Sciences	climatologyMeteorologyAtmosphere	no
GB3258	3258	GB	METEOROLOGY	l1_jdt3b_climate_vap3	vapor pressure	kPa	15 minute	15 minute	3/4/11	2011-03-04	2011-03-04	7/19/18	2018-07-19	2018-07-19	7	Marks	SAS V9			1	point	Open	Meteorology	WeatherDaily, WeatherStation	vapor pressure, mean					Natural Resources, Earth and Environmental Sciences	climatologyMeteorologyAtmosphere	no
GB3259	3259	GB	METEOROLOGY	l1_098c_climate_wnd3d	wind direction	°N	15 minute	15 minute	8/27/11	2011-08-27	2011-08-27	1/29/19	2019-01-29	2019-01-29	7	Marks	SAS V9			1	point	Open	Meteorology	WeatherDaily, WeatherStation	Wind direction air, daily, mean					Natural Resources, Earth and Environmental Sciences	climatologyMeteorologyAtmosphere	no
GB3260	3260	GB	METEOROLOGY	l1_098c_climate_wnd3dr	resultant wind direction	°N	15 minute	15 minute	8/27/11	2011-08-27	2011-08-27	1/29/19	2019-01-29	2019-01-29	7	Marks	SAS V9			1	point	Open	Meteorology	WeatherDaily, WeatherStation	Wind direction air, daily, mean					Natural Resources, Earth and Environmental Sciences	climatologyMeteorologyAtmosphere	no
GB3261	3261	GB	METEOROLOGY	l1_098c_climate_wnd3sa	average wind speed	m/s	15 minute	15 minute	8/27/11	2011-08-27	2011-08-27	1/29/19	2019-01-29	2019-01-29	7	Marks	SAS V9			1	point	Open	Meteorology	WeatherDaily, WeatherStation	Wind speed, air, daily, mean					Natural Resources, Earth and Environmental Sciences	climatologyMeteorologyAtmosphere	no
GB3262	3262	GB	METEOROLOGY	l1_098c_climate_hum3	relative humidity	%	15 minute	15 minute	8/24/11	2011-08-24	2011-08-24	1/29/19	2019-01-29	2019-01-29	7	Marks	SAS V9			1	point	Open	Meteorology	WeatherDaily, WeatherStation	Relative humidity, air, daily, mean					Natural Resources, Earth and Environmental Sciences	climatologyMeteorologyAtmosphere	no
GB3263	3263	GB	METEOROLOGY	l1_098c_climate_sol	incoming shortwave solar radiation	W/m2	15 minute	15 minute	8/24/11	2011-08-24	2011-08-24	1/29/19	2019-01-29	2019-01-29	7	Marks	SAS V9			1	point	Open	Meteorology	WeatherDaily, WeatherStation	ave_incoming_shortwave radiation					Natural Resources, Earth and Environmental Sciences	climatologyMeteorologyAtmosphere	no
GB3264	3264	GB	METEOROLOGY	l1_098c_climate_tmp3	air temperature	°C	15 minute	15 minute	8/24/11	2011-08-24	2011-08-24	1/29/19	2019-01-29	2019-01-29	7	Marks	SAS V9			1	point	Open	Meteorology	WeatherDaily, WeatherStation	Temperature, air, daily, mean	Meteorology				Natural Resources, Earth and Environmental Sciences	climatologyMeteorologyAtmosphere	no
GB3265	3265	GB	METEOROLOGY	l1_098c_climate_wnd3sr	resultant wind speed	m/s	15 minute	15 minute	8/24/11	2011-08-24	2011-08-24	1/29/19	2019-01-29	2019-01-29	7	Marks	SAS V9			1	point	Open	Meteorology	WeatherDaily, WeatherStation	Wind speed, air, daily, mean					Natural Resources, Earth and Environmental Sciences	climatologyMeteorologyAtmosphere	no
GB3266	3266	GB	METEOROLOGY	l1_jdt3b_climate_wnd3sx	maximum wind speed	m/s	15 minute	15 minute	12/13/10	2010-12-13	2010-12-13	7/18/18	2018-07-18	2018-07-18	8	Marks	SAS V9			1	point	Open	Meteorology	WeatherDaily, WeatherStation	wind speed, air, daily, max					Natural Resources, Earth and Environmental Sciences	climatologyMeteorologyAtmosphere	no
GB3267	3267	GB	METEOROLOGY	l1_jdt3b_climate_hum3	relative humidity	%	15 minute	15 minute	3/4/11	2011-03-04	2011-03-04	12/7/18	2018-12-07	2018-12-07	8	Marks	SAS V9			1	point	Open	Meteorology	WeatherDaily, WeatherStation	Relative humidity, air, daily, mean					Natural Resources, Earth and Environmental Sciences	climatologyMeteorologyAtmosphere	no
GB3268	3268	GB	METEOROLOGY	l1_spt_climate_wnd3sa	average wind speed	m/s	15 minute	15 minute	9/22/05	2005-09-22	2005-09-22	7/24/13	2013-07-24	2013-07-24	8	Marks	SAS V9			1	point	Open	Meteorology	WeatherDaily, WeatherStation	Wind speed, air, daily, mean					Natural Resources, Earth and Environmental Sciences	climatologyMeteorologyAtmosphere	no
GB3269	3269	GB	METEOROLOGY	l1_spt_climate_wnd3sr	resultant wind speed	m/s	15 minute	15 minute	9/22/05	2005-09-22	2005-09-22	7/24/13	2013-07-24	2013-07-24	8	Marks	SAS V9			1	point	Open	Meteorology	WeatherDaily, WeatherStation	Wind speed, air, daily, mean					Natural Resources, Earth and Environmental Sciences	climatologyMeteorologyAtmosphere	no
GB3270	3270	GB	METEOROLOGY	l1_jdt3b_climate_wnd3d	wind direction	°N	15 minute	15 minute	12/22/10	2010-12-22	2010-12-22	12/7/18	2018-12-07	2018-12-07	8	Marks	SAS V9			1	point	Open	Meteorology	WeatherDaily, WeatherStation	Wind direction air, daily, mean					Natural Resources, Earth and Environmental Sciences	climatologyMeteorologyAtmosphere	no
GB3271	3271	GB	METEOROLOGY	l1_jdt3b_climate_tmp3	air temperature	°C	15 minute	15 minute	12/13/10	2010-12-13	2010-12-13	12/7/18	2018-12-07	2018-12-07	8	Marks	SAS V9			1	point	Open	Meteorology	WeatherDaily, WeatherStation	Temperature, air, daily, mean	Meteorology				Natural Resources, Earth and Environmental Sciences	climatologyMeteorologyAtmosphere	no
GB3272	3272	GB	METEOROLOGY	l1_jdt3b_climate_wnd3sa	average wind speed	m/s	15 minute	15 minute	12/13/10	2010-12-13	2010-12-13	12/7/18	2018-12-07	2018-12-07	8	Marks	SAS V9			1	point	Open	Meteorology	WeatherDaily, WeatherStation	Wind speed, air, daily, mean					Natural Resources, Earth and Environmental Sciences	climatologyMeteorologyAtmosphere	no
GB3273	3273	GB	METEOROLOGY	l1_bst_climate_wnd3d	wind direction	°N	15 minute	15 minute	5/25/05	2005-05-25	2005-05-25	7/11/13	2013-07-11	2013-07-11	8	Marks	SAS V9			1	point	Open	Meteorology	WeatherDaily, WeatherStation	Wind direction air, daily, mean					Natural Resources, Earth and Environmental Sciences	climatologyMeteorologyAtmosphere	no
GB3274	3274	GB	METEOROLOGY	l1_spt_climate_wnd3sx	maximum wind speed	m/s	15 minute	15 minute	10/4/04	2004-10-04	2004-10-04	7/24/13	2013-07-24	2013-07-24	9	Marks	SAS V9			1	point	Open	Meteorology	WeatherDaily, WeatherStation	wind speed, air, daily, max					Natural Resources, Earth and Environmental Sciences	climatologyMeteorologyAtmosphere	no
GB3275	3275	GB	METEOROLOGY	l1_spt_climate_vap3	vapor pressure	kPa	15 minute	15 minute	9/23/04	2004-09-23	2004-09-23	7/24/13	2013-07-24	2013-07-24	9	Marks	SAS V9			1	point	Open	Meteorology	WeatherDaily, WeatherStation	vapor pressure, mean					Natural Resources, Earth and Environmental Sciences	climatologyMeteorologyAtmosphere	no
GB3276	3276	GB	METEOROLOGY	l1_spt_climate_wnd3s	wind speed	m/s	15 minute	15 minute	9/23/04	2004-09-23	2004-09-23	7/24/13	2013-07-24	2013-07-24	9	Marks	SAS V9			1	point	Open	Meteorology	WeatherDaily, WeatherStation	Wind speed, air, daily, mean					Natural Resources, Earth and Environmental Sciences	climatologyMeteorologyAtmosphere	no
GB3277	3277	GB	METEOROLOGY	l1_138i23_climate_hum3	relative humidity	%	15 minute	15 minute	11/25/04	2004-11-25	2004-11-25	10/30/13	2013-10-30	2013-10-30	9	Marks	SAS V9			1	point	Open	Meteorology	WeatherDaily, WeatherStation	Relative humidity, air, daily, mean					Natural Resources, Earth and Environmental Sciences	climatologyMeteorologyAtmosphere	no
GB3278	3278	GB	METEOROLOGY	l1_138i23_climate_tmp3	air temperature	°C	15 minute	15 minute	11/25/04	2004-11-25	2004-11-25	10/30/13	2013-10-30	2013-10-30	9	Marks	SAS V9			1	point	Open	Meteorology	WeatherDaily, WeatherStation	Temperature, air, daily, mean	Meteorology				Natural Resources, Earth and Environmental Sciences	climatologyMeteorologyAtmosphere	no
GB3279	3279	GB	METEOROLOGY	l1_138i23_climate_vap3	vapor pressure	kPa	15 minute	15 minute	11/25/04	2004-11-25	2004-11-25	10/30/13	2013-10-30	2013-10-30	9	Marks	SAS V9			1	point	Open	Meteorology	WeatherDaily, WeatherStation	vapor pressure, mean					Natural Resources, Earth and Environmental Sciences	climatologyMeteorologyAtmosphere	no
GB3280	3280	GB	METEOROLOGY	l1_127_climate_wnd10r	wind run	km	15 minute	15 minute	3/25/97	1997-03-25	1997-03-25	3/20/06	2006-03-20	2006-03-20	9	Marks	SAS V9			1	point	Open	Meteorology	WeatherDaily, WeatherStation	wind run					Natural Resources, Earth and Environmental Sciences	climatologyMeteorologyAtmosphere	no
GB3281	3281	GB	METEOROLOGY	l1_127_climate_wnd10s	wind speed	m/s	15 minute	15 minute	3/25/97	1997-03-25	1997-03-25	3/20/06	2006-03-20	2006-03-20	9	Marks	SAS V9			1	point	Open	Meteorology	WeatherDaily, WeatherStation	Wind speed, air, daily, mean					Natural Resources, Earth and Environmental Sciences	climatologyMeteorologyAtmosphere	no
GB3282	3282	GB	METEOROLOGY	l1_127_climate_wnd3r	wind run	km	15 minute	15 minute	3/25/97	1997-03-25	1997-03-25	3/20/06	2006-03-20	2006-03-20	9	Marks	SAS V9			1	point	Open	Meteorology	WeatherDaily, WeatherStation	wind run					Natural Resources, Earth and Environmental Sciences	climatologyMeteorologyAtmosphere	no
GB3283	3283	GB	METEOROLOGY	l1_127_climate_wnd3s	wind speed	m/s	15 minute	15 minute	3/25/97	1997-03-25	1997-03-25	3/20/06	2006-03-20	2006-03-20	9	Marks	SAS V9			1	point	Open	Meteorology	WeatherDaily, WeatherStation	Wind speed, air, daily, mean					Natural Resources, Earth and Environmental Sciences	climatologyMeteorologyAtmosphere	no
GB3284	3284	GB	METEOROLOGY	l1_bst_climate_hum3	relative humidity	%	15 minute	15 minute	7/8/04	2004-07-08	2004-07-08	7/11/13	2013-07-11	2013-07-11	9	Marks	SAS V9			1	point	Open	Meteorology	WeatherDaily, WeatherStation	Relative humidity, air, daily, mean					Natural Resources, Earth and Environmental Sciences	climatologyMeteorologyAtmosphere	no
GB3285	3285	GB	METEOROLOGY	l1_bst_climate_vap3	vapor pressure	kPa	15 minute	15 minute	7/8/04	2004-07-08	2004-07-08	7/11/13	2013-07-11	2013-07-11	9	Marks	SAS V9			1	point	Open	Meteorology	WeatherDaily, WeatherStation	vapor pressure, mean					Natural Resources, Earth and Environmental Sciences	climatologyMeteorologyAtmosphere	no
GB3286	3286	GB	METEOROLOGY	l1_bst_climate_wnd3dr	resultant wind direction	°N	15 minute	15 minute	7/8/04	2004-07-08	2004-07-08	7/11/13	2013-07-11	2013-07-11	9	Marks	SAS V9			1	point	Open	Meteorology	WeatherDaily, WeatherStation	Wind direction air, daily, mean					Natural Resources, Earth and Environmental Sciences	climatologyMeteorologyAtmosphere	no
GB3287	3287	GB	METEOROLOGY	l1_bst_climate_wnd3sa	average wind speed	m/s	15 minute	15 minute	7/8/04	2004-07-08	2004-07-08	7/11/13	2013-07-11	2013-07-11	9	Marks	SAS V9			1	point	Open	Meteorology	WeatherDaily, WeatherStation	Wind speed, air, daily, mean					Natural Resources, Earth and Environmental Sciences	climatologyMeteorologyAtmosphere	no
GB3288	3288	GB	METEOROLOGY	l1_bst_climate_wnd3sr	resultant wind speed	m/s	15 minute	15 minute	7/8/04	2004-07-08	2004-07-08	7/11/13	2013-07-11	2013-07-11	9	Marks	SAS V9			1	point	Open	Meteorology	WeatherDaily, WeatherStation	Wind speed, air, daily, mean					Natural Resources, Earth and Environmental Sciences	climatologyMeteorologyAtmosphere	no
GB3289	3289	GB	METEOROLOGY	l1_bst_climate_wnd3sx	maximum wind speed	m/s	15 minute	15 minute	7/8/04	2004-07-08	2004-07-08	7/11/13	2013-07-11	2013-07-11	9	Marks	SAS V9			1	point	Open	Meteorology	WeatherDaily, WeatherStation	wind speed, air, daily, max					Natural Resources, Earth and Environmental Sciences	climatologyMeteorologyAtmosphere	no
GB3290	3290	GB	METEOROLOGY	l1_127_climate_vap10	vapor pressure	kPa	15 minute	15 minute	3/20/06	2006-03-20	2006-03-20	7/6/15	2015-07-06	2015-07-06	9	Marks	SAS V9			1	point	Open	Meteorology	WeatherDaily, WeatherStation	vapor pressure, mean					Natural Resources, Earth and Environmental Sciences	climatologyMeteorologyAtmosphere	no
GB3291	3291	GB	METEOROLOGY	l1_127_climate_vap3	vapor pressure	kPa	15 minute	15 minute	3/20/06	2006-03-20	2006-03-20	7/6/15	2015-07-06	2015-07-06	9	Marks	SAS V9			1	point	Open	Meteorology	WeatherDaily, WeatherStation	vapor pressure, mean					Natural Resources, Earth and Environmental Sciences	climatologyMeteorologyAtmosphere	no
GB3292	3292	GB	METEOROLOGY	l1_076_climate_vap10	vapor pressure	kPa	15 minute	15 minute	5/2/06	2006-05-02	2006-05-02	8/19/15	2015-08-19	2015-08-19	9	Marks	SAS V9			1	point	Open	Meteorology	WeatherDaily, WeatherStation	vapor pressure, mean					Natural Resources, Earth and Environmental Sciences	climatologyMeteorologyAtmosphere	no
GB3293	3293	GB	METEOROLOGY	l1_076_climate_vap3	vapor pressure	kPa	15 minute	15 minute	5/2/06	2006-05-02	2006-05-02	8/19/15	2015-08-19	2015-08-19	9	Marks	SAS V9			1	point	Open	Meteorology	WeatherDaily, WeatherStation	vapor pressure, mean					Natural Resources, Earth and Environmental Sciences	climatologyMeteorologyAtmosphere	no
GB3294	3294	GB	METEOROLOGY	l1_138i23_climate_wnd3sa	average wind speed	m/s	15 minute	15 minute	11/25/04	2004-11-25	2004-11-25	3/28/14	2014-03-28	2014-03-28	9	Marks	SAS V9			1	point	Open	Meteorology	WeatherDaily, WeatherStation	Wind speed, air, daily, mean					Natural Resources, Earth and Environmental Sciences	climatologyMeteorologyAtmosphere	no
GB3295	3295	GB	METEOROLOGY	l1_128_climate_vap10	vapor pressure	kPa	15 minute	15 minute	3/20/06	2006-03-20	2006-03-20	10/21/15	2015-10-21	2015-10-21	10	Marks	SAS V9			1	point	Open	Meteorology	WeatherDaily, WeatherStation	vapor pressure, mean					Natural Resources, Earth and Environmental Sciences	climatologyMeteorologyAtmosphere	no
GB3296	3296	GB	METEOROLOGY	l1_128_climate_vap3	vapor pressure	kPa	15 minute	15 minute	3/20/06	2006-03-20	2006-03-20	10/21/15	2015-10-21	2015-10-21	10	Marks	SAS V9			1	point	Open	Meteorology	WeatherDaily, WeatherStation	vapor pressure, mean					Natural Resources, Earth and Environmental Sciences	climatologyMeteorologyAtmosphere	no
GB3297	3297	GB	METEOROLOGY	l1_13803_climate_sol	incoming shortwave solar radiation	W/m2	15 minute	15 minute	1/21/04	2004-01-21	2004-01-21	9/4/13	2013-09-04	2013-09-04	10	Marks	SAS V9			1	point	Open	Meteorology	WeatherDaily, WeatherStation	ave_incoming_shortwave radiation					Natural Resources, Earth and Environmental Sciences	climatologyMeteorologyAtmosphere	no
GB3298	3298	GB	METEOROLOGY	l1_128_climate_wnd10s	wind speed	m/s	15 minute	15 minute	7/24/96	1996-07-24	1996-07-24	3/20/06	2006-03-20	2006-03-20	10	Marks	SAS V9			1	point	Open	Meteorology	WeatherDaily, WeatherStation	Wind speed, air, daily, mean					Natural Resources, Earth and Environmental Sciences	climatologyMeteorologyAtmosphere	no
GB3299	3299	GB	METEOROLOGY	l1_128_climate_wnd3s	wind speed	m/s	15 minute	15 minute	7/24/96	1996-07-24	1996-07-24	3/20/06	2006-03-20	2006-03-20	10	Marks	SAS V9			1	point	Open	Meteorology	WeatherDaily, WeatherStation	Wind speed, air, daily, mean					Natural Resources, Earth and Environmental Sciences	climatologyMeteorologyAtmosphere	no
GB3300	3300	GB	METEOROLOGY	l1_bst_climate_irt1	infrared plant canopy temperature	°C	15 minute	15 minute	11/14/03	2003-11-14	2003-11-14	7/11/13	2013-07-11	2013-07-11	10	Marks	SAS V9			1	point	Open	Meteorology	WeatherDaily, WeatherStation	Solar radiation, vegetated ground, no media, daily, total					Natural Resources, Earth and Environmental Sciences	climatologyMeteorologyAtmosphere	no
GB3301	3301	GB	METEOROLOGY	l1_bst_climate_tmp3	air temperature	°C	15 minute	15 minute	11/14/03	2003-11-14	2003-11-14	7/11/13	2013-07-11	2013-07-11	10	Marks	SAS V9			1	point	Open	Meteorology	WeatherDaily, WeatherStation	Temperature, air, daily, mean	Meteorology				Natural Resources, Earth and Environmental Sciences	climatologyMeteorologyAtmosphere	no
GB3302	3302	GB	METEOROLOGY	l1_138i23_climate_hum1_5	relative humidity	%	15 minute	15 minute	11/25/04	2004-11-25	2004-11-25	8/11/14	2014-08-11	2014-08-11	10	Marks	SAS V9			1	point	Open	Meteorology	WeatherDaily, WeatherStation	Relative humidity, air, daily, mean					Natural Resources, Earth and Environmental Sciences	climatologyMeteorologyAtmosphere	no
GB3303	3303	GB	METEOROLOGY	l1_138i23_climate_hum4_5	relative humidity	%	15 minute	15 minute	11/25/04	2004-11-25	2004-11-25	8/11/14	2014-08-11	2014-08-11	10	Marks	SAS V9			1	point	Open	Meteorology	WeatherDaily, WeatherStation	Relative humidity, air, daily, mean					Natural Resources, Earth and Environmental Sciences	climatologyMeteorologyAtmosphere	no
GB3304	3304	GB	METEOROLOGY	l1_138i23_climate_sol	incoming shortwave solar radiation	W/m2	15 minute	15 minute	11/25/04	2004-11-25	2004-11-25	8/11/14	2014-08-11	2014-08-11	10	Marks	SAS V9			1	point	Open	Meteorology	WeatherDaily, WeatherStation	ave_incoming_shortwave radiation					Natural Resources, Earth and Environmental Sciences	climatologyMeteorologyAtmosphere	no
GB3305	3305	GB	METEOROLOGY	l1_138i23_climate_tmp1_5	air temperature	°C	15 minute	15 minute	11/25/04	2004-11-25	2004-11-25	8/11/14	2014-08-11	2014-08-11	10	Marks	SAS V9			1	point	Open	Meteorology	WeatherDaily, WeatherStation	Temperature, air, daily, mean	Meteorology				Natural Resources, Earth and Environmental Sciences	climatologyMeteorologyAtmosphere	no
GB3306	3306	GB	METEOROLOGY	l1_138i23_climate_tmp4_5	air temperature	°C	15 minute	15 minute	11/25/04	2004-11-25	2004-11-25	8/11/14	2014-08-11	2014-08-11	10	Marks	SAS V9			1	point	Open	Meteorology	WeatherDaily, WeatherStation	Temperature, air, daily, mean	Meteorology				Natural Resources, Earth and Environmental Sciences	climatologyMeteorologyAtmosphere	no
GB3307	3307	GB	METEOROLOGY	l1_138i23_climate_vap1_5	vapor pressure	kPa	15 minute	15 minute	11/25/04	2004-11-25	2004-11-25	8/11/14	2014-08-11	2014-08-11	10	Marks	SAS V9			1	point	Open	Meteorology	WeatherDaily, WeatherStation	vapor pressure, mean					Natural Resources, Earth and Environmental Sciences	climatologyMeteorologyAtmosphere	no
GB3308	3308	GB	METEOROLOGY	l1_138i23_climate_vap4_5	vapor pressure	kPa	15 minute	15 minute	11/25/04	2004-11-25	2004-11-25	8/11/14	2014-08-11	2014-08-11	10	Marks	SAS V9			1	point	Open	Meteorology	WeatherDaily, WeatherStation	vapor pressure, mean					Natural Resources, Earth and Environmental Sciences	climatologyMeteorologyAtmosphere	no
GB3309	3309	GB	METEOROLOGY	l1_138i23_climate_wnd1_5sa	average wind speed	m/s	15 minute	15 minute	11/25/04	2004-11-25	2004-11-25	8/11/14	2014-08-11	2014-08-11	10	Marks	SAS V9			1	point	Open	Meteorology	WeatherDaily, WeatherStation	Wind speed, air, daily, mean					Natural Resources, Earth and Environmental Sciences	climatologyMeteorologyAtmosphere	no
GB3310	3310	GB	METEOROLOGY	l1_138i23_climate_irt0	infrared surface temperature	°C	15 minute	15 minute	11/2/04	2004-11-02	2004-11-02	8/11/14	2014-08-11	2014-08-11	10	Marks	SAS V9			1	point	Open	Meteorology	WeatherDaily, WeatherStation	Solar radiation, bare ground, no media, daily, total					Natural Resources, Earth and Environmental Sciences	climatologyMeteorologyAtmosphere	
GB3311	3311	GB	METEOROLOGY	l1_138i23_climate_irt1_5	infrared plant canopy temperature	°C	15 minute	15 minute	11/2/04	2004-11-02	2004-11-02	8/11/14	2014-08-11	2014-08-11	10	Marks	SAS V9			1	point	Open	Meteorology	WeatherDaily, WeatherStation	Solar radiation, vegetated ground, no media, daily, total					Natural Resources, Earth and Environmental Sciences	climatologyMeteorologyAtmosphere	no
GB3312	3312	GB	METEOROLOGY	l1_138i23_climate_irt3	infrared plant canopy temperature	°C	15 minute	15 minute	11/2/04	2004-11-02	2004-11-02	8/11/14	2014-08-11	2014-08-11	10	Marks	SAS V9			1	point	Open	Meteorology	WeatherDaily, WeatherStation	Solar radiation, vegetated ground, no media, daily, total					Natural Resources, Earth and Environmental Sciences	climatologyMeteorologyAtmosphere	no
GB3313	3313	GB	METEOROLOGY	l1_138i23_climate_wnd1_5dr	resultant wind direction	°N	15 minute	15 minute	11/2/04	2004-11-02	2004-11-02	8/11/14	2014-08-11	2014-08-11	10	Marks	SAS V9			1	point	Open	Meteorology	WeatherDaily, WeatherStation	Wind direction air, daily, mean					Natural Resources, Earth and Environmental Sciences	climatologyMeteorologyAtmosphere	no
GB3314	3314	GB	METEOROLOGY	l1_138i23_climate_wnd1_5r	wind run	km	15 minute	15 minute	11/2/04	2004-11-02	2004-11-02	8/11/14	2014-08-11	2014-08-11	10	Marks	SAS V9			1	point	Open	Meteorology	WeatherDaily, WeatherStation	wind run					Natural Resources, Earth and Environmental Sciences	climatologyMeteorologyAtmosphere	no
GB3315	3315	GB	METEOROLOGY	l1_138i23_climate_wnd1_5sr	resultant wind speed	m/s	15 minute	15 minute	11/2/04	2004-11-02	2004-11-02	8/11/14	2014-08-11	2014-08-11	10	Marks	SAS V9			1	point	Open	Meteorology	WeatherDaily, WeatherStation	Wind speed, air, daily, mean					Natural Resources, Earth and Environmental Sciences	climatologyMeteorologyAtmosphere	no
GB3316	3316	GB	METEOROLOGY	l1_138i23_climate_wnd1_5sx	maximum wind speed	m/s	15 minute	15 minute	11/2/04	2004-11-02	2004-11-02	8/11/14	2014-08-11	2014-08-11	10	Marks	SAS V9			1	point	Open	Meteorology	WeatherDaily, WeatherStation	wind speed, air, daily, max					Natural Resources, Earth and Environmental Sciences	climatologyMeteorologyAtmosphere	no
GB3317	3317	GB	METEOROLOGY	l1_138i23_climate_wnd3dr	resultant wind direction	°N	15 minute	15 minute	11/2/04	2004-11-02	2004-11-02	8/11/14	2014-08-11	2014-08-11	10	Marks	SAS V9			1	point	Open	Meteorology	WeatherDaily, WeatherStation	Wind direction air, daily, mean					Natural Resources, Earth and Environmental Sciences	climatologyMeteorologyAtmosphere	no
GB3318	3318	GB	METEOROLOGY	l1_138i23_climate_wnd3r	wind run	km	15 minute	15 minute	11/2/04	2004-11-02	2004-11-02	8/11/14	2014-08-11	2014-08-11	10	Marks	SAS V9			1	point	Open	Meteorology	WeatherDaily, WeatherStation	wind run					Natural Resources, Earth and Environmental Sciences	climatologyMeteorologyAtmosphere	no
GB3319	3319	GB	METEOROLOGY	l1_138i23_climate_wnd3sr	resultant wind speed	m/s	15 minute	15 minute	11/2/04	2004-11-02	2004-11-02	8/11/14	2014-08-11	2014-08-11	10	Marks	SAS V9			1	point	Open	Meteorology	WeatherDaily, WeatherStation	Wind speed, air, daily, mean					Natural Resources, Earth and Environmental Sciences	climatologyMeteorologyAtmosphere	no
GB3320	3320	GB	METEOROLOGY	l1_138i23_climate_wnd3sx	maximum wind speed	m/s	15 minute	15 minute	11/2/04	2004-11-02	2004-11-02	8/11/14	2014-08-11	2014-08-11	10	Marks	SAS V9			1	point	Open	Meteorology	WeatherDaily, WeatherStation	wind speed, air, daily, max					Natural Resources, Earth and Environmental Sciences	climatologyMeteorologyAtmosphere	no
GB3321	3321	GB	METEOROLOGY	l1_166b_climate_sol	incoming shortwave solar radiation	W/m2	15 minute	15 minute	10/2/03	2003-10-02	2003-10-02	8/27/13	2013-08-27	2013-08-27	10	Marks	SAS V9			1	point	Open	Meteorology	WeatherDaily, WeatherStation	ave_incoming_shortwave radiation					Natural Resources, Earth and Environmental Sciences	climatologyMeteorologyAtmosphere	no
GB3322	3322	GB	METEOROLOGY	l1_176b_climate_vap3	vapor pressure	kPa	15 minute	15 minute	5/25/05	2005-05-25	2005-05-25	4/20/15	2015-04-20	2015-04-20	10	Marks	SAS V9			1	point	Open	Meteorology	WeatherDaily, WeatherStation	vapor pressure, mean					Natural Resources, Earth and Environmental Sciences	climatologyMeteorologyAtmosphere	no
GB3323	3323	GB	METEOROLOGY	l1_095b_climate_vap3	vapor pressure	kPa	15 minute	15 minute	2/27/06	2006-02-27	2006-02-27	2/2/16	2016-02-02	2016-02-02	10	Marks	SAS V9			1	point	Open	Meteorology	WeatherDaily, WeatherStation	vapor pressure, mean					Natural Resources, Earth and Environmental Sciences	climatologyMeteorologyAtmosphere	no
GB3324	3324	GB	METEOROLOGY	l1_095b_climate_wnd3sx	maximum wind speed	m/s	15 minute	15 minute	2/27/06	2006-02-27	2006-02-27	2/2/16	2016-02-02	2016-02-02	10	Marks	SAS V9			1	point	Open	Meteorology	WeatherDaily, WeatherStation	wind speed, air, daily, max					Natural Resources, Earth and Environmental Sciences	climatologyMeteorologyAtmosphere	no
GB3325	3325	GB	METEOROLOGY	l1_176_climate_wnd10s	wind speed	m/s	15 minute	15 minute	8/2/96	1996-08-02	1996-08-02	8/22/06	2006-08-22	2006-08-22	10	Marks	SAS V9			1	point	Open	Meteorology	WeatherDaily, WeatherStation	Wind speed, air, daily, mean					Natural Resources, Earth and Environmental Sciences	climatologyMeteorologyAtmosphere	no
GB3326	3326	GB	METEOROLOGY	l1_176_climate_wnd3s	wind speed	m/s	15 minute	15 minute	8/2/96	1996-08-02	1996-08-02	8/22/06	2006-08-22	2006-08-22	10	Marks	SAS V9			1	point	Open	Meteorology	WeatherDaily, WeatherStation	Wind speed, air, daily, mean					Natural Resources, Earth and Environmental Sciences	climatologyMeteorologyAtmosphere	no
GB3327	3327	GB	METEOROLOGY	l1_145_climate_vap3	vapor pressure	kPa	15 minute	15 minute	7/7/05	2005-07-07	2005-07-07	9/22/15	2015-09-22	2015-09-22	10	Marks	SAS V9			1	point	Open	Meteorology	WeatherDaily, WeatherStation	vapor pressure, mean					Natural Resources, Earth and Environmental Sciences	climatologyMeteorologyAtmosphere	no
GB3328	3328	GB	METEOROLOGY	l1_124_climate_hum3	relative humidity	%	15 minute	15 minute	7/1/02	2002-07-01	2002-07-01	9/23/12	2012-09-23	2012-09-23	10	Marks	SAS V9			1	point	Open	Meteorology	WeatherDaily, WeatherStation	Relative humidity, air, daily, mean					Natural Resources, Earth and Environmental Sciences	climatologyMeteorologyAtmosphere	no
GB3329	3329	GB	METEOROLOGY	l1_176b_climate_vap15	vapor pressure	kPa	15 minute	15 minute	5/25/05	2005-05-25	2005-05-25	8/27/15	2015-08-27	2015-08-27	10	Marks	SAS V9			1	point	Open	Meteorology	WeatherDaily, WeatherStation	vapor pressure, mean					Natural Resources, Earth and Environmental Sciences	climatologyMeteorologyAtmosphere	no
GB3330	3330	GB	METEOROLOGY	l1_176b_climate_vap9	vapor pressure	kPa	15 minute	15 minute	5/25/05	2005-05-25	2005-05-25	8/27/15	2015-08-27	2015-08-27	10	Marks	SAS V9			1	point	Open	Meteorology	WeatherDaily, WeatherStation	vapor pressure, mean					Natural Resources, Earth and Environmental Sciences	climatologyMeteorologyAtmosphere	no
GB3331	3331	GB	METEOROLOGY	l1_167b_climate_vap3	vapor pressure	kPa	15 minute	15 minute	1/27/05	2005-01-27	2005-01-27	6/9/15	2015-06-09	2015-06-09	10	Marks	SAS V9			1	point	Open	Meteorology	WeatherDaily, WeatherStation	vapor pressure, mean					Natural Resources, Earth and Environmental Sciences	climatologyMeteorologyAtmosphere	no
GB3332	3332	GB	METEOROLOGY	l1_124b_climate_wnd3d	wind direction	°N	15 minute	15 minute	10/31/06	2006-10-31	2006-10-31	3/29/17	2017-03-29	2017-03-29	10	Marks	SAS V9			1	point	Open	Meteorology	WeatherDaily, WeatherStation	Wind direction air, daily, mean					Natural Resources, Earth and Environmental Sciences	climatologyMeteorologyAtmosphere	no
GB3333	3333	GB	METEOROLOGY	l1_124b_climate_wnd3dr	resultant wind direction	°N	15 minute	15 minute	10/31/06	2006-10-31	2006-10-31	3/29/17	2017-03-29	2017-03-29	10	Marks	SAS V9			1	point	Open	Meteorology	WeatherDaily, WeatherStation	Wind direction air, daily, mean					Natural Resources, Earth and Environmental Sciences	climatologyMeteorologyAtmosphere	no
GB3334	3334	GB	METEOROLOGY	l1_124b_climate_wnd3sr	resultant wind speed	m/s	15 minute	15 minute	10/31/06	2006-10-31	2006-10-31	3/29/17	2017-03-29	2017-03-29	10	Marks	SAS V9			1	point	Open	Meteorology	WeatherDaily, WeatherStation	Wind speed, air, daily, mean					Natural Resources, Earth and Environmental Sciences	climatologyMeteorologyAtmosphere	no
GB3335	3335	GB	METEOROLOGY	l1_167b_climate_wnd3sx	maximum wind speed	m/s	15 minute	15 minute	1/27/05	2005-01-27	2005-01-27	8/19/15	2015-08-19	2015-08-19	11	Marks	SAS V9			1	point	Open	Meteorology	WeatherDaily, WeatherStation	wind speed, air, daily, max					Natural Resources, Earth and Environmental Sciences	climatologyMeteorologyAtmosphere	no
GB3336	3336	GB	METEOROLOGY	l1_124_climate_wnd3sx	maximum wind speed	m/s	15 minute	15 minute	11/4/04	2004-11-04	2004-11-04	8/19/15	2015-08-19	2015-08-19	11	Marks	SAS V9			1	point	Open	Meteorology	WeatherDaily, WeatherStation	wind speed, air, daily, max					Natural Resources, Earth and Environmental Sciences	climatologyMeteorologyAtmosphere	no
GB3337	3337	GB	METEOROLOGY	l1_176_climate_vap10	vapor pressure	kPa	15 minute	15 minute	11/11/04	2004-11-11	2004-11-11	1/19/16	2016-01-19	2016-01-19	11	Marks	SAS V9			1	point	Open	Meteorology	WeatherDaily, WeatherStation	vapor pressure, mean					Natural Resources, Earth and Environmental Sciences	climatologyMeteorologyAtmosphere	no
GB3338	3338	GB	METEOROLOGY	l1_176_climate_vap3	vapor pressure	kPa	15 minute	15 minute	11/8/04	2004-11-08	2004-11-08	1/19/16	2016-01-19	2016-01-19	11	Marks	SAS V9			1	point	Open	Meteorology	WeatherDaily, WeatherStation	vapor pressure, mean					Natural Resources, Earth and Environmental Sciences	climatologyMeteorologyAtmosphere	no
GB3339	3339	GB	METEOROLOGY	l1_166b_climate_vap3	vapor pressure	kPa	15 minute	15 minute	9/20/04	2004-09-20	2004-09-20	1/21/16	2016-01-21	2016-01-21	11	Marks	SAS V9			1	point	Open	Meteorology	WeatherDaily, WeatherStation	vapor pressure, mean					Natural Resources, Earth and Environmental Sciences	climatologyMeteorologyAtmosphere	no
GB3340	3340	GB	METEOROLOGY	l1_166b_climate_wnd3sx	maximum wind speed	m/s	15 minute	15 minute	9/20/04	2004-09-20	2004-09-20	1/21/16	2016-01-21	2016-01-21	11	Marks	SAS V9			1	point	Open	Meteorology	WeatherDaily, WeatherStation	wind speed, air, daily, max					Natural Resources, Earth and Environmental Sciences	climatologyMeteorologyAtmosphere	no
GB3341	3341	GB	METEOROLOGY	l1_smm2_climate_hum3	relative humidity	%	15 minute	15 minute	7/12/07	2007-07-12	2007-07-12	1/29/19	2019-01-29	2019-01-29	12	Marks	SAS V9			1	point	Open	Meteorology	WeatherDaily, WeatherStation	Relative humidity, air, daily, mean					Natural Resources, Earth and Environmental Sciences	climatologyMeteorologyAtmosphere	no
GB3342	3342	GB	METEOROLOGY	l1_smm2_climate_sol	incoming shortwave solar radiation	W/m2	15 minute	15 minute	7/12/07	2007-07-12	2007-07-12	1/29/19	2019-01-29	2019-01-29	12	Marks	SAS V9			1	point	Open	Meteorology	WeatherDaily, WeatherStation	ave_incoming_shortwave radiation					Natural Resources, Earth and Environmental Sciences	climatologyMeteorologyAtmosphere	no
GB3343	3343	GB	METEOROLOGY	l1_smm2_climate_tmp3	air temperature	°C	15 minute	15 minute	7/12/07	2007-07-12	2007-07-12	1/29/19	2019-01-29	2019-01-29	12	Marks	SAS V9			1	point	Open	Meteorology	WeatherDaily, WeatherStation	Temperature, air, daily, mean	Meteorology				Natural Resources, Earth and Environmental Sciences	climatologyMeteorologyAtmosphere	no
GB3344	3344	GB	METEOROLOGY	l1_smm2_climate_vap3	vapor pressure	kPa	15 minute	15 minute	7/12/07	2007-07-12	2007-07-12	1/29/19	2019-01-29	2019-01-29	12	Marks	SAS V9			1	point	Open	Meteorology	WeatherDaily, WeatherStation	vapor pressure, mean					Natural Resources, Earth and Environmental Sciences	climatologyMeteorologyAtmosphere	no
GB3345	3345	GB	METEOROLOGY	l1_smm2_climate_wnd3d	wind direction	°N	15 minute	15 minute	7/12/07	2007-07-12	2007-07-12	1/29/19	2019-01-29	2019-01-29	12	Marks	SAS V9			1	point	Open	Meteorology	WeatherDaily, WeatherStation	Wind direction air, daily, mean					Natural Resources, Earth and Environmental Sciences	climatologyMeteorologyAtmosphere	no
GB3346	3346	GB	METEOROLOGY	l1_smm2_climate_wnd3dr	resultant wind direction	°N	15 minute	15 minute	7/12/07	2007-07-12	2007-07-12	1/29/19	2019-01-29	2019-01-29	12	Marks	SAS V9			1	point	Open	Meteorology	WeatherDaily, WeatherStation	Wind direction air, daily, mean					Natural Resources, Earth and Environmental Sciences	climatologyMeteorologyAtmosphere	no
GB3347	3347	GB	METEOROLOGY	l1_smm2_climate_wnd3sa	average wind speed	m/s	15 minute	15 minute	7/12/07	2007-07-12	2007-07-12	1/29/19	2019-01-29	2019-01-29	12	Marks	SAS V9			1	point	Open	Meteorology	WeatherDaily, WeatherStation	Wind speed, air, daily, mean					Natural Resources, Earth and Environmental Sciences	climatologyMeteorologyAtmosphere	no
GB3348	3348	GB	METEOROLOGY	l1_smm2_climate_wnd3sr	resultant wind speed	m/s	15 minute	15 minute	7/12/07	2007-07-12	2007-07-12	1/29/19	2019-01-29	2019-01-29	12	Marks	SAS V9			1	point	Open	Meteorology	WeatherDaily, WeatherStation	Wind speed, air, daily, mean					Natural Resources, Earth and Environmental Sciences	climatologyMeteorologyAtmosphere	no
GB3349	3349	GB	METEOROLOGY	l1_smm2_climate_wnd3sx	maximum wind speed	m/s	15 minute	15 minute	7/12/07	2007-07-12	2007-07-12	1/29/19	2019-01-29	2019-01-29	12	Marks	SAS V9			1	point	Open	Meteorology	WeatherDaily, WeatherStation	wind speed, air, daily, max					Natural Resources, Earth and Environmental Sciences	climatologyMeteorologyAtmosphere	no
GB3350	3350	GB	METEOROLOGY	l1_176b_climate_wnd15sx	maximum wind speed	m/s	15 minute	15 minute	2/4/04	2004-02-04	2004-02-04	8/26/15	2015-08-26	2015-08-26	12	Marks	SAS V9			1	point	Open	Meteorology	WeatherDaily, WeatherStation	wind speed, air, daily, max					Natural Resources, Earth and Environmental Sciences	climatologyMeteorologyAtmosphere	no
GB3351	3351	GB	METEOROLOGY	l1_176b_climate_wnd3sx	maximum wind speed	m/s	15 minute	15 minute	2/4/04	2004-02-04	2004-02-04	8/26/15	2015-08-26	2015-08-26	12	Marks	SAS V9			1	point	Open	Meteorology	WeatherDaily, WeatherStation	wind speed, air, daily, max					Natural Resources, Earth and Environmental Sciences	climatologyMeteorologyAtmosphere	no
GB3352	3352	GB	METEOROLOGY	l1_176b_climate_wnd9sx	maximum wind speed	m/s	15 minute	15 minute	2/4/04	2004-02-04	2004-02-04	8/26/15	2015-08-26	2015-08-26	12	Marks	SAS V9			1	point	Open	Meteorology	WeatherDaily, WeatherStation	wind speed, air, daily, max					Natural Resources, Earth and Environmental Sciences	climatologyMeteorologyAtmosphere	no
GB3353	3353	GB	METEOROLOGY	l1_smm1_climate_hum3	relative humidity	%	15 minute	15 minute	5/16/07	2007-05-16	2007-05-16	1/29/19	2019-01-29	2019-01-29	12	Marks	SAS V9			1	point	Open	Meteorology	WeatherDaily, WeatherStation	Relative humidity, air, daily, mean					Natural Resources, Earth and Environmental Sciences	climatologyMeteorologyAtmosphere	no
GB3354	3354	GB	METEOROLOGY	l1_smm1_climate_sol	incoming shortwave solar radiation	W/m2	15 minute	15 minute	5/16/07	2007-05-16	2007-05-16	1/29/19	2019-01-29	2019-01-29	12	Marks	SAS V9			1	point	Open	Meteorology	WeatherDaily, WeatherStation	ave_incoming_shortwave radiation					Natural Resources, Earth and Environmental Sciences	climatologyMeteorologyAtmosphere	no
GB3355	3355	GB	METEOROLOGY	l1_smm1_climate_tmp3	air temperature	°C	15 minute	15 minute	5/16/07	2007-05-16	2007-05-16	1/29/19	2019-01-29	2019-01-29	12	Marks	SAS V9			1	point	Open	Meteorology	WeatherDaily, WeatherStation	Temperature, air, daily, mean	Meteorology				Natural Resources, Earth and Environmental Sciences	climatologyMeteorologyAtmosphere	no
GB3356	3356	GB	METEOROLOGY	l1_smm1_climate_vap3	vapor pressure	kPa	15 minute	15 minute	5/16/07	2007-05-16	2007-05-16	1/29/19	2019-01-29	2019-01-29	12	Marks	SAS V9			1	point	Open	Meteorology	WeatherDaily, WeatherStation	vapor pressure, mean					Natural Resources, Earth and Environmental Sciences	climatologyMeteorologyAtmosphere	no
GB3357	3357	GB	METEOROLOGY	l1_smm1_climate_wnd3d	wind direction	°N	15 minute	15 minute	5/16/07	2007-05-16	2007-05-16	1/29/19	2019-01-29	2019-01-29	12	Marks	SAS V9			1	point	Open	Meteorology	WeatherDaily, WeatherStation	Wind direction air, daily, mean					Natural Resources, Earth and Environmental Sciences	climatologyMeteorologyAtmosphere	no
GB3358	3358	GB	METEOROLOGY	l1_smm1_climate_wnd3dr	resultant wind direction	°N	15 minute	15 minute	5/16/07	2007-05-16	2007-05-16	1/29/19	2019-01-29	2019-01-29	12	Marks	SAS V9			1	point	Open	Meteorology	WeatherDaily, WeatherStation	Wind direction air, daily, mean					Natural Resources, Earth and Environmental Sciences	climatologyMeteorologyAtmosphere	no
GB3359	3359	GB	METEOROLOGY	l1_smm1_climate_wnd3sa	average wind speed	m/s	15 minute	15 minute	5/16/07	2007-05-16	2007-05-16	1/29/19	2019-01-29	2019-01-29	12	Marks	SAS V9			1	point	Open	Meteorology	WeatherDaily, WeatherStation	Wind speed, air, daily, mean					Natural Resources, Earth and Environmental Sciences	climatologyMeteorologyAtmosphere	no
GB3360	3360	GB	METEOROLOGY	l1_smm1_climate_wnd3sr	resultant wind speed	m/s	15 minute	15 minute	5/16/07	2007-05-16	2007-05-16	1/29/19	2019-01-29	2019-01-29	12	Marks	SAS V9			1	point	Open	Meteorology	WeatherDaily, WeatherStation	Wind speed, air, daily, mean					Natural Resources, Earth and Environmental Sciences	climatologyMeteorologyAtmosphere	no
GB3361	3361	GB	METEOROLOGY	l1_smm1_climate_wnd3sx	maximum wind speed	m/s	15 minute	15 minute	5/16/07	2007-05-16	2007-05-16	1/29/19	2019-01-29	2019-01-29	12	Marks	SAS V9			1	point	Open	Meteorology	WeatherDaily, WeatherStation	wind speed, air, daily, max					Natural Resources, Earth and Environmental Sciences	climatologyMeteorologyAtmosphere	no
GB3362	3362	GB	METEOROLOGY	l1_sme2_climate_hum3	relative humidity	%	15 minute	15 minute	5/1/07	2007-05-01	2007-05-01	1/29/19	2019-01-29	2019-01-29	12	Marks	SAS V9			1	point	Open	Meteorology	WeatherDaily, WeatherStation	Relative humidity, air, daily, mean					Natural Resources, Earth and Environmental Sciences	climatologyMeteorologyAtmosphere	no
GB3363	3363	GB	METEOROLOGY	l1_sme2_climate_sol	incoming shortwave solar radiation	W/m2	15 minute	15 minute	5/1/07	2007-05-01	2007-05-01	1/29/19	2019-01-29	2019-01-29	12	Marks	SAS V9			1	point	Open	Meteorology	WeatherDaily, WeatherStation	ave_incoming_shortwave radiation					Natural Resources, Earth and Environmental Sciences	climatologyMeteorologyAtmosphere	no
GB3364	3364	GB	METEOROLOGY	l1_sme2_climate_tmp3	air temperature	°C	15 minute	15 minute	5/1/07	2007-05-01	2007-05-01	1/29/19	2019-01-29	2019-01-29	12	Marks	SAS V9			1	point	Open	Meteorology	WeatherDaily, WeatherStation	Temperature, air, daily, mean	Meteorology				Natural Resources, Earth and Environmental Sciences	climatologyMeteorologyAtmosphere	no
GB3365	3365	GB	METEOROLOGY	l1_sme2_climate_vap3	vapor pressure	kPa	15 minute	15 minute	5/1/07	2007-05-01	2007-05-01	1/29/19	2019-01-29	2019-01-29	12	Marks	SAS V9			1	point	Open	Meteorology	WeatherDaily, WeatherStation	vapor pressure, mean					Natural Resources, Earth and Environmental Sciences	climatologyMeteorologyAtmosphere	no
GB3366	3366	GB	METEOROLOGY	l1_sme2_climate_wnd3d	wind direction	°N	15 minute	15 minute	5/1/07	2007-05-01	2007-05-01	1/29/19	2019-01-29	2019-01-29	12	Marks	SAS V9			1	point	Open	Meteorology	WeatherDaily, WeatherStation	Wind direction air, daily, mean					Natural Resources, Earth and Environmental Sciences	climatologyMeteorologyAtmosphere	no
GB3367	3367	GB	METEOROLOGY	l1_sme2_climate_wnd3dr	resultant wind direction	°N	15 minute	15 minute	5/1/07	2007-05-01	2007-05-01	1/29/19	2019-01-29	2019-01-29	12	Marks	SAS V9			1	point	Open	Meteorology	WeatherDaily, WeatherStation	Wind direction air, daily, mean					Natural Resources, Earth and Environmental Sciences	climatologyMeteorologyAtmosphere	no
GB3368	3368	GB	METEOROLOGY	l1_sme2_climate_wnd3sa	average wind speed	m/s	15 minute	15 minute	5/1/07	2007-05-01	2007-05-01	1/29/19	2019-01-29	2019-01-29	12	Marks	SAS V9			1	point	Open	Meteorology	WeatherDaily, WeatherStation	Wind speed, air, daily, mean					Natural Resources, Earth and Environmental Sciences	climatologyMeteorologyAtmosphere	no
GB3369	3369	GB	METEOROLOGY	l1_sme2_climate_wnd3sr	resultant wind speed	m/s	15 minute	15 minute	5/1/07	2007-05-01	2007-05-01	1/29/19	2019-01-29	2019-01-29	12	Marks	SAS V9			1	point	Open	Meteorology	WeatherDaily, WeatherStation	Wind speed, air, daily, mean					Natural Resources, Earth and Environmental Sciences	climatologyMeteorologyAtmosphere	no
GB3370	3370	GB	METEOROLOGY	l1_sme2_climate_wnd3sx	maximum wind speed	m/s	15 minute	15 minute	5/1/07	2007-05-01	2007-05-01	1/29/19	2019-01-29	2019-01-29	12	Marks	SAS V9			1	point	Open	Meteorology	WeatherDaily, WeatherStation	wind speed, air, daily, max					Natural Resources, Earth and Environmental Sciences	climatologyMeteorologyAtmosphere	no
GB3371	3371	GB	METEOROLOGY	l1_124b_climate_hum3	relative humidity	%	15 minute	15 minute	10/31/06	2006-10-31	2006-10-31	1/29/19	2019-01-29	2019-01-29	12	Marks	SAS V9			1	point	Open	Meteorology	WeatherDaily, WeatherStation	Relative humidity, air, daily, mean					Natural Resources, Earth and Environmental Sciences	climatologyMeteorologyAtmosphere	no
GB3372	3372	GB	METEOROLOGY	l1_124b_climate_sol	incoming shortwave solar radiation	W/m2	15 minute	15 minute	10/31/06	2006-10-31	2006-10-31	1/29/19	2019-01-29	2019-01-29	12	Marks	SAS V9			1	point	Open	Meteorology	WeatherDaily, WeatherStation	ave_incoming_shortwave radiation					Natural Resources, Earth and Environmental Sciences	climatologyMeteorologyAtmosphere	no
GB3373	3373	GB	METEOROLOGY	l1_124b_climate_tmp3	air temperature	°C	15 minute	15 minute	10/31/06	2006-10-31	2006-10-31	1/29/19	2019-01-29	2019-01-29	12	Marks	SAS V9			1	point	Open	Meteorology	WeatherDaily, WeatherStation	Temperature, air, daily, mean	Meteorology				Natural Resources, Earth and Environmental Sciences	climatologyMeteorologyAtmosphere	no
GB3374	3374	GB	METEOROLOGY	l1_124b_climate_vap3	vapor pressure	kPa	15 minute	15 minute	10/31/06	2006-10-31	2006-10-31	1/29/19	2019-01-29	2019-01-29	12	Marks	SAS V9			1	point	Open	Meteorology	WeatherDaily, WeatherStation	vapor pressure, mean					Natural Resources, Earth and Environmental Sciences	climatologyMeteorologyAtmosphere	no
GB3375	3375	GB	METEOROLOGY	l1_124b_climate_wnd3r	wind run	km	15 minute	15 minute	10/31/06	2006-10-31	2006-10-31	1/29/19	2019-01-29	2019-01-29	12	Marks	SAS V9			1	point	Open	Meteorology	WeatherDaily, WeatherStation	wind run					Natural Resources, Earth and Environmental Sciences	climatologyMeteorologyAtmosphere	no
GB3376	3376	GB	METEOROLOGY	l1_124b_climate_wnd3sa	average wind speed	m/s	15 minute	15 minute	10/31/06	2006-10-31	2006-10-31	1/29/19	2019-01-29	2019-01-29	12	Marks	SAS V9			1	point	Open	Meteorology	WeatherDaily, WeatherStation	Wind speed, air, daily, mean					Natural Resources, Earth and Environmental Sciences	climatologyMeteorologyAtmosphere	no
GB3377	3377	GB	METEOROLOGY	l1_124b_climate_wnd3sx	maximum wind speed	m/s	15 minute	15 minute	10/31/06	2006-10-31	2006-10-31	1/29/19	2019-01-29	2019-01-29	12	Marks	SAS V9			1	point	Open	Meteorology	WeatherDaily, WeatherStation	wind speed, air, daily, max					Natural Resources, Earth and Environmental Sciences	climatologyMeteorologyAtmosphere	no
GB3378	3378	GB	METEOROLOGY	l1_095b_climate_wnd3r	wind run	km	15 minute	15 minute	5/14/03	2003-05-14	2003-05-14	2/2/16	2016-02-02	2016-02-02	13	Marks	SAS V9			1	point	Open	Meteorology	WeatherDaily, WeatherStation	wind run					Natural Resources, Earth and Environmental Sciences	climatologyMeteorologyAtmosphere	no
GB3379	3379	GB	METEOROLOGY	l1_124_climate_wnd3r	wind run	km	15 minute	15 minute	7/1/02	2002-07-01	2002-07-01	4/23/15	2015-04-23	2015-04-23	13	Marks	SAS V9			1	point	Open	Meteorology	WeatherDaily, WeatherStation	wind run					Natural Resources, Earth and Environmental Sciences	climatologyMeteorologyAtmosphere	no
GB3380	3380	GB	METEOROLOGY	l1_spt_climate_hum3	relative humidity	%	15 minute	15 minute	9/27/00	2000-09-27	2000-09-27	7/24/13	2013-07-24	2013-07-24	13	Marks	SAS V9			1	point	Open	Meteorology	WeatherDaily, WeatherStation	Relative humidity, air, daily, mean					Natural Resources, Earth and Environmental Sciences	climatologyMeteorologyAtmosphere	no
GB3381	3381	GB	METEOROLOGY	l1_spt_climate_sol	incoming shortwave solar radiation	W/m2	15 minute	15 minute	9/27/00	2000-09-27	2000-09-27	7/24/13	2013-07-24	2013-07-24	13	Marks	SAS V9			1	point	Open	Meteorology	WeatherDaily, WeatherStation	ave_incoming_shortwave radiation					Natural Resources, Earth and Environmental Sciences	climatologyMeteorologyAtmosphere	no
GB3382	3382	GB	METEOROLOGY	l1_spt_climate_tmp3	air temperature	°C	15 minute	15 minute	9/27/00	2000-09-27	2000-09-27	7/24/13	2013-07-24	2013-07-24	13	Marks	SAS V9			1	point	Open	Meteorology	WeatherDaily, WeatherStation	Temperature, air, daily, mean	Meteorology				Natural Resources, Earth and Environmental Sciences	climatologyMeteorologyAtmosphere	no
GB3383	3383	GB	METEOROLOGY	l1_138l21_climate_vap3	vapor pressure	kPa	15 minute	15 minute	3/30/06	2006-03-30	2006-03-30	1/29/19	2019-01-29	2019-01-29	13	Marks	SAS V9			1	point	Open	Meteorology	WeatherDaily, WeatherStation	vapor pressure, mean					Natural Resources, Earth and Environmental Sciences	climatologyMeteorologyAtmosphere	no
GB3384	3384	GB	METEOROLOGY	l1_138l21_climate_wnd3d	wind direction	°N	15 minute	15 minute	3/30/06	2006-03-30	2006-03-30	1/29/19	2019-01-29	2019-01-29	13	Marks	SAS V9			1	point	Open	Meteorology	WeatherDaily, WeatherStation	Wind direction air, daily, mean					Natural Resources, Earth and Environmental Sciences	climatologyMeteorologyAtmosphere	no
GB3385	3385	GB	METEOROLOGY	l1_138l21_climate_wnd3dr	resultant wind direction	°N	15 minute	15 minute	3/30/06	2006-03-30	2006-03-30	1/29/19	2019-01-29	2019-01-29	13	Marks	SAS V9			1	point	Open	Meteorology	WeatherDaily, WeatherStation	Wind direction air, daily, mean					Natural Resources, Earth and Environmental Sciences	climatologyMeteorologyAtmosphere	no
GB3386	3386	GB	METEOROLOGY	l1_138l21_climate_wnd3sa	average wind speed	m/s	15 minute	15 minute	3/30/06	2006-03-30	2006-03-30	1/29/19	2019-01-29	2019-01-29	13	Marks	SAS V9			1	point	Open	Meteorology	WeatherDaily, WeatherStation	Wind speed, air, daily, mean					Natural Resources, Earth and Environmental Sciences	climatologyMeteorologyAtmosphere	no
GB3387	3387	GB	METEOROLOGY	l1_138l21_climate_wnd3sr	resultant wind speed	m/s	15 minute	15 minute	3/30/06	2006-03-30	2006-03-30	1/29/19	2019-01-29	2019-01-29	13	Marks	SAS V9			1	point	Open	Meteorology	WeatherDaily, WeatherStation	Wind speed, air, daily, mean					Natural Resources, Earth and Environmental Sciences	climatologyMeteorologyAtmosphere	no
GB3388	3388	GB	METEOROLOGY	l1_138l21_climate_wnd3sx	maximum wind speed	m/s	15 minute	15 minute	3/30/06	2006-03-30	2006-03-30	1/29/19	2019-01-29	2019-01-29	13	Marks	SAS V9			1	point	Open	Meteorology	WeatherDaily, WeatherStation	wind speed, air, daily, max					Natural Resources, Earth and Environmental Sciences	climatologyMeteorologyAtmosphere	no
GB3389	3389	GB	METEOROLOGY	l1_13803_climate_vap3	vapor pressure	kPa	15 minute	15 minute	3/20/06	2006-03-20	2006-03-20	1/29/19	2019-01-29	2019-01-29	13	Marks	SAS V9			1	point	Open	Meteorology	WeatherDaily, WeatherStation	vapor pressure, mean					Natural Resources, Earth and Environmental Sciences	climatologyMeteorologyAtmosphere	no
GB3390	3390	GB	METEOROLOGY	l1_13803_climate_wnd3d	wind direction	°N	15 minute	15 minute	3/20/06	2006-03-20	2006-03-20	1/29/19	2019-01-29	2019-01-29	13	Marks	SAS V9			1	point	Open	Meteorology	WeatherDaily, WeatherStation	Wind direction air, daily, mean					Natural Resources, Earth and Environmental Sciences	climatologyMeteorologyAtmosphere	no
GB3391	3391	GB	METEOROLOGY	l1_13803_climate_wnd3dr	resultant wind direction	°N	15 minute	15 minute	3/20/06	2006-03-20	2006-03-20	1/29/19	2019-01-29	2019-01-29	13	Marks	SAS V9			1	point	Open	Meteorology	WeatherDaily, WeatherStation	Wind direction air, daily, mean					Natural Resources, Earth and Environmental Sciences	climatologyMeteorologyAtmosphere	no
GB3392	3392	GB	METEOROLOGY	l1_13803_climate_wnd3sa	average wind speed	m/s	15 minute	15 minute	3/20/06	2006-03-20	2006-03-20	1/29/19	2019-01-29	2019-01-29	13	Marks	SAS V9			1	point	Open	Meteorology	WeatherDaily, WeatherStation	Wind speed, air, daily, mean					Natural Resources, Earth and Environmental Sciences	climatologyMeteorologyAtmosphere	no
GB3393	3393	GB	METEOROLOGY	l1_13803_climate_wnd3sr	resultant wind speed	m/s	15 minute	15 minute	3/20/06	2006-03-20	2006-03-20	1/29/19	2019-01-29	2019-01-29	13	Marks	SAS V9			1	point	Open	Meteorology	WeatherDaily, WeatherStation	Wind speed, air, daily, mean					Natural Resources, Earth and Environmental Sciences	climatologyMeteorologyAtmosphere	no
GB3394	3394	GB	METEOROLOGY	l1_13803_climate_wnd3sx	maximum wind speed	m/s	15 minute	15 minute	3/20/06	2006-03-20	2006-03-20	1/29/19	2019-01-29	2019-01-29	13	Marks	SAS V9			1	point	Open	Meteorology	WeatherDaily, WeatherStation	wind speed, air, daily, max					Natural Resources, Earth and Environmental Sciences	climatologyMeteorologyAtmosphere	no
GB3395	3395	GB	METEOROLOGY	l1_012_climate_vap3	vapor pressure	kPa	15 minute	15 minute	2/27/06	2006-02-27	2006-02-27	1/28/19	2019-01-28	2019-01-28	13	Marks	SAS V9			1	point	Open	Meteorology	WeatherDaily, WeatherStation	vapor pressure, mean					Natural Resources, Earth and Environmental Sciences	climatologyMeteorologyAtmosphere	no
GB3396	3396	GB	METEOROLOGY	l1_031_climate_vap3	vapor pressure	kPa	15 minute	15 minute	2/27/06	2006-02-27	2006-02-27	1/28/19	2019-01-28	2019-01-28	13	Marks	SAS V9			1	point	Open	Meteorology	WeatherDaily, WeatherStation	vapor pressure, mean					Natural Resources, Earth and Environmental Sciences	climatologyMeteorologyAtmosphere	no
GB3397	3397	GB	METEOROLOGY	l1_012_climate_wnd3d	wind direction	°N	15 minute	15 minute	2/27/06	2006-02-27	2006-02-27	1/28/19	2019-01-28	2019-01-28	13	Marks	SAS V9			1	point	Open	Meteorology	WeatherDaily, WeatherStation	Wind direction air, daily, mean					Natural Resources, Earth and Environmental Sciences	climatologyMeteorologyAtmosphere	no
GB3398	3398	GB	METEOROLOGY	l1_031_climate_wnd3d	wind direction	°N	15 minute	15 minute	2/27/06	2006-02-27	2006-02-27	1/28/19	2019-01-28	2019-01-28	13	Marks	SAS V9			1	point	Open	Meteorology	WeatherDaily, WeatherStation	Wind direction air, daily, mean					Natural Resources, Earth and Environmental Sciences	climatologyMeteorologyAtmosphere	no
GB3399	3399	GB	METEOROLOGY	l1_012_climate_wnd3dr	resultant wind direction	°N	15 minute	15 minute	2/27/06	2006-02-27	2006-02-27	1/28/19	2019-01-28	2019-01-28	13	Marks	SAS V9			1	point	Open	Meteorology	WeatherDaily, WeatherStation	Wind direction air, daily, mean					Natural Resources, Earth and Environmental Sciences	climatologyMeteorologyAtmosphere	no
GB3400	3400	GB	METEOROLOGY	l1_031_climate_wnd3dr	resultant wind direction	°N	15 minute	15 minute	2/27/06	2006-02-27	2006-02-27	1/28/19	2019-01-28	2019-01-28	13	Marks	SAS V9			1	point	Open	Meteorology	WeatherDaily, WeatherStation	Wind direction air, daily, mean					Natural Resources, Earth and Environmental Sciences	climatologyMeteorologyAtmosphere	no
GB3401	3401	GB	METEOROLOGY	l1_012_climate_wnd3sa	average wind speed	m/s	15 minute	15 minute	2/27/06	2006-02-27	2006-02-27	1/28/19	2019-01-28	2019-01-28	13	Marks	SAS V9			1	point	Open	Meteorology	WeatherDaily, WeatherStation	Wind speed, air, daily, mean					Natural Resources, Earth and Environmental Sciences	climatologyMeteorologyAtmosphere	no
GB3402	3402	GB	METEOROLOGY	l1_031_climate_wnd3sa	average wind speed	m/s	15 minute	15 minute	2/27/06	2006-02-27	2006-02-27	1/28/19	2019-01-28	2019-01-28	13	Marks	SAS V9			1	point	Open	Meteorology	WeatherDaily, WeatherStation	Wind speed, air, daily, mean					Natural Resources, Earth and Environmental Sciences	climatologyMeteorologyAtmosphere	no
GB3403	3403	GB	METEOROLOGY	l1_012_climate_wnd3sr	resultant wind speed	m/s	15 minute	15 minute	2/27/06	2006-02-27	2006-02-27	1/28/19	2019-01-28	2019-01-28	13	Marks	SAS V9			1	point	Open	Meteorology	WeatherDaily, WeatherStation	Wind speed, air, daily, mean					Natural Resources, Earth and Environmental Sciences	climatologyMeteorologyAtmosphere	no
GB3404	3404	GB	METEOROLOGY	l1_031_climate_wnd3sr	resultant wind speed	m/s	15 minute	15 minute	2/27/06	2006-02-27	2006-02-27	1/28/19	2019-01-28	2019-01-28	13	Marks	SAS V9			1	point	Open	Meteorology	WeatherDaily, WeatherStation	Wind speed, air, daily, mean					Natural Resources, Earth and Environmental Sciences	climatologyMeteorologyAtmosphere	no
GB3405	3405	GB	METEOROLOGY	l1_012_climate_wnd3sx	maximum wind speed	m/s	15 minute	15 minute	2/27/06	2006-02-27	2006-02-27	1/28/19	2019-01-28	2019-01-28	13	Marks	SAS V9			1	point	Open	Meteorology	WeatherDaily, WeatherStation	wind speed, air, daily, max					Natural Resources, Earth and Environmental Sciences	climatologyMeteorologyAtmosphere	no
GB3406	3406	GB	METEOROLOGY	l1_031_climate_wnd3sx	maximum wind speed	m/s	15 minute	15 minute	2/27/06	2006-02-27	2006-02-27	1/28/19	2019-01-28	2019-01-28	13	Marks	SAS V9			1	point	Open	Meteorology	WeatherDaily, WeatherStation	wind speed, air, daily, max					Natural Resources, Earth and Environmental Sciences	climatologyMeteorologyAtmosphere	no
GB3407	3407	GB	METEOROLOGY	l1_095b_climate_wnd3d	wind direction	°N	15 minute	15 minute	2/27/06	2006-02-27	2006-02-27	1/29/19	2019-01-29	2019-01-29	13	Marks	SAS V9			1	point	Open	Meteorology	WeatherDaily, WeatherStation	Wind direction air, daily, mean					Natural Resources, Earth and Environmental Sciences	climatologyMeteorologyAtmosphere	no
GB3408	3408	GB	METEOROLOGY	l1_095b_climate_wnd3dr	resultant wind direction	°N	15 minute	15 minute	2/27/06	2006-02-27	2006-02-27	1/29/19	2019-01-29	2019-01-29	13	Marks	SAS V9			1	point	Open	Meteorology	WeatherDaily, WeatherStation	Wind direction air, daily, mean					Natural Resources, Earth and Environmental Sciences	climatologyMeteorologyAtmosphere	no
GB3409	3409	GB	METEOROLOGY	l1_095b_climate_wnd3sa	average wind speed	m/s	15 minute	15 minute	2/27/06	2006-02-27	2006-02-27	1/29/19	2019-01-29	2019-01-29	13	Marks	SAS V9			1	point	Open	Meteorology	WeatherDaily, WeatherStation	Wind speed, air, daily, mean					Natural Resources, Earth and Environmental Sciences	climatologyMeteorologyAtmosphere	no
GB3410	3410	GB	METEOROLOGY	l1_095b_climate_wnd3sr	resultant wind speed	m/s	15 minute	15 minute	2/27/06	2006-02-27	2006-02-27	1/29/19	2019-01-29	2019-01-29	13	Marks	SAS V9			1	point	Open	Meteorology	WeatherDaily, WeatherStation	Wind speed, air, daily, mean					Natural Resources, Earth and Environmental Sciences	climatologyMeteorologyAtmosphere	no
GB3411	3411	GB	METEOROLOGY	l1_rmsp3_climate_vap3	vapor pressure	kPa	15 minute	15 minute	11/8/04	2004-11-08	2004-11-08	10/30/17	2017-10-30	2017-10-30	13	Marks	SAS V9			1	point	Open	Meteorology	WeatherDaily, WeatherStation	vapor pressure, mean					Natural Resources, Earth and Environmental Sciences	climatologyMeteorologyAtmosphere	no
GB3412	3412	GB	METEOROLOGY	l1_176b_climate_wnd3d	wind direction	°N	15 minute	15 minute	2/4/04	2004-02-04	2004-02-04	2/19/17	2017-02-19	2017-02-19	13	Marks	SAS V9			1	point	Open	Meteorology	WeatherDaily, WeatherStation	Wind direction air, daily, mean					Natural Resources, Earth and Environmental Sciences	climatologyMeteorologyAtmosphere	no
GB3413	3413	GB	METEOROLOGY	l1_176b_climate_wnd15sa	average wind speed	m/s	15 minute	15 minute	2/5/04	2004-02-05	2004-02-05	2/21/17	2017-02-21	2017-02-21	13	Marks	SAS V9			1	point	Open	Meteorology	WeatherDaily, WeatherStation	Wind speed, air, daily, mean					Natural Resources, Earth and Environmental Sciences	climatologyMeteorologyAtmosphere	no
GB3414	3414	GB	METEOROLOGY	l1_176b_climate_wnd3sa	average wind speed	m/s	15 minute	15 minute	2/5/04	2004-02-05	2004-02-05	2/21/17	2017-02-21	2017-02-21	13	Marks	SAS V9			1	point	Open	Meteorology	WeatherDaily, WeatherStation	Wind speed, air, daily, mean					Natural Resources, Earth and Environmental Sciences	climatologyMeteorologyAtmosphere	no
GB3415	3415	GB	METEOROLOGY	l1_176b_climate_wnd9sa	average wind speed	m/s	15 minute	15 minute	2/5/04	2004-02-05	2004-02-05	2/21/17	2017-02-21	2017-02-21	13	Marks	SAS V9			1	point	Open	Meteorology	WeatherDaily, WeatherStation	Wind speed, air, daily, mean					Natural Resources, Earth and Environmental Sciences	climatologyMeteorologyAtmosphere	no
GB3416	3416	GB	METEOROLOGY	l1_176b_climate_wnd15d	wind direction	°N	15 minute	15 minute	2/4/04	2004-02-04	2004-02-04	2/21/17	2017-02-21	2017-02-21	13	Marks	SAS V9			1	point	Open	Meteorology	WeatherDaily, WeatherStation	Wind direction air, daily, mean					Natural Resources, Earth and Environmental Sciences	climatologyMeteorologyAtmosphere	no
GB3417	3417	GB	METEOROLOGY	l1_176b_climate_wnd15dr	resultant wind direction	°N	15 minute	15 minute	2/4/04	2004-02-04	2004-02-04	2/21/17	2017-02-21	2017-02-21	13	Marks	SAS V9			1	point	Open	Meteorology	WeatherDaily, WeatherStation	Wind direction air, daily, mean					Natural Resources, Earth and Environmental Sciences	climatologyMeteorologyAtmosphere	no
GB3418	3418	GB	METEOROLOGY	l1_176b_climate_wnd15sr	resultant wind speed	m/s	15 minute	15 minute	2/4/04	2004-02-04	2004-02-04	2/21/17	2017-02-21	2017-02-21	13	Marks	SAS V9			1	point	Open	Meteorology	WeatherDaily, WeatherStation	Wind speed, air, daily, mean					Natural Resources, Earth and Environmental Sciences	climatologyMeteorologyAtmosphere	no
GB3419	3419	GB	METEOROLOGY	l1_176b_climate_wnd3dr	resultant wind direction	°N	15 minute	15 minute	2/4/04	2004-02-04	2004-02-04	2/21/17	2017-02-21	2017-02-21	13	Marks	SAS V9			1	point	Open	Meteorology	WeatherDaily, WeatherStation	Wind direction air, daily, mean					Natural Resources, Earth and Environmental Sciences	climatologyMeteorologyAtmosphere	no
GB3420	3420	GB	METEOROLOGY	l1_176b_climate_wnd3sr	resultant wind speed	m/s	15 minute	15 minute	2/4/04	2004-02-04	2004-02-04	2/21/17	2017-02-21	2017-02-21	13	Marks	SAS V9			1	point	Open	Meteorology	WeatherDaily, WeatherStation	Wind speed, air, daily, mean					Natural Resources, Earth and Environmental Sciences	climatologyMeteorologyAtmosphere	no
GB3421	3421	GB	METEOROLOGY	l1_176b_climate_wnd9d	wind direction	°N	15 minute	15 minute	2/4/04	2004-02-04	2004-02-04	2/21/17	2017-02-21	2017-02-21	13	Marks	SAS V9			1	point	Open	Meteorology	WeatherDaily, WeatherStation	Wind direction air, daily, mean					Natural Resources, Earth and Environmental Sciences	climatologyMeteorologyAtmosphere	no
GB3422	3422	GB	METEOROLOGY	l1_176b_climate_wnd9dr	resultant wind direction	°N	15 minute	15 minute	2/4/04	2004-02-04	2004-02-04	2/21/17	2017-02-21	2017-02-21	13	Marks	SAS V9			1	point	Open	Meteorology	WeatherDaily, WeatherStation	Wind direction air, daily, mean					Natural Resources, Earth and Environmental Sciences	climatologyMeteorologyAtmosphere	no
GB3423	3423	GB	METEOROLOGY	l1_176b_climate_wnd9sr	resultant wind speed	m/s	15 minute	15 minute	2/4/04	2004-02-04	2004-02-04	2/21/17	2017-02-21	2017-02-21	13	Marks	SAS V9			1	point	Open	Meteorology	WeatherDaily, WeatherStation	Wind speed, air, daily, mean					Natural Resources, Earth and Environmental Sciences	climatologyMeteorologyAtmosphere	no
GB3424	3424	GB	METEOROLOGY	l1_rmsp3_climate_wnd3sx	maximum wind speed	m/s	15 minute	15 minute	9/22/04	2004-09-22	2004-09-22	10/30/17	2017-10-30	2017-10-30	13	Marks	SAS V9			1	point	Open	Meteorology	WeatherDaily, WeatherStation	wind speed, air, daily, max					Natural Resources, Earth and Environmental Sciences	climatologyMeteorologyAtmosphere	no
GB3425	3425	GB	METEOROLOGY	l1_jdt3_climate_vap3	vapor pressure	kPa	15 minute	15 minute	9/20/05	2005-09-20	2005-09-20	11/7/18	2018-11-07	2018-11-07	13	Marks	SAS V9			1	point	Open	Meteorology	WeatherDaily, WeatherStation	vapor pressure, mean					Natural Resources, Earth and Environmental Sciences	climatologyMeteorologyAtmosphere	no
GB3426	3426	GB	METEOROLOGY	l1_jdt3_climate_wnd3r	wind run	km	15 minute	15 minute	9/20/05	2005-09-20	2005-09-20	11/7/18	2018-11-07	2018-11-07	13	Marks	SAS V9			1	point	Open	Meteorology	WeatherDaily, WeatherStation	wind run					Natural Resources, Earth and Environmental Sciences	climatologyMeteorologyAtmosphere	no
GB3427	3427	GB	METEOROLOGY	l1_jdt3_climate_wnd3sx	maximum wind speed	m/s	15 minute	15 minute	9/20/05	2005-09-20	2005-09-20	11/7/18	2018-11-07	2018-11-07	13	Marks	SAS V9			1	point	Open	Meteorology	WeatherDaily, WeatherStation	wind speed, air, daily, max					Natural Resources, Earth and Environmental Sciences	climatologyMeteorologyAtmosphere	no
GB3428	3428	GB	METEOROLOGY	l1_jdt3_climate_hum3	relative humidity	%	15 minute	15 minute	9/20/05	2005-09-20	2005-09-20	12/7/18	2018-12-07	2018-12-07	13	Marks	SAS V9			1	point	Open	Meteorology	WeatherDaily, WeatherStation	Relative humidity, air, daily, mean					Natural Resources, Earth and Environmental Sciences	climatologyMeteorologyAtmosphere	no
GB3429	3429	GB	METEOROLOGY	l1_jdt3_climate_tmp3	air temperature	°C	15 minute	15 minute	9/20/05	2005-09-20	2005-09-20	12/7/18	2018-12-07	2018-12-07	13	Marks	SAS V9			1	point	Open	Meteorology	WeatherDaily, WeatherStation	Temperature, air, daily, mean	Meteorology				Natural Resources, Earth and Environmental Sciences	climatologyMeteorologyAtmosphere	no
GB3430	3430	GB	METEOROLOGY	l1_jdt3_climate_wnd3d	wind direction	°N	15 minute	15 minute	9/20/05	2005-09-20	2005-09-20	12/7/18	2018-12-07	2018-12-07	13	Marks	SAS V9			1	point	Open	Meteorology	WeatherDaily, WeatherStation	Wind direction air, daily, mean					Natural Resources, Earth and Environmental Sciences	climatologyMeteorologyAtmosphere	no
GB3431	3431	GB	METEOROLOGY	l1_jdt3_climate_wnd3dr	resultant wind direction	°N	15 minute	15 minute	9/20/05	2005-09-20	2005-09-20	12/7/18	2018-12-07	2018-12-07	13	Marks	SAS V9			1	point	Open	Meteorology	WeatherDaily, WeatherStation	Wind direction air, daily, mean					Natural Resources, Earth and Environmental Sciences	climatologyMeteorologyAtmosphere	no
GB3432	3432	GB	METEOROLOGY	l1_jdt3_climate_wnd3sa	average wind speed	m/s	15 minute	15 minute	9/20/05	2005-09-20	2005-09-20	12/7/18	2018-12-07	2018-12-07	13	Marks	SAS V9			1	point	Open	Meteorology	WeatherDaily, WeatherStation	Wind speed, air, daily, mean					Natural Resources, Earth and Environmental Sciences	climatologyMeteorologyAtmosphere	no
GB3433	3433	GB	METEOROLOGY	l1_jdt3_climate_wnd3sr	resultant wind speed	m/s	15 minute	15 minute	9/20/05	2005-09-20	2005-09-20	12/7/18	2018-12-07	2018-12-07	13	Marks	SAS V9			1	point	Open	Meteorology	WeatherDaily, WeatherStation	Wind speed, air, daily, mean					Natural Resources, Earth and Environmental Sciences	climatologyMeteorologyAtmosphere	no
GB3434	3434	GB	METEOROLOGY	l1_jdt1_climate_hum3	relative humidity	%	15 minute	15 minute	11/4/05	2005-11-04	2005-11-04	1/29/19	2019-01-29	2019-01-29	13	Marks	SAS V9			1	point	Open	Meteorology	WeatherDaily, WeatherStation	Relative humidity, air, daily, mean					Natural Resources, Earth and Environmental Sciences	climatologyMeteorologyAtmosphere	no
GB3435	3435	GB	METEOROLOGY	l1_jdt2_climate_hum3	relative humidity	%	15 minute	15 minute	11/4/05	2005-11-04	2005-11-04	1/29/19	2019-01-29	2019-01-29	13	Marks	SAS V9			1	point	Open	Meteorology	WeatherDaily, WeatherStation	Relative humidity, air, daily, mean					Natural Resources, Earth and Environmental Sciences	climatologyMeteorologyAtmosphere	no
GB3436	3436	GB	METEOROLOGY	l1_jdt1_climate_tmp3	air temperature	°C	15 minute	15 minute	11/4/05	2005-11-04	2005-11-04	1/29/19	2019-01-29	2019-01-29	13	Marks	SAS V9			1	point	Open	Meteorology	WeatherDaily, WeatherStation	Temperature, air, daily, mean	Meteorology				Natural Resources, Earth and Environmental Sciences	climatologyMeteorologyAtmosphere	no
GB3437	3437	GB	METEOROLOGY	l1_jdt2_climate_tmp3	air temperature	°C	15 minute	15 minute	11/4/05	2005-11-04	2005-11-04	1/29/19	2019-01-29	2019-01-29	13	Marks	SAS V9			1	point	Open	Meteorology	WeatherDaily, WeatherStation	Temperature, air, daily, mean	Meteorology				Natural Resources, Earth and Environmental Sciences	climatologyMeteorologyAtmosphere	no
GB3438	3438	GB	METEOROLOGY	l1_jdt1_climate_vap3	vapor pressure	kPa	15 minute	15 minute	11/4/05	2005-11-04	2005-11-04	1/29/19	2019-01-29	2019-01-29	13	Marks	SAS V9			1	point	Open	Meteorology	WeatherDaily, WeatherStation	vapor pressure, mean					Natural Resources, Earth and Environmental Sciences	climatologyMeteorologyAtmosphere	no
GB3439	3439	GB	METEOROLOGY	l1_jdt2_climate_vap3	vapor pressure	kPa	15 minute	15 minute	11/4/05	2005-11-04	2005-11-04	1/29/19	2019-01-29	2019-01-29	13	Marks	SAS V9			1	point	Open	Meteorology	WeatherDaily, WeatherStation	vapor pressure, mean					Natural Resources, Earth and Environmental Sciences	climatologyMeteorologyAtmosphere	no
GB3440	3440	GB	METEOROLOGY	l1_jdt4_climate_hum3	relative humidity	%	15 minute	15 minute	11/1/05	2005-11-01	2005-11-01	1/29/19	2019-01-29	2019-01-29	13	Marks	SAS V9			1	point	Open	Meteorology	WeatherDaily, WeatherStation	Relative humidity, air, daily, mean					Natural Resources, Earth and Environmental Sciences	climatologyMeteorologyAtmosphere	no
GB3441	3441	GB	METEOROLOGY	l1_jdt5_climate_hum3	relative humidity	%	15 minute	15 minute	11/1/05	2005-11-01	2005-11-01	1/29/19	2019-01-29	2019-01-29	13	Marks	SAS V9			1	point	Open	Meteorology	WeatherDaily, WeatherStation	Relative humidity, air, daily, mean					Natural Resources, Earth and Environmental Sciences	climatologyMeteorologyAtmosphere	no
GB3442	3442	GB	METEOROLOGY	l1_jdt4_climate_tmp3	air temperature	°C	15 minute	15 minute	11/1/05	2005-11-01	2005-11-01	1/29/19	2019-01-29	2019-01-29	13	Marks	SAS V9			1	point	Open	Meteorology	WeatherDaily, WeatherStation	Temperature, air, daily, mean	Meteorology				Natural Resources, Earth and Environmental Sciences	climatologyMeteorologyAtmosphere	no
GB3443	3443	GB	METEOROLOGY	l1_jdt5_climate_tmp3	air temperature	°C	15 minute	15 minute	11/1/05	2005-11-01	2005-11-01	1/29/19	2019-01-29	2019-01-29	13	Marks	SAS V9			1	point	Open	Meteorology	WeatherDaily, WeatherStation	Temperature, air, daily, mean	Meteorology				Natural Resources, Earth and Environmental Sciences	climatologyMeteorologyAtmosphere	no
GB3444	3444	GB	METEOROLOGY	l1_jdt4_climate_vap3	vapor pressure	kPa	15 minute	15 minute	11/1/05	2005-11-01	2005-11-01	1/29/19	2019-01-29	2019-01-29	13	Marks	SAS V9			1	point	Open	Meteorology	WeatherDaily, WeatherStation	vapor pressure, mean					Natural Resources, Earth and Environmental Sciences	climatologyMeteorologyAtmosphere	no
GB3445	3445	GB	METEOROLOGY	l1_jdt5_climate_vap3	vapor pressure	kPa	15 minute	15 minute	11/1/05	2005-11-01	2005-11-01	1/29/19	2019-01-29	2019-01-29	13	Marks	SAS V9			1	point	Open	Meteorology	WeatherDaily, WeatherStation	vapor pressure, mean					Natural Resources, Earth and Environmental Sciences	climatologyMeteorologyAtmosphere	no
GB3446	3446	GB	METEOROLOGY	l1_144_climate_vap3	vapor pressure	kPa	15 minute	15 minute	7/7/05	2005-07-07	2005-07-07	11/2/18	2018-11-02	2018-11-02	13	Marks	SAS V9			1	point	Open	Meteorology	WeatherDaily, WeatherStation	vapor pressure, mean					Natural Resources, Earth and Environmental Sciences	climatologyMeteorologyAtmosphere	no
GB3447	3447	GB	METEOROLOGY	l1_rmsp3_climate_wnd3dr	resultant wind direction	°N	15 minute	15 minute	9/22/05	2005-09-22	2005-09-22	1/28/19	2019-01-28	2019-01-28	13	Marks	SAS V9			1	point	Open	Meteorology	WeatherDaily, WeatherStation	Wind direction air, daily, mean					Natural Resources, Earth and Environmental Sciences	climatologyMeteorologyAtmosphere	no
GB3448	3448	GB	METEOROLOGY	l1_rmsp3_climate_wnd3sa	average wind speed	m/s	15 minute	15 minute	9/22/05	2005-09-22	2005-09-22	1/29/19	2019-01-29	2019-01-29	13	Marks	SAS V9			1	point	Open	Meteorology	WeatherDaily, WeatherStation	Wind speed, air, daily, mean					Natural Resources, Earth and Environmental Sciences	climatologyMeteorologyAtmosphere	no
GB3449	3449	GB	METEOROLOGY	l1_rmsp3_climate_wnd3sr	resultant wind speed	m/s	15 minute	15 minute	9/22/05	2005-09-22	2005-09-22	1/29/19	2019-01-29	2019-01-29	13	Marks	SAS V9			1	point	Open	Meteorology	WeatherDaily, WeatherStation	Wind speed, air, daily, mean					Natural Resources, Earth and Environmental Sciences	climatologyMeteorologyAtmosphere	no
GB3450	3450	GB	METEOROLOGY	l1_smf1_climate_wnd3d	wind direction	°N	15 minute	15 minute	9/20/05	2005-09-20	2005-09-20	1/29/19	2019-01-29	2019-01-29	13	Marks	SAS V9			1	point	Open	Meteorology	WeatherDaily, WeatherStation	Wind direction air, daily, mean					Natural Resources, Earth and Environmental Sciences	climatologyMeteorologyAtmosphere	no
GB3451	3451	GB	METEOROLOGY	l1_smf1_climate_wnd3dr	resultant wind direction	°N	15 minute	15 minute	9/20/05	2005-09-20	2005-09-20	1/29/19	2019-01-29	2019-01-29	13	Marks	SAS V9			1	point	Open	Meteorology	WeatherDaily, WeatherStation	Wind direction air, daily, mean					Natural Resources, Earth and Environmental Sciences	climatologyMeteorologyAtmosphere	no
GB3452	3452	GB	METEOROLOGY	l1_smf1_climate_wnd3sa	average wind speed	m/s	15 minute	15 minute	9/20/05	2005-09-20	2005-09-20	1/29/19	2019-01-29	2019-01-29	13	Marks	SAS V9			1	point	Open	Meteorology	WeatherDaily, WeatherStation	Wind speed, air, daily, mean					Natural Resources, Earth and Environmental Sciences	climatologyMeteorologyAtmosphere	no
GB3453	3453	GB	METEOROLOGY	l1_smf1_climate_wnd3sr	resultant wind speed	m/s	15 minute	15 minute	9/20/05	2005-09-20	2005-09-20	1/29/19	2019-01-29	2019-01-29	13	Marks	SAS V9			1	point	Open	Meteorology	WeatherDaily, WeatherStation	Wind speed, air, daily, mean					Natural Resources, Earth and Environmental Sciences	climatologyMeteorologyAtmosphere	no
GB3454	3454	GB	METEOROLOGY	l1_smf1_climate_wnd3sx	maximum wind speed	m/s	15 minute	15 minute	9/20/05	2005-09-20	2005-09-20	1/29/19	2019-01-29	2019-01-29	13	Marks	SAS V9			1	point	Open	Meteorology	WeatherDaily, WeatherStation	wind speed, air, daily, max					Natural Resources, Earth and Environmental Sciences	climatologyMeteorologyAtmosphere	no
GB3455	3455	GB	METEOROLOGY	l1_138j10_climate_vap3	vapor pressure	kPa	15 minute	15 minute	8/3/05	2005-08-03	2005-08-03	1/29/19	2019-01-29	2019-01-29	13	Marks	SAS V9			1	point	Open	Meteorology	WeatherDaily, WeatherStation	vapor pressure, mean					Natural Resources, Earth and Environmental Sciences	climatologyMeteorologyAtmosphere	no
GB3456	3456	GB	METEOROLOGY	l1_138j10_climate_wnd3d	wind direction	°N	15 minute	15 minute	8/3/05	2005-08-03	2005-08-03	1/29/19	2019-01-29	2019-01-29	13	Marks	SAS V9			1	point	Open	Meteorology	WeatherDaily, WeatherStation	Wind direction air, daily, mean					Natural Resources, Earth and Environmental Sciences	climatologyMeteorologyAtmosphere	no
GB3457	3457	GB	METEOROLOGY	l1_138j10_climate_wnd3dr	resultant wind direction	°N	15 minute	15 minute	8/3/05	2005-08-03	2005-08-03	1/29/19	2019-01-29	2019-01-29	13	Marks	SAS V9			1	point	Open	Meteorology	WeatherDaily, WeatherStation	Wind direction air, daily, mean					Natural Resources, Earth and Environmental Sciences	climatologyMeteorologyAtmosphere	no
GB3458	3458	GB	METEOROLOGY	l1_138j10_climate_wnd3sa	average wind speed	m/s	15 minute	15 minute	8/3/05	2005-08-03	2005-08-03	1/29/19	2019-01-29	2019-01-29	13	Marks	SAS V9			1	point	Open	Meteorology	WeatherDaily, WeatherStation	Wind speed, air, daily, mean					Natural Resources, Earth and Environmental Sciences	climatologyMeteorologyAtmosphere	no
GB3459	3459	GB	METEOROLOGY	l1_138j10_climate_wnd3sr	resultant wind speed	m/s	15 minute	15 minute	8/3/05	2005-08-03	2005-08-03	1/29/19	2019-01-29	2019-01-29	13	Marks	SAS V9			1	point	Open	Meteorology	WeatherDaily, WeatherStation	Wind speed, air, daily, mean					Natural Resources, Earth and Environmental Sciences	climatologyMeteorologyAtmosphere	no
GB3460	3460	GB	METEOROLOGY	l1_138j10_climate_wnd3sx	maximum wind speed	m/s	15 minute	15 minute	8/3/05	2005-08-03	2005-08-03	1/29/19	2019-01-29	2019-01-29	13	Marks	SAS V9			1	point	Open	Meteorology	WeatherDaily, WeatherStation	wind speed, air, daily, max					Natural Resources, Earth and Environmental Sciences	climatologyMeteorologyAtmosphere	no
GB3461	3461	GB	METEOROLOGY	l1_smg2_climate_hum3	relative humidity	%	15 minute	15 minute	7/27/05	2005-07-27	2005-07-27	1/29/19	2019-01-29	2019-01-29	14	Marks	SAS V9			1	point	Open	Meteorology	WeatherDaily, WeatherStation	Relative humidity, air, daily, mean					Natural Resources, Earth and Environmental Sciences	climatologyMeteorologyAtmosphere	no
GB3462	3462	GB	METEOROLOGY	l1_smg2_climate_sol	incoming shortwave solar radiation	W/m2	15 minute	15 minute	7/27/05	2005-07-27	2005-07-27	1/29/19	2019-01-29	2019-01-29	14	Marks	SAS V9			1	point	Open	Meteorology	WeatherDaily, WeatherStation	ave_incoming_shortwave radiation					Natural Resources, Earth and Environmental Sciences	climatologyMeteorologyAtmosphere	no
GB3463	3463	GB	METEOROLOGY	l1_smg2_climate_tmp3	air temperature	°C	15 minute	15 minute	7/27/05	2005-07-27	2005-07-27	1/29/19	2019-01-29	2019-01-29	14	Marks	SAS V9			1	point	Open	Meteorology	WeatherDaily, WeatherStation	Temperature, air, daily, mean	Meteorology				Natural Resources, Earth and Environmental Sciences	climatologyMeteorologyAtmosphere	no
GB3464	3464	GB	METEOROLOGY	l1_smg2_climate_vap3	vapor pressure	kPa	15 minute	15 minute	7/27/05	2005-07-27	2005-07-27	1/29/19	2019-01-29	2019-01-29	14	Marks	SAS V9			1	point	Open	Meteorology	WeatherDaily, WeatherStation	vapor pressure, mean					Natural Resources, Earth and Environmental Sciences	climatologyMeteorologyAtmosphere	no
GB3465	3465	GB	METEOROLOGY	l1_smg2_climate_wnd3d	wind direction	°N	15 minute	15 minute	7/27/05	2005-07-27	2005-07-27	1/29/19	2019-01-29	2019-01-29	14	Marks	SAS V9			1	point	Open	Meteorology	WeatherDaily, WeatherStation	Wind direction air, daily, mean					Natural Resources, Earth and Environmental Sciences	climatologyMeteorologyAtmosphere	no
GB3466	3466	GB	METEOROLOGY	l1_smg2_climate_wnd3dr	resultant wind direction	°N	15 minute	15 minute	7/27/05	2005-07-27	2005-07-27	1/29/19	2019-01-29	2019-01-29	14	Marks	SAS V9			1	point	Open	Meteorology	WeatherDaily, WeatherStation	Wind direction air, daily, mean					Natural Resources, Earth and Environmental Sciences	climatologyMeteorologyAtmosphere	no
GB3467	3467	GB	METEOROLOGY	l1_smg2_climate_wnd3sa	average wind speed	m/s	15 minute	15 minute	7/27/05	2005-07-27	2005-07-27	1/29/19	2019-01-29	2019-01-29	14	Marks	SAS V9			1	point	Open	Meteorology	WeatherDaily, WeatherStation	Wind speed, air, daily, mean					Natural Resources, Earth and Environmental Sciences	climatologyMeteorologyAtmosphere	no
GB3468	3468	GB	METEOROLOGY	l1_smg2_climate_wnd3sr	resultant wind speed	m/s	15 minute	15 minute	7/27/05	2005-07-27	2005-07-27	1/29/19	2019-01-29	2019-01-29	14	Marks	SAS V9			1	point	Open	Meteorology	WeatherDaily, WeatherStation	Wind speed, air, daily, mean					Natural Resources, Earth and Environmental Sciences	climatologyMeteorologyAtmosphere	no
GB3469	3469	GB	METEOROLOGY	l1_smg2_climate_wnd3sx	maximum wind speed	m/s	15 minute	15 minute	7/27/05	2005-07-27	2005-07-27	1/29/19	2019-01-29	2019-01-29	14	Marks	SAS V9			1	point	Open	Meteorology	WeatherDaily, WeatherStation	wind speed, air, daily, max					Natural Resources, Earth and Environmental Sciences	climatologyMeteorologyAtmosphere	no
GB3470	3470	GB	METEOROLOGY	l1_smf1_climate_hum3	relative humidity	%	15 minute	15 minute	7/25/05	2005-07-25	2005-07-25	1/29/19	2019-01-29	2019-01-29	14	Marks	SAS V9			1	point	Open	Meteorology	WeatherDaily, WeatherStation	Relative humidity, air, daily, mean					Natural Resources, Earth and Environmental Sciences	climatologyMeteorologyAtmosphere	no
GB3471	3471	GB	METEOROLOGY	l1_smf1_climate_sol	incoming shortwave solar radiation	W/m2	15 minute	15 minute	7/25/05	2005-07-25	2005-07-25	1/29/19	2019-01-29	2019-01-29	14	Marks	SAS V9			1	point	Open	Meteorology	WeatherDaily, WeatherStation	ave_incoming_shortwave radiation					Natural Resources, Earth and Environmental Sciences	climatologyMeteorologyAtmosphere	no
GB3472	3472	GB	METEOROLOGY	l1_smf1_climate_tmp3	air temperature	°C	15 minute	15 minute	7/25/05	2005-07-25	2005-07-25	1/29/19	2019-01-29	2019-01-29	14	Marks	SAS V9			1	point	Open	Meteorology	WeatherDaily, WeatherStation	Temperature, air, daily, mean	Meteorology				Natural Resources, Earth and Environmental Sciences	climatologyMeteorologyAtmosphere	no
GB3473	3473	GB	METEOROLOGY	l1_smf1_climate_vap3	vapor pressure	kPa	15 minute	15 minute	7/25/05	2005-07-25	2005-07-25	1/29/19	2019-01-29	2019-01-29	14	Marks	SAS V9			1	point	Open	Meteorology	WeatherDaily, WeatherStation	vapor pressure, mean					Natural Resources, Earth and Environmental Sciences	climatologyMeteorologyAtmosphere	no
GB3474	3474	GB	METEOROLOGY	l1_125_climate_vap3	vapor pressure	kPa	15 minute	15 minute	7/7/05	2005-07-07	2005-07-07	1/28/19	2019-01-28	2019-01-28	14	Marks	SAS V9			1	point	Open	Meteorology	WeatherDaily, WeatherStation	vapor pressure, mean					Natural Resources, Earth and Environmental Sciences	climatologyMeteorologyAtmosphere	no
GB3475	3475	GB	METEOROLOGY	l1_163_climate_vap3	vapor pressure	kPa	15 minute	15 minute	7/6/05	2005-07-06	2005-07-06	1/29/19	2019-01-29	2019-01-29	14	Marks	SAS V9			1	point	Open	Meteorology	WeatherDaily, WeatherStation	vapor pressure, mean					Natural Resources, Earth and Environmental Sciences	climatologyMeteorologyAtmosphere	no
GB3476	3476	GB	METEOROLOGY	l1_174_climate_vap3	vapor pressure	kPa	15 minute	15 minute	7/6/05	2005-07-06	2005-07-06	1/29/19	2019-01-29	2019-01-29	14	Marks	SAS V9			1	point	Open	Meteorology	WeatherDaily, WeatherStation	vapor pressure, mean					Natural Resources, Earth and Environmental Sciences	climatologyMeteorologyAtmosphere	no
GB3477	3477	GB	METEOROLOGY	l1_166b_climate_wnd3d	wind direction	°N	15 minute	15 minute	5/25/05	2005-05-25	2005-05-25	1/29/19	2019-01-29	2019-01-29	14	Marks	SAS V9			1	point	Open	Meteorology	WeatherDaily, WeatherStation	Wind direction air, daily, mean					Natural Resources, Earth and Environmental Sciences	climatologyMeteorologyAtmosphere	no
GB3478	3478	GB	METEOROLOGY	l1_167_climate_vap3	vapor pressure	kPa	15 minute	15 minute	4/21/05	2005-04-21	2005-04-21	1/29/19	2019-01-29	2019-01-29	14	Marks	SAS V9			1	point	Open	Meteorology	WeatherDaily, WeatherStation	vapor pressure, mean					Natural Resources, Earth and Environmental Sciences	climatologyMeteorologyAtmosphere	no
GB3479	3479	GB	METEOROLOGY	l1_smg1_climate_wnd3d	wind direction	°N	15 minute	15 minute	4/11/05	2005-04-11	2005-04-11	1/28/19	2019-01-28	2019-01-28	14	Marks	SAS V9			1	point	Open	Meteorology	WeatherDaily, WeatherStation	Wind direction air, daily, mean					Natural Resources, Earth and Environmental Sciences	climatologyMeteorologyAtmosphere	no
GB3480	3480	GB	METEOROLOGY	l1_smg1_climate_wnd3dr	resultant wind direction	°N	15 minute	15 minute	4/11/05	2005-04-11	2005-04-11	1/28/19	2019-01-28	2019-01-28	14	Marks	SAS V9			1	point	Open	Meteorology	WeatherDaily, WeatherStation	Wind direction air, daily, mean					Natural Resources, Earth and Environmental Sciences	climatologyMeteorologyAtmosphere	no
GB3481	3481	GB	METEOROLOGY	l1_145_climate_wnd3r	wind run	km	15 minute	15 minute	10/2/01	2001-10-02	2001-10-02	9/22/15	2015-09-22	2015-09-22	14	Marks	SAS V9			1	point	Open	Meteorology	WeatherDaily, WeatherStation	wind run					Natural Resources, Earth and Environmental Sciences	climatologyMeteorologyAtmosphere	no
GB3482	3482	GB	METEOROLOGY	l1_144_climate_wnd3sx	maximum wind speed	m/s	15 minute	15 minute	11/5/04	2004-11-05	2004-11-05	11/2/18	2018-11-02	2018-11-02	14	Marks	SAS V9			1	point	Open	Meteorology	WeatherDaily, WeatherStation	wind speed, air, daily, max					Natural Resources, Earth and Environmental Sciences	climatologyMeteorologyAtmosphere	no
GB3483	3483	GB	METEOROLOGY	l1_167b_climate_hum3	relative humidity	%	15 minute	15 minute	1/27/05	2005-01-27	2005-01-27	1/26/19	2019-01-26	2019-01-26	14	Marks	SAS V9			1	point	Open	Meteorology	WeatherDaily, WeatherStation	Relative humidity, air, daily, mean					Natural Resources, Earth and Environmental Sciences	climatologyMeteorologyAtmosphere	no
GB3484	3484	GB	METEOROLOGY	l1_167b_climate_sol	incoming shortwave solar radiation	W/m2	15 minute	15 minute	1/27/05	2005-01-27	2005-01-27	1/26/19	2019-01-26	2019-01-26	14	Marks	SAS V9			1	point	Open	Meteorology	WeatherDaily, WeatherStation	ave_incoming_shortwave radiation					Natural Resources, Earth and Environmental Sciences	climatologyMeteorologyAtmosphere	no
GB3485	3485	GB	METEOROLOGY	l1_167b_climate_tmp3	air temperature	°C	15 minute	15 minute	1/27/05	2005-01-27	2005-01-27	1/26/19	2019-01-26	2019-01-26	14	Marks	SAS V9			1	point	Open	Meteorology	WeatherDaily, WeatherStation	Temperature, air, daily, mean	Meteorology				Natural Resources, Earth and Environmental Sciences	climatologyMeteorologyAtmosphere	no
GB3486	3486	GB	METEOROLOGY	l1_167b_climate_wnd3d	wind direction	°N	15 minute	15 minute	1/27/05	2005-01-27	2005-01-27	1/26/19	2019-01-26	2019-01-26	14	Marks	SAS V9			1	point	Open	Meteorology	WeatherDaily, WeatherStation	Wind direction air, daily, mean					Natural Resources, Earth and Environmental Sciences	climatologyMeteorologyAtmosphere	no
GB3487	3487	GB	METEOROLOGY	l1_167b_climate_wnd3dr	resultant wind direction	°N	15 minute	15 minute	1/27/05	2005-01-27	2005-01-27	1/26/19	2019-01-26	2019-01-26	14	Marks	SAS V9			1	point	Open	Meteorology	WeatherDaily, WeatherStation	Wind direction air, daily, mean					Natural Resources, Earth and Environmental Sciences	climatologyMeteorologyAtmosphere	no
GB3488	3488	GB	METEOROLOGY	l1_167b_climate_wnd3sa	average wind speed	m/s	15 minute	15 minute	1/27/05	2005-01-27	2005-01-27	1/26/19	2019-01-26	2019-01-26	14	Marks	SAS V9			1	point	Open	Meteorology	WeatherDaily, WeatherStation	Wind speed, air, daily, mean					Natural Resources, Earth and Environmental Sciences	climatologyMeteorologyAtmosphere	no
GB3489	3489	GB	METEOROLOGY	l1_167b_climate_wnd3sr	resultant wind speed	m/s	15 minute	15 minute	1/27/05	2005-01-27	2005-01-27	1/26/19	2019-01-26	2019-01-26	14	Marks	SAS V9			1	point	Open	Meteorology	WeatherDaily, WeatherStation	Wind speed, air, daily, mean					Natural Resources, Earth and Environmental Sciences	climatologyMeteorologyAtmosphere	no
GB3490	3490	GB	METEOROLOGY	l1_smg1_climate_hum3	relative humidity	%	15 minute	15 minute	11/9/04	2004-11-09	2004-11-09	1/29/19	2019-01-29	2019-01-29	14	Marks	SAS V9			1	point	Open	Meteorology	WeatherDaily, WeatherStation	Relative humidity, air, daily, mean					Natural Resources, Earth and Environmental Sciences	climatologyMeteorologyAtmosphere	no
GB3491	3491	GB	METEOROLOGY	l1_smg1_climate_sol	incoming shortwave solar radiation	W/m2	15 minute	15 minute	11/9/04	2004-11-09	2004-11-09	1/29/19	2019-01-29	2019-01-29	14	Marks	SAS V9			1	point	Open	Meteorology	WeatherDaily, WeatherStation	ave_incoming_shortwave radiation					Natural Resources, Earth and Environmental Sciences	climatologyMeteorologyAtmosphere	no
GB3492	3492	GB	METEOROLOGY	l1_smg1_climate_tmp3	air temperature	°C	15 minute	15 minute	11/9/04	2004-11-09	2004-11-09	1/29/19	2019-01-29	2019-01-29	14	Marks	SAS V9			1	point	Open	Meteorology	WeatherDaily, WeatherStation	Temperature, air, daily, mean	Meteorology				Natural Resources, Earth and Environmental Sciences	climatologyMeteorologyAtmosphere	no
GB3493	3493	GB	METEOROLOGY	l1_smg1_climate_vap3	vapor pressure	kPa	15 minute	15 minute	11/9/04	2004-11-09	2004-11-09	1/29/19	2019-01-29	2019-01-29	14	Marks	SAS V9			1	point	Open	Meteorology	WeatherDaily, WeatherStation	vapor pressure, mean					Natural Resources, Earth and Environmental Sciences	climatologyMeteorologyAtmosphere	no
GB3494	3494	GB	METEOROLOGY	l1_smg1_climate_wnd3sa	average wind speed	m/s	15 minute	15 minute	11/9/04	2004-11-09	2004-11-09	1/29/19	2019-01-29	2019-01-29	14	Marks	SAS V9			1	point	Open	Meteorology	WeatherDaily, WeatherStation	Wind speed, air, daily, mean					Natural Resources, Earth and Environmental Sciences	climatologyMeteorologyAtmosphere	no
GB3495	3495	GB	METEOROLOGY	l1_smg1_climate_wnd3sr	resultant wind speed	m/s	15 minute	15 minute	11/9/04	2004-11-09	2004-11-09	1/29/19	2019-01-29	2019-01-29	14	Marks	SAS V9			1	point	Open	Meteorology	WeatherDaily, WeatherStation	Wind speed, air, daily, mean					Natural Resources, Earth and Environmental Sciences	climatologyMeteorologyAtmosphere	no
GB3496	3496	GB	METEOROLOGY	l1_smg1_climate_wnd3sx	maximum wind speed	m/s	15 minute	15 minute	11/9/04	2004-11-09	2004-11-09	1/29/19	2019-01-29	2019-01-29	14	Marks	SAS V9			1	point	Open	Meteorology	WeatherDaily, WeatherStation	wind speed, air, daily, max					Natural Resources, Earth and Environmental Sciences	climatologyMeteorologyAtmosphere	no
GB3497	3497	GB	METEOROLOGY	l1_124_climate_wnd3d	wind direction	°N	15 minute	15 minute	11/4/04	2004-11-04	2004-11-04	1/28/19	2019-01-28	2019-01-28	14	Marks	SAS V9			1	point	Open	Meteorology	WeatherDaily, WeatherStation	Wind direction air, daily, mean					Natural Resources, Earth and Environmental Sciences	climatologyMeteorologyAtmosphere	no
GB3498	3498	GB	METEOROLOGY	l1_125_climate_wnd3d	wind direction	°N	15 minute	15 minute	11/4/04	2004-11-04	2004-11-04	1/28/19	2019-01-28	2019-01-28	14	Marks	SAS V9			1	point	Open	Meteorology	WeatherDaily, WeatherStation	Wind direction air, daily, mean					Natural Resources, Earth and Environmental Sciences	climatologyMeteorologyAtmosphere	no
GB3499	3499	GB	METEOROLOGY	l1_144_climate_wnd3d	wind direction	°N	15 minute	15 minute	11/4/04	2004-11-04	2004-11-04	1/28/19	2019-01-28	2019-01-28	14	Marks	SAS V9			1	point	Open	Meteorology	WeatherDaily, WeatherStation	Wind direction air, daily, mean					Natural Resources, Earth and Environmental Sciences	climatologyMeteorologyAtmosphere	no
GB3500	3500	GB	METEOROLOGY	l1_124_climate_wnd3dr	resultant wind direction	°N	15 minute	15 minute	11/4/04	2004-11-04	2004-11-04	1/28/19	2019-01-28	2019-01-28	14	Marks	SAS V9			1	point	Open	Meteorology	WeatherDaily, WeatherStation	Wind direction air, daily, mean					Natural Resources, Earth and Environmental Sciences	climatologyMeteorologyAtmosphere	no
GB3501	3501	GB	METEOROLOGY	l1_125_climate_wnd3dr	resultant wind direction	°N	15 minute	15 minute	11/4/04	2004-11-04	2004-11-04	1/28/19	2019-01-28	2019-01-28	14	Marks	SAS V9			1	point	Open	Meteorology	WeatherDaily, WeatherStation	Wind direction air, daily, mean					Natural Resources, Earth and Environmental Sciences	climatologyMeteorologyAtmosphere	no
GB3502	3502	GB	METEOROLOGY	l1_144_climate_wnd3dr	resultant wind direction	°N	15 minute	15 minute	11/4/04	2004-11-04	2004-11-04	1/28/19	2019-01-28	2019-01-28	14	Marks	SAS V9			1	point	Open	Meteorology	WeatherDaily, WeatherStation	Wind direction air, daily, mean					Natural Resources, Earth and Environmental Sciences	climatologyMeteorologyAtmosphere	no
GB3503	3503	GB	METEOROLOGY	l1_124_climate_wnd3sa	average wind speed	m/s	15 minute	15 minute	11/4/04	2004-11-04	2004-11-04	1/28/19	2019-01-28	2019-01-28	14	Marks	SAS V9			1	point	Open	Meteorology	WeatherDaily, WeatherStation	Wind speed, air, daily, mean					Natural Resources, Earth and Environmental Sciences	climatologyMeteorologyAtmosphere	no
GB3504	3504	GB	METEOROLOGY	l1_125_climate_wnd3sa	average wind speed	m/s	15 minute	15 minute	11/4/04	2004-11-04	2004-11-04	1/28/19	2019-01-28	2019-01-28	14	Marks	SAS V9			1	point	Open	Meteorology	WeatherDaily, WeatherStation	Wind speed, air, daily, mean					Natural Resources, Earth and Environmental Sciences	climatologyMeteorologyAtmosphere	no
GB3505	3505	GB	METEOROLOGY	l1_144_climate_wnd3sa	average wind speed	m/s	15 minute	15 minute	11/4/04	2004-11-04	2004-11-04	1/28/19	2019-01-28	2019-01-28	14	Marks	SAS V9			1	point	Open	Meteorology	WeatherDaily, WeatherStation	Wind speed, air, daily, mean					Natural Resources, Earth and Environmental Sciences	climatologyMeteorologyAtmosphere	no
GB3506	3506	GB	METEOROLOGY	l1_124_climate_wnd3sr	resultant wind speed	m/s	15 minute	15 minute	11/4/04	2004-11-04	2004-11-04	1/28/19	2019-01-28	2019-01-28	14	Marks	SAS V9			1	point	Open	Meteorology	WeatherDaily, WeatherStation	Wind speed, air, daily, mean					Natural Resources, Earth and Environmental Sciences	climatologyMeteorologyAtmosphere	no
GB3507	3507	GB	METEOROLOGY	l1_125_climate_wnd3sr	resultant wind speed	m/s	15 minute	15 minute	11/4/04	2004-11-04	2004-11-04	1/28/19	2019-01-28	2019-01-28	14	Marks	SAS V9			1	point	Open	Meteorology	WeatherDaily, WeatherStation	Wind speed, air, daily, mean					Natural Resources, Earth and Environmental Sciences	climatologyMeteorologyAtmosphere	no
GB3508	3508	GB	METEOROLOGY	l1_144_climate_wnd3sr	resultant wind speed	m/s	15 minute	15 minute	11/4/04	2004-11-04	2004-11-04	1/28/19	2019-01-28	2019-01-28	14	Marks	SAS V9			1	point	Open	Meteorology	WeatherDaily, WeatherStation	Wind speed, air, daily, mean					Natural Resources, Earth and Environmental Sciences	climatologyMeteorologyAtmosphere	no
GB3509	3509	GB	METEOROLOGY	l1_125_climate_wnd3sx	maximum wind speed	m/s	15 minute	15 minute	11/4/04	2004-11-04	2004-11-04	1/28/19	2019-01-28	2019-01-28	14	Marks	SAS V9			1	point	Open	Meteorology	WeatherDaily, WeatherStation	wind speed, air, daily, max					Natural Resources, Earth and Environmental Sciences	climatologyMeteorologyAtmosphere	no
GB3510	3510	GB	METEOROLOGY	l1_145_climate_wnd3d	wind direction	°N	15 minute	15 minute	11/5/04	2004-11-05	2004-11-05	1/29/19	2019-01-29	2019-01-29	14	Marks	SAS V9			1	point	Open	Meteorology	WeatherDaily, WeatherStation	Wind direction air, daily, mean					Natural Resources, Earth and Environmental Sciences	climatologyMeteorologyAtmosphere	no
GB3511	3511	GB	METEOROLOGY	l1_145_climate_wnd3dr	resultant wind direction	°N	15 minute	15 minute	11/5/04	2004-11-05	2004-11-05	1/29/19	2019-01-29	2019-01-29	14	Marks	SAS V9			1	point	Open	Meteorology	WeatherDaily, WeatherStation	Wind direction air, daily, mean					Natural Resources, Earth and Environmental Sciences	climatologyMeteorologyAtmosphere	no
GB3512	3512	GB	METEOROLOGY	l1_145_climate_wnd3sa	average wind speed	m/s	15 minute	15 minute	11/5/04	2004-11-05	2004-11-05	1/29/19	2019-01-29	2019-01-29	14	Marks	SAS V9			1	point	Open	Meteorology	WeatherDaily, WeatherStation	Wind speed, air, daily, mean					Natural Resources, Earth and Environmental Sciences	climatologyMeteorologyAtmosphere	no
GB3513	3513	GB	METEOROLOGY	l1_145_climate_wnd3sr	resultant wind speed	m/s	15 minute	15 minute	11/5/04	2004-11-05	2004-11-05	1/29/19	2019-01-29	2019-01-29	14	Marks	SAS V9			1	point	Open	Meteorology	WeatherDaily, WeatherStation	Wind speed, air, daily, mean					Natural Resources, Earth and Environmental Sciences	climatologyMeteorologyAtmosphere	no
GB3514	3514	GB	METEOROLOGY	l1_145_climate_wnd3sx	maximum wind speed	m/s	15 minute	15 minute	11/5/04	2004-11-05	2004-11-05	1/29/19	2019-01-29	2019-01-29	14	Marks	SAS V9			1	point	Open	Meteorology	WeatherDaily, WeatherStation	wind speed, air, daily, max					Natural Resources, Earth and Environmental Sciences	climatologyMeteorologyAtmosphere	no
GB3515	3515	GB	METEOROLOGY	l1_163_climate_wnd3d	wind direction	°N	15 minute	15 minute	11/4/04	2004-11-04	2004-11-04	1/29/19	2019-01-29	2019-01-29	14	Marks	SAS V9			1	point	Open	Meteorology	WeatherDaily, WeatherStation	Wind direction air, daily, mean					Natural Resources, Earth and Environmental Sciences	climatologyMeteorologyAtmosphere	no
GB3516	3516	GB	METEOROLOGY	l1_167_climate_wnd3d	wind direction	°N	15 minute	15 minute	11/4/04	2004-11-04	2004-11-04	1/29/19	2019-01-29	2019-01-29	14	Marks	SAS V9			1	point	Open	Meteorology	WeatherDaily, WeatherStation	Wind direction air, daily, mean					Natural Resources, Earth and Environmental Sciences	climatologyMeteorologyAtmosphere	no
GB3517	3517	GB	METEOROLOGY	l1_174_climate_wnd3d	wind direction	°N	15 minute	15 minute	11/4/04	2004-11-04	2004-11-04	1/29/19	2019-01-29	2019-01-29	14	Marks	SAS V9			1	point	Open	Meteorology	WeatherDaily, WeatherStation	Wind direction air, daily, mean					Natural Resources, Earth and Environmental Sciences	climatologyMeteorologyAtmosphere	no
GB3518	3518	GB	METEOROLOGY	l1_163_climate_wnd3dr	resultant wind direction	°N	15 minute	15 minute	11/4/04	2004-11-04	2004-11-04	1/29/19	2019-01-29	2019-01-29	14	Marks	SAS V9			1	point	Open	Meteorology	WeatherDaily, WeatherStation	Wind direction air, daily, mean					Natural Resources, Earth and Environmental Sciences	climatologyMeteorologyAtmosphere	no
GB3519	3519	GB	METEOROLOGY	l1_167_climate_wnd3dr	resultant wind direction	°N	15 minute	15 minute	11/4/04	2004-11-04	2004-11-04	1/29/19	2019-01-29	2019-01-29	14	Marks	SAS V9			1	point	Open	Meteorology	WeatherDaily, WeatherStation	Wind direction air, daily, mean					Natural Resources, Earth and Environmental Sciences	climatologyMeteorologyAtmosphere	no
GB3520	3520	GB	METEOROLOGY	l1_174_climate_wnd3dr	resultant wind direction	°N	15 minute	15 minute	11/4/04	2004-11-04	2004-11-04	1/29/19	2019-01-29	2019-01-29	14	Marks	SAS V9			1	point	Open	Meteorology	WeatherDaily, WeatherStation	Wind direction air, daily, mean					Natural Resources, Earth and Environmental Sciences	climatologyMeteorologyAtmosphere	no
GB3521	3521	GB	METEOROLOGY	l1_163_climate_wnd3sa	average wind speed	m/s	15 minute	15 minute	11/4/04	2004-11-04	2004-11-04	1/29/19	2019-01-29	2019-01-29	14	Marks	SAS V9			1	point	Open	Meteorology	WeatherDaily, WeatherStation	Wind speed, air, daily, mean					Natural Resources, Earth and Environmental Sciences	climatologyMeteorologyAtmosphere	no
GB3522	3522	GB	METEOROLOGY	l1_167_climate_wnd3sa	average wind speed	m/s	15 minute	15 minute	11/4/04	2004-11-04	2004-11-04	1/29/19	2019-01-29	2019-01-29	14	Marks	SAS V9			1	point	Open	Meteorology	WeatherDaily, WeatherStation	Wind speed, air, daily, mean					Natural Resources, Earth and Environmental Sciences	climatologyMeteorologyAtmosphere	no
GB3523	3523	GB	METEOROLOGY	l1_174_climate_wnd3sa	average wind speed	m/s	15 minute	15 minute	11/4/04	2004-11-04	2004-11-04	1/29/19	2019-01-29	2019-01-29	14	Marks	SAS V9			1	point	Open	Meteorology	WeatherDaily, WeatherStation	Wind speed, air, daily, mean					Natural Resources, Earth and Environmental Sciences	climatologyMeteorologyAtmosphere	no
GB3524	3524	GB	METEOROLOGY	l1_163_climate_wnd3sr	resultant wind speed	m/s	15 minute	15 minute	11/4/04	2004-11-04	2004-11-04	1/29/19	2019-01-29	2019-01-29	14	Marks	SAS V9			1	point	Open	Meteorology	WeatherDaily, WeatherStation	Wind speed, air, daily, mean					Natural Resources, Earth and Environmental Sciences	climatologyMeteorologyAtmosphere	no
GB3525	3525	GB	METEOROLOGY	l1_167_climate_wnd3sr	resultant wind speed	m/s	15 minute	15 minute	11/4/04	2004-11-04	2004-11-04	1/29/19	2019-01-29	2019-01-29	14	Marks	SAS V9			1	point	Open	Meteorology	WeatherDaily, WeatherStation	Wind speed, air, daily, mean					Natural Resources, Earth and Environmental Sciences	climatologyMeteorologyAtmosphere	no
GB3526	3526	GB	METEOROLOGY	l1_174_climate_wnd3sr	resultant wind speed	m/s	15 minute	15 minute	11/4/04	2004-11-04	2004-11-04	1/29/19	2019-01-29	2019-01-29	14	Marks	SAS V9			1	point	Open	Meteorology	WeatherDaily, WeatherStation	Wind speed, air, daily, mean					Natural Resources, Earth and Environmental Sciences	climatologyMeteorologyAtmosphere	no
GB3527	3527	GB	METEOROLOGY	l1_163_climate_wnd3sx	maximum wind speed	m/s	15 minute	15 minute	11/4/04	2004-11-04	2004-11-04	1/29/19	2019-01-29	2019-01-29	14	Marks	SAS V9			1	point	Open	Meteorology	WeatherDaily, WeatherStation	wind speed, air, daily, max					Natural Resources, Earth and Environmental Sciences	climatologyMeteorologyAtmosphere	no
GB3528	3528	GB	METEOROLOGY	l1_167_climate_wnd3sx	maximum wind speed	m/s	15 minute	15 minute	11/4/04	2004-11-04	2004-11-04	1/29/19	2019-01-29	2019-01-29	14	Marks	SAS V9			1	point	Open	Meteorology	WeatherDaily, WeatherStation	wind speed, air, daily, max					Natural Resources, Earth and Environmental Sciences	climatologyMeteorologyAtmosphere	no
GB3529	3529	GB	METEOROLOGY	l1_174_climate_wnd3sx	maximum wind speed	m/s	15 minute	15 minute	11/4/04	2004-11-04	2004-11-04	1/29/19	2019-01-29	2019-01-29	14	Marks	SAS V9			1	point	Open	Meteorology	WeatherDaily, WeatherStation	wind speed, air, daily, max					Natural Resources, Earth and Environmental Sciences	climatologyMeteorologyAtmosphere	no
GB3530	3530	GB	METEOROLOGY	l1_rmsp3_climate_wnd3s	wind speed	m/s	15 minute	15 minute	9/22/04	2004-09-22	2004-09-22	1/29/19	2019-01-29	2019-01-29	14	Marks	SAS V9			1	point	Open	Meteorology	WeatherDaily, WeatherStation	Wind speed, air, daily, mean					Natural Resources, Earth and Environmental Sciences	climatologyMeteorologyAtmosphere	no
GB3531	3531	GB	METEOROLOGY	l1_166b_climate_wnd3dr	resultant wind direction	°N	15 minute	15 minute	9/20/04	2004-09-20	2004-09-20	1/29/19	2019-01-29	2019-01-29	14	Marks	SAS V9			1	point	Open	Meteorology	WeatherDaily, WeatherStation	Wind direction air, daily, mean					Natural Resources, Earth and Environmental Sciences	climatologyMeteorologyAtmosphere	no
GB3532	3532	GB	METEOROLOGY	l1_166b_climate_wnd3sa	average wind speed	m/s	15 minute	15 minute	9/20/04	2004-09-20	2004-09-20	1/29/19	2019-01-29	2019-01-29	14	Marks	SAS V9			1	point	Open	Meteorology	WeatherDaily, WeatherStation	Wind speed, air, daily, mean					Natural Resources, Earth and Environmental Sciences	climatologyMeteorologyAtmosphere	no
GB3533	3533	GB	METEOROLOGY	l1_166b_climate_wnd3sr	resultant wind speed	m/s	15 minute	15 minute	9/20/04	2004-09-20	2004-09-20	1/29/19	2019-01-29	2019-01-29	14	Marks	SAS V9			1	point	Open	Meteorology	WeatherDaily, WeatherStation	Wind speed, air, daily, mean					Natural Resources, Earth and Environmental Sciences	climatologyMeteorologyAtmosphere	no
GB3534	3534	GB	METEOROLOGY	l1_urt_climate_wnd2dr	resultant wind direction	°N	15 minute	15 minute	8/31/04	2004-08-31	2004-08-31	3/9/19	2019-03-09	2019-03-09	15	Marks	SAS V9			1	point	Open	Meteorology	WeatherDaily, WeatherStation	Wind direction air, daily, mean					Natural Resources, Earth and Environmental Sciences	climatologyMeteorologyAtmosphere	no
GB3535	3535	GB	METEOROLOGY	l1_urt_climate_wnd2sr	resultant wind speed	m/s	15 minute	15 minute	8/31/04	2004-08-31	2004-08-31	3/9/19	2019-03-09	2019-03-09	15	Marks	SAS V9			1	point	Open	Meteorology	WeatherDaily, WeatherStation	Wind speed, air, daily, mean					Natural Resources, Earth and Environmental Sciences	climatologyMeteorologyAtmosphere	no
GB3536	3536	GB	METEOROLOGY	l1_orc1_climate_wnd3d	wind direction	°N	15 minute	15 minute	3/16/98	1998-03-16	1998-03-16	10/2/12	2012-10-02	2012-10-02	15	Marks	SAS V9			1	point	Open	Meteorology	WeatherDaily, WeatherStation	Wind direction air, daily, mean					Natural Resources, Earth and Environmental Sciences	climatologyMeteorologyAtmosphere	no
GB3537	3537	GB	METEOROLOGY	l1_guard_climate_wnd3r	wind run	km	15 minute	15 minute	10/28/97	1997-10-28	1997-10-28	9/29/12	2012-09-29	2012-09-29	15	Marks	SAS V9			1	point	Open	Meteorology	WeatherDaily, WeatherStation	wind run					Natural Resources, Earth and Environmental Sciences	climatologyMeteorologyAtmosphere	no
GB3538	3538	GB	METEOROLOGY	l1_176b_climate_hum15	relative humidity	%	15 minute	15 minute	2/4/04	2004-02-04	2004-02-04	1/29/19	2019-01-29	2019-01-29	15	Marks	SAS V9			1	point	Open	Meteorology	WeatherDaily, WeatherStation	Relative humidity, air, daily, mean					Natural Resources, Earth and Environmental Sciences	climatologyMeteorologyAtmosphere	no
GB3539	3539	GB	METEOROLOGY	l1_176b_climate_hum3	relative humidity	%	15 minute	15 minute	2/4/04	2004-02-04	2004-02-04	1/29/19	2019-01-29	2019-01-29	15	Marks	SAS V9			1	point	Open	Meteorology	WeatherDaily, WeatherStation	Relative humidity, air, daily, mean					Natural Resources, Earth and Environmental Sciences	climatologyMeteorologyAtmosphere	no
GB3540	3540	GB	METEOROLOGY	l1_176b_climate_hum9	relative humidity	%	15 minute	15 minute	2/4/04	2004-02-04	2004-02-04	1/29/19	2019-01-29	2019-01-29	15	Marks	SAS V9			1	point	Open	Meteorology	WeatherDaily, WeatherStation	Relative humidity, air, daily, mean					Natural Resources, Earth and Environmental Sciences	climatologyMeteorologyAtmosphere	no
GB3541	3541	GB	METEOROLOGY	l1_176b_climate_irt0a	infrared surface temperature	°C	15 minute	15 minute	2/4/04	2004-02-04	2004-02-04	1/29/19	2019-01-29	2019-01-29	15	Marks	SAS V9			1	point	Open	Meteorology	WeatherDaily, WeatherStation	Solar radiation, bare ground, no media, daily, total					Natural Resources, Earth and Environmental Sciences	climatologyMeteorologyAtmosphere	
GB3542	3542	GB	METEOROLOGY	l1_176b_climate_irt15a	infrared plant canopy temperature	°C	15 minute	15 minute	2/4/04	2004-02-04	2004-02-04	1/29/19	2019-01-29	2019-01-29	15	Marks	SAS V9			1	point	Open	Meteorology	WeatherDaily, WeatherStation	Solar radiation, vegetated ground, no media, daily, total					Natural Resources, Earth and Environmental Sciences	climatologyMeteorologyAtmosphere	no
GB3543	3543	GB	METEOROLOGY	l1_176b_climate_irt3a	infrared plant canopy temperature	°C	15 minute	15 minute	2/4/04	2004-02-04	2004-02-04	1/29/19	2019-01-29	2019-01-29	15	Marks	SAS V9			1	point	Open	Meteorology	WeatherDaily, WeatherStation	Solar radiation, vegetated ground, no media, daily, total					Natural Resources, Earth and Environmental Sciences	climatologyMeteorologyAtmosphere	no
GB3544	3544	GB	METEOROLOGY	l1_176b_climate_irt9a	infrared plant canopy temperature	°C	15 minute	15 minute	2/4/04	2004-02-04	2004-02-04	1/29/19	2019-01-29	2019-01-29	15	Marks	SAS V9			1	point	Open	Meteorology	WeatherDaily, WeatherStation	Solar radiation, vegetated ground, no media, daily, total					Natural Resources, Earth and Environmental Sciences	climatologyMeteorologyAtmosphere	no
GB3545	3545	GB	METEOROLOGY	l1_176b_climate_tmp15	air temperature	°C	15 minute	15 minute	2/4/04	2004-02-04	2004-02-04	1/29/19	2019-01-29	2019-01-29	15	Marks	SAS V9			1	point	Open	Meteorology	WeatherDaily, WeatherStation	Temperature, air, daily, mean	Meteorology				Natural Resources, Earth and Environmental Sciences	climatologyMeteorologyAtmosphere	no
GB3546	3546	GB	METEOROLOGY	l1_176b_climate_tmp3	air temperature	°C	15 minute	15 minute	2/4/04	2004-02-04	2004-02-04	1/29/19	2019-01-29	2019-01-29	15	Marks	SAS V9			1	point	Open	Meteorology	WeatherDaily, WeatherStation	Temperature, air, daily, mean	Meteorology				Natural Resources, Earth and Environmental Sciences	climatologyMeteorologyAtmosphere	no
GB3547	3547	GB	METEOROLOGY	l1_176b_climate_tmp9	air temperature	°C	15 minute	15 minute	2/4/04	2004-02-04	2004-02-04	1/29/19	2019-01-29	2019-01-29	15	Marks	SAS V9			1	point	Open	Meteorology	WeatherDaily, WeatherStation	Temperature, air, daily, mean	Meteorology				Natural Resources, Earth and Environmental Sciences	climatologyMeteorologyAtmosphere	no
GB3548	3548	GB	METEOROLOGY	l1_urt_climate_wnd2sa	average wind speed	m/s	15 minute	15 minute	11/14/03	2003-11-14	2003-11-14	3/9/19	2019-03-09	2019-03-09	15	Marks	SAS V9			1	point	Open	Meteorology	WeatherDaily, WeatherStation	Wind speed, air, daily, mean					Natural Resources, Earth and Environmental Sciences	climatologyMeteorologyAtmosphere	no
GB3549	3549	GB	METEOROLOGY	l1_urt_climate_wnd2sx	maximum wind speed	m/s	15 minute	15 minute	11/14/03	2003-11-14	2003-11-14	3/9/19	2019-03-09	2019-03-09	15	Marks	SAS V9			1	point	Open	Meteorology	WeatherDaily, WeatherStation	wind speed, air, daily, max					Natural Resources, Earth and Environmental Sciences	climatologyMeteorologyAtmosphere	no
GB3550	3550	GB	METEOROLOGY	l1_166b_climate_hum3	relative humidity	%	15 minute	15 minute	10/2/03	2003-10-02	2003-10-02	1/29/19	2019-01-29	2019-01-29	15	Marks	SAS V9			1	point	Open	Meteorology	WeatherDaily, WeatherStation	Relative humidity, air, daily, mean					Natural Resources, Earth and Environmental Sciences	climatologyMeteorologyAtmosphere	no
GB3551	3551	GB	METEOROLOGY	l1_166b_climate_tmp3	air temperature	°C	15 minute	15 minute	10/2/03	2003-10-02	2003-10-02	1/29/19	2019-01-29	2019-01-29	15	Marks	SAS V9			1	point	Open	Meteorology	WeatherDaily, WeatherStation	Temperature, air, daily, mean	Meteorology				Natural Resources, Earth and Environmental Sciences	climatologyMeteorologyAtmosphere	no
GB3552	3552	GB	METEOROLOGY	l1_nich_climate_wnd3r	wind run	km	15 minute	15 minute	5/20/97	1997-05-20	1997-05-20	10/23/12	2012-10-23	2012-10-23	15	Marks	SAS V9			1	point	Open	Meteorology	WeatherDaily, WeatherStation	wind run					Natural Resources, Earth and Environmental Sciences	climatologyMeteorologyAtmosphere	no
GB3553	3553	GB	METEOROLOGY	l1_cbte_climate_wnd3r	wind run	km	15 minute	15 minute	4/28/97	1997-04-28	1997-04-28	10/23/12	2012-10-23	2012-10-23	15	Marks	SAS V9			1	point	Open	Meteorology	WeatherDaily, WeatherStation	wind run					Natural Resources, Earth and Environmental Sciences	climatologyMeteorologyAtmosphere	no
GB3554	3554	GB	METEOROLOGY	l1_138j10_climate_hum3	relative humidity	%	15 minute	15 minute	7/17/03	2003-07-17	2003-07-17	1/29/19	2019-01-29	2019-01-29	16	Marks	SAS V9			1	point	Open	Meteorology	WeatherDaily, WeatherStation	Relative humidity, air, daily, mean					Natural Resources, Earth and Environmental Sciences	climatologyMeteorologyAtmosphere	no
GB3555	3555	GB	METEOROLOGY	l1_138j10_climate_sol	incoming shortwave solar radiation	W/m2	15 minute	15 minute	7/17/03	2003-07-17	2003-07-17	1/29/19	2019-01-29	2019-01-29	16	Marks	SAS V9			1	point	Open	Meteorology	WeatherDaily, WeatherStation	ave_incoming_shortwave radiation					Natural Resources, Earth and Environmental Sciences	climatologyMeteorologyAtmosphere	no
GB3556	3556	GB	METEOROLOGY	l1_138j10_climate_tmp3	air temperature	°C	15 minute	15 minute	7/17/03	2003-07-17	2003-07-17	1/29/19	2019-01-29	2019-01-29	16	Marks	SAS V9			1	point	Open	Meteorology	WeatherDaily, WeatherStation	Temperature, air, daily, mean	Meteorology				Natural Resources, Earth and Environmental Sciences	climatologyMeteorologyAtmosphere	no
GB3557	3557	GB	METEOROLOGY	l1_138l21_climate_hum3	relative humidity	%	15 minute	15 minute	7/16/03	2003-07-16	2003-07-16	1/29/19	2019-01-29	2019-01-29	16	Marks	SAS V9			1	point	Open	Meteorology	WeatherDaily, WeatherStation	Relative humidity, air, daily, mean					Natural Resources, Earth and Environmental Sciences	climatologyMeteorologyAtmosphere	no
GB3558	3558	GB	METEOROLOGY	l1_138l21_climate_sol	incoming shortwave solar radiation	W/m2	15 minute	15 minute	7/16/03	2003-07-16	2003-07-16	1/29/19	2019-01-29	2019-01-29	16	Marks	SAS V9			1	point	Open	Meteorology	WeatherDaily, WeatherStation	ave_incoming_shortwave radiation					Natural Resources, Earth and Environmental Sciences	climatologyMeteorologyAtmosphere	no
GB3559	3559	GB	METEOROLOGY	l1_138l21_climate_tmp3	air temperature	°C	15 minute	15 minute	7/16/03	2003-07-16	2003-07-16	1/29/19	2019-01-29	2019-01-29	16	Marks	SAS V9			1	point	Open	Meteorology	WeatherDaily, WeatherStation	Temperature, air, daily, mean	Meteorology				Natural Resources, Earth and Environmental Sciences	climatologyMeteorologyAtmosphere	no
GB3560	3560	GB	METEOROLOGY	l1_138l21_climate_wnd3r	wind run	km	15 minute	15 minute	7/16/03	2003-07-16	2003-07-16	1/29/19	2019-01-29	2019-01-29	16	Marks	SAS V9			1	point	Open	Meteorology	WeatherDaily, WeatherStation	wind run					Natural Resources, Earth and Environmental Sciences	climatologyMeteorologyAtmosphere	no
GB3561	3561	GB	METEOROLOGY	l1_095b_climate_hum3	relative humidity	%	15 minute	15 minute	5/14/03	2003-05-14	2003-05-14	1/29/19	2019-01-29	2019-01-29	16	Marks	SAS V9			1	point	Open	Meteorology	WeatherDaily, WeatherStation	Relative humidity, air, daily, mean					Natural Resources, Earth and Environmental Sciences	climatologyMeteorologyAtmosphere	no
GB3562	3562	GB	METEOROLOGY	l1_095b_climate_sol	incoming shortwave solar radiation	W/m2	15 minute	15 minute	5/14/03	2003-05-14	2003-05-14	1/29/19	2019-01-29	2019-01-29	16	Marks	SAS V9			1	point	Open	Meteorology	WeatherDaily, WeatherStation	ave_incoming_shortwave radiation					Natural Resources, Earth and Environmental Sciences	climatologyMeteorologyAtmosphere	no
GB3563	3563	GB	METEOROLOGY	l1_095b_climate_tmp3	air temperature	°C	15 minute	15 minute	5/14/03	2003-05-14	2003-05-14	1/29/19	2019-01-29	2019-01-29	16	Marks	SAS V9			1	point	Open	Meteorology	WeatherDaily, WeatherStation	Temperature, air, daily, mean	Meteorology				Natural Resources, Earth and Environmental Sciences	climatologyMeteorologyAtmosphere	no
GB3564	3564	GB	METEOROLOGY	l1_orc1_climate_wnd3r	wind run	km	15 minute	15 minute	6/26/96	1996-06-26	1996-06-26	10/2/12	2012-10-02	2012-10-02	16	Marks	SAS V9			1	point	Open	Meteorology	WeatherDaily, WeatherStation	wind run					Natural Resources, Earth and Environmental Sciences	climatologyMeteorologyAtmosphere	no
GB3565	3565	GB	METEOROLOGY	l1_012_climate_wnd3r	wind run	km	15 minute	15 minute	8/15/02	2002-08-15	2002-08-15	1/28/19	2019-01-28	2019-01-28	16	Marks	SAS V9			1	point	Open	Meteorology	WeatherDaily, WeatherStation	wind run					Natural Resources, Earth and Environmental Sciences	climatologyMeteorologyAtmosphere	no
GB3566	3566	GB	METEOROLOGY	l1_124_climate_sol	incoming shortwave solar radiation	W/m2	15 minute	15 minute	7/1/02	2002-07-01	2002-07-01	1/28/19	2019-01-28	2019-01-28	17	Marks	SAS V9			1	point	Open	Meteorology	WeatherDaily, WeatherStation	ave_incoming_shortwave radiation					Natural Resources, Earth and Environmental Sciences	climatologyMeteorologyAtmosphere	no
GB3567	3567	GB	METEOROLOGY	l1_124_climate_tmp3	air temperature	°C	15 minute	15 minute	7/1/02	2002-07-01	2002-07-01	1/28/19	2019-01-28	2019-01-28	17	Marks	SAS V9			1	point	Open	Meteorology	WeatherDaily, WeatherStation	Temperature, air, daily, mean	Meteorology				Natural Resources, Earth and Environmental Sciences	climatologyMeteorologyAtmosphere	no
GB3568	3568	GB	METEOROLOGY	l1_125_climate_hum3	relative humidity	%	15 minute	15 minute	6/26/02	2002-06-26	2002-06-26	1/28/19	2019-01-28	2019-01-28	17	Marks	SAS V9			1	point	Open	Meteorology	WeatherDaily, WeatherStation	Relative humidity, air, daily, mean					Natural Resources, Earth and Environmental Sciences	climatologyMeteorologyAtmosphere	no
GB3569	3569	GB	METEOROLOGY	l1_125_climate_sol	incoming shortwave solar radiation	W/m2	15 minute	15 minute	6/26/02	2002-06-26	2002-06-26	1/28/19	2019-01-28	2019-01-28	17	Marks	SAS V9			1	point	Open	Meteorology	WeatherDaily, WeatherStation	ave_incoming_shortwave radiation					Natural Resources, Earth and Environmental Sciences	climatologyMeteorologyAtmosphere	no
GB3570	3570	GB	METEOROLOGY	l1_125_climate_tmp3	air temperature	°C	15 minute	15 minute	6/26/02	2002-06-26	2002-06-26	1/28/19	2019-01-28	2019-01-28	17	Marks	SAS V9			1	point	Open	Meteorology	WeatherDaily, WeatherStation	Temperature, air, daily, mean	Meteorology				Natural Resources, Earth and Environmental Sciences	climatologyMeteorologyAtmosphere	no
GB3571	3571	GB	METEOROLOGY	l1_125_climate_wnd3r	wind run	km	15 minute	15 minute	6/26/02	2002-06-26	2002-06-26	1/28/19	2019-01-28	2019-01-28	17	Marks	SAS V9			1	point	Open	Meteorology	WeatherDaily, WeatherStation	wind run					Natural Resources, Earth and Environmental Sciences	climatologyMeteorologyAtmosphere	no
GB3572	3572	GB	METEOROLOGY	l1_076_climate_radsh	diffuse solar radiation	W/m2	15 minute	15 minute	2/6/02	2002-02-06	2002-02-06	1/29/19	2019-01-29	2019-01-29	17	Marks	SAS V9			1	point	Open	Meteorology	WeatherDaily, WeatherStation	Wind speed, air, daily, mean					Natural Resources, Earth and Environmental Sciences	climatologyMeteorologyAtmosphere	no
GB3573	3573	GB	METEOROLOGY	l1_144_climate_wnd3r	wind run	km	15 minute	15 minute	9/20/01	2001-09-20	2001-09-20	11/2/18	2018-11-02	2018-11-02	17	Marks	SAS V9			1	point	Open	Meteorology	WeatherDaily, WeatherStation	wind run					Natural Resources, Earth and Environmental Sciences	climatologyMeteorologyAtmosphere	no
GB3574	3574	GB	METEOROLOGY	l1_13803_climate_hum3	relative humidity	%	15 minute	15 minute	12/13/01	2001-12-13	2001-12-13	1/29/19	2019-01-29	2019-01-29	17	Marks	SAS V9			1	point	Open	Meteorology	WeatherDaily, WeatherStation	Relative humidity, air, daily, mean					Natural Resources, Earth and Environmental Sciences	climatologyMeteorologyAtmosphere	no
GB3575	3575	GB	METEOROLOGY	l1_13803_climate_wnd3r	wind run	km	15 minute	15 minute	12/13/01	2001-12-13	2001-12-13	1/29/19	2019-01-29	2019-01-29	17	Marks	SAS V9			1	point	Open	Meteorology	WeatherDaily, WeatherStation	wind run					Natural Resources, Earth and Environmental Sciences	climatologyMeteorologyAtmosphere	no
GB3576	3576	GB	METEOROLOGY	l1_145_climate_hum3	relative humidity	%	15 minute	15 minute	10/2/01	2001-10-02	2001-10-02	1/29/19	2019-01-29	2019-01-29	17	Marks	SAS V9			1	point	Open	Meteorology	WeatherDaily, WeatherStation	Relative humidity, air, daily, mean					Natural Resources, Earth and Environmental Sciences	climatologyMeteorologyAtmosphere	no
GB3577	3577	GB	METEOROLOGY	l1_145_climate_sol	incoming shortwave solar radiation	W/m2	15 minute	15 minute	10/2/01	2001-10-02	2001-10-02	1/29/19	2019-01-29	2019-01-29	17	Marks	SAS V9			1	point	Open	Meteorology	WeatherDaily, WeatherStation	ave_incoming_shortwave radiation					Natural Resources, Earth and Environmental Sciences	climatologyMeteorologyAtmosphere	no
GB3578	3578	GB	METEOROLOGY	l1_145_climate_tmp3	air temperature	°C	15 minute	15 minute	10/2/01	2001-10-02	2001-10-02	1/29/19	2019-01-29	2019-01-29	17	Marks	SAS V9			1	point	Open	Meteorology	WeatherDaily, WeatherStation	Temperature, air, daily, mean	Meteorology				Natural Resources, Earth and Environmental Sciences	climatologyMeteorologyAtmosphere	no
GB3579	3579	GB	METEOROLOGY	l1_144_climate_hum3	relative humidity	%	15 minute	15 minute	9/20/01	2001-09-20	2001-09-20	1/28/19	2019-01-28	2019-01-28	17	Marks	SAS V9			1	point	Open	Meteorology	WeatherDaily, WeatherStation	Relative humidity, air, daily, mean					Natural Resources, Earth and Environmental Sciences	climatologyMeteorologyAtmosphere	no
GB3580	3580	GB	METEOROLOGY	l1_144_climate_sol	incoming shortwave solar radiation	W/m2	15 minute	15 minute	9/20/01	2001-09-20	2001-09-20	1/28/19	2019-01-28	2019-01-28	17	Marks	SAS V9			1	point	Open	Meteorology	WeatherDaily, WeatherStation	ave_incoming_shortwave radiation					Natural Resources, Earth and Environmental Sciences	climatologyMeteorologyAtmosphere	no
GB3581	3581	GB	METEOROLOGY	l1_144_climate_tmp3	air temperature	°C	15 minute	15 minute	9/20/01	2001-09-20	2001-09-20	1/28/19	2019-01-28	2019-01-28	17	Marks	SAS V9			1	point	Open	Meteorology	WeatherDaily, WeatherStation	Temperature, air, daily, mean	Meteorology				Natural Resources, Earth and Environmental Sciences	climatologyMeteorologyAtmosphere	no
GB3582	3582	GB	METEOROLOGY	l1_174_climate_hum3	relative humidity	%	15 minute	15 minute	9/18/01	2001-09-18	2001-09-18	1/29/19	2019-01-29	2019-01-29	17	Marks	SAS V9			1	point	Open	Meteorology	WeatherDaily, WeatherStation	Relative humidity, air, daily, mean					Natural Resources, Earth and Environmental Sciences	climatologyMeteorologyAtmosphere	no
GB3583	3583	GB	METEOROLOGY	l1_174_climate_sol	incoming shortwave solar radiation	W/m2	15 minute	15 minute	9/18/01	2001-09-18	2001-09-18	1/29/19	2019-01-29	2019-01-29	17	Marks	SAS V9			1	point	Open	Meteorology	WeatherDaily, WeatherStation	ave_incoming_shortwave radiation					Natural Resources, Earth and Environmental Sciences	climatologyMeteorologyAtmosphere	no
GB3584	3584	GB	METEOROLOGY	l1_174_climate_tmp3	air temperature	°C	15 minute	15 minute	9/18/01	2001-09-18	2001-09-18	1/29/19	2019-01-29	2019-01-29	17	Marks	SAS V9			1	point	Open	Meteorology	WeatherDaily, WeatherStation	Temperature, air, daily, mean	Meteorology				Natural Resources, Earth and Environmental Sciences	climatologyMeteorologyAtmosphere	no
GB3585	3585	GB	METEOROLOGY	l1_174_climate_wnd3r	wind run	km	15 minute	15 minute	9/18/01	2001-09-18	2001-09-18	1/29/19	2019-01-29	2019-01-29	17	Marks	SAS V9			1	point	Open	Meteorology	WeatherDaily, WeatherStation	wind run					Natural Resources, Earth and Environmental Sciences	climatologyMeteorologyAtmosphere	no
GB3586	3586	GB	METEOROLOGY	l1_031_climate_hum3	relative humidity	%	15 minute	15 minute	8/8/00	2000-08-08	2000-08-08	1/28/19	2019-01-28	2019-01-28	18	Marks	SAS V9			1	point	Open	Meteorology	WeatherDaily, WeatherStation	Relative humidity, air, daily, mean					Natural Resources, Earth and Environmental Sciences	climatologyMeteorologyAtmosphere	no
GB3587	3587	GB	METEOROLOGY	l1_031_climate_sol	incoming shortwave solar radiation	W/m2	15 minute	15 minute	8/8/00	2000-08-08	2000-08-08	1/28/19	2019-01-28	2019-01-28	18	Marks	SAS V9			1	point	Open	Meteorology	WeatherDaily, WeatherStation	ave_incoming_shortwave radiation					Natural Resources, Earth and Environmental Sciences	climatologyMeteorologyAtmosphere	no
GB3588	3588	GB	METEOROLOGY	l1_031_climate_tmp3	air temperature	°C	15 minute	15 minute	8/8/00	2000-08-08	2000-08-08	1/28/19	2019-01-28	2019-01-28	18	Marks	SAS V9			1	point	Open	Meteorology	WeatherDaily, WeatherStation	Temperature, air, daily, mean	Meteorology				Natural Resources, Earth and Environmental Sciences	climatologyMeteorologyAtmosphere	no
GB3589	3589	GB	METEOROLOGY	l1_031_climate_wnd3r	wind run	km	15 minute	15 minute	8/8/00	2000-08-08	2000-08-08	1/28/19	2019-01-28	2019-01-28	18	Marks	SAS V9			1	point	Open	Meteorology	WeatherDaily, WeatherStation	wind run					Natural Resources, Earth and Environmental Sciences	climatologyMeteorologyAtmosphere	no
GB3590	3590	GB	METEOROLOGY	l1_012_climate_hum3	relative humidity	%	15 minute	15 minute	6/29/00	2000-06-29	2000-06-29	1/28/19	2019-01-28	2019-01-28	19	Marks	SAS V9			1	point	Open	Meteorology	WeatherDaily, WeatherStation	Relative humidity, air, daily, mean					Natural Resources, Earth and Environmental Sciences	climatologyMeteorologyAtmosphere	no
GB3591	3591	GB	METEOROLOGY	l1_012_climate_sol	incoming shortwave solar radiation	W/m2	15 minute	15 minute	6/29/00	2000-06-29	2000-06-29	1/28/19	2019-01-28	2019-01-28	19	Marks	SAS V9			1	point	Open	Meteorology	WeatherDaily, WeatherStation	ave_incoming_shortwave radiation					Natural Resources, Earth and Environmental Sciences	climatologyMeteorologyAtmosphere	no
GB3592	3592	GB	METEOROLOGY	l1_012_climate_tmp3	air temperature	°C	15 minute	15 minute	6/29/00	2000-06-29	2000-06-29	1/28/19	2019-01-28	2019-01-28	19	Marks	SAS V9			1	point	Open	Meteorology	WeatherDaily, WeatherStation	Temperature, air, daily, mean	Meteorology				Natural Resources, Earth and Environmental Sciences	climatologyMeteorologyAtmosphere	no
GB3593	3593	GB	METEOROLOGY	l1_076_climate_wnd3sx	maximum wind speed	m/s	15 minute	15 minute	10/7/96	1996-10-07	1996-10-07	8/19/15	2015-08-19	2015-08-19	19	Marks	SAS V9			1	point	Open	Meteorology	WeatherDaily, WeatherStation	wind speed, air, daily, max					Natural Resources, Earth and Environmental Sciences	climatologyMeteorologyAtmosphere	no
GB3594	3594	GB	METEOROLOGY	l1_167_climate_hum3	relative humidity	%	15 minute	15 minute	12/8/99	1999-12-08	1999-12-08	1/29/19	2019-01-29	2019-01-29	19	Marks	SAS V9			1	point	Open	Meteorology	WeatherDaily, WeatherStation	Relative humidity, air, daily, mean					Natural Resources, Earth and Environmental Sciences	climatologyMeteorologyAtmosphere	no
GB3595	3595	GB	METEOROLOGY	l1_167_climate_sol	incoming shortwave solar radiation	W/m2	15 minute	15 minute	12/8/99	1999-12-08	1999-12-08	1/29/19	2019-01-29	2019-01-29	19	Marks	SAS V9			1	point	Open	Meteorology	WeatherDaily, WeatherStation	ave_incoming_shortwave radiation					Natural Resources, Earth and Environmental Sciences	climatologyMeteorologyAtmosphere	no
GB3596	3596	GB	METEOROLOGY	l1_167_climate_tmp3	air temperature	°C	15 minute	15 minute	12/8/99	1999-12-08	1999-12-08	1/29/19	2019-01-29	2019-01-29	19	Marks	SAS V9			1	point	Open	Meteorology	WeatherDaily, WeatherStation	Temperature, air, daily, mean	Meteorology				Natural Resources, Earth and Environmental Sciences	climatologyMeteorologyAtmosphere	no
GB3597	3597	GB	METEOROLOGY	l1_167_climate_wnd3r	wind run	km	15 minute	15 minute	12/8/99	1999-12-08	1999-12-08	1/29/19	2019-01-29	2019-01-29	19	Marks	SAS V9			1	point	Open	Meteorology	WeatherDaily, WeatherStation	wind run					Natural Resources, Earth and Environmental Sciences	climatologyMeteorologyAtmosphere	no
GB3598	3598	GB	METEOROLOGY	l1_163_climate_hum3	relative humidity	%	15 minute	15 minute	11/29/99	1999-11-29	1999-11-29	1/29/19	2019-01-29	2019-01-29	19	Marks	SAS V9			1	point	Open	Meteorology	WeatherDaily, WeatherStation	Relative humidity, air, daily, mean					Natural Resources, Earth and Environmental Sciences	climatologyMeteorologyAtmosphere	no
GB3599	3599	GB	METEOROLOGY	l1_163_climate_sol	incoming shortwave solar radiation	W/m2	15 minute	15 minute	11/29/99	1999-11-29	1999-11-29	1/29/19	2019-01-29	2019-01-29	19	Marks	SAS V9			1	point	Open	Meteorology	WeatherDaily, WeatherStation	ave_incoming_shortwave radiation					Natural Resources, Earth and Environmental Sciences	climatologyMeteorologyAtmosphere	no
GB3600	3600	GB	METEOROLOGY	l1_163_climate_tmp3	air temperature	°C	15 minute	15 minute	11/29/99	1999-11-29	1999-11-29	1/29/19	2019-01-29	2019-01-29	19	Marks	SAS V9			1	point	Open	Meteorology	WeatherDaily, WeatherStation	Temperature, air, daily, mean	Meteorology				Natural Resources, Earth and Environmental Sciences	climatologyMeteorologyAtmosphere	no
GB3601	3601	GB	METEOROLOGY	l1_163_climate_wnd3r	wind run	km	15 minute	15 minute	11/29/99	1999-11-29	1999-11-29	1/29/19	2019-01-29	2019-01-29	19	Marks	SAS V9			1	point	Open	Meteorology	WeatherDaily, WeatherStation	wind run					Natural Resources, Earth and Environmental Sciences	climatologyMeteorologyAtmosphere	no
GB3602	3602	GB	METEOROLOGY	l1_128_climate_wnd10r	wind run	km	15 minute	15 minute	7/24/96	1996-07-24	1996-07-24	10/21/15	2015-10-21	2015-10-21	19	Marks	SAS V9			1	point	Open	Meteorology	WeatherDaily, WeatherStation	wind run					Natural Resources, Earth and Environmental Sciences	climatologyMeteorologyAtmosphere	no
GB3603	3603	GB	METEOROLOGY	l1_128_climate_wnd3r	wind run	km	15 minute	15 minute	7/24/96	1996-07-24	1996-07-24	10/21/15	2015-10-21	2015-10-21	19	Marks	SAS V9			1	point	Open	Meteorology	WeatherDaily, WeatherStation	wind run					Natural Resources, Earth and Environmental Sciences	climatologyMeteorologyAtmosphere	no
GB3604	3604	GB	METEOROLOGY	l1_nich_climate_wnd3sx	maximum wind speed	m/s	15 minute	15 minute	6/23/98	1998-06-23	1998-06-23	8/9/18	2018-08-09	2018-08-09	20	Marks	SAS V9			1	point	Open	Meteorology	WeatherDaily, WeatherStation	wind speed, air, daily, max					Natural Resources, Earth and Environmental Sciences	climatologyMeteorologyAtmosphere	no
GB3605	3605	GB	METEOROLOGY	l1_rmsp3_climate_hum3	relative humidity	%	15 minute	15 minute	10/27/98	1998-10-27	1998-10-27	1/29/19	2019-01-29	2019-01-29	20	Marks	SAS V9			1	point	Open	Meteorology	WeatherDaily, WeatherStation	Relative humidity, air, daily, mean					Natural Resources, Earth and Environmental Sciences	climatologyMeteorologyAtmosphere	no
GB3606	3606	GB	METEOROLOGY	l1_rmsp3_climate_sol	incoming shortwave solar radiation	W/m2	15 minute	15 minute	10/27/98	1998-10-27	1998-10-27	1/29/19	2019-01-29	2019-01-29	20	Marks	SAS V9			1	point	Open	Meteorology	WeatherDaily, WeatherStation	ave_incoming_shortwave radiation					Natural Resources, Earth and Environmental Sciences	climatologyMeteorologyAtmosphere	no
GB3607	3607	GB	METEOROLOGY	l1_rmsp3_climate_tmp3	air temperature	°C	15 minute	15 minute	10/27/98	1998-10-27	1998-10-27	1/29/19	2019-01-29	2019-01-29	20	Marks	SAS V9			1	point	Open	Meteorology	WeatherDaily, WeatherStation	Temperature, air, daily, mean	Meteorology				Natural Resources, Earth and Environmental Sciences	climatologyMeteorologyAtmosphere	no
GB3608	3608	GB	METEOROLOGY	l1_cbte_climate_wnd3sx	maximum wind speed	m/s	15 minute	15 minute	6/23/98	1998-06-23	1998-06-23	1/29/19	2019-01-29	2019-01-29	21	Marks	SAS V9			1	point	Open	Meteorology	WeatherDaily, WeatherStation	wind speed, air, daily, max					Natural Resources, Earth and Environmental Sciences	climatologyMeteorologyAtmosphere	no
GB3609	3609	GB	METEOROLOGY	l1_guard_climate_wnd3sx	maximum wind speed	m/s	15 minute	15 minute	6/23/98	1998-06-23	1998-06-23	1/29/19	2019-01-29	2019-01-29	21	Marks	SAS V9			1	point	Open	Meteorology	WeatherDaily, WeatherStation	wind speed, air, daily, max					Natural Resources, Earth and Environmental Sciences	climatologyMeteorologyAtmosphere	no
GB3610	3610	GB	METEOROLOGY	l1_orc1_climate_wnd3sa	average wind speed	m/s	15 minute	15 minute	6/22/98	1998-06-22	1998-06-22	1/29/19	2019-01-29	2019-01-29	21	Marks	SAS V9			1	point	Open	Meteorology	WeatherDaily, WeatherStation	Wind speed, air, daily, mean					Natural Resources, Earth and Environmental Sciences	climatologyMeteorologyAtmosphere	no
GB3611	3611	GB	METEOROLOGY	l1_orc1_climate_wnd3sr	resultant wind speed	m/s	15 minute	15 minute	6/22/98	1998-06-22	1998-06-22	1/29/19	2019-01-29	2019-01-29	21	Marks	SAS V9			1	point	Open	Meteorology	WeatherDaily, WeatherStation	Wind speed, air, daily, mean					Natural Resources, Earth and Environmental Sciences	climatologyMeteorologyAtmosphere	no
GB3612	3612	GB	METEOROLOGY	l1_orc1_climate_wnd3sx	maximum wind speed	m/s	15 minute	15 minute	6/22/98	1998-06-22	1998-06-22	1/29/19	2019-01-29	2019-01-29	21	Marks	SAS V9			1	point	Open	Meteorology	WeatherDaily, WeatherStation	wind speed, air, daily, max					Natural Resources, Earth and Environmental Sciences	climatologyMeteorologyAtmosphere	no
GB3613	3613	GB	METEOROLOGY	l1_076_climate_wnd10sx	maximum wind speed	m/s	15 minute	15 minute	6/7/94	1994-06-07	1994-06-07	8/19/15	2015-08-19	2015-08-19	21	Marks	SAS V9			1	point	Open	Meteorology	WeatherDaily, WeatherStation	wind speed, air, daily, max					Natural Resources, Earth and Environmental Sciences	climatologyMeteorologyAtmosphere	no
GB3614	3614	GB	METEOROLOGY	l1_nich_climate_sol	incoming shortwave solar radiation	W/m2	15 minute	15 minute	5/20/97	1997-05-20	1997-05-20	8/9/18	2018-08-09	2018-08-09	21	Marks	SAS V9			1	point	Open	Meteorology	WeatherDaily, WeatherStation	ave_incoming_shortwave radiation					Natural Resources, Earth and Environmental Sciences	climatologyMeteorologyAtmosphere	no
GB3615	3615	GB	METEOROLOGY	l1_guard_climate_hum3	relative humidity	%	15 minute	15 minute	10/28/97	1997-10-28	1997-10-28	1/29/19	2019-01-29	2019-01-29	21	Marks	SAS V9			1	point	Open	Meteorology	WeatherDaily, WeatherStation	Relative humidity, air, daily, mean					Natural Resources, Earth and Environmental Sciences	climatologyMeteorologyAtmosphere	no
GB3616	3616	GB	METEOROLOGY	l1_guard_climate_sol	incoming shortwave solar radiation	W/m2	15 minute	15 minute	10/28/97	1997-10-28	1997-10-28	1/29/19	2019-01-29	2019-01-29	21	Marks	SAS V9			1	point	Open	Meteorology	WeatherDaily, WeatherStation	ave_incoming_shortwave radiation					Natural Resources, Earth and Environmental Sciences	climatologyMeteorologyAtmosphere	no
GB3617	3617	GB	METEOROLOGY	l1_guard_climate_tmp3	air temperature	°C	15 minute	15 minute	10/28/97	1997-10-28	1997-10-28	1/29/19	2019-01-29	2019-01-29	21	Marks	SAS V9			1	point	Open	Meteorology	WeatherDaily, WeatherStation	Temperature, air, daily, mean	Meteorology				Natural Resources, Earth and Environmental Sciences	climatologyMeteorologyAtmosphere	no
GB3618	3618	GB	METEOROLOGY	l1_nich_climate_hum3	relative humidity	%	15 minute	15 minute	5/20/97	1997-05-20	1997-05-20	12/19/18	2018-12-19	2018-12-19	22	Marks	SAS V9			1	point	Open	Meteorology	WeatherDaily, WeatherStation	Relative humidity, air, daily, mean					Natural Resources, Earth and Environmental Sciences	climatologyMeteorologyAtmosphere	no
GB3619	3619	GB	METEOROLOGY	l1_nich_climate_tmp3	air temperature	°C	15 minute	15 minute	5/20/97	1997-05-20	1997-05-20	12/19/18	2018-12-19	2018-12-19	22	Marks	SAS V9			1	point	Open	Meteorology	WeatherDaily, WeatherStation	Temperature, air, daily, mean	Meteorology				Natural Resources, Earth and Environmental Sciences	climatologyMeteorologyAtmosphere	no
GB3620	3620	GB	METEOROLOGY	l1_cbte_climate_hum3	relative humidity	%	15 minute	15 minute	4/28/97	1997-04-28	1997-04-28	1/29/19	2019-01-29	2019-01-29	22	Marks	SAS V9			1	point	Open	Meteorology	WeatherDaily, WeatherStation	Relative humidity, air, daily, mean					Natural Resources, Earth and Environmental Sciences	climatologyMeteorologyAtmosphere	no
GB3621	3621	GB	METEOROLOGY	l1_cbte_climate_sol	incoming shortwave solar radiation	W/m2	15 minute	15 minute	4/28/97	1997-04-28	1997-04-28	1/29/19	2019-01-29	2019-01-29	22	Marks	SAS V9			1	point	Open	Meteorology	WeatherDaily, WeatherStation	ave_incoming_shortwave radiation					Natural Resources, Earth and Environmental Sciences	climatologyMeteorologyAtmosphere	no
GB3622	3622	GB	METEOROLOGY	l1_cbte_climate_tmp3	air temperature	°C	15 minute	15 minute	4/28/97	1997-04-28	1997-04-28	1/29/19	2019-01-29	2019-01-29	22	Marks	SAS V9			1	point	Open	Meteorology	WeatherDaily, WeatherStation	Temperature, air, daily, mean	Meteorology				Natural Resources, Earth and Environmental Sciences	climatologyMeteorologyAtmosphere	no
GB3623	3623	GB	METEOROLOGY	l1_127_climate_wnd10sx	maximum wind speed	m/s	15 minute	15 minute	9/15/93	1993-09-15	1993-09-15	7/6/15	2015-07-06	2015-07-06	22	Marks	SAS V9			1	point	Open	Meteorology	WeatherDaily, WeatherStation	wind speed, air, daily, max					Natural Resources, Earth and Environmental Sciences	climatologyMeteorologyAtmosphere	no
GB3624	3624	GB	METEOROLOGY	l1_127_climate_wnd3sx	maximum wind speed	m/s	15 minute	15 minute	9/15/93	1993-09-15	1993-09-15	7/6/15	2015-07-06	2015-07-06	22	Marks	SAS V9			1	point	Open	Meteorology	WeatherDaily, WeatherStation	wind speed, air, daily, max					Natural Resources, Earth and Environmental Sciences	climatologyMeteorologyAtmosphere	no
GB3625	3625	GB	METEOROLOGY	l1_128_climate_wnd10sx	maximum wind speed	m/s	15 minute	15 minute	11/6/93	1993-11-06	1993-11-06	10/21/15	2015-10-21	2015-10-21	22	Marks	SAS V9			1	point	Open	Meteorology	WeatherDaily, WeatherStation	wind speed, air, daily, max					Natural Resources, Earth and Environmental Sciences	climatologyMeteorologyAtmosphere	no
GB3626	3626	GB	METEOROLOGY	l1_128_climate_wnd3sx	maximum wind speed	m/s	15 minute	15 minute	11/6/93	1993-11-06	1993-11-06	10/21/15	2015-10-21	2015-10-21	22	Marks	SAS V9			1	point	Open	Meteorology	WeatherDaily, WeatherStation	wind speed, air, daily, max					Natural Resources, Earth and Environmental Sciences	climatologyMeteorologyAtmosphere	no
GB3627	3627	GB	METEOROLOGY	l1_076_climate_hum10	relative humidity	%	15 minute	15 minute	10/7/96	1996-10-07	1996-10-07	1/29/19	2019-01-29	2019-01-29	22	Marks	SAS V9			1	point	Open	Meteorology	WeatherDaily, WeatherStation	Relative humidity, air, daily, mean					Natural Resources, Earth and Environmental Sciences	climatologyMeteorologyAtmosphere	no
GB3628	3628	GB	METEOROLOGY	l1_076_climate_hum3	relative humidity	%	15 minute	15 minute	10/7/96	1996-10-07	1996-10-07	1/29/19	2019-01-29	2019-01-29	22	Marks	SAS V9			1	point	Open	Meteorology	WeatherDaily, WeatherStation	Relative humidity, air, daily, mean					Natural Resources, Earth and Environmental Sciences	climatologyMeteorologyAtmosphere	no
GB3629	3629	GB	METEOROLOGY	l1_076_climate_tmp10	air temperature	°C	15 minute	15 minute	10/7/96	1996-10-07	1996-10-07	1/29/19	2019-01-29	2019-01-29	22	Marks	SAS V9			1	point	Open	Meteorology	WeatherDaily, WeatherStation	Temperature, air, daily, mean	Meteorology				Natural Resources, Earth and Environmental Sciences	climatologyMeteorologyAtmosphere	no
GB3630	3630	GB	METEOROLOGY	l1_076_climate_wnd10s	wind speed	m/s	15 minute	15 minute	10/7/96	1996-10-07	1996-10-07	1/29/19	2019-01-29	2019-01-29	22	Marks	SAS V9			1	point	Open	Meteorology	WeatherDaily, WeatherStation	Wind speed, air, daily, mean					Natural Resources, Earth and Environmental Sciences	climatologyMeteorologyAtmosphere	no
GB3631	3631	GB	METEOROLOGY	l1_076_climate_wnd3d	wind direction	°N	15 minute	15 minute	10/7/96	1996-10-07	1996-10-07	1/29/19	2019-01-29	2019-01-29	22	Marks	SAS V9			1	point	Open	Meteorology	WeatherDaily, WeatherStation	Wind direction air, daily, mean					Natural Resources, Earth and Environmental Sciences	climatologyMeteorologyAtmosphere	no
GB3632	3632	GB	METEOROLOGY	l1_076_climate_wnd3dr	resultant wind direction	°N	15 minute	15 minute	10/7/96	1996-10-07	1996-10-07	1/29/19	2019-01-29	2019-01-29	22	Marks	SAS V9			1	point	Open	Meteorology	WeatherDaily, WeatherStation	Wind direction air, daily, mean					Natural Resources, Earth and Environmental Sciences	climatologyMeteorologyAtmosphere	no
GB3633	3633	GB	METEOROLOGY	l1_076_climate_wnd3s	wind speed	m/s	15 minute	15 minute	10/7/96	1996-10-07	1996-10-07	1/29/19	2019-01-29	2019-01-29	22	Marks	SAS V9			1	point	Open	Meteorology	WeatherDaily, WeatherStation	Wind speed, air, daily, mean					Natural Resources, Earth and Environmental Sciences	climatologyMeteorologyAtmosphere	no
GB3634	3634	GB	METEOROLOGY	l1_076_climate_wnd3sa	average wind speed	m/s	15 minute	15 minute	10/7/96	1996-10-07	1996-10-07	1/29/19	2019-01-29	2019-01-29	22	Marks	SAS V9			1	point	Open	Meteorology	WeatherDaily, WeatherStation	Wind speed, air, daily, mean					Natural Resources, Earth and Environmental Sciences	climatologyMeteorologyAtmosphere	no
GB3635	3635	GB	METEOROLOGY	l1_076_climate_wnd3sr	resultant wind speed	m/s	15 minute	15 minute	10/7/96	1996-10-07	1996-10-07	1/29/19	2019-01-29	2019-01-29	22	Marks	SAS V9			1	point	Open	Meteorology	WeatherDaily, WeatherStation	Wind speed, air, daily, mean					Natural Resources, Earth and Environmental Sciences	climatologyMeteorologyAtmosphere	no
GB3636	3636	GB	METEOROLOGY	l1_176_climate_wnd10r	wind run	km	15 minute	15 minute	9/8/93	1993-09-08	1993-09-08	1/21/16	2016-01-21	2016-01-21	22	Marks	SAS V9			1	point	Open	Meteorology	WeatherDaily, WeatherStation	wind run					Natural Resources, Earth and Environmental Sciences	climatologyMeteorologyAtmosphere	no
GB3637	3637	GB	METEOROLOGY	l1_176_climate_wnd10sx	maximum wind speed	m/s	15 minute	15 minute	9/8/93	1993-09-08	1993-09-08	1/21/16	2016-01-21	2016-01-21	22	Marks	SAS V9			1	point	Open	Meteorology	WeatherDaily, WeatherStation	wind speed, air, daily, max					Natural Resources, Earth and Environmental Sciences	climatologyMeteorologyAtmosphere	no
GB3638	3638	GB	METEOROLOGY	l1_176_climate_wnd3sx	maximum wind speed	m/s	15 minute	15 minute	9/8/93	1993-09-08	1993-09-08	1/21/16	2016-01-21	2016-01-21	22	Marks	SAS V9			1	point	Open	Meteorology	WeatherDaily, WeatherStation	wind speed, air, daily, max					Natural Resources, Earth and Environmental Sciences	climatologyMeteorologyAtmosphere	no
GB3639	3639	GB	METEOROLOGY	l1_orc1_climate_hum3	relative humidity	%	15 minute	15 minute	6/27/96	1996-06-27	1996-06-27	1/29/19	2019-01-29	2019-01-29	23	Marks	SAS V9			1	point	Open	Meteorology	WeatherDaily, WeatherStation	Relative humidity, air, daily, mean					Natural Resources, Earth and Environmental Sciences	climatologyMeteorologyAtmosphere	no
GB3640	3640	GB	METEOROLOGY	l1_orc1_climate_sol	incoming shortwave solar radiation	W/m2	15 minute	15 minute	6/26/96	1996-06-26	1996-06-26	1/29/19	2019-01-29	2019-01-29	23	Marks	SAS V9			1	point	Open	Meteorology	WeatherDaily, WeatherStation	ave_incoming_shortwave radiation					Natural Resources, Earth and Environmental Sciences	climatologyMeteorologyAtmosphere	no
GB3641	3641	GB	METEOROLOGY	l1_orc1_climate_tmp3	air temperature	°C	15 minute	15 minute	6/26/96	1996-06-26	1996-06-26	1/29/19	2019-01-29	2019-01-29	23	Marks	SAS V9			1	point	Open	Meteorology	WeatherDaily, WeatherStation	Temperature, air, daily, mean	Meteorology				Natural Resources, Earth and Environmental Sciences	climatologyMeteorologyAtmosphere	no
GB3642	3642	GB	METEOROLOGY	l1_176_climate_hum10	relative humidity	%	15 minute	15 minute	11/2/95	1995-11-02	1995-11-02	1/29/19	2019-01-29	2019-01-29	23	Marks	SAS V9			1	point	Open	Meteorology	WeatherDaily, WeatherStation	Relative humidity, air, daily, mean					Natural Resources, Earth and Environmental Sciences	climatologyMeteorologyAtmosphere	no
GB3643	3643	GB	METEOROLOGY	l1_127_climate_hum10	relative humidity	%	15 minute	15 minute	10/25/95	1995-10-25	1995-10-25	1/29/19	2019-01-29	2019-01-29	23	Marks	SAS V9			1	point	Open	Meteorology	WeatherDaily, WeatherStation	Relative humidity, air, daily, mean					Natural Resources, Earth and Environmental Sciences	climatologyMeteorologyAtmosphere	no
GB3644	3644	GB	METEOROLOGY	l1_128_climate_hum10	relative humidity	%	15 minute	15 minute	9/26/95	1995-09-26	1995-09-26	1/29/19	2019-01-29	2019-01-29	23	Marks	SAS V9			1	point	Open	Meteorology	WeatherDaily, WeatherStation	Relative humidity, air, daily, mean					Natural Resources, Earth and Environmental Sciences	climatologyMeteorologyAtmosphere	no
GB3645	3645	GB	METEOROLOGY	l1_128_climate_hum3	relative humidity	%	15 minute	15 minute	9/26/95	1995-09-26	1995-09-26	1/29/19	2019-01-29	2019-01-29	23	Marks	SAS V9			1	point	Open	Meteorology	WeatherDaily, WeatherStation	Relative humidity, air, daily, mean					Natural Resources, Earth and Environmental Sciences	climatologyMeteorologyAtmosphere	no
GB3646	3646	GB	METEOROLOGY	l1_076_climate_wnd10d	wind direction	°N	15 minute	15 minute	6/7/94	1994-06-07	1994-06-07	1/29/19	2019-01-29	2019-01-29	25	Marks	SAS V9			1	point	Open	Meteorology	WeatherDaily, WeatherStation	Wind direction air, daily, mean					Natural Resources, Earth and Environmental Sciences	climatologyMeteorologyAtmosphere	no
GB3647	3647	GB	METEOROLOGY	l1_076_climate_wnd10dr	resultant wind direction	°N	15 minute	15 minute	6/7/94	1994-06-07	1994-06-07	1/29/19	2019-01-29	2019-01-29	25	Marks	SAS V9			1	point	Open	Meteorology	WeatherDaily, WeatherStation	Wind direction air, daily, mean					Natural Resources, Earth and Environmental Sciences	climatologyMeteorologyAtmosphere	no
GB3648	3648	GB	METEOROLOGY	l1_076_climate_wnd10sa	average wind speed	m/s	15 minute	15 minute	6/7/94	1994-06-07	1994-06-07	1/29/19	2019-01-29	2019-01-29	25	Marks	SAS V9			1	point	Open	Meteorology	WeatherDaily, WeatherStation	Wind speed, air, daily, mean					Natural Resources, Earth and Environmental Sciences	climatologyMeteorologyAtmosphere	no
GB3649	3649	GB	METEOROLOGY	l1_076_climate_wnd10sr	resultant wind speed	m/s	15 minute	15 minute	6/7/94	1994-06-07	1994-06-07	1/29/19	2019-01-29	2019-01-29	25	Marks	SAS V9			1	point	Open	Meteorology	WeatherDaily, WeatherStation	Wind speed, air, daily, mean					Natural Resources, Earth and Environmental Sciences	climatologyMeteorologyAtmosphere	no
GB3650	3650	GB	METEOROLOGY	l1_128_climate_tmp10	air temperature	°C	15 minute	15 minute	11/6/93	1993-11-06	1993-11-06	1/29/19	2019-01-29	2019-01-29	25	Marks	SAS V9			1	point	Open	Meteorology	WeatherDaily, WeatherStation	Temperature, air, daily, mean	Meteorology				Natural Resources, Earth and Environmental Sciences	climatologyMeteorologyAtmosphere	no
GB3651	3651	GB	METEOROLOGY	l1_128_climate_tmp3	air temperature	°C	15 minute	15 minute	11/6/93	1993-11-06	1993-11-06	1/29/19	2019-01-29	2019-01-29	25	Marks	SAS V9			1	point	Open	Meteorology	WeatherDaily, WeatherStation	Temperature, air, daily, mean	Meteorology				Natural Resources, Earth and Environmental Sciences	climatologyMeteorologyAtmosphere	no
GB3652	3652	GB	METEOROLOGY	l1_128_climate_wnd10d	wind direction	°N	15 minute	15 minute	11/6/93	1993-11-06	1993-11-06	1/29/19	2019-01-29	2019-01-29	25	Marks	SAS V9			1	point	Open	Meteorology	WeatherDaily, WeatherStation	Wind direction air, daily, mean					Natural Resources, Earth and Environmental Sciences	climatologyMeteorologyAtmosphere	no
GB3653	3653	GB	METEOROLOGY	l1_128_climate_wnd10dr	resultant wind direction	°N	15 minute	15 minute	11/6/93	1993-11-06	1993-11-06	1/29/19	2019-01-29	2019-01-29	25	Marks	SAS V9			1	point	Open	Meteorology	WeatherDaily, WeatherStation	Wind direction air, daily, mean					Natural Resources, Earth and Environmental Sciences	climatologyMeteorologyAtmosphere	no
GB3654	3654	GB	METEOROLOGY	l1_128_climate_wnd10sa	average wind speed	m/s	15 minute	15 minute	11/6/93	1993-11-06	1993-11-06	1/29/19	2019-01-29	2019-01-29	25	Marks	SAS V9			1	point	Open	Meteorology	WeatherDaily, WeatherStation	Wind speed, air, daily, mean					Natural Resources, Earth and Environmental Sciences	climatologyMeteorologyAtmosphere	no
GB3655	3655	GB	METEOROLOGY	l1_128_climate_wnd10sr	resultant wind speed	m/s	15 minute	15 minute	11/6/93	1993-11-06	1993-11-06	1/29/19	2019-01-29	2019-01-29	25	Marks	SAS V9			1	point	Open	Meteorology	WeatherDaily, WeatherStation	Wind speed, air, daily, mean					Natural Resources, Earth and Environmental Sciences	climatologyMeteorologyAtmosphere	no
GB3656	3656	GB	METEOROLOGY	l1_128_climate_wnd3d	wind direction	°N	15 minute	15 minute	11/6/93	1993-11-06	1993-11-06	1/29/19	2019-01-29	2019-01-29	25	Marks	SAS V9			1	point	Open	Meteorology	WeatherDaily, WeatherStation	Wind direction air, daily, mean					Natural Resources, Earth and Environmental Sciences	climatologyMeteorologyAtmosphere	no
GB3657	3657	GB	METEOROLOGY	l1_128_climate_wnd3dr	resultant wind direction	°N	15 minute	15 minute	11/6/93	1993-11-06	1993-11-06	1/29/19	2019-01-29	2019-01-29	25	Marks	SAS V9			1	point	Open	Meteorology	WeatherDaily, WeatherStation	Wind direction air, daily, mean					Natural Resources, Earth and Environmental Sciences	climatologyMeteorologyAtmosphere	no
GB3658	3658	GB	METEOROLOGY	l1_128_climate_wnd3sa	average wind speed	m/s	15 minute	15 minute	11/6/93	1993-11-06	1993-11-06	1/29/19	2019-01-29	2019-01-29	25	Marks	SAS V9			1	point	Open	Meteorology	WeatherDaily, WeatherStation	Wind speed, air, daily, mean					Natural Resources, Earth and Environmental Sciences	climatologyMeteorologyAtmosphere	no
GB3659	3659	GB	METEOROLOGY	l1_128_climate_wnd3sr	resultant wind speed	m/s	15 minute	15 minute	11/6/93	1993-11-06	1993-11-06	1/29/19	2019-01-29	2019-01-29	25	Marks	SAS V9			1	point	Open	Meteorology	WeatherDaily, WeatherStation	Wind speed, air, daily, mean					Natural Resources, Earth and Environmental Sciences	climatologyMeteorologyAtmosphere	no
GB3660	3660	GB	METEOROLOGY	l1_127_climate_tmp10	air temperature	°C	15 minute	15 minute	9/15/93	1993-09-15	1993-09-15	1/29/19	2019-01-29	2019-01-29	25	Marks	SAS V9			1	point	Open	Meteorology	WeatherDaily, WeatherStation	Temperature, air, daily, mean	Meteorology				Natural Resources, Earth and Environmental Sciences	climatologyMeteorologyAtmosphere	no
GB3661	3661	GB	METEOROLOGY	l1_127_climate_wnd10d	wind direction	°N	15 minute	15 minute	9/15/93	1993-09-15	1993-09-15	1/29/19	2019-01-29	2019-01-29	25	Marks	SAS V9			1	point	Open	Meteorology	WeatherDaily, WeatherStation	Wind direction air, daily, mean					Natural Resources, Earth and Environmental Sciences	climatologyMeteorologyAtmosphere	no
GB3662	3662	GB	METEOROLOGY	l1_127_climate_wnd10dr	resultant wind direction	°N	15 minute	15 minute	9/15/93	1993-09-15	1993-09-15	1/29/19	2019-01-29	2019-01-29	25	Marks	SAS V9			1	point	Open	Meteorology	WeatherDaily, WeatherStation	Wind direction air, daily, mean					Natural Resources, Earth and Environmental Sciences	climatologyMeteorologyAtmosphere	no
GB3663	3663	GB	METEOROLOGY	l1_127_climate_wnd10sa	average wind speed	m/s	15 minute	15 minute	9/15/93	1993-09-15	1993-09-15	1/29/19	2019-01-29	2019-01-29	25	Marks	SAS V9			1	point	Open	Meteorology	WeatherDaily, WeatherStation	Wind speed, air, daily, mean					Natural Resources, Earth and Environmental Sciences	climatologyMeteorologyAtmosphere	no
GB3664	3664	GB	METEOROLOGY	l1_127_climate_wnd10sr	resultant wind speed	m/s	15 minute	15 minute	9/15/93	1993-09-15	1993-09-15	1/29/19	2019-01-29	2019-01-29	25	Marks	SAS V9			1	point	Open	Meteorology	WeatherDaily, WeatherStation	Wind speed, air, daily, mean					Natural Resources, Earth and Environmental Sciences	climatologyMeteorologyAtmosphere	no
GB3665	3665	GB	METEOROLOGY	l1_176_climate_tmp10	air temperature	°C	15 minute	15 minute	9/8/93	1993-09-08	1993-09-08	1/29/19	2019-01-29	2019-01-29	25	Marks	SAS V9			1	point	Open	Meteorology	WeatherDaily, WeatherStation	Temperature, air, daily, mean	Meteorology				Natural Resources, Earth and Environmental Sciences	climatologyMeteorologyAtmosphere	no
GB3666	3666	GB	METEOROLOGY	l1_176_climate_wnd10d	wind direction	°N	15 minute	15 minute	9/8/93	1993-09-08	1993-09-08	1/29/19	2019-01-29	2019-01-29	25	Marks	SAS V9			1	point	Open	Meteorology	WeatherDaily, WeatherStation	Wind direction air, daily, mean					Natural Resources, Earth and Environmental Sciences	climatologyMeteorologyAtmosphere	no
GB3667	3667	GB	METEOROLOGY	l1_176_climate_wnd10dr	resultant wind direction	°N	15 minute	15 minute	9/8/93	1993-09-08	1993-09-08	1/29/19	2019-01-29	2019-01-29	25	Marks	SAS V9			1	point	Open	Meteorology	WeatherDaily, WeatherStation	Wind direction air, daily, mean					Natural Resources, Earth and Environmental Sciences	climatologyMeteorologyAtmosphere	no
GB3668	3668	GB	METEOROLOGY	l1_176_climate_wnd10sa	average wind speed	m/s	15 minute	15 minute	9/8/93	1993-09-08	1993-09-08	1/29/19	2019-01-29	2019-01-29	25	Marks	SAS V9			1	point	Open	Meteorology	WeatherDaily, WeatherStation	Wind speed, air, daily, mean					Natural Resources, Earth and Environmental Sciences	climatologyMeteorologyAtmosphere	no
GB3669	3669	GB	METEOROLOGY	l1_176_climate_wnd10sr	resultant wind speed	m/s	15 minute	15 minute	9/8/93	1993-09-08	1993-09-08	1/29/19	2019-01-29	2019-01-29	25	Marks	SAS V9			1	point	Open	Meteorology	WeatherDaily, WeatherStation	Wind speed, air, daily, mean					Natural Resources, Earth and Environmental Sciences	climatologyMeteorologyAtmosphere	no
GB3670	3670	GB	METEOROLOGY	l1_176_climate_wnd3d	wind direction	°N	15 minute	15 minute	2/3/93	1993-02-03	1993-02-03	1/29/19	2019-01-29	2019-01-29	26	Marks	SAS V9			1	point	Open	Meteorology	WeatherDaily, WeatherStation	Wind direction air, daily, mean					Natural Resources, Earth and Environmental Sciences	climatologyMeteorologyAtmosphere	no
GB3671	3671	GB	METEOROLOGY	l1_176_climate_wnd3dr	resultant wind direction	°N	15 minute	15 minute	2/3/93	1993-02-03	1993-02-03	1/29/19	2019-01-29	2019-01-29	26	Marks	SAS V9			1	point	Open	Meteorology	WeatherDaily, WeatherStation	Wind direction air, daily, mean					Natural Resources, Earth and Environmental Sciences	climatologyMeteorologyAtmosphere	no
GB3672	3672	GB	METEOROLOGY	l1_127_climate_wnd3d	wind direction	°N	15 minute	15 minute	9/28/92	1992-09-28	1992-09-28	1/29/19	2019-01-29	2019-01-29	26	Marks	SAS V9			1	point	Open	Meteorology	WeatherDaily, WeatherStation	Wind direction air, daily, mean					Natural Resources, Earth and Environmental Sciences	climatologyMeteorologyAtmosphere	no
GB3673	3673	GB	METEOROLOGY	l1_127_climate_wnd3dr	resultant wind direction	°N	15 minute	15 minute	9/28/92	1992-09-28	1992-09-28	1/29/19	2019-01-29	2019-01-29	26	Marks	SAS V9			1	point	Open	Meteorology	WeatherDaily, WeatherStation	Wind direction air, daily, mean					Natural Resources, Earth and Environmental Sciences	climatologyMeteorologyAtmosphere	no
GB3674	3674	GB	METEOROLOGY	l1_127_climate_wnd3sa	average wind speed	m/s	15 minute	15 minute	9/28/92	1992-09-28	1992-09-28	1/29/19	2019-01-29	2019-01-29	26	Marks	SAS V9			1	point	Open	Meteorology	WeatherDaily, WeatherStation	Wind speed, air, daily, mean					Natural Resources, Earth and Environmental Sciences	climatologyMeteorologyAtmosphere	no
GB3675	3675	GB	METEOROLOGY	l1_127_climate_wnd3sr	resultant wind speed	m/s	15 minute	15 minute	9/28/92	1992-09-28	1992-09-28	1/29/19	2019-01-29	2019-01-29	26	Marks	SAS V9			1	point	Open	Meteorology	WeatherDaily, WeatherStation	Wind speed, air, daily, mean					Natural Resources, Earth and Environmental Sciences	climatologyMeteorologyAtmosphere	no
GB3676	3676	GB	METEOROLOGY	l1_176_climate_wnd3sa	average wind speed	m/s	15 minute	15 minute	6/16/92	1992-06-16	1992-06-16	1/29/19	2019-01-29	2019-01-29	27	Marks	SAS V9			1	point	Open	Meteorology	WeatherDaily, WeatherStation	Wind speed, air, daily, mean					Natural Resources, Earth and Environmental Sciences	climatologyMeteorologyAtmosphere	no
GB3677	3677	GB	METEOROLOGY	l1_176_climate_wnd3sr	resultant wind speed	m/s	15 minute	15 minute	6/16/92	1992-06-16	1992-06-16	1/29/19	2019-01-29	2019-01-29	27	Marks	SAS V9			1	point	Open	Meteorology	WeatherDaily, WeatherStation	Wind speed, air, daily, mean					Natural Resources, Earth and Environmental Sciences	climatologyMeteorologyAtmosphere	no
GB3678	3678	GB	METEOROLOGY	l1_076_climate_wnd10r	wind run	km	15 minute	15 minute	8/2/85	1985-08-02	1985-08-02	7/21/15	2015-07-21	2015-07-21	30	Marks	SAS V9			1	point	Open	Meteorology	WeatherDaily, WeatherStation	wind run					Natural Resources, Earth and Environmental Sciences	climatologyMeteorologyAtmosphere	no
GB3679	3679	GB	METEOROLOGY	l1_098_climate_wnd2r	wind run	km	15 minute	15 minute	11/5/81	1981-11-05	1981-11-05	8/22/12	2012-08-22	2012-08-22	31	Marks	SAS V9			1	point	Open	Meteorology	WeatherDaily, WeatherStation	wind run					Natural Resources, Earth and Environmental Sciences	climatologyMeteorologyAtmosphere	no
GB3680	3680	GB	METEOROLOGY	l1_076_climate_prs	air pressure	kPa	15 minute	15 minute	2/12/87	1987-02-12	1987-02-12	1/29/19	2019-01-29	2019-01-29	32	Marks	SAS V9			1	point	Open	Meteorology	WeatherDaily, WeatherStation	Pressure	Meteorology, Eddy Covariance				Natural Resources, Earth and Environmental Sciences	climatologyMeteorologyAtmosphere	
GB3681	3681	GB	METEOROLOGY	l1_176_climate_wnd3r	wind run	km	15 minute	15 minute	2/24/83	1983-02-24	1983-02-24	1/21/16	2016-01-21	2016-01-21	33	Marks	SAS V9			1	point	Open	Meteorology	WeatherDaily, WeatherStation	wind run					Natural Resources, Earth and Environmental Sciences	climatologyMeteorologyAtmosphere	no
GB3682	3682	GB	METEOROLOGY	l1_076_climate_wnd3r	wind run	km	15 minute	15 minute	6/18/81	1981-06-18	1981-06-18	7/21/15	2015-07-21	2015-07-21	34	Marks	SAS V9			1	point	Open	Meteorology	WeatherDaily, WeatherStation	wind run					Natural Resources, Earth and Environmental Sciences	climatologyMeteorologyAtmosphere	no
GB3683	3683	GB	METEOROLOGY	l1_13803_climate_tmp3	air temperature	°C	15 minute	15 minute	12/19/84	1984-12-19	1984-12-19	1/29/19	2019-01-29	2019-01-29	34	Marks	SAS V9			1	point	Open	Meteorology	WeatherDaily, WeatherStation	Temperature, air, daily, mean	Meteorology				Natural Resources, Earth and Environmental Sciences	climatologyMeteorologyAtmosphere	no
GB3684	3684	GB	METEOROLOGY	l1_127_climate_hum3	relative humidity	%	15 minute	15 minute	12/5/84	1984-12-05	1984-12-05	1/29/19	2019-01-29	2019-01-29	34	Marks	SAS V9			1	point	Open	Meteorology	WeatherDaily, WeatherStation	Relative humidity, air, daily, mean					Natural Resources, Earth and Environmental Sciences	climatologyMeteorologyAtmosphere	no
GB3685	3685	GB	METEOROLOGY	l1_127_climate_sol	incoming shortwave solar radiation	W/m2	15 minute	15 minute	12/5/84	1984-12-05	1984-12-05	1/29/19	2019-01-29	2019-01-29	34	Marks	SAS V9			1	point	Open	Meteorology	WeatherDaily, WeatherStation	ave_incoming_shortwave radiation					Natural Resources, Earth and Environmental Sciences	climatologyMeteorologyAtmosphere	no
GB3686	3686	GB	METEOROLOGY	l1_127_climate_tmp3	air temperature	°C	15 minute	15 minute	12/5/84	1984-12-05	1984-12-05	1/29/19	2019-01-29	2019-01-29	34	Marks	SAS V9			1	point	Open	Meteorology	WeatherDaily, WeatherStation	Temperature, air, daily, mean	Meteorology				Natural Resources, Earth and Environmental Sciences	climatologyMeteorologyAtmosphere	no
GB3687	3687	GB	METEOROLOGY	l1_176_climate_hum3	relative humidity	%	15 minute	15 minute	2/24/83	1983-02-24	1983-02-24	1/29/19	2019-01-29	2019-01-29	36	Marks	SAS V9			1	point	Open	Meteorology	WeatherDaily, WeatherStation	Relative humidity, air, daily, mean					Natural Resources, Earth and Environmental Sciences	climatologyMeteorologyAtmosphere	no
GB3688	3688	GB	METEOROLOGY	l1_176_climate_sol	incoming shortwave solar radiation	W/m2	15 minute	15 minute	2/24/83	1983-02-24	1983-02-24	1/29/19	2019-01-29	2019-01-29	36	Marks	SAS V9			1	point	Open	Meteorology	WeatherDaily, WeatherStation	ave_incoming_shortwave radiation					Natural Resources, Earth and Environmental Sciences	climatologyMeteorologyAtmosphere	no
GB3689	3689	GB	METEOROLOGY	l1_176_climate_tmp3	air temperature	°C	15 minute	15 minute	2/24/83	1983-02-24	1983-02-24	1/29/19	2019-01-29	2019-01-29	36	Marks	SAS V9			1	point	Open	Meteorology	WeatherDaily, WeatherStation	Temperature, air, daily, mean	Meteorology				Natural Resources, Earth and Environmental Sciences	climatologyMeteorologyAtmosphere	no
GB3690	3690	GB	METEOROLOGY	l1_098_climate_tmp2	air temperature	°C	15 minute	15 minute	11/5/81	1981-11-05	1981-11-05	1/29/19	2019-01-29	2019-01-29	37	Marks	SAS V9			1	point	Open	Meteorology	WeatherDaily, WeatherStation	Temperature, air, daily, mean	Meteorology				Natural Resources, Earth and Environmental Sciences	climatologyMeteorologyAtmosphere	no
GB3691	3691	GB	METEOROLOGY	l1_076_climate_sol	incoming shortwave solar radiation	W/m2	15 minute	15 minute	6/18/81	1981-06-18	1981-06-18	1/29/19	2019-01-29	2019-01-29	38	Marks	SAS V9			1	point	Open	Meteorology	WeatherDaily, WeatherStation	ave_incoming_shortwave radiation					Natural Resources, Earth and Environmental Sciences	climatologyMeteorologyAtmosphere	no
GB3692	3692	GB	METEOROLOGY	l1_076_climate_tmp3	air temperature	°C	15 minute	15 minute	6/18/81	1981-06-18	1981-06-18	1/29/19	2019-01-29	2019-01-29	38	Marks	SAS V9			1	point	Open	Meteorology	WeatherDaily, WeatherStation	Temperature, air, daily, mean	Meteorology				Natural Resources, Earth and Environmental Sciences	climatologyMeteorologyAtmosphere	no
GB3693	3693	GB	PRECIPITATION	hourly_043b_precipitation_ppta	wind corrected precipitation	mm	1 hour	1 hour	1/1/16	2016-01-01	2016-01-01	12/31/18	2018-12-31	2018-12-31	3	Marks	SAS V9			1	point	Open	Meteorology	WeatherDaily, WeatherStation	Precipitation, total, no media, daily					Natural Resources, Earth and Environmental Sciences	climatologyMeteorologyAtmosphere	no
GB3694	3694	GB	PRECIPITATION	hourly_043b_precipitation_ppts	shielded precipitation	mm	1 hour	1 hour	1/1/16	2016-01-01	2016-01-01	12/31/18	2018-12-31	2018-12-31	3	Marks	SAS V9			1	point	Open	Meteorology	WeatherDaily, WeatherStation	Precipitation, total, no media, daily					Natural Resources, Earth and Environmental Sciences	climatologyMeteorologyAtmosphere	no
GB3695	3695	GB	PRECIPITATION	hourly_043b_precipitation_pptu	unshielded precipitation	mm	1 hour	1 hour	1/1/16	2016-01-01	2016-01-01	12/31/18	2018-12-31	2018-12-31	3	Marks	SAS V9			1	point	Open	Meteorology	WeatherDaily, WeatherStation	Precipitation, total, no media, daily					Natural Resources, Earth and Environmental Sciences	climatologyMeteorologyAtmosphere	no
GB3696	3696	GB	PRECIPITATION	l1_138h08ec_snowdepth_sno	snow depth	cm	15 minute	15 minute	4/30/15	2015-04-30	2015-04-30	6/13/18	2018-06-13	2018-06-13	3	Marks	SAS V9			1	point	Open	Meteorology	WeatherDaily, WeatherStation	Precipitation, snow, no media, daily					Natural Resources, Earth and Environmental Sciences	climatologyMeteorologyAtmosphere	no
GB3697	3697	GB	PRECIPITATION	l1_losec_snowdepth_sno	snow depth	cm	15 minute	15 minute	1/15/15	2015-01-15	2015-01-15	6/14/18	2018-06-14	2018-06-14	3	Marks	SAS V9			1	point	Open	Meteorology	WeatherDaily, WeatherStation	Precipitation, snow, no media, daily					Natural Resources, Earth and Environmental Sciences	climatologyMeteorologyAtmosphere	no
GB3698	3698	GB	PRECIPITATION	l1_wbsec_snowdepth_sno	snow depth	cm	15 minute	15 minute	1/15/15	2015-01-15	2015-01-15	6/14/18	2018-06-14	2018-06-14	3	Marks	SAS V9			1	point	Open	Meteorology	WeatherDaily, WeatherStation	Precipitation, snow, no media, daily					Natural Resources, Earth and Environmental Sciences	climatologyMeteorologyAtmosphere	no
GB3699	3699	GB	PRECIPITATION	l1_mbsec_snowdepth_sno	snow depth	cm	15 minute	15 minute	12/18/14	2014-12-18	2014-12-18	6/14/18	2018-06-14	2018-06-14	3	Marks	SAS V9			1	point	Open	Meteorology	WeatherDaily, WeatherStation	Precipitation, snow, no media, daily					Natural Resources, Earth and Environmental Sciences	climatologyMeteorologyAtmosphere	no
GB3700	3700	GB	PRECIPITATION	l1_jdt2b_snowdepth_sno	snow depth	cm	15 minute	15 minute	12/13/10	2010-12-13	2010-12-13	5/26/17	2017-05-26	2017-05-26	6	Marks	SAS V9			1	point	Open	Meteorology	WeatherDaily, WeatherStation	Precipitation, snow, no media, daily					Natural Resources, Earth and Environmental Sciences	climatologyMeteorologyAtmosphere	no
GB3701	3701	GB	PRECIPITATION	l1_jdt4b_snowdepth_sno	snow depth	cm	15 minute	15 minute	12/13/10	2010-12-13	2010-12-13	5/26/17	2017-05-26	2017-05-26	6	Marks	SAS V9			1	point	Open	Meteorology	WeatherDaily, WeatherStation	Precipitation, snow, no media, daily					Natural Resources, Earth and Environmental Sciences	climatologyMeteorologyAtmosphere	no
GB3702	3702	GB	PRECIPITATION	l1_jdt3b_snowdepth_sno	snow depth	cm	15 minute	15 minute	12/13/10	2010-12-13	2010-12-13	1/30/18	2018-01-30	2018-01-30	7	Marks	SAS V9			1	point	Open	Meteorology	WeatherDaily, WeatherStation	Precipitation, snow, no media, daily					Natural Resources, Earth and Environmental Sciences	climatologyMeteorologyAtmosphere	no
GB3703	3703	GB	PRECIPITATION	hourly_166b_precipitation_ppta	wind corrected precipitation	mm	1 hour	1 hour	12/31/03	2003-12-31	2003-12-31	7/10/13	2013-07-10	2013-07-10	10	Marks	SAS V9			1	point	Open	Meteorology	WeatherDaily, WeatherStation	Precipitation, total, no media, daily					Natural Resources, Earth and Environmental Sciences	climatologyMeteorologyAtmosphere	no
GB3704	3704	GB	PRECIPITATION	hourly_166b_precipitation_ppts	shielded precipitation	mm	1 hour	1 hour	12/31/03	2003-12-31	2003-12-31	7/10/13	2013-07-10	2013-07-10	10	Marks	SAS V9			1	point	Open	Meteorology	WeatherDaily, WeatherStation	Precipitation, total, no media, daily					Natural Resources, Earth and Environmental Sciences	climatologyMeteorologyAtmosphere	no
GB3705	3705	GB	PRECIPITATION	hourly_166b_precipitation_pptu	unshielded precipitation	mm	1 hour	1 hour	12/31/03	2003-12-31	2003-12-31	7/10/13	2013-07-10	2013-07-10	10	Marks	SAS V9			1	point	Open	Meteorology	WeatherDaily, WeatherStation	Precipitation, total, no media, daily					Natural Resources, Earth and Environmental Sciences	climatologyMeteorologyAtmosphere	no
GB3706	3706	GB	PRECIPITATION	l1_057_snowdepth_sno	snow depth	cm	15 minute	15 minute	10/31/08	2008-10-31	2008-10-31	6/11/18	2018-06-11	2018-06-11	10	Marks	SAS V9			1	point	Open	Meteorology	WeatherDaily, WeatherStation	Precipitation, snow, no media, daily					Natural Resources, Earth and Environmental Sciences	climatologyMeteorologyAtmosphere	no
GB3707	3707	GB	PRECIPITATION	l1_116c_snowdepth_sno	snow depth	cm	15 minute	15 minute	10/28/08	2008-10-28	2008-10-28	6/11/18	2018-06-11	2018-06-11	10	Marks	SAS V9			1	point	Open	Meteorology	WeatherDaily, WeatherStation	Precipitation, snow, no media, daily					Natural Resources, Earth and Environmental Sciences	climatologyMeteorologyAtmosphere	no
GB3708	3708	GB	PRECIPITATION	l1_bst_snowdepth_sno	snow depth	cm	15 minute	15 minute	11/14/03	2003-11-14	2003-11-14	7/11/13	2013-07-11	2013-07-11	10	Marks	SAS V9			1	point	Open	Meteorology	WeatherDaily, WeatherStation	Precipitation, snow, no media, daily					Natural Resources, Earth and Environmental Sciences	climatologyMeteorologyAtmosphere	no
GB3709	3709	GB	PRECIPITATION	l1_166b_snowdepth_sno	snow depth	cm	15 minute	15 minute	10/2/03	2003-10-02	2003-10-02	8/27/13	2013-08-27	2013-08-27	10	Marks	SAS V9			1	point	Open	Meteorology	WeatherDaily, WeatherStation	Precipitation, snow, no media, daily					Natural Resources, Earth and Environmental Sciences	climatologyMeteorologyAtmosphere	no
GB3710	3710	GB	PRECIPITATION	hourly_orc2_precipitation_ppts	shielded precipitation	mm	1 hour	1 hour	3/25/93	1993-03-25	1993-03-25	6/16/03	2003-06-16	2003-06-16	10	Marks	SAS V9			1	point	Open	Meteorology	WeatherDaily, WeatherStation	Precipitation, total, no media, daily					Natural Resources, Earth and Environmental Sciences	climatologyMeteorologyAtmosphere	no
GB3711	3711	GB	PRECIPITATION	hourly_orc3_precipitation_ppts	shielded precipitation	mm	1 hour	1 hour	3/25/93	1993-03-25	1993-03-25	6/16/03	2003-06-16	2003-06-16	10	Marks	SAS V9			1	point	Open	Meteorology	WeatherDaily, WeatherStation	Precipitation, total, no media, daily					Natural Resources, Earth and Environmental Sciences	climatologyMeteorologyAtmosphere	no
GB3712	3712	GB	PRECIPITATION	l1_098c_snowdepth_sno	snow depth	cm	15 minute	15 minute	2/8/08	2008-02-08	2008-02-08	6/11/18	2018-06-11	2018-06-11	10	Marks	SAS V9			1	point	Open	Meteorology	WeatherDaily, WeatherStation	Precipitation, snow, no media, daily					Natural Resources, Earth and Environmental Sciences	climatologyMeteorologyAtmosphere	no
GB3713	3713	GB	PRECIPITATION	l1_127_snowdepth_sno	snow depth	cm	15 minute	15 minute	1/8/08	2008-01-08	2008-01-08	6/11/18	2018-06-11	2018-06-11	10	Marks	SAS V9			1	point	Open	Meteorology	WeatherDaily, WeatherStation	Precipitation, snow, no media, daily					Natural Resources, Earth and Environmental Sciences	climatologyMeteorologyAtmosphere	no
GB3714	3714	GB	PRECIPITATION	l1_155_snowdepth_sno	snow depth	cm	15 minute	15 minute	11/28/07	2007-11-28	2007-11-28	6/9/18	2018-06-09	2018-06-09	11	Marks	SAS V9			1	point	Open	Meteorology	WeatherDaily, WeatherStation	Precipitation, snow, no media, daily					Natural Resources, Earth and Environmental Sciences	climatologyMeteorologyAtmosphere	no
GB3715	3715	GB	PRECIPITATION	l1_147_snowdepth_sno	snow depth	cm	15 minute	15 minute	11/28/07	2007-11-28	2007-11-28	6/11/18	2018-06-11	2018-06-11	11	Marks	SAS V9			1	point	Open	Meteorology	WeatherDaily, WeatherStation	Precipitation, snow, no media, daily					Natural Resources, Earth and Environmental Sciences	climatologyMeteorologyAtmosphere	no
GB3716	3716	GB	PRECIPITATION	l1_076_snowdepth_sno	snow depth	cm	15 minute	15 minute	7/1/07	2007-07-01	2007-07-01	5/30/18	2018-05-30	2018-05-30	11	Marks	SAS V9			1	point	Open	Meteorology	WeatherDaily, WeatherStation	Precipitation, snow, no media, daily					Natural Resources, Earth and Environmental Sciences	climatologyMeteorologyAtmosphere	no
GB3717	3717	GB	PRECIPITATION	l1_smm2_snowdepth_sno	snow depth	cm	15 minute	15 minute	7/12/07	2007-07-12	2007-07-12	6/11/18	2018-06-11	2018-06-11	11	Marks	SAS V9			1	point	Open	Meteorology	WeatherDaily, WeatherStation	Precipitation, snow, no media, daily					Natural Resources, Earth and Environmental Sciences	climatologyMeteorologyAtmosphere	no
GB3718	3718	GB	PRECIPITATION	l1_smm1_snowdepth_sno	snow depth	cm	15 minute	15 minute	5/16/07	2007-05-16	2007-05-16	6/11/18	2018-06-11	2018-06-11	11	Marks	SAS V9			1	point	Open	Meteorology	WeatherDaily, WeatherStation	Precipitation, snow, no media, daily					Natural Resources, Earth and Environmental Sciences	climatologyMeteorologyAtmosphere	no
GB3719	3719	GB	PRECIPITATION	l1_sme2_snowdepth_sno	snow depth	cm	15 minute	15 minute	5/1/07	2007-05-01	2007-05-01	6/11/18	2018-06-11	2018-06-11	11	Marks	SAS V9			1	point	Open	Meteorology	WeatherDaily, WeatherStation	Precipitation, snow, no media, daily					Natural Resources, Earth and Environmental Sciences	climatologyMeteorologyAtmosphere	no
GB3720	3720	GB	PRECIPITATION	hourly_smm2_precipitation_ppts	shielded precipitation	mm	1 hour	1 hour	7/12/07	2007-07-12	2007-07-12	12/31/18	2018-12-31	2018-12-31	11	Marks	SAS V9			1	point	Open	Meteorology	WeatherDaily, WeatherStation	Precipitation, total, no media, daily					Natural Resources, Earth and Environmental Sciences	climatologyMeteorologyAtmosphere	no
GB3721	3721	GB	PRECIPITATION	l1_124b_snowdepth_sno	snow depth	cm	15 minute	15 minute	10/31/06	2006-10-31	2006-10-31	6/11/18	2018-06-11	2018-06-11	12	Marks	SAS V9			1	point	Open	Meteorology	WeatherDaily, WeatherStation	Precipitation, snow, no media, daily					Natural Resources, Earth and Environmental Sciences	climatologyMeteorologyAtmosphere	no
GB3722	3722	GB	PRECIPITATION	hourly_smm1_precipitation_ppts	shielded precipitation	mm	1 hour	1 hour	5/16/07	2007-05-16	2007-05-16	12/31/18	2018-12-31	2018-12-31	12	Marks	SAS V9			1	point	Open	Meteorology	WeatherDaily, WeatherStation	Precipitation, total, no media, daily					Natural Resources, Earth and Environmental Sciences	climatologyMeteorologyAtmosphere	no
GB3723	3723	GB	PRECIPITATION	hourly_sme2_precipitation_ppts	shielded precipitation	mm	1 hour	1 hour	5/1/07	2007-05-01	2007-05-01	12/31/18	2018-12-31	2018-12-31	12	Marks	SAS V9			1	point	Open	Meteorology	WeatherDaily, WeatherStation	Precipitation, total, no media, daily					Natural Resources, Earth and Environmental Sciences	climatologyMeteorologyAtmosphere	no
GB3724	3724	GB	PRECIPITATION	hourly_138x44_precipitation_ppta	wind corrected precipitation	mm	1 hour	1 hour	1/1/83	1983-01-01	1983-01-01	1/1/95	1995-01-01	1995-01-01	12	Marks	SAS V9			1	point	Open	Meteorology	WeatherDaily, WeatherStation	Precipitation, total, no media, daily					Natural Resources, Earth and Environmental Sciences	climatologyMeteorologyAtmosphere	no
GB3725	3725	GB	PRECIPITATION	hourly_138x44_precipitation_ppts	shielded precipitation	mm	1 hour	1 hour	1/1/83	1983-01-01	1983-01-01	1/1/95	1995-01-01	1995-01-01	12	Marks	SAS V9			1	point	Open	Meteorology	WeatherDaily, WeatherStation	Precipitation, total, no media, daily					Natural Resources, Earth and Environmental Sciences	climatologyMeteorologyAtmosphere	no
GB3726	3726	GB	PRECIPITATION	hourly_138x44_precipitation_pptu	unshielded precipitation	mm	1 hour	1 hour	1/1/83	1983-01-01	1983-01-01	1/1/95	1995-01-01	1995-01-01	12	Marks	SAS V9			1	point	Open	Meteorology	WeatherDaily, WeatherStation	Precipitation, total, no media, daily					Natural Resources, Earth and Environmental Sciences	climatologyMeteorologyAtmosphere	no
GB3727	3727	GB	PRECIPITATION	hourly_124b_precipitation_ppts	shielded precipitation	mm	1 hour	1 hour	10/31/06	2006-10-31	2006-10-31	12/31/18	2018-12-31	2018-12-31	12	Marks	SAS V9			1	point	Open	Meteorology	WeatherDaily, WeatherStation	Precipitation, total, no media, daily					Natural Resources, Earth and Environmental Sciences	climatologyMeteorologyAtmosphere	no
GB3728	3728	GB	PRECIPITATION	l1_138l21_snowdepth_sno	snow depth	cm	15 minute	15 minute	7/16/03	2003-07-16	2003-07-16	11/15/15	2015-11-15	2015-11-15	12	Marks	SAS V9			1	point	Open	Meteorology	WeatherDaily, WeatherStation	Precipitation, snow, no media, daily					Natural Resources, Earth and Environmental Sciences	climatologyMeteorologyAtmosphere	no
GB3729	3729	GB	PRECIPITATION	hourly_138l21_precipitation_ppta	wind corrected precipitation	mm	1 hour	1 hour	7/16/03	2003-07-16	2003-07-16	12/31/15	2015-12-31	2015-12-31	12	Marks	SAS V9			1	point	Open	Meteorology	WeatherDaily, WeatherStation	Precipitation, total, no media, daily					Natural Resources, Earth and Environmental Sciences	climatologyMeteorologyAtmosphere	no
GB3730	3730	GB	PRECIPITATION	hourly_138l21_precipitation_ppts	shielded precipitation	mm	1 hour	1 hour	7/16/03	2003-07-16	2003-07-16	12/31/15	2015-12-31	2015-12-31	12	Marks	SAS V9			1	point	Open	Meteorology	WeatherDaily, WeatherStation	Precipitation, total, no media, daily					Natural Resources, Earth and Environmental Sciences	climatologyMeteorologyAtmosphere	no
GB3731	3731	GB	PRECIPITATION	hourly_138l21_precipitation_pptu	unshielded precipitation	mm	1 hour	1 hour	7/16/03	2003-07-16	2003-07-16	12/31/15	2015-12-31	2015-12-31	12	Marks	SAS V9			1	point	Open	Meteorology	WeatherDaily, WeatherStation	Precipitation, total, no media, daily					Natural Resources, Earth and Environmental Sciences	climatologyMeteorologyAtmosphere	no
GB3732	3732	GB	PRECIPITATION	l1_jdt3_snowdepth_sno	snow depth	cm	15 minute	15 minute	11/5/05	2005-11-05	2005-11-05	6/11/18	2018-06-11	2018-06-11	13	Marks	SAS V9			1	point	Open	Meteorology	WeatherDaily, WeatherStation	Precipitation, snow, no media, daily					Natural Resources, Earth and Environmental Sciences	climatologyMeteorologyAtmosphere	no
GB3733	3733	GB	PRECIPITATION	l1_jdt1_snowdepth_sno	snow depth	cm	15 minute	15 minute	11/4/05	2005-11-04	2005-11-04	6/11/18	2018-06-11	2018-06-11	13	Marks	SAS V9			1	point	Open	Meteorology	WeatherDaily, WeatherStation	Precipitation, snow, no media, daily					Natural Resources, Earth and Environmental Sciences	climatologyMeteorologyAtmosphere	no
GB3734	3734	GB	PRECIPITATION	l1_jdt2_snowdepth_sno	snow depth	cm	15 minute	15 minute	11/4/05	2005-11-04	2005-11-04	6/11/18	2018-06-11	2018-06-11	13	Marks	SAS V9			1	point	Open	Meteorology	WeatherDaily, WeatherStation	Precipitation, snow, no media, daily					Natural Resources, Earth and Environmental Sciences	climatologyMeteorologyAtmosphere	no
GB3735	3735	GB	PRECIPITATION	l1_jdt4_snowdepth_sno	snow depth	cm	15 minute	15 minute	11/1/05	2005-11-01	2005-11-01	6/11/18	2018-06-11	2018-06-11	13	Marks	SAS V9			1	point	Open	Meteorology	WeatherDaily, WeatherStation	Precipitation, snow, no media, daily					Natural Resources, Earth and Environmental Sciences	climatologyMeteorologyAtmosphere	no
GB3736	3736	GB	PRECIPITATION	l1_jdt5_snowdepth_sno	snow depth	cm	15 minute	15 minute	11/1/05	2005-11-01	2005-11-01	6/11/18	2018-06-11	2018-06-11	13	Marks	SAS V9			1	point	Open	Meteorology	WeatherDaily, WeatherStation	Precipitation, snow, no media, daily					Natural Resources, Earth and Environmental Sciences	climatologyMeteorologyAtmosphere	no
GB3737	3737	GB	PRECIPITATION	l1_spt_snowdepth_sno	snow depth	cm	15 minute	15 minute	9/27/00	2000-09-27	2000-09-27	7/24/13	2013-07-24	2013-07-24	13	Marks	SAS V9			1	point	Open	Meteorology	WeatherDaily, WeatherStation	Precipitation, snow, no media, daily					Natural Resources, Earth and Environmental Sciences	climatologyMeteorologyAtmosphere	no
GB3738	3738	GB	PRECIPITATION	l1_smg2_snowdepth_sno	snow depth	cm	15 minute	15 minute	7/27/05	2005-07-27	2005-07-27	6/11/18	2018-06-11	2018-06-11	13	Marks	SAS V9			1	point	Open	Meteorology	WeatherDaily, WeatherStation	Precipitation, snow, no media, daily					Natural Resources, Earth and Environmental Sciences	climatologyMeteorologyAtmosphere	no
GB3739	3739	GB	PRECIPITATION	l1_smf1_snowdepth_sno	snow depth	cm	15 minute	15 minute	7/25/05	2005-07-25	2005-07-25	6/11/18	2018-06-11	2018-06-11	13	Marks	SAS V9			1	point	Open	Meteorology	WeatherDaily, WeatherStation	Precipitation, snow, no media, daily					Natural Resources, Earth and Environmental Sciences	climatologyMeteorologyAtmosphere	no
GB3740	3740	GB	PRECIPITATION	hourly_smf1_precipitation_ppts	shielded precipitation	mm	1 hour	1 hour	9/20/05	2005-09-20	2005-09-20	12/31/18	2018-12-31	2018-12-31	13	Marks	SAS V9			1	point	Open	Meteorology	WeatherDaily, WeatherStation	Precipitation, total, no media, daily					Natural Resources, Earth and Environmental Sciences	climatologyMeteorologyAtmosphere	no
GB3741	3741	GB	PRECIPITATION	l1_167b_snowdepth_sno	snow depth	cm	15 minute	15 minute	1/27/05	2005-01-27	2005-01-27	6/11/18	2018-06-11	2018-06-11	13	Marks	SAS V9			1	point	Open	Meteorology	WeatherDaily, WeatherStation	Precipitation, snow, no media, daily					Natural Resources, Earth and Environmental Sciences	climatologyMeteorologyAtmosphere	no
GB3742	3742	GB	PRECIPITATION	hourly_smg2_precipitation_ppts	shielded precipitation	mm	1 hour	1 hour	7/28/05	2005-07-28	2005-07-28	12/31/18	2018-12-31	2018-12-31	13	Marks	SAS V9			1	point	Open	Meteorology	WeatherDaily, WeatherStation	Precipitation, total, no media, daily					Natural Resources, Earth and Environmental Sciences	climatologyMeteorologyAtmosphere	no
GB3743	3743	GB	PRECIPITATION	l1_smg1_snowdepth_sno	snow depth	cm	15 minute	15 minute	11/9/04	2004-11-09	2004-11-09	6/11/18	2018-06-11	2018-06-11	14	Marks	SAS V9			1	point	Open	Meteorology	WeatherDaily, WeatherStation	Precipitation, snow, no media, daily					Natural Resources, Earth and Environmental Sciences	climatologyMeteorologyAtmosphere	no
GB3744	3744	GB	PRECIPITATION	l1_138f06_snowdepth_sno	snow depth	cm	15 minute	15 minute	7/1/04	2004-07-01	2004-07-01	6/11/18	2018-06-11	2018-06-11	14	Marks	SAS V9			1	point	Open	Meteorology	WeatherDaily, WeatherStation	Precipitation, snow, no media, daily					Natural Resources, Earth and Environmental Sciences	climatologyMeteorologyAtmosphere	no
GB3745	3745	GB	PRECIPITATION	l1_138j09_snowdepth_sno	snow depth	cm	15 minute	15 minute	7/1/04	2004-07-01	2004-07-01	6/11/18	2018-06-11	2018-06-11	14	Marks	SAS V9			1	point	Open	Meteorology	WeatherDaily, WeatherStation	Precipitation, snow, no media, daily					Natural Resources, Earth and Environmental Sciences	climatologyMeteorologyAtmosphere	no
GB3746	3746	GB	PRECIPITATION	hourly_smg1_precipitation_ppts	shielded precipitation	mm	1 hour	1 hour	11/9/04	2004-11-09	2004-11-09	12/31/18	2018-12-31	2018-12-31	14	Marks	SAS V9			1	point	Open	Meteorology	WeatherDaily, WeatherStation	Precipitation, total, no media, daily					Natural Resources, Earth and Environmental Sciences	climatologyMeteorologyAtmosphere	no
GB3747	3747	GB	PRECIPITATION	l1_176b_snowdepth_sno	snow depth	cm	15 minute	15 minute	2/6/04	2004-02-06	2004-02-06	6/11/18	2018-06-11	2018-06-11	14	Marks	SAS V9			1	point	Open	Meteorology	WeatherDaily, WeatherStation	Precipitation, snow, no media, daily					Natural Resources, Earth and Environmental Sciences	climatologyMeteorologyAtmosphere	no
GB3748	3748	GB	PRECIPITATION	l1_13803_snowdepth_sno	snow depth	cm	15 minute	15 minute	1/21/04	2004-01-21	2004-01-21	6/11/18	2018-06-11	2018-06-11	14	Marks	SAS V9			1	point	Open	Meteorology	WeatherDaily, WeatherStation	Precipitation, snow, no media, daily					Natural Resources, Earth and Environmental Sciences	climatologyMeteorologyAtmosphere	no
GB3749	3749	GB	PRECIPITATION	l1_rmsp3_snowdepth_sno	snow depth	cm	15 minute	15 minute	1/19/04	2004-01-19	2004-01-19	6/11/18	2018-06-11	2018-06-11	14	Marks	SAS V9			1	point	Open	Meteorology	WeatherDaily, WeatherStation	Precipitation, snow, no media, daily					Natural Resources, Earth and Environmental Sciences	climatologyMeteorologyAtmosphere	no
GB3750	3750	GB	PRECIPITATION	l1_138j10_snowdepth_sno	snow depth	cm	15 minute	15 minute	7/15/03	2003-07-15	2003-07-15	6/11/18	2018-06-11	2018-06-11	15	Marks	SAS V9			1	point	Open	Meteorology	WeatherDaily, WeatherStation	Precipitation, snow, no media, daily					Natural Resources, Earth and Environmental Sciences	climatologyMeteorologyAtmosphere	no
GB3751	3751	GB	PRECIPITATION	l1_095b_snowdepth_sno	snow depth	cm	15 minute	15 minute	7/1/03	2003-07-01	2003-07-01	6/11/18	2018-06-11	2018-06-11	15	Marks	SAS V9			1	point	Open	Meteorology	WeatherDaily, WeatherStation	Precipitation, snow, no media, daily					Natural Resources, Earth and Environmental Sciences	climatologyMeteorologyAtmosphere	no
GB3752	3752	GB	PRECIPITATION	hourly_095b_precipitation_ppta	wind corrected precipitation	mm	1 hour	1 hour	5/14/03	2003-05-14	2003-05-14	12/31/18	2018-12-31	2018-12-31	16	Marks	SAS V9			1	point	Open	Meteorology	WeatherDaily, WeatherStation	Precipitation, total, no media, daily					Natural Resources, Earth and Environmental Sciences	climatologyMeteorologyAtmosphere	no
GB3753	3753	GB	PRECIPITATION	hourly_095b_precipitation_ppts	shielded precipitation	mm	1 hour	1 hour	5/14/03	2003-05-14	2003-05-14	12/31/18	2018-12-31	2018-12-31	16	Marks	SAS V9			1	point	Open	Meteorology	WeatherDaily, WeatherStation	Precipitation, total, no media, daily					Natural Resources, Earth and Environmental Sciences	climatologyMeteorologyAtmosphere	no
GB3754	3754	GB	PRECIPITATION	hourly_095b_precipitation_pptu	unshielded precipitation	mm	1 hour	1 hour	5/14/03	2003-05-14	2003-05-14	12/31/18	2018-12-31	2018-12-31	16	Marks	SAS V9			1	point	Open	Meteorology	WeatherDaily, WeatherStation	Precipitation, total, no media, daily					Natural Resources, Earth and Environmental Sciences	climatologyMeteorologyAtmosphere	no
GB3755	3755	GB	PRECIPITATION	l1_124_snowdepth_sno	snow depth	cm	15 minute	15 minute	7/1/02	2002-07-01	2002-07-01	6/11/18	2018-06-11	2018-06-11	16	Marks	SAS V9			1	point	Open	Meteorology	WeatherDaily, WeatherStation	Precipitation, snow, no media, daily					Natural Resources, Earth and Environmental Sciences	climatologyMeteorologyAtmosphere	no
GB3756	3756	GB	PRECIPITATION	l1_125_snowdepth_sno	snow depth	cm	15 minute	15 minute	7/1/02	2002-07-01	2002-07-01	6/11/18	2018-06-11	2018-06-11	16	Marks	SAS V9			1	point	Open	Meteorology	WeatherDaily, WeatherStation	Precipitation, snow, no media, daily					Natural Resources, Earth and Environmental Sciences	climatologyMeteorologyAtmosphere	no
GB3757	3757	GB	PRECIPITATION	hourly_125_precipitation_ppta	wind corrected precipitation	mm	1 hour	1 hour	6/26/02	2002-06-26	2002-06-26	12/31/18	2018-12-31	2018-12-31	17	Marks	SAS V9			1	point	Open	Meteorology	WeatherDaily, WeatherStation	Precipitation, total, no media, daily					Natural Resources, Earth and Environmental Sciences	climatologyMeteorologyAtmosphere	no
GB3758	3758	GB	PRECIPITATION	hourly_125_precipitation_ppts	shielded precipitation	mm	1 hour	1 hour	6/26/02	2002-06-26	2002-06-26	12/31/18	2018-12-31	2018-12-31	17	Marks	SAS V9			1	point	Open	Meteorology	WeatherDaily, WeatherStation	Precipitation, total, no media, daily					Natural Resources, Earth and Environmental Sciences	climatologyMeteorologyAtmosphere	no
GB3759	3759	GB	PRECIPITATION	hourly_125_precipitation_pptu	unshielded precipitation	mm	1 hour	1 hour	6/26/02	2002-06-26	2002-06-26	12/31/18	2018-12-31	2018-12-31	17	Marks	SAS V9			1	point	Open	Meteorology	WeatherDaily, WeatherStation	Precipitation, total, no media, daily					Natural Resources, Earth and Environmental Sciences	climatologyMeteorologyAtmosphere	no
GB3760	3760	GB	PRECIPITATION	l1_145_snowdepth_sno	snow depth	cm	15 minute	15 minute	10/2/01	2001-10-02	2001-10-02	6/11/18	2018-06-11	2018-06-11	17	Marks	SAS V9			1	point	Open	Meteorology	WeatherDaily, WeatherStation	Precipitation, snow, no media, daily					Natural Resources, Earth and Environmental Sciences	climatologyMeteorologyAtmosphere	no
GB3761	3761	GB	PRECIPITATION	l1_144_snowdepth_sno	snow depth	cm	15 minute	15 minute	9/20/01	2001-09-20	2001-09-20	6/11/18	2018-06-11	2018-06-11	17	Marks	SAS V9			1	point	Open	Meteorology	WeatherDaily, WeatherStation	Precipitation, snow, no media, daily					Natural Resources, Earth and Environmental Sciences	climatologyMeteorologyAtmosphere	no
GB3762	3762	GB	PRECIPITATION	l1_174_snowdepth_sno	snow depth	cm	15 minute	15 minute	9/18/01	2001-09-18	2001-09-18	6/11/18	2018-06-11	2018-06-11	17	Marks	SAS V9			1	point	Open	Meteorology	WeatherDaily, WeatherStation	Precipitation, snow, no media, daily					Natural Resources, Earth and Environmental Sciences	climatologyMeteorologyAtmosphere	no
GB3763	3763	GB	PRECIPITATION	l1_031_snowdepth_sno	snow depth	cm	15 minute	15 minute	8/8/00	2000-08-08	2000-08-08	6/10/18	2018-06-10	2018-06-10	18	Marks	SAS V9			1	point	Open	Meteorology	WeatherDaily, WeatherStation	Precipitation, snow, no media, daily					Natural Resources, Earth and Environmental Sciences	climatologyMeteorologyAtmosphere	no
GB3764	3764	GB	PRECIPITATION	l1_012_snowdepth_sno	snow depth	cm	15 minute	15 minute	7/1/00	2000-07-01	2000-07-01	6/10/18	2018-06-10	2018-06-10	18	Marks	SAS V9			1	point	Open	Meteorology	WeatherDaily, WeatherStation	Precipitation, snow, no media, daily					Natural Resources, Earth and Environmental Sciences	climatologyMeteorologyAtmosphere	no
GB3765	3765	GB	PRECIPITATION	l1_167_snowdepth_sno	snow depth	cm	15 minute	15 minute	12/8/99	1999-12-08	1999-12-08	6/11/18	2018-06-11	2018-06-11	19	Marks	SAS V9			1	point	Open	Meteorology	WeatherDaily, WeatherStation	Precipitation, snow, no media, daily					Natural Resources, Earth and Environmental Sciences	climatologyMeteorologyAtmosphere	no
GB3766	3766	GB	PRECIPITATION	l1_163_snowdepth_sno	snow depth	cm	15 minute	15 minute	11/29/99	1999-11-29	1999-11-29	6/11/18	2018-06-11	2018-06-11	19	Marks	SAS V9			1	point	Open	Meteorology	WeatherDaily, WeatherStation	Precipitation, snow, no media, daily					Natural Resources, Earth and Environmental Sciences	climatologyMeteorologyAtmosphere	no
GB3767	3767	GB	PRECIPITATION	l1_176_snowdepth_sno	snow depth	cm	15 minute	15 minute	11/24/99	1999-11-24	1999-11-24	6/11/18	2018-06-11	2018-06-11	19	Marks	SAS V9			1	point	Open	Meteorology	WeatherDaily, WeatherStation	Precipitation, snow, no media, daily					Natural Resources, Earth and Environmental Sciences	climatologyMeteorologyAtmosphere	no
GB3768	3768	GB	PRECIPITATION	hourly_nich_precipitation_ppts	shielded precipitation	mm	1 hour	1 hour	5/22/97	1997-05-22	1997-05-22	12/31/17	2017-12-31	2017-12-31	21	Marks	SAS V9			1	point	Open	Meteorology	WeatherDaily, WeatherStation	Precipitation, total, no media, daily					Natural Resources, Earth and Environmental Sciences	climatologyMeteorologyAtmosphere	no
GB3769	3769	GB	PRECIPITATION	hourly_guard_precipitation_ppts	shielded precipitation	mm	1 hour	1 hour	10/28/97	1997-10-28	1997-10-28	12/31/18	2018-12-31	2018-12-31	21	Marks	SAS V9			1	point	Open	Meteorology	WeatherDaily, WeatherStation	Precipitation, total, no media, daily					Natural Resources, Earth and Environmental Sciences	climatologyMeteorologyAtmosphere	no
GB3770	3770	GB	PRECIPITATION	hourly_cbte_precipitation_ppts	shielded precipitation	mm	1 hour	1 hour	4/28/97	1997-04-28	1997-04-28	12/31/18	2018-12-31	2018-12-31	22	Marks	SAS V9			1	point	Open	Meteorology	WeatherDaily, WeatherStation	Precipitation, total, no media, daily					Natural Resources, Earth and Environmental Sciences	climatologyMeteorologyAtmosphere	no
GB3771	3771	GB	PRECIPITATION	hourly_orc1_precipitation_ppts	shielded precipitation	mm	1 hour	1 hour	3/25/93	1993-03-25	1993-03-25	12/31/18	2018-12-31	2018-12-31	26	Marks	SAS V9			1	point	Open	Meteorology	WeatherDaily, WeatherStation	Precipitation, total, no media, daily					Natural Resources, Earth and Environmental Sciences	climatologyMeteorologyAtmosphere	no
GB3772	3772	GB	PRECIPITATION	hourly_13803_precipitation_ppta	wind corrected precipitation	mm	1 hour	1 hour	10/13/83	1983-10-13	1983-10-13	12/31/18	2018-12-31	2018-12-31	35	Marks	SAS V9			1	point	Open	Meteorology	WeatherDaily, WeatherStation	Precipitation, total, no media, daily					Natural Resources, Earth and Environmental Sciences	climatologyMeteorologyAtmosphere	no
GB3773	3773	GB	PRECIPITATION	hourly_13803_precipitation_ppts	shielded precipitation	mm	1 hour	1 hour	10/13/83	1983-10-13	1983-10-13	12/31/18	2018-12-31	2018-12-31	35	Marks	SAS V9			1	point	Open	Meteorology	WeatherDaily, WeatherStation	Precipitation, total, no media, daily					Natural Resources, Earth and Environmental Sciences	climatologyMeteorologyAtmosphere	no
GB3774	3774	GB	PRECIPITATION	hourly_13803_precipitation_pptu	unshielded precipitation	mm	1 hour	1 hour	10/13/83	1983-10-13	1983-10-13	12/31/18	2018-12-31	2018-12-31	35	Marks	SAS V9			1	point	Open	Meteorology	WeatherDaily, WeatherStation	Precipitation, total, no media, daily					Natural Resources, Earth and Environmental Sciences	climatologyMeteorologyAtmosphere	no
GB3775	3775	GB	PRECIPITATION	hourly_138j10_precipitation_ppta	wind corrected precipitation	mm	1 hour	1 hour	10/8/83	1983-10-08	1983-10-08	12/31/18	2018-12-31	2018-12-31	35	Marks	SAS V9			1	point	Open	Meteorology	WeatherDaily, WeatherStation	Precipitation, total, no media, daily					Natural Resources, Earth and Environmental Sciences	climatologyMeteorologyAtmosphere	no
GB3776	3776	GB	PRECIPITATION	hourly_138j10_precipitation_ppts	shielded precipitation	mm	1 hour	1 hour	10/8/83	1983-10-08	1983-10-08	12/31/18	2018-12-31	2018-12-31	35	Marks	SAS V9			1	point	Open	Meteorology	WeatherDaily, WeatherStation	Precipitation, total, no media, daily					Natural Resources, Earth and Environmental Sciences	climatologyMeteorologyAtmosphere	no
GB3777	3777	GB	PRECIPITATION	hourly_138j10_precipitation_pptu	unshielded precipitation	mm	1 hour	1 hour	10/8/83	1983-10-08	1983-10-08	12/31/18	2018-12-31	2018-12-31	35	Marks	SAS V9			1	point	Open	Meteorology	WeatherDaily, WeatherStation	Precipitation, total, no media, daily					Natural Resources, Earth and Environmental Sciences	climatologyMeteorologyAtmosphere	no
GB3778	3778	GB	PRECIPITATION	hourly_095_precipitation_ppta	wind corrected precipitation	mm	1 hour	1 hour	1/1/62	1962-01-01	1962-01-01	6/11/02	2002-06-11	2002-06-11	40	Marks	SAS V9			1	point	Open	Meteorology	WeatherDaily, WeatherStation	Precipitation, total, no media, daily					Natural Resources, Earth and Environmental Sciences	climatologyMeteorologyAtmosphere	no
GB3779	3779	GB	PRECIPITATION	hourly_095_precipitation_ppts	shielded precipitation	mm	1 hour	1 hour	1/1/62	1962-01-01	1962-01-01	6/11/02	2002-06-11	2002-06-11	40	Marks	SAS V9			1	point	Open	Meteorology	WeatherDaily, WeatherStation	Precipitation, total, no media, daily					Natural Resources, Earth and Environmental Sciences	climatologyMeteorologyAtmosphere	no
GB3780	3780	GB	PRECIPITATION	hourly_095_precipitation_pptu	unshielded precipitation	mm	1 hour	1 hour	1/1/62	1962-01-01	1962-01-01	6/11/02	2002-06-11	2002-06-11	40	Marks	SAS V9			1	point	Open	Meteorology	WeatherDaily, WeatherStation	Precipitation, total, no media, daily					Natural Resources, Earth and Environmental Sciences	climatologyMeteorologyAtmosphere	no
GB3781	3781	GB	PRECIPITATION	hourly_098c_precipitation_ppta	wind corrected precipitation	mm	1 hour	1 hour	1/1/72	1972-01-01	1972-01-01	12/31/18	2018-12-31	2018-12-31	47	Marks	SAS V9			1	point	Open	Meteorology	WeatherDaily, WeatherStation	Precipitation, total, no media, daily					Natural Resources, Earth and Environmental Sciences	climatologyMeteorologyAtmosphere	no
GB3782	3782	GB	PRECIPITATION	hourly_098c_precipitation_ppts	shielded precipitation	mm	1 hour	1 hour	1/1/72	1972-01-01	1972-01-01	12/31/18	2018-12-31	2018-12-31	47	Marks	SAS V9			1	point	Open	Meteorology	WeatherDaily, WeatherStation	Precipitation, total, no media, daily					Natural Resources, Earth and Environmental Sciences	climatologyMeteorologyAtmosphere	no
GB3783	3783	GB	PRECIPITATION	hourly_098c_precipitation_pptu	unshielded precipitation	mm	1 hour	1 hour	1/1/72	1972-01-01	1972-01-01	12/31/18	2018-12-31	2018-12-31	47	Marks	SAS V9			1	point	Open	Meteorology	WeatherDaily, WeatherStation	Precipitation, total, no media, daily					Natural Resources, Earth and Environmental Sciences	climatologyMeteorologyAtmosphere	no
GB3784	3784	GB	PRECIPITATION	hourly_031_precipitation_ppta	wind corrected precipitation	mm	1 hour	1 hour	1/1/68	1968-01-01	1968-01-01	12/31/18	2018-12-31	2018-12-31	51	Marks	SAS V9			1	point	Open	Meteorology	WeatherDaily, WeatherStation	Precipitation, total, no media, daily					Natural Resources, Earth and Environmental Sciences	climatologyMeteorologyAtmosphere	no
GB3785	3785	GB	PRECIPITATION	hourly_176_precipitation_ppta	wind corrected precipitation	mm	1 hour	1 hour	1/1/68	1968-01-01	1968-01-01	12/31/18	2018-12-31	2018-12-31	51	Marks	SAS V9			1	point	Open	Meteorology	WeatherDaily, WeatherStation	Precipitation, total, no media, daily					Natural Resources, Earth and Environmental Sciences	climatologyMeteorologyAtmosphere	no
GB3786	3786	GB	PRECIPITATION	hourly_031_precipitation_ppts	shielded precipitation	mm	1 hour	1 hour	1/1/68	1968-01-01	1968-01-01	12/31/18	2018-12-31	2018-12-31	51	Marks	SAS V9			1	point	Open	Meteorology	WeatherDaily, WeatherStation	Precipitation, total, no media, daily					Natural Resources, Earth and Environmental Sciences	climatologyMeteorologyAtmosphere	no
GB3787	3787	GB	PRECIPITATION	hourly_176_precipitation_ppts	shielded precipitation	mm	1 hour	1 hour	1/1/68	1968-01-01	1968-01-01	12/31/18	2018-12-31	2018-12-31	51	Marks	SAS V9			1	point	Open	Meteorology	WeatherDaily, WeatherStation	Precipitation, total, no media, daily					Natural Resources, Earth and Environmental Sciences	climatologyMeteorologyAtmosphere	no
GB3788	3788	GB	PRECIPITATION	hourly_031_precipitation_pptu	unshielded precipitation	mm	1 hour	1 hour	1/1/68	1968-01-01	1968-01-01	12/31/18	2018-12-31	2018-12-31	51	Marks	SAS V9			1	point	Open	Meteorology	WeatherDaily, WeatherStation	Precipitation, total, no media, daily					Natural Resources, Earth and Environmental Sciences	climatologyMeteorologyAtmosphere	no
GB3789	3789	GB	PRECIPITATION	hourly_176_precipitation_pptu	unshielded precipitation	mm	1 hour	1 hour	1/1/68	1968-01-01	1968-01-01	12/31/18	2018-12-31	2018-12-31	51	Marks	SAS V9			1	point	Open	Meteorology	WeatherDaily, WeatherStation	Precipitation, total, no media, daily					Natural Resources, Earth and Environmental Sciences	climatologyMeteorologyAtmosphere	no
GB3790	3790	GB	PRECIPITATION	hourly_124_precipitation_ppta	wind corrected precipitation	mm	1 hour	1 hour	1/1/62	1962-01-01	1962-01-01	12/31/14	2014-12-31	2014-12-31	53	Marks	SAS V9			1	point	Open	Meteorology	WeatherDaily, WeatherStation	Precipitation, total, no media, daily					Natural Resources, Earth and Environmental Sciences	climatologyMeteorologyAtmosphere	no
GB3791	3791	GB	PRECIPITATION	hourly_124_precipitation_ppts	shielded precipitation	mm	1 hour	1 hour	1/1/62	1962-01-01	1962-01-01	12/31/14	2014-12-31	2014-12-31	53	Marks	SAS V9			1	point	Open	Meteorology	WeatherDaily, WeatherStation	Precipitation, total, no media, daily					Natural Resources, Earth and Environmental Sciences	climatologyMeteorologyAtmosphere	no
GB3792	3792	GB	PRECIPITATION	hourly_124_precipitation_pptu	unshielded precipitation	mm	1 hour	1 hour	1/1/62	1962-01-01	1962-01-01	12/31/14	2014-12-31	2014-12-31	53	Marks	SAS V9			1	point	Open	Meteorology	WeatherDaily, WeatherStation	Precipitation, total, no media, daily					Natural Resources, Earth and Environmental Sciences	climatologyMeteorologyAtmosphere	no
GB3793	3793	GB	PRECIPITATION	hourly_049_precipitation_ppta	wind corrected precipitation	mm	1 hour	1 hour	1/1/65	1965-01-01	1965-01-01	12/31/18	2018-12-31	2018-12-31	54	Marks	SAS V9			1	point	Open	Meteorology	WeatherDaily, WeatherStation	Precipitation, total, no media, daily					Natural Resources, Earth and Environmental Sciences	climatologyMeteorologyAtmosphere	no
GB3794	3794	GB	PRECIPITATION	hourly_145_precipitation_ppta	wind corrected precipitation	mm	1 hour	1 hour	1/1/65	1965-01-01	1965-01-01	12/31/18	2018-12-31	2018-12-31	54	Marks	SAS V9			1	point	Open	Meteorology	WeatherDaily, WeatherStation	Precipitation, total, no media, daily					Natural Resources, Earth and Environmental Sciences	climatologyMeteorologyAtmosphere	no
GB3795	3795	GB	PRECIPITATION	hourly_049_precipitation_ppts	shielded precipitation	mm	1 hour	1 hour	1/1/65	1965-01-01	1965-01-01	12/31/18	2018-12-31	2018-12-31	54	Marks	SAS V9			1	point	Open	Meteorology	WeatherDaily, WeatherStation	Precipitation, total, no media, daily					Natural Resources, Earth and Environmental Sciences	climatologyMeteorologyAtmosphere	no
GB3796	3796	GB	PRECIPITATION	hourly_145_precipitation_ppts	shielded precipitation	mm	1 hour	1 hour	1/1/65	1965-01-01	1965-01-01	12/31/18	2018-12-31	2018-12-31	54	Marks	SAS V9			1	point	Open	Meteorology	WeatherDaily, WeatherStation	Precipitation, total, no media, daily					Natural Resources, Earth and Environmental Sciences	climatologyMeteorologyAtmosphere	no
GB3797	3797	GB	PRECIPITATION	hourly_049_precipitation_pptu	unshielded precipitation	mm	1 hour	1 hour	1/1/65	1965-01-01	1965-01-01	12/31/18	2018-12-31	2018-12-31	54	Marks	SAS V9			1	point	Open	Meteorology	WeatherDaily, WeatherStation	Precipitation, total, no media, daily					Natural Resources, Earth and Environmental Sciences	climatologyMeteorologyAtmosphere	no
GB3798	3798	GB	PRECIPITATION	hourly_145_precipitation_pptu	unshielded precipitation	mm	1 hour	1 hour	1/1/65	1965-01-01	1965-01-01	12/31/18	2018-12-31	2018-12-31	54	Marks	SAS V9			1	point	Open	Meteorology	WeatherDaily, WeatherStation	Precipitation, total, no media, daily					Natural Resources, Earth and Environmental Sciences	climatologyMeteorologyAtmosphere	no
GB3799	3799	GB	PRECIPITATION	hourly_012_precipitation_ppta	wind corrected precipitation	mm	1 hour	1 hour	1/1/62	1962-01-01	1962-01-01	12/31/18	2018-12-31	2018-12-31	57	Marks	SAS V9			1	point	Open	Meteorology	WeatherDaily, WeatherStation	Precipitation, total, no media, daily					Natural Resources, Earth and Environmental Sciences	climatologyMeteorologyAtmosphere	no
GB3800	3800	GB	PRECIPITATION	hourly_057_precipitation_ppta	wind corrected precipitation	mm	1 hour	1 hour	1/1/62	1962-01-01	1962-01-01	12/31/18	2018-12-31	2018-12-31	57	Marks	SAS V9			1	point	Open	Meteorology	WeatherDaily, WeatherStation	Precipitation, total, no media, daily					Natural Resources, Earth and Environmental Sciences	climatologyMeteorologyAtmosphere	no
GB3801	3801	GB	PRECIPITATION	hourly_076_precipitation_ppta	wind corrected precipitation	mm	1 hour	1 hour	1/1/62	1962-01-01	1962-01-01	12/31/18	2018-12-31	2018-12-31	57	Marks	SAS V9			1	point	Open	Meteorology	WeatherDaily, WeatherStation	Precipitation, total, no media, daily					Natural Resources, Earth and Environmental Sciences	climatologyMeteorologyAtmosphere	no
GB3802	3802	GB	PRECIPITATION	hourly_116c_precipitation_ppta	wind corrected precipitation	mm	1 hour	1 hour	1/1/62	1962-01-01	1962-01-01	12/31/18	2018-12-31	2018-12-31	57	Marks	SAS V9			1	point	Open	Meteorology	WeatherDaily, WeatherStation	Precipitation, total, no media, daily					Natural Resources, Earth and Environmental Sciences	climatologyMeteorologyAtmosphere	no
GB3803	3803	GB	PRECIPITATION	hourly_127_precipitation_ppta	wind corrected precipitation	mm	1 hour	1 hour	1/1/62	1962-01-01	1962-01-01	12/31/18	2018-12-31	2018-12-31	57	Marks	SAS V9			1	point	Open	Meteorology	WeatherDaily, WeatherStation	Precipitation, total, no media, daily					Natural Resources, Earth and Environmental Sciences	climatologyMeteorologyAtmosphere	no
GB3804	3804	GB	PRECIPITATION	hourly_144_precipitation_ppta	wind corrected precipitation	mm	1 hour	1 hour	1/1/62	1962-01-01	1962-01-01	12/31/18	2018-12-31	2018-12-31	57	Marks	SAS V9			1	point	Open	Meteorology	WeatherDaily, WeatherStation	Precipitation, total, no media, daily					Natural Resources, Earth and Environmental Sciences	climatologyMeteorologyAtmosphere	no
GB3805	3805	GB	PRECIPITATION	hourly_147_precipitation_ppta	wind corrected precipitation	mm	1 hour	1 hour	1/1/62	1962-01-01	1962-01-01	12/31/18	2018-12-31	2018-12-31	57	Marks	SAS V9			1	point	Open	Meteorology	WeatherDaily, WeatherStation	Precipitation, total, no media, daily					Natural Resources, Earth and Environmental Sciences	climatologyMeteorologyAtmosphere	no
GB3806	3806	GB	PRECIPITATION	hourly_155_precipitation_ppta	wind corrected precipitation	mm	1 hour	1 hour	1/1/62	1962-01-01	1962-01-01	12/31/18	2018-12-31	2018-12-31	57	Marks	SAS V9			1	point	Open	Meteorology	WeatherDaily, WeatherStation	Precipitation, total, no media, daily					Natural Resources, Earth and Environmental Sciences	climatologyMeteorologyAtmosphere	no
GB3807	3807	GB	PRECIPITATION	hourly_163_precipitation_ppta	wind corrected precipitation	mm	1 hour	1 hour	1/1/62	1962-01-01	1962-01-01	12/31/18	2018-12-31	2018-12-31	57	Marks	SAS V9			1	point	Open	Meteorology	WeatherDaily, WeatherStation	Precipitation, total, no media, daily					Natural Resources, Earth and Environmental Sciences	climatologyMeteorologyAtmosphere	no
GB3808	3808	GB	PRECIPITATION	hourly_167_precipitation_ppta	wind corrected precipitation	mm	1 hour	1 hour	1/1/62	1962-01-01	1962-01-01	12/31/18	2018-12-31	2018-12-31	57	Marks	SAS V9			1	point	Open	Meteorology	WeatherDaily, WeatherStation	Precipitation, total, no media, daily					Natural Resources, Earth and Environmental Sciences	climatologyMeteorologyAtmosphere	no
GB3809	3809	GB	PRECIPITATION	hourly_174_precipitation_ppta	wind corrected precipitation	mm	1 hour	1 hour	1/1/62	1962-01-01	1962-01-01	12/31/18	2018-12-31	2018-12-31	57	Marks	SAS V9			1	point	Open	Meteorology	WeatherDaily, WeatherStation	Precipitation, total, no media, daily					Natural Resources, Earth and Environmental Sciences	climatologyMeteorologyAtmosphere	no
GB3810	3810	GB	PRECIPITATION	hourly_rmsp3_precipitation_ppta	wind corrected precipitation	mm	1 hour	1 hour	1/1/62	1962-01-01	1962-01-01	12/31/18	2018-12-31	2018-12-31	57	Marks	SAS V9			1	point	Open	Meteorology	WeatherDaily, WeatherStation	Precipitation, total, no media, daily					Natural Resources, Earth and Environmental Sciences	climatologyMeteorologyAtmosphere	no
GB3811	3811	GB	PRECIPITATION	hourly_012_precipitation_ppts	shielded precipitation	mm	1 hour	1 hour	1/1/62	1962-01-01	1962-01-01	12/31/18	2018-12-31	2018-12-31	57	Marks	SAS V9			1	point	Open	Meteorology	WeatherDaily, WeatherStation	Precipitation, total, no media, daily					Natural Resources, Earth and Environmental Sciences	climatologyMeteorologyAtmosphere	no
GB3812	3812	GB	PRECIPITATION	hourly_057_precipitation_ppts	shielded precipitation	mm	1 hour	1 hour	1/1/62	1962-01-01	1962-01-01	12/31/18	2018-12-31	2018-12-31	57	Marks	SAS V9			1	point	Open	Meteorology	WeatherDaily, WeatherStation	Precipitation, total, no media, daily					Natural Resources, Earth and Environmental Sciences	climatologyMeteorologyAtmosphere	no
GB3813	3813	GB	PRECIPITATION	hourly_076_precipitation_ppts	shielded precipitation	mm	1 hour	1 hour	1/1/62	1962-01-01	1962-01-01	12/31/18	2018-12-31	2018-12-31	57	Marks	SAS V9			1	point	Open	Meteorology	WeatherDaily, WeatherStation	Precipitation, total, no media, daily					Natural Resources, Earth and Environmental Sciences	climatologyMeteorologyAtmosphere	no
GB3814	3814	GB	PRECIPITATION	hourly_116c_precipitation_ppts	shielded precipitation	mm	1 hour	1 hour	1/1/62	1962-01-01	1962-01-01	12/31/18	2018-12-31	2018-12-31	57	Marks	SAS V9			1	point	Open	Meteorology	WeatherDaily, WeatherStation	Precipitation, total, no media, daily					Natural Resources, Earth and Environmental Sciences	climatologyMeteorologyAtmosphere	no
GB3815	3815	GB	PRECIPITATION	hourly_127_precipitation_ppts	shielded precipitation	mm	1 hour	1 hour	1/1/62	1962-01-01	1962-01-01	12/31/18	2018-12-31	2018-12-31	57	Marks	SAS V9			1	point	Open	Meteorology	WeatherDaily, WeatherStation	Precipitation, total, no media, daily					Natural Resources, Earth and Environmental Sciences	climatologyMeteorologyAtmosphere	no
GB3816	3816	GB	PRECIPITATION	hourly_144_precipitation_ppts	shielded precipitation	mm	1 hour	1 hour	1/1/62	1962-01-01	1962-01-01	12/31/18	2018-12-31	2018-12-31	57	Marks	SAS V9			1	point	Open	Meteorology	WeatherDaily, WeatherStation	Precipitation, total, no media, daily					Natural Resources, Earth and Environmental Sciences	climatologyMeteorologyAtmosphere	no
GB3817	3817	GB	PRECIPITATION	hourly_147_precipitation_ppts	shielded precipitation	mm	1 hour	1 hour	1/1/62	1962-01-01	1962-01-01	12/31/18	2018-12-31	2018-12-31	57	Marks	SAS V9			1	point	Open	Meteorology	WeatherDaily, WeatherStation	Precipitation, total, no media, daily					Natural Resources, Earth and Environmental Sciences	climatologyMeteorologyAtmosphere	no
GB3818	3818	GB	PRECIPITATION	hourly_155_precipitation_ppts	shielded precipitation	mm	1 hour	1 hour	1/1/62	1962-01-01	1962-01-01	12/31/18	2018-12-31	2018-12-31	57	Marks	SAS V9			1	point	Open	Meteorology	WeatherDaily, WeatherStation	Precipitation, total, no media, daily					Natural Resources, Earth and Environmental Sciences	climatologyMeteorologyAtmosphere	no
GB3819	3819	GB	PRECIPITATION	hourly_163_precipitation_ppts	shielded precipitation	mm	1 hour	1 hour	1/1/62	1962-01-01	1962-01-01	12/31/18	2018-12-31	2018-12-31	57	Marks	SAS V9			1	point	Open	Meteorology	WeatherDaily, WeatherStation	Precipitation, total, no media, daily					Natural Resources, Earth and Environmental Sciences	climatologyMeteorologyAtmosphere	no
GB3820	3820	GB	PRECIPITATION	hourly_167_precipitation_ppts	shielded precipitation	mm	1 hour	1 hour	1/1/62	1962-01-01	1962-01-01	12/31/18	2018-12-31	2018-12-31	57	Marks	SAS V9			1	point	Open	Meteorology	WeatherDaily, WeatherStation	Precipitation, total, no media, daily					Natural Resources, Earth and Environmental Sciences	climatologyMeteorologyAtmosphere	no
GB3821	3821	GB	PRECIPITATION	hourly_174_precipitation_ppts	shielded precipitation	mm	1 hour	1 hour	1/1/62	1962-01-01	1962-01-01	12/31/18	2018-12-31	2018-12-31	57	Marks	SAS V9			1	point	Open	Meteorology	WeatherDaily, WeatherStation	Precipitation, total, no media, daily					Natural Resources, Earth and Environmental Sciences	climatologyMeteorologyAtmosphere	no
GB3822	3822	GB	PRECIPITATION	hourly_rmsp3_precipitation_ppts	shielded precipitation	mm	1 hour	1 hour	1/1/62	1962-01-01	1962-01-01	12/31/18	2018-12-31	2018-12-31	57	Marks	SAS V9			1	point	Open	Meteorology	WeatherDaily, WeatherStation	Precipitation, total, no media, daily					Natural Resources, Earth and Environmental Sciences	climatologyMeteorologyAtmosphere	no
GB3823	3823	GB	PRECIPITATION	hourly_012_precipitation_pptu	unshielded precipitation	mm	1 hour	1 hour	1/1/62	1962-01-01	1962-01-01	12/31/18	2018-12-31	2018-12-31	57	Marks	SAS V9			1	point	Open	Meteorology	WeatherDaily, WeatherStation	Precipitation, total, no media, daily					Natural Resources, Earth and Environmental Sciences	climatologyMeteorologyAtmosphere	no
GB3824	3824	GB	PRECIPITATION	hourly_057_precipitation_pptu	unshielded precipitation	mm	1 hour	1 hour	1/1/62	1962-01-01	1962-01-01	12/31/18	2018-12-31	2018-12-31	57	Marks	SAS V9			1	point	Open	Meteorology	WeatherDaily, WeatherStation	Precipitation, total, no media, daily					Natural Resources, Earth and Environmental Sciences	climatologyMeteorologyAtmosphere	no
GB3825	3825	GB	PRECIPITATION	hourly_076_precipitation_pptu	unshielded precipitation	mm	1 hour	1 hour	1/1/62	1962-01-01	1962-01-01	12/31/18	2018-12-31	2018-12-31	57	Marks	SAS V9			1	point	Open	Meteorology	WeatherDaily, WeatherStation	Precipitation, total, no media, daily					Natural Resources, Earth and Environmental Sciences	climatologyMeteorologyAtmosphere	no
GB3826	3826	GB	PRECIPITATION	hourly_116c_precipitation_pptu	unshielded precipitation	mm	1 hour	1 hour	1/1/62	1962-01-01	1962-01-01	12/31/18	2018-12-31	2018-12-31	57	Marks	SAS V9			1	point	Open	Meteorology	WeatherDaily, WeatherStation	Precipitation, total, no media, daily					Natural Resources, Earth and Environmental Sciences	climatologyMeteorologyAtmosphere	no
GB3827	3827	GB	PRECIPITATION	hourly_127_precipitation_pptu	unshielded precipitation	mm	1 hour	1 hour	1/1/62	1962-01-01	1962-01-01	12/31/18	2018-12-31	2018-12-31	57	Marks	SAS V9			1	point	Open	Meteorology	WeatherDaily, WeatherStation	Precipitation, total, no media, daily					Natural Resources, Earth and Environmental Sciences	climatologyMeteorologyAtmosphere	no
GB3828	3828	GB	PRECIPITATION	hourly_144_precipitation_pptu	unshielded precipitation	mm	1 hour	1 hour	1/1/62	1962-01-01	1962-01-01	12/31/18	2018-12-31	2018-12-31	57	Marks	SAS V9			1	point	Open	Meteorology	WeatherDaily, WeatherStation	Precipitation, total, no media, daily					Natural Resources, Earth and Environmental Sciences	climatologyMeteorologyAtmosphere	no
GB3829	3829	GB	PRECIPITATION	hourly_147_precipitation_pptu	unshielded precipitation	mm	1 hour	1 hour	1/1/62	1962-01-01	1962-01-01	12/31/18	2018-12-31	2018-12-31	57	Marks	SAS V9			1	point	Open	Meteorology	WeatherDaily, WeatherStation	Precipitation, total, no media, daily					Natural Resources, Earth and Environmental Sciences	climatologyMeteorologyAtmosphere	no
GB3830	3830	GB	PRECIPITATION	hourly_155_precipitation_pptu	unshielded precipitation	mm	1 hour	1 hour	1/1/62	1962-01-01	1962-01-01	12/31/18	2018-12-31	2018-12-31	57	Marks	SAS V9			1	point	Open	Meteorology	WeatherDaily, WeatherStation	Precipitation, total, no media, daily					Natural Resources, Earth and Environmental Sciences	climatologyMeteorologyAtmosphere	no
GB3831	3831	GB	PRECIPITATION	hourly_163_precipitation_pptu	unshielded precipitation	mm	1 hour	1 hour	1/1/62	1962-01-01	1962-01-01	12/31/18	2018-12-31	2018-12-31	57	Marks	SAS V9			1	point	Open	Meteorology	WeatherDaily, WeatherStation	Precipitation, total, no media, daily					Natural Resources, Earth and Environmental Sciences	climatologyMeteorologyAtmosphere	no
GB3832	3832	GB	PRECIPITATION	hourly_167_precipitation_pptu	unshielded precipitation	mm	1 hour	1 hour	1/1/62	1962-01-01	1962-01-01	12/31/18	2018-12-31	2018-12-31	57	Marks	SAS V9			1	point	Open	Meteorology	WeatherDaily, WeatherStation	Precipitation, total, no media, daily					Natural Resources, Earth and Environmental Sciences	climatologyMeteorologyAtmosphere	no
GB3833	3833	GB	PRECIPITATION	hourly_174_precipitation_pptu	unshielded precipitation	mm	1 hour	1 hour	1/1/62	1962-01-01	1962-01-01	12/31/18	2018-12-31	2018-12-31	57	Marks	SAS V9			1	point	Open	Meteorology	WeatherDaily, WeatherStation	Precipitation, total, no media, daily					Natural Resources, Earth and Environmental Sciences	climatologyMeteorologyAtmosphere	no
GB3834	3834	GB	PRECIPITATION	hourly_rmsp3_precipitation_pptu	unshielded precipitation	mm	1 hour	1 hour	1/1/62	1962-01-01	1962-01-01	12/31/18	2018-12-31	2018-12-31	57	Marks	SAS V9			1	point	Open	Meteorology	WeatherDaily, WeatherStation	Precipitation, total, no media, daily					Natural Resources, Earth and Environmental Sciences	climatologyMeteorologyAtmosphere	no
GB3835	3835	GB	SOIL PHYSICS	l1_177_hydraprobe_wat007i	soil water content	%	15 minute	15 minute	10/21/16	2016-10-21	2016-10-21	2/14/17	2017-02-14	2017-02-14	1	Seyfried	SAS V9			1	point	Open	Soil	MeasSoilCover, MeasSoilChem, MeasSoilPhys, MeasSoilBiol	soil moisture	Soil Physics				Natural Resources, Earth and Environmental Sciences	geoscientificInformation	no
GB3836	3836	GB	SOIL PHYSICS	l1_177_hydraprobe_wat008s	soil water content	%	15 minute	15 minute	10/21/16	2016-10-21	2016-10-21	2/14/17	2017-02-14	2017-02-14	1	Seyfried	SAS V9			1	point	Open	Soil	MeasSoilCover, MeasSoilChem, MeasSoilPhys, MeasSoilBiol	soil moisture	Soil Physics				Natural Resources, Earth and Environmental Sciences	geoscientificInformation	no
GB3837	3837	GB	SOIL PHYSICS	l1_177_hydraprobe_wat015	soil water content	%	15 minute	15 minute	10/21/16	2016-10-21	2016-10-21	2/14/17	2017-02-14	2017-02-14	1	Seyfried	SAS V9			1	point	Open	Soil	MeasSoilCover, MeasSoilChem, MeasSoilPhys, MeasSoilBiol	soil moisture	Soil Physics				Natural Resources, Earth and Environmental Sciences	geoscientificInformation	no
GB3838	3838	GB	SOIL PHYSICS	l1_177_hydraprobe_wat031	soil water content	%	15 minute	15 minute	10/21/16	2016-10-21	2016-10-21	2/14/17	2017-02-14	2017-02-14	1	Seyfried	SAS V9			1	point	Open	Soil	MeasSoilCover, MeasSoilChem, MeasSoilPhys, MeasSoilBiol	soil moisture	Soil Physics				Natural Resources, Earth and Environmental Sciences	geoscientificInformation	no
GB3839	3839	GB	SOIL PHYSICS	l1_177_hydraprobe_wat050	soil water content	%	15 minute	15 minute	10/21/16	2016-10-21	2016-10-21	2/14/17	2017-02-14	2017-02-14	1	Seyfried	SAS V9			1	point	Open	Soil	MeasSoilCover, MeasSoilChem, MeasSoilPhys, MeasSoilBiol	soil moisture	Soil Physics				Natural Resources, Earth and Environmental Sciences	geoscientificInformation	no
GB3840	3840	GB	SOIL PHYSICS	l1_177_hydraprobe_wat073	soil water content	%	15 minute	15 minute	10/21/16	2016-10-21	2016-10-21	2/14/17	2017-02-14	2017-02-14	1	Seyfried	SAS V9			1	point	Open	Soil	MeasSoilCover, MeasSoilChem, MeasSoilPhys, MeasSoilBiol	soil moisture	Soil Physics				Natural Resources, Earth and Environmental Sciences	geoscientificInformation	no
GB3841	3841	GB	SOIL PHYSICS	l1_127e_hydraprobe_wat005s	soil water content	%	15 minute	15 minute	9/6/16	2016-09-06	2016-09-06	2/14/17	2017-02-14	2017-02-14	1	Seyfried	SAS V9			1	point	Open	Soil	MeasSoilCover, MeasSoilChem, MeasSoilPhys, MeasSoilBiol	soil moisture	Soil Physics				Natural Resources, Earth and Environmental Sciences	geoscientificInformation	no
GB3842	3842	GB	SOIL PHYSICS	l1_127e_hydraprobe_wat006i	soil water content	%	15 minute	15 minute	9/6/16	2016-09-06	2016-09-06	2/14/17	2017-02-14	2017-02-14	1	Seyfried	SAS V9			1	point	Open	Soil	MeasSoilCover, MeasSoilChem, MeasSoilPhys, MeasSoilBiol	soil moisture	Soil Physics				Natural Resources, Earth and Environmental Sciences	geoscientificInformation	no
GB3843	3843	GB	SOIL PHYSICS	l1_127e_hydraprobe_wat023	soil water content	%	15 minute	15 minute	9/6/16	2016-09-06	2016-09-06	2/14/17	2017-02-14	2017-02-14	1	Seyfried	SAS V9			1	point	Open	Soil	MeasSoilCover, MeasSoilChem, MeasSoilPhys, MeasSoilBiol	soil moisture	Soil Physics				Natural Resources, Earth and Environmental Sciences	geoscientificInformation	no
GB3844	3844	GB	SOIL PHYSICS	l1_127e_hydraprobe_wat025	soil water content	%	15 minute	15 minute	9/6/16	2016-09-06	2016-09-06	2/14/17	2017-02-14	2017-02-14	1	Seyfried	SAS V9			1	point	Open	Soil	MeasSoilCover, MeasSoilChem, MeasSoilPhys, MeasSoilBiol	soil moisture	Soil Physics				Natural Resources, Earth and Environmental Sciences	geoscientificInformation	no
GB3845	3845	GB	SOIL PHYSICS	l1_127e_hydraprobe_wat080	soil water content	%	15 minute	15 minute	9/6/16	2016-09-06	2016-09-06	2/14/17	2017-02-14	2017-02-14	1	Seyfried	SAS V9			1	point	Open	Soil	MeasSoilCover, MeasSoilChem, MeasSoilPhys, MeasSoilBiol	soil moisture	Soil Physics				Natural Resources, Earth and Environmental Sciences	geoscientificInformation	no
GB3846	3846	GB	SOIL PHYSICS	l1_127e_hydraprobe_wat117	soil water content	%	15 minute	15 minute	9/6/16	2016-09-06	2016-09-06	2/14/17	2017-02-14	2017-02-14	1	Seyfried	SAS V9			1	point	Open	Soil	MeasSoilCover, MeasSoilChem, MeasSoilPhys, MeasSoilBiol	soil moisture	Soil Physics				Natural Resources, Earth and Environmental Sciences	geoscientificInformation	no
GB3847	3847	GB	SOIL PHYSICS	l1_043b_hydraprobe_wat005	soil water content	%	15 minute	15 minute	9/14/16	2016-09-14	2016-09-14	2/18/18	2018-02-18	2018-02-18	1	Seyfried	SAS V9			1	point	Open	Soil	MeasSoilCover, MeasSoilChem, MeasSoilPhys, MeasSoilBiol	soil moisture	Soil Physics				Natural Resources, Earth and Environmental Sciences	geoscientificInformation	no
GB3848	3848	GB	SOIL PHYSICS	l1_057_hydraprobe_wat005	soil water content	%	15 minute	15 minute	9/14/16	2016-09-14	2016-09-14	2/18/18	2018-02-18	2018-02-18	1	Seyfried	SAS V9			1	point	Open	Soil	MeasSoilCover, MeasSoilChem, MeasSoilPhys, MeasSoilBiol	soil moisture	Soil Physics				Natural Resources, Earth and Environmental Sciences	geoscientificInformation	no
GB3849	3849	GB	SOIL PHYSICS	l1_098f_hydraprobe_wat005i	soil water content	%	15 minute	15 minute	7/17/15	2015-07-17	2015-07-17	2/13/17	2017-02-13	2017-02-13	2	Seyfried	SAS V9			1	point	Open	Soil	MeasSoilCover, MeasSoilChem, MeasSoilPhys, MeasSoilBiol	soil moisture	Soil Physics				Natural Resources, Earth and Environmental Sciences	geoscientificInformation	no
GB3850	3850	GB	SOIL PHYSICS	l1_098f_hydraprobe_wat005s	soil water content	%	15 minute	15 minute	7/17/15	2015-07-17	2015-07-17	2/13/17	2017-02-13	2017-02-13	2	Seyfried	SAS V9			1	point	Open	Soil	MeasSoilCover, MeasSoilChem, MeasSoilPhys, MeasSoilBiol	soil moisture	Soil Physics				Natural Resources, Earth and Environmental Sciences	geoscientificInformation	no
GB3851	3851	GB	SOIL PHYSICS	l1_098f_hydraprobe_wat015i	soil water content	%	15 minute	15 minute	7/17/15	2015-07-17	2015-07-17	2/13/17	2017-02-13	2017-02-13	2	Seyfried	SAS V9			1	point	Open	Soil	MeasSoilCover, MeasSoilChem, MeasSoilPhys, MeasSoilBiol	soil moisture	Soil Physics				Natural Resources, Earth and Environmental Sciences	geoscientificInformation	no
GB3852	3852	GB	SOIL PHYSICS	l1_098f_hydraprobe_wat015s	soil water content	%	15 minute	15 minute	7/17/15	2015-07-17	2015-07-17	2/13/17	2017-02-13	2017-02-13	2	Seyfried	SAS V9			1	point	Open	Soil	MeasSoilCover, MeasSoilChem, MeasSoilPhys, MeasSoilBiol	soil moisture	Soil Physics				Natural Resources, Earth and Environmental Sciences	geoscientificInformation	no
GB3853	3853	GB	SOIL PHYSICS	l1_098f_hydraprobe_wat030i	soil water content	%	15 minute	15 minute	7/17/15	2015-07-17	2015-07-17	2/13/17	2017-02-13	2017-02-13	2	Seyfried	SAS V9			1	point	Open	Soil	MeasSoilCover, MeasSoilChem, MeasSoilPhys, MeasSoilBiol	soil moisture	Soil Physics				Natural Resources, Earth and Environmental Sciences	geoscientificInformation	no
GB3854	3854	GB	SOIL PHYSICS	l1_098f_hydraprobe_wat030s	soil water content	%	15 minute	15 minute	7/17/15	2015-07-17	2015-07-17	2/13/17	2017-02-13	2017-02-13	2	Seyfried	SAS V9			1	point	Open	Soil	MeasSoilCover, MeasSoilChem, MeasSoilPhys, MeasSoilBiol	soil moisture	Soil Physics				Natural Resources, Earth and Environmental Sciences	geoscientificInformation	no
GB3855	3855	GB	SOIL PHYSICS	l1_098f_hydraprobe_wat063i	soil water content	%	15 minute	15 minute	7/17/15	2015-07-17	2015-07-17	2/13/17	2017-02-13	2017-02-13	2	Seyfried	SAS V9			1	point	Open	Soil	MeasSoilCover, MeasSoilChem, MeasSoilPhys, MeasSoilBiol	soil moisture	Soil Physics				Natural Resources, Earth and Environmental Sciences	geoscientificInformation	no
GB3856	3856	GB	SOIL PHYSICS	l1_098f_hydraprobe_wat064s	soil water content	%	15 minute	15 minute	7/17/15	2015-07-17	2015-07-17	2/13/17	2017-02-13	2017-02-13	2	Seyfried	SAS V9			1	point	Open	Soil	MeasSoilCover, MeasSoilChem, MeasSoilPhys, MeasSoilBiol	soil moisture	Soil Physics				Natural Resources, Earth and Environmental Sciences	geoscientificInformation	no
GB3857	3857	GB	SOIL PHYSICS	l1_098f_hydraprobe_wat090s	soil water content	%	15 minute	15 minute	7/17/15	2015-07-17	2015-07-17	2/13/17	2017-02-13	2017-02-13	2	Seyfried	SAS V9			1	point	Open	Soil	MeasSoilCover, MeasSoilChem, MeasSoilPhys, MeasSoilBiol	soil moisture	Soil Physics				Natural Resources, Earth and Environmental Sciences	geoscientificInformation	no
GB3858	3858	GB	SOIL PHYSICS	l1_098f_hydraprobe_wat097i	soil water content	%	15 minute	15 minute	7/17/15	2015-07-17	2015-07-17	2/13/17	2017-02-13	2017-02-13	2	Seyfried	SAS V9			1	point	Open	Soil	MeasSoilCover, MeasSoilChem, MeasSoilPhys, MeasSoilBiol	soil moisture	Soil Physics				Natural Resources, Earth and Environmental Sciences	geoscientificInformation	no
GB3859	3859	GB	SOIL PHYSICS	l1_098f_hydraprobe_wat150i	soil water content	%	15 minute	15 minute	7/17/15	2015-07-17	2015-07-17	2/13/17	2017-02-13	2017-02-13	2	Seyfried	SAS V9			1	point	Open	Soil	MeasSoilCover, MeasSoilChem, MeasSoilPhys, MeasSoilBiol	soil moisture	Soil Physics				Natural Resources, Earth and Environmental Sciences	geoscientificInformation	no
GB3860	3860	GB	SOIL PHYSICS	l1_098f_hydraprobe_wat150s	soil water content	%	15 minute	15 minute	7/17/15	2015-07-17	2015-07-17	2/13/17	2017-02-13	2017-02-13	2	Seyfried	SAS V9			1	point	Open	Soil	MeasSoilCover, MeasSoilChem, MeasSoilPhys, MeasSoilBiol	soil moisture	Soil Physics				Natural Resources, Earth and Environmental Sciences	geoscientificInformation	no
GB3861	3861	GB	SOIL PHYSICS	l1_mbsec_hydraprobe_wat005	soil water content	%	15 minute	15 minute	10/30/14	2014-10-30	2014-10-30	2/13/17	2017-02-13	2017-02-13	2	Seyfried	SAS V9			1	point	Open	Soil	MeasSoilCover, MeasSoilChem, MeasSoilPhys, MeasSoilBiol	soil moisture	Soil Physics				Natural Resources, Earth and Environmental Sciences	geoscientificInformation	no
GB3862	3862	GB	SOIL PHYSICS	l1_mbsec_hydraprobe_wat015	soil water content	%	15 minute	15 minute	10/30/14	2014-10-30	2014-10-30	2/13/17	2017-02-13	2017-02-13	2	Seyfried	SAS V9			1	point	Open	Soil	MeasSoilCover, MeasSoilChem, MeasSoilPhys, MeasSoilBiol	soil moisture	Soil Physics				Natural Resources, Earth and Environmental Sciences	geoscientificInformation	no
GB3863	3863	GB	SOIL PHYSICS	l1_mbsec_hydraprobe_wat030	soil water content	%	15 minute	15 minute	10/30/14	2014-10-30	2014-10-30	2/13/17	2017-02-13	2017-02-13	2	Seyfried	SAS V9			1	point	Open	Soil	MeasSoilCover, MeasSoilChem, MeasSoilPhys, MeasSoilBiol	soil moisture	Soil Physics				Natural Resources, Earth and Environmental Sciences	geoscientificInformation	no
GB3864	3864	GB	SOIL PHYSICS	l1_mbsec_hydraprobe_wat060	soil water content	%	15 minute	15 minute	10/30/14	2014-10-30	2014-10-30	2/13/17	2017-02-13	2017-02-13	2	Seyfried	SAS V9			1	point	Open	Soil	MeasSoilCover, MeasSoilChem, MeasSoilPhys, MeasSoilBiol	soil moisture	Soil Physics				Natural Resources, Earth and Environmental Sciences	geoscientificInformation	no
GB3865	3865	GB	SOIL PHYSICS	l1_mbsec_hydraprobe_wat090	soil water content	%	15 minute	15 minute	10/30/14	2014-10-30	2014-10-30	2/13/17	2017-02-13	2017-02-13	2	Seyfried	SAS V9			1	point	Open	Soil	MeasSoilCover, MeasSoilChem, MeasSoilPhys, MeasSoilBiol	soil moisture	Soil Physics				Natural Resources, Earth and Environmental Sciences	geoscientificInformation	no
GB3866	3866	GB	SOIL PHYSICS	l1_145c_hydraprobe_wat005b	soil water content	%	15 minute	15 minute	8/21/12	2012-08-21	2012-08-21	4/2/15	2015-04-02	2015-04-02	3	Seyfried	SAS V9			1	point	Open	Soil	MeasSoilCover, MeasSoilChem, MeasSoilPhys, MeasSoilBiol	soil moisture	Soil Physics				Natural Resources, Earth and Environmental Sciences	geoscientificInformation	no
GB3867	3867	GB	SOIL PHYSICS	l1_145c_hydraprobe_wat005u	soil water content	%	15 minute	15 minute	8/21/12	2012-08-21	2012-08-21	4/2/15	2015-04-02	2015-04-02	3	Seyfried	SAS V9			1	point	Open	Soil	MeasSoilCover, MeasSoilChem, MeasSoilPhys, MeasSoilBiol	soil moisture	Soil Physics				Natural Resources, Earth and Environmental Sciences	geoscientificInformation	no
GB3868	3868	GB	SOIL PHYSICS	l1_145c_hydraprobe_wat015b	soil water content	%	15 minute	15 minute	8/21/12	2012-08-21	2012-08-21	4/2/15	2015-04-02	2015-04-02	3	Seyfried	SAS V9			1	point	Open	Soil	MeasSoilCover, MeasSoilChem, MeasSoilPhys, MeasSoilBiol	soil moisture	Soil Physics				Natural Resources, Earth and Environmental Sciences	geoscientificInformation	no
GB3869	3869	GB	SOIL PHYSICS	l1_145c_hydraprobe_wat030b	soil water content	%	15 minute	15 minute	8/21/12	2012-08-21	2012-08-21	4/2/15	2015-04-02	2015-04-02	3	Seyfried	SAS V9			1	point	Open	Soil	MeasSoilCover, MeasSoilChem, MeasSoilPhys, MeasSoilBiol	soil moisture	Soil Physics				Natural Resources, Earth and Environmental Sciences	geoscientificInformation	no
GB3870	3870	GB	SOIL PHYSICS	l1_145c_hydraprobe_wat060b	soil water content	%	15 minute	15 minute	8/21/12	2012-08-21	2012-08-21	4/2/15	2015-04-02	2015-04-02	3	Seyfried	SAS V9			1	point	Open	Soil	MeasSoilCover, MeasSoilChem, MeasSoilPhys, MeasSoilBiol	soil moisture	Soil Physics				Natural Resources, Earth and Environmental Sciences	geoscientificInformation	no
GB3871	3871	GB	SOIL PHYSICS	l1_145c_hydraprobe_wat090b	soil water content	%	15 minute	15 minute	8/21/12	2012-08-21	2012-08-21	4/2/15	2015-04-02	2015-04-02	3	Seyfried	SAS V9			1	point	Open	Soil	MeasSoilCover, MeasSoilChem, MeasSoilPhys, MeasSoilBiol	soil moisture	Soil Physics				Natural Resources, Earth and Environmental Sciences	geoscientificInformation	no
GB3872	3872	GB	SOIL PHYSICS	l1_145c_hydraprobe_wat120b	soil water content	%	15 minute	15 minute	8/21/12	2012-08-21	2012-08-21	4/2/15	2015-04-02	2015-04-02	3	Seyfried	SAS V9			1	point	Open	Soil	MeasSoilCover, MeasSoilChem, MeasSoilPhys, MeasSoilBiol	soil moisture	Soil Physics				Natural Resources, Earth and Environmental Sciences	geoscientificInformation	no
GB3873	3873	GB	SOIL PHYSICS	hourly_127_soiltemperature_stm240	soil temperature	°C	1 hour	1 hour	10/13/81	1981-10-13	1981-10-13	12/4/84	1984-12-04	1984-12-04	3	Seyfried	SAS V9			1	point	Open	Soil	MeasSoilCover, MeasSoilChem, MeasSoilPhys, MeasSoilBiol	soil temperature	Soil Physics				Natural Resources, Earth and Environmental Sciences	geoscientificInformation	no
GB3874	3874	GB	SOIL PHYSICS	hourly_145c_soiltemperature_stm120uu	soil temperature	°C	1 hour	1 hour	5/31/02	2002-05-31	2002-05-31	9/5/05	2005-09-05	2005-09-05	3	Seyfried	SAS V9			1	point	Open	Soil	MeasSoilCover, MeasSoilChem, MeasSoilPhys, MeasSoilBiol	soil temperature	Soil Physics				Natural Resources, Earth and Environmental Sciences	geoscientificInformation	no
GB3875	3875	GB	SOIL PHYSICS	l1_176c_hydraprobe_wat005a	soil water content	%	15 minute	15 minute	8/14/13	2013-08-14	2013-08-14	1/27/17	2017-01-27	2017-01-27	3	Seyfried	SAS V9			1	point	Open	Soil	MeasSoilCover, MeasSoilChem, MeasSoilPhys, MeasSoilBiol	soil moisture	Soil Physics				Natural Resources, Earth and Environmental Sciences	geoscientificInformation	no
GB3876	3876	GB	SOIL PHYSICS	l1_176c_hydraprobe_wat010m	soil water content	%	15 minute	15 minute	8/14/13	2013-08-14	2013-08-14	1/27/17	2017-01-27	2017-01-27	3	Seyfried	SAS V9			1	point	Open	Soil	MeasSoilCover, MeasSoilChem, MeasSoilPhys, MeasSoilBiol	soil moisture	Soil Physics				Natural Resources, Earth and Environmental Sciences	geoscientificInformation	no
GB3877	3877	GB	SOIL PHYSICS	l1_176c_hydraprobe_wat030m	soil water content	%	15 minute	15 minute	8/14/13	2013-08-14	2013-08-14	1/27/17	2017-01-27	2017-01-27	3	Seyfried	SAS V9			1	point	Open	Soil	MeasSoilCover, MeasSoilChem, MeasSoilPhys, MeasSoilBiol	soil moisture	Soil Physics				Natural Resources, Earth and Environmental Sciences	geoscientificInformation	no
GB3878	3878	GB	SOIL PHYSICS	l1_176c_hydraprobe_wat050m	soil water content	%	15 minute	15 minute	8/14/13	2013-08-14	2013-08-14	1/27/17	2017-01-27	2017-01-27	3	Seyfried	SAS V9			1	point	Open	Soil	MeasSoilCover, MeasSoilChem, MeasSoilPhys, MeasSoilBiol	soil moisture	Soil Physics				Natural Resources, Earth and Environmental Sciences	geoscientificInformation	no
GB3879	3879	GB	SOIL PHYSICS	l1_176c_hydraprobe_wat100m	soil water content	%	15 minute	15 minute	8/14/13	2013-08-14	2013-08-14	1/27/17	2017-01-27	2017-01-27	3	Seyfried	SAS V9			1	point	Open	Soil	MeasSoilCover, MeasSoilChem, MeasSoilPhys, MeasSoilBiol	soil moisture	Soil Physics				Natural Resources, Earth and Environmental Sciences	geoscientificInformation	no
GB3880	3880	GB	SOIL PHYSICS	hourly_057_soiltemperature_stm005	soil temperature	°C	1 hour	1 hour	8/7/90	1990-08-07	1990-08-07	12/31/94	1994-12-31	1994-12-31	4	Seyfried	SAS V9			1	point	Open	Soil	MeasSoilCover, MeasSoilChem, MeasSoilPhys, MeasSoilBiol	soil temperature	Soil Physics				Natural Resources, Earth and Environmental Sciences	geoscientificInformation	no
GB3881	3881	GB	SOIL PHYSICS	hourly_076_soiltemperature_stm050	soil temperature	°C	1 hour	1 hour	6/7/94	1994-06-07	1994-06-07	8/26/99	1999-08-26	1999-08-26	5	Seyfried	SAS V9			1	point	Open	Soil	MeasSoilCover, MeasSoilChem, MeasSoilPhys, MeasSoilBiol	soil temperature	Soil Physics				Natural Resources, Earth and Environmental Sciences	geoscientificInformation	no
GB3882	3882	GB	SOIL PHYSICS	hourly_098_soiltemperature_stm240	soil temperature	°C	1 hour	1 hour	6/14/85	1985-06-14	1985-06-14	9/27/90	1990-09-27	1990-09-27	5	Seyfried	SAS V9			1	point	Open	Soil	MeasSoilCover, MeasSoilChem, MeasSoilPhys, MeasSoilBiol	soil temperature	Soil Physics				Natural Resources, Earth and Environmental Sciences	geoscientificInformation	no
GB3883	3883	GB	SOIL PHYSICS	l1_124b_hydraprobe_wat075a	soil water content	%	15 minute	15 minute	10/13/11	2011-10-13	2011-10-13	2/13/17	2017-02-13	2017-02-13	5	Seyfried	SAS V9			1	point	Open	Soil	MeasSoilCover, MeasSoilChem, MeasSoilPhys, MeasSoilBiol	soil moisture	Soil Physics				Natural Resources, Earth and Environmental Sciences	geoscientificInformation	no
GB3884	3884	GB	SOIL PHYSICS	l1_jdt2b_hydraprobe_wat005	soil water content	%	15 minute	15 minute	12/13/10	2010-12-13	2010-12-13	12/7/16	2016-12-07	2016-12-07	6	Seyfried	SAS V9			1	point	Open	Soil	MeasSoilCover, MeasSoilChem, MeasSoilPhys, MeasSoilBiol	soil moisture	Soil Physics				Natural Resources, Earth and Environmental Sciences	geoscientificInformation	no
GB3885	3885	GB	SOIL PHYSICS	l1_jdt3b_hydraprobe_wat005	soil water content	%	15 minute	15 minute	12/13/10	2010-12-13	2010-12-13	12/7/16	2016-12-07	2016-12-07	6	Seyfried	SAS V9			1	point	Open	Soil	MeasSoilCover, MeasSoilChem, MeasSoilPhys, MeasSoilBiol	soil moisture	Soil Physics				Natural Resources, Earth and Environmental Sciences	geoscientificInformation	no
GB3886	3886	GB	SOIL PHYSICS	l1_jdt4b_hydraprobe_wat005	soil water content	%	15 minute	15 minute	12/13/10	2010-12-13	2010-12-13	12/7/16	2016-12-07	2016-12-07	6	Seyfried	SAS V9			1	point	Open	Soil	MeasSoilCover, MeasSoilChem, MeasSoilPhys, MeasSoilBiol	soil moisture	Soil Physics				Natural Resources, Earth and Environmental Sciences	geoscientificInformation	no
GB3887	3887	GB	SOIL PHYSICS	l1_jdt2b_hydraprobe_wat020	soil water content	%	15 minute	15 minute	12/13/10	2010-12-13	2010-12-13	12/7/16	2016-12-07	2016-12-07	6	Seyfried	SAS V9			1	point	Open	Soil	MeasSoilCover, MeasSoilChem, MeasSoilPhys, MeasSoilBiol	soil moisture	Soil Physics				Natural Resources, Earth and Environmental Sciences	geoscientificInformation	no
GB3888	3888	GB	SOIL PHYSICS	l1_jdt4b_hydraprobe_wat020	soil water content	%	15 minute	15 minute	12/13/10	2010-12-13	2010-12-13	12/7/16	2016-12-07	2016-12-07	6	Seyfried	SAS V9			1	point	Open	Soil	MeasSoilCover, MeasSoilChem, MeasSoilPhys, MeasSoilBiol	soil moisture	Soil Physics				Natural Resources, Earth and Environmental Sciences	geoscientificInformation	no
GB3889	3889	GB	SOIL PHYSICS	l1_jdt3b_hydraprobe_wat021	soil water content	%	15 minute	15 minute	12/13/10	2010-12-13	2010-12-13	12/7/16	2016-12-07	2016-12-07	6	Seyfried	SAS V9			1	point	Open	Soil	MeasSoilCover, MeasSoilChem, MeasSoilPhys, MeasSoilBiol	soil moisture	Soil Physics				Natural Resources, Earth and Environmental Sciences	geoscientificInformation	no
GB3890	3890	GB	SOIL PHYSICS	l1_jdt3b_hydraprobe_wat034	soil water content	%	15 minute	15 minute	12/13/10	2010-12-13	2010-12-13	12/7/16	2016-12-07	2016-12-07	6	Seyfried	SAS V9			1	point	Open	Soil	MeasSoilCover, MeasSoilChem, MeasSoilPhys, MeasSoilBiol	soil moisture	Soil Physics				Natural Resources, Earth and Environmental Sciences	geoscientificInformation	no
GB3891	3891	GB	SOIL PHYSICS	l1_jdt2b_hydraprobe_wat035	soil water content	%	15 minute	15 minute	12/13/10	2010-12-13	2010-12-13	12/7/16	2016-12-07	2016-12-07	6	Seyfried	SAS V9			1	point	Open	Soil	MeasSoilCover, MeasSoilChem, MeasSoilPhys, MeasSoilBiol	soil moisture	Soil Physics				Natural Resources, Earth and Environmental Sciences	geoscientificInformation	no
GB3892	3892	GB	SOIL PHYSICS	l1_jdt4b_hydraprobe_wat035	soil water content	%	15 minute	15 minute	12/13/10	2010-12-13	2010-12-13	12/7/16	2016-12-07	2016-12-07	6	Seyfried	SAS V9			1	point	Open	Soil	MeasSoilCover, MeasSoilChem, MeasSoilPhys, MeasSoilBiol	soil moisture	Soil Physics				Natural Resources, Earth and Environmental Sciences	geoscientificInformation	no
GB3893	3893	GB	SOIL PHYSICS	l1_jdt2b_hydraprobe_wat050	soil water content	%	15 minute	15 minute	12/13/10	2010-12-13	2010-12-13	12/7/16	2016-12-07	2016-12-07	6	Seyfried	SAS V9			1	point	Open	Soil	MeasSoilCover, MeasSoilChem, MeasSoilPhys, MeasSoilBiol	soil moisture	Soil Physics				Natural Resources, Earth and Environmental Sciences	geoscientificInformation	no
GB3894	3894	GB	SOIL PHYSICS	l1_jdt3b_hydraprobe_wat050	soil water content	%	15 minute	15 minute	12/13/10	2010-12-13	2010-12-13	12/7/16	2016-12-07	2016-12-07	6	Seyfried	SAS V9			1	point	Open	Soil	MeasSoilCover, MeasSoilChem, MeasSoilPhys, MeasSoilBiol	soil moisture	Soil Physics				Natural Resources, Earth and Environmental Sciences	geoscientificInformation	no
GB3895	3895	GB	SOIL PHYSICS	l1_jdt4b_hydraprobe_wat050	soil water content	%	15 minute	15 minute	12/13/10	2010-12-13	2010-12-13	12/7/16	2016-12-07	2016-12-07	6	Seyfried	SAS V9			1	point	Open	Soil	MeasSoilCover, MeasSoilChem, MeasSoilPhys, MeasSoilBiol	soil moisture	Soil Physics				Natural Resources, Earth and Environmental Sciences	geoscientificInformation	no
GB3896	3896	GB	SOIL PHYSICS	l1_jdt2b_hydraprobe_wat075	soil water content	%	15 minute	15 minute	12/13/10	2010-12-13	2010-12-13	12/7/16	2016-12-07	2016-12-07	6	Seyfried	SAS V9			1	point	Open	Soil	MeasSoilCover, MeasSoilChem, MeasSoilPhys, MeasSoilBiol	soil moisture	Soil Physics				Natural Resources, Earth and Environmental Sciences	geoscientificInformation	no
GB3897	3897	GB	SOIL PHYSICS	l1_124b_hydraprobe_wat005	soil water content	%	15 minute	15 minute	11/22/10	2010-11-22	2010-11-22	2/13/17	2017-02-13	2017-02-13	6	Seyfried	SAS V9			1	point	Open	Soil	MeasSoilCover, MeasSoilChem, MeasSoilPhys, MeasSoilBiol	soil moisture	Soil Physics				Natural Resources, Earth and Environmental Sciences	geoscientificInformation	no
GB3898	3898	GB	SOIL PHYSICS	l1_124b_hydraprobe_wat005a	soil water content	%	15 minute	15 minute	11/22/10	2010-11-22	2010-11-22	2/13/17	2017-02-13	2017-02-13	6	Seyfried	SAS V9			1	point	Open	Soil	MeasSoilCover, MeasSoilChem, MeasSoilPhys, MeasSoilBiol	soil moisture	Soil Physics				Natural Resources, Earth and Environmental Sciences	geoscientificInformation	no
GB3899	3899	GB	SOIL PHYSICS	l1_124b_hydraprobe_wat005s	soil water content	%	15 minute	15 minute	11/22/10	2010-11-22	2010-11-22	2/13/17	2017-02-13	2017-02-13	6	Seyfried	SAS V9			1	point	Open	Soil	MeasSoilCover, MeasSoilChem, MeasSoilPhys, MeasSoilBiol	soil moisture	Soil Physics				Natural Resources, Earth and Environmental Sciences	geoscientificInformation	no
GB3900	3900	GB	SOIL PHYSICS	l1_124b_hydraprobe_wat020a	soil water content	%	15 minute	15 minute	11/22/10	2010-11-22	2010-11-22	2/13/17	2017-02-13	2017-02-13	6	Seyfried	SAS V9			1	point	Open	Soil	MeasSoilCover, MeasSoilChem, MeasSoilPhys, MeasSoilBiol	soil moisture	Soil Physics				Natural Resources, Earth and Environmental Sciences	geoscientificInformation	no
GB3901	3901	GB	SOIL PHYSICS	l1_124b_hydraprobe_wat020s	soil water content	%	15 minute	15 minute	11/22/10	2010-11-22	2010-11-22	2/13/17	2017-02-13	2017-02-13	6	Seyfried	SAS V9			1	point	Open	Soil	MeasSoilCover, MeasSoilChem, MeasSoilPhys, MeasSoilBiol	soil moisture	Soil Physics				Natural Resources, Earth and Environmental Sciences	geoscientificInformation	no
GB3902	3902	GB	SOIL PHYSICS	l1_124b_hydraprobe_wat035s	soil water content	%	15 minute	15 minute	11/22/10	2010-11-22	2010-11-22	2/13/17	2017-02-13	2017-02-13	6	Seyfried	SAS V9			1	point	Open	Soil	MeasSoilCover, MeasSoilChem, MeasSoilPhys, MeasSoilBiol	soil moisture	Soil Physics				Natural Resources, Earth and Environmental Sciences	geoscientificInformation	no
GB3903	3903	GB	SOIL PHYSICS	l1_124b_hydraprobe_wat050a	soil water content	%	15 minute	15 minute	11/22/10	2010-11-22	2010-11-22	2/13/17	2017-02-13	2017-02-13	6	Seyfried	SAS V9			1	point	Open	Soil	MeasSoilCover, MeasSoilChem, MeasSoilPhys, MeasSoilBiol	soil moisture	Soil Physics				Natural Resources, Earth and Environmental Sciences	geoscientificInformation	no
GB3904	3904	GB	SOIL PHYSICS	l1_124b_hydraprobe_wat050s	soil water content	%	15 minute	15 minute	11/22/10	2010-11-22	2010-11-22	2/13/17	2017-02-13	2017-02-13	6	Seyfried	SAS V9			1	point	Open	Soil	MeasSoilCover, MeasSoilChem, MeasSoilPhys, MeasSoilBiol	soil moisture	Soil Physics				Natural Resources, Earth and Environmental Sciences	geoscientificInformation	no
GB3905	3905	GB	SOIL PHYSICS	l1_124b_hydraprobe_wat088a	soil water content	%	15 minute	15 minute	11/22/10	2010-11-22	2010-11-22	2/13/17	2017-02-13	2017-02-13	6	Seyfried	SAS V9			1	point	Open	Soil	MeasSoilCover, MeasSoilChem, MeasSoilPhys, MeasSoilBiol	soil moisture	Soil Physics				Natural Resources, Earth and Environmental Sciences	geoscientificInformation	no
GB3906	3906	GB	SOIL PHYSICS	l1_jdt3_hydraprobe_wat005	soil water content	%	15 minute	15 minute	9/30/10	2010-09-30	2010-09-30	2/13/17	2017-02-13	2017-02-13	6	Seyfried	SAS V9			1	point	Open	Soil	MeasSoilCover, MeasSoilChem, MeasSoilPhys, MeasSoilBiol	soil moisture	Soil Physics				Natural Resources, Earth and Environmental Sciences	geoscientificInformation	no
GB3907	3907	GB	SOIL PHYSICS	l1_jdt4_hydraprobe_wat005	soil water content	%	15 minute	15 minute	9/30/10	2010-09-30	2010-09-30	2/13/17	2017-02-13	2017-02-13	6	Seyfried	SAS V9			1	point	Open	Soil	MeasSoilCover, MeasSoilChem, MeasSoilPhys, MeasSoilBiol	soil moisture	Soil Physics				Natural Resources, Earth and Environmental Sciences	geoscientificInformation	no
GB3908	3908	GB	SOIL PHYSICS	l1_jdt3_hydraprobe_wat020	soil water content	%	15 minute	15 minute	9/30/10	2010-09-30	2010-09-30	2/13/17	2017-02-13	2017-02-13	6	Seyfried	SAS V9			1	point	Open	Soil	MeasSoilCover, MeasSoilChem, MeasSoilPhys, MeasSoilBiol	soil moisture	Soil Physics				Natural Resources, Earth and Environmental Sciences	geoscientificInformation	no
GB3909	3909	GB	SOIL PHYSICS	l1_jdt4_hydraprobe_wat020	soil water content	%	15 minute	15 minute	9/30/10	2010-09-30	2010-09-30	2/13/17	2017-02-13	2017-02-13	6	Seyfried	SAS V9			1	point	Open	Soil	MeasSoilCover, MeasSoilChem, MeasSoilPhys, MeasSoilBiol	soil moisture	Soil Physics				Natural Resources, Earth and Environmental Sciences	geoscientificInformation	no
GB3910	3910	GB	SOIL PHYSICS	l1_jdt3_hydraprobe_wat050	soil water content	%	15 minute	15 minute	9/30/10	2010-09-30	2010-09-30	2/13/17	2017-02-13	2017-02-13	6	Seyfried	SAS V9			1	point	Open	Soil	MeasSoilCover, MeasSoilChem, MeasSoilPhys, MeasSoilBiol	soil moisture	Soil Physics				Natural Resources, Earth and Environmental Sciences	geoscientificInformation	no
GB3911	3911	GB	SOIL PHYSICS	l1_jdt4_hydraprobe_wat050	soil water content	%	15 minute	15 minute	9/30/10	2010-09-30	2010-09-30	2/13/17	2017-02-13	2017-02-13	6	Seyfried	SAS V9			1	point	Open	Soil	MeasSoilCover, MeasSoilChem, MeasSoilPhys, MeasSoilBiol	soil moisture	Soil Physics				Natural Resources, Earth and Environmental Sciences	geoscientificInformation	no
GB3912	3912	GB	SOIL PHYSICS	l1_jdt3_hydraprobe_wat075	soil water content	%	15 minute	15 minute	9/30/10	2010-09-30	2010-09-30	2/13/17	2017-02-13	2017-02-13	6	Seyfried	SAS V9			1	point	Open	Soil	MeasSoilCover, MeasSoilChem, MeasSoilPhys, MeasSoilBiol	soil moisture	Soil Physics				Natural Resources, Earth and Environmental Sciences	geoscientificInformation	no
GB3913	3913	GB	SOIL PHYSICS	l1_jdt4_hydraprobe_wat075	soil water content	%	15 minute	15 minute	9/30/10	2010-09-30	2010-09-30	2/13/17	2017-02-13	2017-02-13	6	Seyfried	SAS V9			1	point	Open	Soil	MeasSoilCover, MeasSoilChem, MeasSoilPhys, MeasSoilBiol	soil moisture	Soil Physics				Natural Resources, Earth and Environmental Sciences	geoscientificInformation	no
GB3914	3914	GB	SOIL PHYSICS	l1_jdt4_hydraprobe_wat100	soil water content	%	15 minute	15 minute	9/30/10	2010-09-30	2010-09-30	2/13/17	2017-02-13	2017-02-13	6	Seyfried	SAS V9			1	point	Open	Soil	MeasSoilCover, MeasSoilChem, MeasSoilPhys, MeasSoilBiol	soil moisture	Soil Physics				Natural Resources, Earth and Environmental Sciences	geoscientificInformation	no
GB3915	3915	GB	SOIL PHYSICS	l1_jdt3_hydraprobe_wat101	soil water content	%	15 minute	15 minute	9/30/10	2010-09-30	2010-09-30	2/13/17	2017-02-13	2017-02-13	6	Seyfried	SAS V9			1	point	Open	Soil	MeasSoilCover, MeasSoilChem, MeasSoilPhys, MeasSoilBiol	soil moisture	Soil Physics				Natural Resources, Earth and Environmental Sciences	geoscientificInformation	no
GB3916	3916	GB	SOIL PHYSICS	l1_jdt1_hydraprobe_wat190	soil water content	%	15 minute	15 minute	8/20/10	2010-08-20	2010-08-20	2/13/17	2017-02-13	2017-02-13	6	Seyfried	SAS V9			1	point	Open	Soil	MeasSoilCover, MeasSoilChem, MeasSoilPhys, MeasSoilBiol	soil moisture	Soil Physics				Natural Resources, Earth and Environmental Sciences	geoscientificInformation	no
GB3917	3917	GB	SOIL PHYSICS	l1_jdt1_hydraprobe_wat005	soil water content	%	15 minute	15 minute	8/13/10	2010-08-13	2010-08-13	2/13/17	2017-02-13	2017-02-13	7	Seyfried	SAS V9			1	point	Open	Soil	MeasSoilCover, MeasSoilChem, MeasSoilPhys, MeasSoilBiol	soil moisture	Soil Physics				Natural Resources, Earth and Environmental Sciences	geoscientificInformation	no
GB3918	3918	GB	SOIL PHYSICS	l1_jdt2_hydraprobe_wat005	soil water content	%	15 minute	15 minute	8/13/10	2010-08-13	2010-08-13	2/13/17	2017-02-13	2017-02-13	7	Seyfried	SAS V9			1	point	Open	Soil	MeasSoilCover, MeasSoilChem, MeasSoilPhys, MeasSoilBiol	soil moisture	Soil Physics				Natural Resources, Earth and Environmental Sciences	geoscientificInformation	no
GB3919	3919	GB	SOIL PHYSICS	l1_jdt1_hydraprobe_wat020	soil water content	%	15 minute	15 minute	8/13/10	2010-08-13	2010-08-13	2/13/17	2017-02-13	2017-02-13	7	Seyfried	SAS V9			1	point	Open	Soil	MeasSoilCover, MeasSoilChem, MeasSoilPhys, MeasSoilBiol	soil moisture	Soil Physics				Natural Resources, Earth and Environmental Sciences	geoscientificInformation	no
GB3920	3920	GB	SOIL PHYSICS	l1_jdt2_hydraprobe_wat020	soil water content	%	15 minute	15 minute	8/13/10	2010-08-13	2010-08-13	2/13/17	2017-02-13	2017-02-13	7	Seyfried	SAS V9			1	point	Open	Soil	MeasSoilCover, MeasSoilChem, MeasSoilPhys, MeasSoilBiol	soil moisture	Soil Physics				Natural Resources, Earth and Environmental Sciences	geoscientificInformation	no
GB3921	3921	GB	SOIL PHYSICS	l1_jdt2_hydraprobe_wat049	soil water content	%	15 minute	15 minute	8/13/10	2010-08-13	2010-08-13	2/13/17	2017-02-13	2017-02-13	7	Seyfried	SAS V9			1	point	Open	Soil	MeasSoilCover, MeasSoilChem, MeasSoilPhys, MeasSoilBiol	soil moisture	Soil Physics				Natural Resources, Earth and Environmental Sciences	geoscientificInformation	no
GB3922	3922	GB	SOIL PHYSICS	l1_jdt1_hydraprobe_wat050	soil water content	%	15 minute	15 minute	8/13/10	2010-08-13	2010-08-13	2/13/17	2017-02-13	2017-02-13	7	Seyfried	SAS V9			1	point	Open	Soil	MeasSoilCover, MeasSoilChem, MeasSoilPhys, MeasSoilBiol	soil moisture	Soil Physics				Natural Resources, Earth and Environmental Sciences	geoscientificInformation	no
GB3923	3923	GB	SOIL PHYSICS	l1_jdt2_hydraprobe_wat073	soil water content	%	15 minute	15 minute	8/13/10	2010-08-13	2010-08-13	2/13/17	2017-02-13	2017-02-13	7	Seyfried	SAS V9			1	point	Open	Soil	MeasSoilCover, MeasSoilChem, MeasSoilPhys, MeasSoilBiol	soil moisture	Soil Physics				Natural Resources, Earth and Environmental Sciences	geoscientificInformation	no
GB3924	3924	GB	SOIL PHYSICS	l1_jdt1_hydraprobe_wat090	soil water content	%	15 minute	15 minute	8/13/10	2010-08-13	2010-08-13	2/13/17	2017-02-13	2017-02-13	7	Seyfried	SAS V9			1	point	Open	Soil	MeasSoilCover, MeasSoilChem, MeasSoilPhys, MeasSoilBiol	soil moisture	Soil Physics				Natural Resources, Earth and Environmental Sciences	geoscientificInformation	no
GB3925	3925	GB	SOIL PHYSICS	l1_jdt2_hydraprobe_wat101	soil water content	%	15 minute	15 minute	8/13/10	2010-08-13	2010-08-13	2/13/17	2017-02-13	2017-02-13	7	Seyfried	SAS V9			1	point	Open	Soil	MeasSoilCover, MeasSoilChem, MeasSoilPhys, MeasSoilBiol	soil moisture	Soil Physics				Natural Resources, Earth and Environmental Sciences	geoscientificInformation	no
GB3926	3926	GB	SOIL PHYSICS	l1_jdt1_hydraprobe_wat130	soil water content	%	15 minute	15 minute	8/13/10	2010-08-13	2010-08-13	2/13/17	2017-02-13	2017-02-13	7	Seyfried	SAS V9			1	point	Open	Soil	MeasSoilCover, MeasSoilChem, MeasSoilPhys, MeasSoilBiol	soil moisture	Soil Physics				Natural Resources, Earth and Environmental Sciences	geoscientificInformation	no
GB3927	3927	GB	SOIL PHYSICS	hourly_076_soiltemperature_stm055	soil temperature	°C	1 hour	1 hour	12/22/77	1977-12-22	1977-12-22	7/29/85	1985-07-29	1985-07-29	8	Seyfried	SAS V9			1	point	Open	Soil	MeasSoilCover, MeasSoilChem, MeasSoilPhys, MeasSoilBiol	soil temperature	Soil Physics				Natural Resources, Earth and Environmental Sciences	geoscientificInformation	no
GB3928	3928	GB	SOIL PHYSICS	l1_145c_hydraprobe_wat010u	soil water content	%	15 minute	15 minute	6/22/07	2007-06-22	2007-06-22	4/2/15	2015-04-02	2015-04-02	8	Seyfried	SAS V9			1	point	Open	Soil	MeasSoilCover, MeasSoilChem, MeasSoilPhys, MeasSoilBiol	soil moisture	Soil Physics				Natural Resources, Earth and Environmental Sciences	geoscientificInformation	no
GB3929	3929	GB	SOIL PHYSICS	l1_145c_hydraprobe_wat030u	soil water content	%	15 minute	15 minute	6/22/07	2007-06-22	2007-06-22	4/2/15	2015-04-02	2015-04-02	8	Seyfried	SAS V9			1	point	Open	Soil	MeasSoilCover, MeasSoilChem, MeasSoilPhys, MeasSoilBiol	soil moisture	Soil Physics				Natural Resources, Earth and Environmental Sciences	geoscientificInformation	no
GB3930	3930	GB	SOIL PHYSICS	l1_145c_hydraprobe_wat060u	soil water content	%	15 minute	15 minute	6/22/07	2007-06-22	2007-06-22	4/2/15	2015-04-02	2015-04-02	8	Seyfried	SAS V9			1	point	Open	Soil	MeasSoilCover, MeasSoilChem, MeasSoilPhys, MeasSoilBiol	soil moisture	Soil Physics				Natural Resources, Earth and Environmental Sciences	geoscientificInformation	no
GB3931	3931	GB	SOIL PHYSICS	l1_145c_hydraprobe_wat090u	soil water content	%	15 minute	15 minute	6/22/07	2007-06-22	2007-06-22	4/2/15	2015-04-02	2015-04-02	8	Seyfried	SAS V9			1	point	Open	Soil	MeasSoilCover, MeasSoilChem, MeasSoilPhys, MeasSoilBiol	soil moisture	Soil Physics				Natural Resources, Earth and Environmental Sciences	geoscientificInformation	no
GB3932	3932	GB	SOIL PHYSICS	l1_145c_hydraprobe_wat120u	soil water content	%	15 minute	15 minute	6/22/07	2007-06-22	2007-06-22	4/2/15	2015-04-02	2015-04-02	8	Seyfried	SAS V9			1	point	Open	Soil	MeasSoilCover, MeasSoilChem, MeasSoilPhys, MeasSoilBiol	soil moisture	Soil Physics				Natural Resources, Earth and Environmental Sciences	geoscientificInformation	no
GB3933	3933	GB	SOIL PHYSICS	l1_095b_hydraprobe_wat005	soil water content	%	15 minute	15 minute	3/24/10	2010-03-24	2010-03-24	2/18/18	2018-02-18	2018-02-18	8	Seyfried	SAS V9			1	point	Open	Soil	MeasSoilCover, MeasSoilChem, MeasSoilPhys, MeasSoilBiol	soil moisture	Soil Physics				Natural Resources, Earth and Environmental Sciences	geoscientificInformation	no
GB3934	3934	GB	SOIL PHYSICS	l1_057b_hydraprobe_wat005g	soil water content	%	15 minute	15 minute	11/25/08	2008-11-25	2008-11-25	1/20/17	2017-01-20	2017-01-20	8	Seyfried	SAS V9			1	point	Open	Soil	MeasSoilCover, MeasSoilChem, MeasSoilPhys, MeasSoilBiol	soil moisture	Soil Physics				Natural Resources, Earth and Environmental Sciences	geoscientificInformation	no
GB3935	3935	GB	SOIL PHYSICS	l1_098d_hydraprobe_wat005g	soil water content	%	15 minute	15 minute	11/25/08	2008-11-25	2008-11-25	1/20/17	2017-01-20	2017-01-20	8	Seyfried	SAS V9			1	point	Open	Soil	MeasSoilCover, MeasSoilChem, MeasSoilPhys, MeasSoilBiol	soil moisture	Soil Physics				Natural Resources, Earth and Environmental Sciences	geoscientificInformation	no
GB3936	3936	GB	SOIL PHYSICS	l1_057b_hydraprobe_wat005n	soil water content	%	15 minute	15 minute	11/25/08	2008-11-25	2008-11-25	1/20/17	2017-01-20	2017-01-20	8	Seyfried	SAS V9			1	point	Open	Soil	MeasSoilCover, MeasSoilChem, MeasSoilPhys, MeasSoilBiol	soil moisture	Soil Physics				Natural Resources, Earth and Environmental Sciences	geoscientificInformation	no
GB3937	3937	GB	SOIL PHYSICS	l1_098d_hydraprobe_wat005n	soil water content	%	15 minute	15 minute	11/25/08	2008-11-25	2008-11-25	1/20/17	2017-01-20	2017-01-20	8	Seyfried	SAS V9			1	point	Open	Soil	MeasSoilCover, MeasSoilChem, MeasSoilPhys, MeasSoilBiol	soil moisture	Soil Physics				Natural Resources, Earth and Environmental Sciences	geoscientificInformation	no
GB3938	3938	GB	SOIL PHYSICS	l1_057b_hydraprobe_wat015g	soil water content	%	15 minute	15 minute	11/25/08	2008-11-25	2008-11-25	1/20/17	2017-01-20	2017-01-20	8	Seyfried	SAS V9			1	point	Open	Soil	MeasSoilCover, MeasSoilChem, MeasSoilPhys, MeasSoilBiol	soil moisture	Soil Physics				Natural Resources, Earth and Environmental Sciences	geoscientificInformation	no
GB3939	3939	GB	SOIL PHYSICS	l1_098d_hydraprobe_wat015g	soil water content	%	15 minute	15 minute	11/25/08	2008-11-25	2008-11-25	1/20/17	2017-01-20	2017-01-20	8	Seyfried	SAS V9			1	point	Open	Soil	MeasSoilCover, MeasSoilChem, MeasSoilPhys, MeasSoilBiol	soil moisture	Soil Physics				Natural Resources, Earth and Environmental Sciences	geoscientificInformation	no
GB3940	3940	GB	SOIL PHYSICS	l1_057b_hydraprobe_wat015n	soil water content	%	15 minute	15 minute	11/25/08	2008-11-25	2008-11-25	1/20/17	2017-01-20	2017-01-20	8	Seyfried	SAS V9			1	point	Open	Soil	MeasSoilCover, MeasSoilChem, MeasSoilPhys, MeasSoilBiol	soil moisture	Soil Physics				Natural Resources, Earth and Environmental Sciences	geoscientificInformation	no
GB3941	3941	GB	SOIL PHYSICS	l1_098d_hydraprobe_wat015n	soil water content	%	15 minute	15 minute	11/25/08	2008-11-25	2008-11-25	1/20/17	2017-01-20	2017-01-20	8	Seyfried	SAS V9			1	point	Open	Soil	MeasSoilCover, MeasSoilChem, MeasSoilPhys, MeasSoilBiol	soil moisture	Soil Physics				Natural Resources, Earth and Environmental Sciences	geoscientificInformation	no
GB3942	3942	GB	SOIL PHYSICS	l1_057b_hydraprobe_wat030g	soil water content	%	15 minute	15 minute	11/25/08	2008-11-25	2008-11-25	1/20/17	2017-01-20	2017-01-20	8	Seyfried	SAS V9			1	point	Open	Soil	MeasSoilCover, MeasSoilChem, MeasSoilPhys, MeasSoilBiol	soil moisture	Soil Physics				Natural Resources, Earth and Environmental Sciences	geoscientificInformation	no
GB3943	3943	GB	SOIL PHYSICS	l1_098d_hydraprobe_wat030g	soil water content	%	15 minute	15 minute	11/25/08	2008-11-25	2008-11-25	1/20/17	2017-01-20	2017-01-20	8	Seyfried	SAS V9			1	point	Open	Soil	MeasSoilCover, MeasSoilChem, MeasSoilPhys, MeasSoilBiol	soil moisture	Soil Physics				Natural Resources, Earth and Environmental Sciences	geoscientificInformation	no
GB3944	3944	GB	SOIL PHYSICS	l1_057b_hydraprobe_wat030n	soil water content	%	15 minute	15 minute	11/25/08	2008-11-25	2008-11-25	1/20/17	2017-01-20	2017-01-20	8	Seyfried	SAS V9			1	point	Open	Soil	MeasSoilCover, MeasSoilChem, MeasSoilPhys, MeasSoilBiol	soil moisture	Soil Physics				Natural Resources, Earth and Environmental Sciences	geoscientificInformation	no
GB3945	3945	GB	SOIL PHYSICS	l1_098d_hydraprobe_wat030n	soil water content	%	15 minute	15 minute	11/25/08	2008-11-25	2008-11-25	1/20/17	2017-01-20	2017-01-20	8	Seyfried	SAS V9			1	point	Open	Soil	MeasSoilCover, MeasSoilChem, MeasSoilPhys, MeasSoilBiol	soil moisture	Soil Physics				Natural Resources, Earth and Environmental Sciences	geoscientificInformation	no
GB3946	3946	GB	SOIL PHYSICS	l1_057b_hydraprobe_wat060g	soil water content	%	15 minute	15 minute	11/25/08	2008-11-25	2008-11-25	1/20/17	2017-01-20	2017-01-20	8	Seyfried	SAS V9			1	point	Open	Soil	MeasSoilCover, MeasSoilChem, MeasSoilPhys, MeasSoilBiol	soil moisture	Soil Physics				Natural Resources, Earth and Environmental Sciences	geoscientificInformation	no
GB3947	3947	GB	SOIL PHYSICS	l1_098d_hydraprobe_wat060g	soil water content	%	15 minute	15 minute	11/25/08	2008-11-25	2008-11-25	1/20/17	2017-01-20	2017-01-20	8	Seyfried	SAS V9			1	point	Open	Soil	MeasSoilCover, MeasSoilChem, MeasSoilPhys, MeasSoilBiol	soil moisture	Soil Physics				Natural Resources, Earth and Environmental Sciences	geoscientificInformation	no
GB3948	3948	GB	SOIL PHYSICS	l1_057b_hydraprobe_wat060n	soil water content	%	15 minute	15 minute	11/25/08	2008-11-25	2008-11-25	1/20/17	2017-01-20	2017-01-20	8	Seyfried	SAS V9			1	point	Open	Soil	MeasSoilCover, MeasSoilChem, MeasSoilPhys, MeasSoilBiol	soil moisture	Soil Physics				Natural Resources, Earth and Environmental Sciences	geoscientificInformation	no
GB3949	3949	GB	SOIL PHYSICS	l1_098d_hydraprobe_wat060n	soil water content	%	15 minute	15 minute	11/25/08	2008-11-25	2008-11-25	1/20/17	2017-01-20	2017-01-20	8	Seyfried	SAS V9			1	point	Open	Soil	MeasSoilCover, MeasSoilChem, MeasSoilPhys, MeasSoilBiol	soil moisture	Soil Physics				Natural Resources, Earth and Environmental Sciences	geoscientificInformation	no
GB3950	3950	GB	SOIL PHYSICS	l1_057b_hydraprobe_wat090g	soil water content	%	15 minute	15 minute	11/25/08	2008-11-25	2008-11-25	1/20/17	2017-01-20	2017-01-20	8	Seyfried	SAS V9			1	point	Open	Soil	MeasSoilCover, MeasSoilChem, MeasSoilPhys, MeasSoilBiol	soil moisture	Soil Physics				Natural Resources, Earth and Environmental Sciences	geoscientificInformation	no
GB3951	3951	GB	SOIL PHYSICS	l1_098d_hydraprobe_wat090g	soil water content	%	15 minute	15 minute	11/25/08	2008-11-25	2008-11-25	1/20/17	2017-01-20	2017-01-20	8	Seyfried	SAS V9			1	point	Open	Soil	MeasSoilCover, MeasSoilChem, MeasSoilPhys, MeasSoilBiol	soil moisture	Soil Physics				Natural Resources, Earth and Environmental Sciences	geoscientificInformation	no
GB3952	3952	GB	SOIL PHYSICS	l1_057b_hydraprobe_wat090n	soil water content	%	15 minute	15 minute	11/25/08	2008-11-25	2008-11-25	1/20/17	2017-01-20	2017-01-20	8	Seyfried	SAS V9			1	point	Open	Soil	MeasSoilCover, MeasSoilChem, MeasSoilPhys, MeasSoilBiol	soil moisture	Soil Physics				Natural Resources, Earth and Environmental Sciences	geoscientificInformation	no
GB3953	3953	GB	SOIL PHYSICS	l1_098d_hydraprobe_wat090n	soil water content	%	15 minute	15 minute	11/25/08	2008-11-25	2008-11-25	1/20/17	2017-01-20	2017-01-20	8	Seyfried	SAS V9			1	point	Open	Soil	MeasSoilCover, MeasSoilChem, MeasSoilPhys, MeasSoilBiol	soil moisture	Soil Physics				Natural Resources, Earth and Environmental Sciences	geoscientificInformation	no
GB3954	3954	GB	SOIL PHYSICS	l1_127d_hydraprobe_wat005g	soil water content	%	15 minute	15 minute	11/19/08	2008-11-19	2008-11-19	1/20/17	2017-01-20	2017-01-20	8	Seyfried	SAS V9			1	point	Open	Soil	MeasSoilCover, MeasSoilChem, MeasSoilPhys, MeasSoilBiol	soil moisture	Soil Physics				Natural Resources, Earth and Environmental Sciences	geoscientificInformation	no
GB3955	3955	GB	SOIL PHYSICS	l1_127d_hydraprobe_wat005n	soil water content	%	15 minute	15 minute	11/19/08	2008-11-19	2008-11-19	1/20/17	2017-01-20	2017-01-20	8	Seyfried	SAS V9			1	point	Open	Soil	MeasSoilCover, MeasSoilChem, MeasSoilPhys, MeasSoilBiol	soil moisture	Soil Physics				Natural Resources, Earth and Environmental Sciences	geoscientificInformation	no
GB3956	3956	GB	SOIL PHYSICS	l1_127d_hydraprobe_wat015g	soil water content	%	15 minute	15 minute	11/19/08	2008-11-19	2008-11-19	1/20/17	2017-01-20	2017-01-20	8	Seyfried	SAS V9			1	point	Open	Soil	MeasSoilCover, MeasSoilChem, MeasSoilPhys, MeasSoilBiol	soil moisture	Soil Physics				Natural Resources, Earth and Environmental Sciences	geoscientificInformation	no
GB3957	3957	GB	SOIL PHYSICS	l1_127d_hydraprobe_wat015n	soil water content	%	15 minute	15 minute	11/19/08	2008-11-19	2008-11-19	1/20/17	2017-01-20	2017-01-20	8	Seyfried	SAS V9			1	point	Open	Soil	MeasSoilCover, MeasSoilChem, MeasSoilPhys, MeasSoilBiol	soil moisture	Soil Physics				Natural Resources, Earth and Environmental Sciences	geoscientificInformation	no
GB3958	3958	GB	SOIL PHYSICS	l1_127d_hydraprobe_wat030g	soil water content	%	15 minute	15 minute	11/19/08	2008-11-19	2008-11-19	1/20/17	2017-01-20	2017-01-20	8	Seyfried	SAS V9			1	point	Open	Soil	MeasSoilCover, MeasSoilChem, MeasSoilPhys, MeasSoilBiol	soil moisture	Soil Physics				Natural Resources, Earth and Environmental Sciences	geoscientificInformation	no
GB3959	3959	GB	SOIL PHYSICS	l1_127d_hydraprobe_wat030n	soil water content	%	15 minute	15 minute	11/19/08	2008-11-19	2008-11-19	1/20/17	2017-01-20	2017-01-20	8	Seyfried	SAS V9			1	point	Open	Soil	MeasSoilCover, MeasSoilChem, MeasSoilPhys, MeasSoilBiol	soil moisture	Soil Physics				Natural Resources, Earth and Environmental Sciences	geoscientificInformation	no
GB3960	3960	GB	SOIL PHYSICS	l1_127d_hydraprobe_wat060g	soil water content	%	15 minute	15 minute	11/19/08	2008-11-19	2008-11-19	1/20/17	2017-01-20	2017-01-20	8	Seyfried	SAS V9			1	point	Open	Soil	MeasSoilCover, MeasSoilChem, MeasSoilPhys, MeasSoilBiol	soil moisture	Soil Physics				Natural Resources, Earth and Environmental Sciences	geoscientificInformation	no
GB3961	3961	GB	SOIL PHYSICS	l1_127d_hydraprobe_wat060n	soil water content	%	15 minute	15 minute	11/19/08	2008-11-19	2008-11-19	1/20/17	2017-01-20	2017-01-20	8	Seyfried	SAS V9			1	point	Open	Soil	MeasSoilCover, MeasSoilChem, MeasSoilPhys, MeasSoilBiol	soil moisture	Soil Physics				Natural Resources, Earth and Environmental Sciences	geoscientificInformation	no
GB3962	3962	GB	SOIL PHYSICS	l1_127d_hydraprobe_wat090g	soil water content	%	15 minute	15 minute	11/19/08	2008-11-19	2008-11-19	1/20/17	2017-01-20	2017-01-20	8	Seyfried	SAS V9			1	point	Open	Soil	MeasSoilCover, MeasSoilChem, MeasSoilPhys, MeasSoilBiol	soil moisture	Soil Physics				Natural Resources, Earth and Environmental Sciences	geoscientificInformation	no
GB3963	3963	GB	SOIL PHYSICS	l1_127d_hydraprobe_wat090n	soil water content	%	15 minute	15 minute	11/19/08	2008-11-19	2008-11-19	1/20/17	2017-01-20	2017-01-20	8	Seyfried	SAS V9			1	point	Open	Soil	MeasSoilCover, MeasSoilChem, MeasSoilPhys, MeasSoilBiol	soil moisture	Soil Physics				Natural Resources, Earth and Environmental Sciences	geoscientificInformation	no
GB3964	3964	GB	SOIL PHYSICS	hourly_145c_soiltemperature_stm060bl	soil temperature	°C	1 hour	1 hour	5/8/02	2002-05-08	2002-05-08	8/13/10	2010-08-13	2010-08-13	8	Seyfried	SAS V9			1	point	Open	Soil	MeasSoilCover, MeasSoilChem, MeasSoilPhys, MeasSoilBiol	soil temperature	Soil Physics				Natural Resources, Earth and Environmental Sciences	geoscientificInformation	no
GB3965	3965	GB	SOIL PHYSICS	l1_138i23b_hydraprobe_wat005	soil water content	%	15 minute	15 minute	10/17/06	2006-10-17	2006-10-17	7/21/15	2015-07-21	2015-07-21	9	Seyfried	SAS V9			1	point	Open	Soil	MeasSoilCover, MeasSoilChem, MeasSoilPhys, MeasSoilBiol	soil moisture	Soil Physics				Natural Resources, Earth and Environmental Sciences	geoscientificInformation	no
GB3966	3966	GB	SOIL PHYSICS	l1_138i23b_hydraprobe_wat015	soil water content	%	15 minute	15 minute	10/17/06	2006-10-17	2006-10-17	7/21/15	2015-07-21	2015-07-21	9	Seyfried	SAS V9			1	point	Open	Soil	MeasSoilCover, MeasSoilChem, MeasSoilPhys, MeasSoilBiol	soil moisture	Soil Physics				Natural Resources, Earth and Environmental Sciences	geoscientificInformation	no
GB3967	3967	GB	SOIL PHYSICS	l1_138i23b_hydraprobe_wat031	soil water content	%	15 minute	15 minute	10/17/06	2006-10-17	2006-10-17	7/21/15	2015-07-21	2015-07-21	9	Seyfried	SAS V9			1	point	Open	Soil	MeasSoilCover, MeasSoilChem, MeasSoilPhys, MeasSoilBiol	soil moisture	Soil Physics				Natural Resources, Earth and Environmental Sciences	geoscientificInformation	no
GB3968	3968	GB	SOIL PHYSICS	l1_138i23b_hydraprobe_wat033a	soil water content	%	15 minute	15 minute	10/17/06	2006-10-17	2006-10-17	7/21/15	2015-07-21	2015-07-21	9	Seyfried	SAS V9			1	point	Open	Soil	MeasSoilCover, MeasSoilChem, MeasSoilPhys, MeasSoilBiol	soil moisture	Soil Physics				Natural Resources, Earth and Environmental Sciences	geoscientificInformation	no
GB3969	3969	GB	SOIL PHYSICS	l1_138i23b_hydraprobe_wat059	soil water content	%	15 minute	15 minute	10/17/06	2006-10-17	2006-10-17	7/21/15	2015-07-21	2015-07-21	9	Seyfried	SAS V9			1	point	Open	Soil	MeasSoilCover, MeasSoilChem, MeasSoilPhys, MeasSoilBiol	soil moisture	Soil Physics				Natural Resources, Earth and Environmental Sciences	geoscientificInformation	no
GB3970	3970	GB	SOIL PHYSICS	l1_138i23b_hydraprobe_wat059a	soil water content	%	15 minute	15 minute	10/17/06	2006-10-17	2006-10-17	7/21/15	2015-07-21	2015-07-21	9	Seyfried	SAS V9			1	point	Open	Soil	MeasSoilCover, MeasSoilChem, MeasSoilPhys, MeasSoilBiol	soil moisture	Soil Physics				Natural Resources, Earth and Environmental Sciences	geoscientificInformation	no
GB3971	3971	GB	SOIL PHYSICS	l1_138i23b_hydraprobe_wat086	soil water content	%	15 minute	15 minute	10/17/06	2006-10-17	2006-10-17	7/21/15	2015-07-21	2015-07-21	9	Seyfried	SAS V9			1	point	Open	Soil	MeasSoilCover, MeasSoilChem, MeasSoilPhys, MeasSoilBiol	soil moisture	Soil Physics				Natural Resources, Earth and Environmental Sciences	geoscientificInformation	no
GB3972	3972	GB	SOIL PHYSICS	l1_138i23b_hydraprobe_wat121	soil water content	%	15 minute	15 minute	10/17/06	2006-10-17	2006-10-17	7/21/15	2015-07-21	2015-07-21	9	Seyfried	SAS V9			1	point	Open	Soil	MeasSoilCover, MeasSoilChem, MeasSoilPhys, MeasSoilBiol	soil moisture	Soil Physics				Natural Resources, Earth and Environmental Sciences	geoscientificInformation	no
GB3973	3973	GB	SOIL PHYSICS	hourly_176_soiltemperature_stm240	soil temperature	°C	1 hour	1 hour	10/14/81	1981-10-14	1981-10-14	12/12/90	1990-12-12	1990-12-12	9	Seyfried	SAS V9			1	point	Open	Soil	MeasSoilCover, MeasSoilChem, MeasSoilPhys, MeasSoilBiol	soil temperature	Soil Physics				Natural Resources, Earth and Environmental Sciences	geoscientificInformation	no
GB3974	3974	GB	SOIL PHYSICS	hourly_145c_soiltemperature_stm010ul	soil temperature	°C	1 hour	1 hour	5/31/02	2002-05-31	2002-05-31	7/17/12	2012-07-17	2012-07-17	10	Seyfried	SAS V9			1	point	Open	Soil	MeasSoilCover, MeasSoilChem, MeasSoilPhys, MeasSoilBiol	soil temperature	Soil Physics				Natural Resources, Earth and Environmental Sciences	geoscientificInformation	no
GB3975	3975	GB	SOIL PHYSICS	hourly_145c_soiltemperature_stm010uu	soil temperature	°C	1 hour	1 hour	5/31/02	2002-05-31	2002-05-31	7/17/12	2012-07-17	2012-07-17	10	Seyfried	SAS V9			1	point	Open	Soil	MeasSoilCover, MeasSoilChem, MeasSoilPhys, MeasSoilBiol	soil temperature	Soil Physics				Natural Resources, Earth and Environmental Sciences	geoscientificInformation	no
GB3976	3976	GB	SOIL PHYSICS	hourly_145c_soiltemperature_stm030ul	soil temperature	°C	1 hour	1 hour	5/31/02	2002-05-31	2002-05-31	7/17/12	2012-07-17	2012-07-17	10	Seyfried	SAS V9			1	point	Open	Soil	MeasSoilCover, MeasSoilChem, MeasSoilPhys, MeasSoilBiol	soil temperature	Soil Physics				Natural Resources, Earth and Environmental Sciences	geoscientificInformation	no
GB3977	3977	GB	SOIL PHYSICS	hourly_145c_soiltemperature_stm030uu	soil temperature	°C	1 hour	1 hour	5/31/02	2002-05-31	2002-05-31	7/17/12	2012-07-17	2012-07-17	10	Seyfried	SAS V9			1	point	Open	Soil	MeasSoilCover, MeasSoilChem, MeasSoilPhys, MeasSoilBiol	soil temperature	Soil Physics				Natural Resources, Earth and Environmental Sciences	geoscientificInformation	no
GB3978	3978	GB	SOIL PHYSICS	hourly_145c_soiltemperature_stm060ul	soil temperature	°C	1 hour	1 hour	5/31/02	2002-05-31	2002-05-31	7/17/12	2012-07-17	2012-07-17	10	Seyfried	SAS V9			1	point	Open	Soil	MeasSoilCover, MeasSoilChem, MeasSoilPhys, MeasSoilBiol	soil temperature	Soil Physics				Natural Resources, Earth and Environmental Sciences	geoscientificInformation	no
GB3979	3979	GB	SOIL PHYSICS	hourly_145c_soiltemperature_stm060uu	soil temperature	°C	1 hour	1 hour	5/31/02	2002-05-31	2002-05-31	7/17/12	2012-07-17	2012-07-17	10	Seyfried	SAS V9			1	point	Open	Soil	MeasSoilCover, MeasSoilChem, MeasSoilPhys, MeasSoilBiol	soil temperature	Soil Physics				Natural Resources, Earth and Environmental Sciences	geoscientificInformation	no
GB3980	3980	GB	SOIL PHYSICS	hourly_145c_soiltemperature_stm090ul	soil temperature	°C	1 hour	1 hour	5/31/02	2002-05-31	2002-05-31	7/17/12	2012-07-17	2012-07-17	10	Seyfried	SAS V9			1	point	Open	Soil	MeasSoilCover, MeasSoilChem, MeasSoilPhys, MeasSoilBiol	soil temperature	Soil Physics				Natural Resources, Earth and Environmental Sciences	geoscientificInformation	no
GB3981	3981	GB	SOIL PHYSICS	hourly_145c_soiltemperature_stm090uu	soil temperature	°C	1 hour	1 hour	5/31/02	2002-05-31	2002-05-31	7/17/12	2012-07-17	2012-07-17	10	Seyfried	SAS V9			1	point	Open	Soil	MeasSoilCover, MeasSoilChem, MeasSoilPhys, MeasSoilBiol	soil temperature	Soil Physics				Natural Resources, Earth and Environmental Sciences	geoscientificInformation	no
GB3982	3982	GB	SOIL PHYSICS	hourly_145c_soiltemperature_stm120ul	soil temperature	°C	1 hour	1 hour	5/31/02	2002-05-31	2002-05-31	7/17/12	2012-07-17	2012-07-17	10	Seyfried	SAS V9			1	point	Open	Soil	MeasSoilCover, MeasSoilChem, MeasSoilPhys, MeasSoilBiol	soil temperature	Soil Physics				Natural Resources, Earth and Environmental Sciences	geoscientificInformation	no
GB3983	3983	GB	SOIL PHYSICS	hourly_145c_soiltemperature_stm010bl	soil temperature	°C	1 hour	1 hour	5/8/02	2002-05-08	2002-05-08	7/17/12	2012-07-17	2012-07-17	10	Seyfried	SAS V9			1	point	Open	Soil	MeasSoilCover, MeasSoilChem, MeasSoilPhys, MeasSoilBiol	soil temperature	Soil Physics				Natural Resources, Earth and Environmental Sciences	geoscientificInformation	no
GB3984	3984	GB	SOIL PHYSICS	hourly_145c_soiltemperature_stm010bu	soil temperature	°C	1 hour	1 hour	5/8/02	2002-05-08	2002-05-08	7/17/12	2012-07-17	2012-07-17	10	Seyfried	SAS V9			1	point	Open	Soil	MeasSoilCover, MeasSoilChem, MeasSoilPhys, MeasSoilBiol	soil temperature	Soil Physics				Natural Resources, Earth and Environmental Sciences	geoscientificInformation	no
GB3985	3985	GB	SOIL PHYSICS	hourly_145c_soiltemperature_stm030bl	soil temperature	°C	1 hour	1 hour	5/8/02	2002-05-08	2002-05-08	7/17/12	2012-07-17	2012-07-17	10	Seyfried	SAS V9			1	point	Open	Soil	MeasSoilCover, MeasSoilChem, MeasSoilPhys, MeasSoilBiol	soil temperature	Soil Physics				Natural Resources, Earth and Environmental Sciences	geoscientificInformation	no
GB3986	3986	GB	SOIL PHYSICS	hourly_145c_soiltemperature_stm030bu	soil temperature	°C	1 hour	1 hour	5/8/02	2002-05-08	2002-05-08	7/17/12	2012-07-17	2012-07-17	10	Seyfried	SAS V9			1	point	Open	Soil	MeasSoilCover, MeasSoilChem, MeasSoilPhys, MeasSoilBiol	soil temperature	Soil Physics				Natural Resources, Earth and Environmental Sciences	geoscientificInformation	no
GB3987	3987	GB	SOIL PHYSICS	hourly_145c_soiltemperature_stm060bu	soil temperature	°C	1 hour	1 hour	5/8/02	2002-05-08	2002-05-08	7/17/12	2012-07-17	2012-07-17	10	Seyfried	SAS V9			1	point	Open	Soil	MeasSoilCover, MeasSoilChem, MeasSoilPhys, MeasSoilBiol	soil temperature	Soil Physics				Natural Resources, Earth and Environmental Sciences	geoscientificInformation	no
GB3988	3988	GB	SOIL PHYSICS	hourly_145c_soiltemperature_stm090bl	soil temperature	°C	1 hour	1 hour	5/8/02	2002-05-08	2002-05-08	7/17/12	2012-07-17	2012-07-17	10	Seyfried	SAS V9			1	point	Open	Soil	MeasSoilCover, MeasSoilChem, MeasSoilPhys, MeasSoilBiol	soil temperature	Soil Physics				Natural Resources, Earth and Environmental Sciences	geoscientificInformation	no
GB3989	3989	GB	SOIL PHYSICS	hourly_145c_soiltemperature_stm090bu	soil temperature	°C	1 hour	1 hour	5/8/02	2002-05-08	2002-05-08	7/17/12	2012-07-17	2012-07-17	10	Seyfried	SAS V9			1	point	Open	Soil	MeasSoilCover, MeasSoilChem, MeasSoilPhys, MeasSoilBiol	soil temperature	Soil Physics				Natural Resources, Earth and Environmental Sciences	geoscientificInformation	no
GB3990	3990	GB	SOIL PHYSICS	hourly_145c_soiltemperature_stm120bl	soil temperature	°C	1 hour	1 hour	5/8/02	2002-05-08	2002-05-08	7/17/12	2012-07-17	2012-07-17	10	Seyfried	SAS V9			1	point	Open	Soil	MeasSoilCover, MeasSoilChem, MeasSoilPhys, MeasSoilBiol	soil temperature	Soil Physics				Natural Resources, Earth and Environmental Sciences	geoscientificInformation	no
GB3991	3991	GB	SOIL PHYSICS	hourly_145c_soiltemperature_stm120bu	soil temperature	°C	1 hour	1 hour	5/8/02	2002-05-08	2002-05-08	7/17/12	2012-07-17	2012-07-17	10	Seyfried	SAS V9			1	point	Open	Soil	MeasSoilCover, MeasSoilChem, MeasSoilPhys, MeasSoilBiol	soil temperature	Soil Physics				Natural Resources, Earth and Environmental Sciences	geoscientificInformation	no
GB3992	3992	GB	SOIL PHYSICS	hourly_057_soiltemperature_stm240	soil temperature	°C	1 hour	1 hour	3/27/81	1981-03-27	1981-03-27	6/11/91	1991-06-11	1991-06-11	10	Seyfried	SAS V9			1	point	Open	Soil	MeasSoilCover, MeasSoilChem, MeasSoilPhys, MeasSoilBiol	soil temperature	Soil Physics				Natural Resources, Earth and Environmental Sciences	geoscientificInformation	no
GB3993	3993	GB	SOIL PHYSICS	hourly_098b_soiltemperature_stm005e	soil temperature	°C	1 hour	1 hour	10/6/89	1989-10-06	1989-10-06	8/30/00	2000-08-30	2000-08-30	11	Seyfried	SAS V9			1	point	Open	Soil	MeasSoilCover, MeasSoilChem, MeasSoilPhys, MeasSoilBiol	soil temperature	Soil Physics				Natural Resources, Earth and Environmental Sciences	geoscientificInformation	no
GB3994	3994	GB	SOIL PHYSICS	hourly_098b_soiltemperature_stm010fc	soil temperature	°C	1 hour	1 hour	10/6/89	1989-10-06	1989-10-06	9/9/00	2000-09-09	2000-09-09	11	Seyfried	SAS V9			1	point	Open	Soil	MeasSoilCover, MeasSoilChem, MeasSoilPhys, MeasSoilBiol	soil temperature	Soil Physics				Natural Resources, Earth and Environmental Sciences	geoscientificInformation	no
GB3995	3995	GB	SOIL PHYSICS	hourly_098b_soiltemperature_stm010fg	soil temperature	°C	1 hour	1 hour	10/6/89	1989-10-06	1989-10-06	9/9/00	2000-09-09	2000-09-09	11	Seyfried	SAS V9			1	point	Open	Soil	MeasSoilCover, MeasSoilChem, MeasSoilPhys, MeasSoilBiol	soil temperature	Soil Physics				Natural Resources, Earth and Environmental Sciences	geoscientificInformation	no
GB3996	3996	GB	SOIL PHYSICS	hourly_098b_soiltemperature_stm005fc	soil temperature	°C	1 hour	1 hour	10/6/89	1989-10-06	1989-10-06	9/20/00	2000-09-20	2000-09-20	11	Seyfried	SAS V9			1	point	Open	Soil	MeasSoilCover, MeasSoilChem, MeasSoilPhys, MeasSoilBiol	soil temperature	Soil Physics				Natural Resources, Earth and Environmental Sciences	geoscientificInformation	no
GB3997	3997	GB	SOIL PHYSICS	l1_smg1_hydraprobe_wat005	soil water content	%	15 minute	15 minute	5/4/06	2006-05-04	2006-05-04	2/3/18	2018-02-03	2018-02-03	12	Seyfried	SAS V9			1	point	Open	Soil	MeasSoilCover, MeasSoilChem, MeasSoilPhys, MeasSoilBiol	soil moisture	Soil Physics				Natural Resources, Earth and Environmental Sciences	geoscientificInformation	no
GB3998	3998	GB	SOIL PHYSICS	l1_076_hydraprobe_wat005	soil water content	%	15 minute	15 minute	5/2/06	2006-05-02	2006-05-02	2/18/18	2018-02-18	2018-02-18	12	Seyfried	SAS V9			1	point	Open	Soil	MeasSoilCover, MeasSoilChem, MeasSoilPhys, MeasSoilBiol	soil moisture	Soil Physics				Natural Resources, Earth and Environmental Sciences	geoscientificInformation	no
GB3999	3999	GB	SOIL PHYSICS	hourly_13803_soiltemperature_stm005	soil temperature	°C	1 hour	1 hour	12/19/84	1984-12-19	1984-12-19	11/13/96	1996-11-13	1996-11-13	12	Seyfried	SAS V9			1	point	Open	Soil	MeasSoilCover, MeasSoilChem, MeasSoilPhys, MeasSoilBiol	soil temperature	Soil Physics				Natural Resources, Earth and Environmental Sciences	geoscientificInformation	no
GB4000	4000	GB	SOIL PHYSICS	hourly_13803_soiltemperature_stm010	soil temperature	°C	1 hour	1 hour	12/19/84	1984-12-19	1984-12-19	11/13/96	1996-11-13	1996-11-13	12	Seyfried	SAS V9			1	point	Open	Soil	MeasSoilCover, MeasSoilChem, MeasSoilPhys, MeasSoilBiol	soil temperature	Soil Physics				Natural Resources, Earth and Environmental Sciences	geoscientificInformation	no
GB4001	4001	GB	SOIL PHYSICS	hourly_13803_soiltemperature_stm015	soil temperature	°C	1 hour	1 hour	12/19/84	1984-12-19	1984-12-19	11/13/96	1996-11-13	1996-11-13	12	Seyfried	SAS V9			1	point	Open	Soil	MeasSoilCover, MeasSoilChem, MeasSoilPhys, MeasSoilBiol	soil temperature	Soil Physics				Natural Resources, Earth and Environmental Sciences	geoscientificInformation	no
GB4002	4002	GB	SOIL PHYSICS	hourly_13803_soiltemperature_stm020	soil temperature	°C	1 hour	1 hour	12/19/84	1984-12-19	1984-12-19	11/13/96	1996-11-13	1996-11-13	12	Seyfried	SAS V9			1	point	Open	Soil	MeasSoilCover, MeasSoilChem, MeasSoilPhys, MeasSoilBiol	soil temperature	Soil Physics				Natural Resources, Earth and Environmental Sciences	geoscientificInformation	no
GB4003	4003	GB	SOIL PHYSICS	hourly_13803_soiltemperature_stm030	soil temperature	°C	1 hour	1 hour	12/19/84	1984-12-19	1984-12-19	11/13/96	1996-11-13	1996-11-13	12	Seyfried	SAS V9			1	point	Open	Soil	MeasSoilCover, MeasSoilChem, MeasSoilPhys, MeasSoilBiol	soil temperature	Soil Physics				Natural Resources, Earth and Environmental Sciences	geoscientificInformation	no
GB4004	4004	GB	SOIL PHYSICS	l1_116c_hydraprobe_wat005	soil water content	%	15 minute	15 minute	3/20/06	2006-03-20	2006-03-20	2/18/18	2018-02-18	2018-02-18	12	Seyfried	SAS V9			1	point	Open	Soil	MeasSoilCover, MeasSoilChem, MeasSoilPhys, MeasSoilBiol	soil moisture	Soil Physics				Natural Resources, Earth and Environmental Sciences	geoscientificInformation	no
GB4005	4005	GB	SOIL PHYSICS	l1_127_hydraprobe_wat005	soil water content	%	15 minute	15 minute	3/20/06	2006-03-20	2006-03-20	2/18/18	2018-02-18	2018-02-18	12	Seyfried	SAS V9			1	point	Open	Soil	MeasSoilCover, MeasSoilChem, MeasSoilPhys, MeasSoilBiol	soil moisture	Soil Physics				Natural Resources, Earth and Environmental Sciences	geoscientificInformation	no
GB4006	4006	GB	SOIL PHYSICS	l1_147_hydraprobe_wat005	soil water content	%	15 minute	15 minute	3/20/06	2006-03-20	2006-03-20	2/18/18	2018-02-18	2018-02-18	12	Seyfried	SAS V9			1	point	Open	Soil	MeasSoilCover, MeasSoilChem, MeasSoilPhys, MeasSoilBiol	soil moisture	Soil Physics				Natural Resources, Earth and Environmental Sciences	geoscientificInformation	no
GB4007	4007	GB	SOIL PHYSICS	l1_155_hydraprobe_wat005	soil water content	%	15 minute	15 minute	3/20/06	2006-03-20	2006-03-20	2/18/18	2018-02-18	2018-02-18	12	Seyfried	SAS V9			1	point	Open	Soil	MeasSoilCover, MeasSoilChem, MeasSoilPhys, MeasSoilBiol	soil moisture	Soil Physics				Natural Resources, Earth and Environmental Sciences	geoscientificInformation	no
GB4008	4008	GB	SOIL PHYSICS	l1_176c_hydraprobe_wat015a	soil water content	%	15 minute	15 minute	12/29/04	2004-12-29	2004-12-29	1/27/17	2017-01-27	2017-01-27	12	Seyfried	SAS V9			1	point	Open	Soil	MeasSoilCover, MeasSoilChem, MeasSoilPhys, MeasSoilBiol	soil moisture	Soil Physics				Natural Resources, Earth and Environmental Sciences	geoscientificInformation	no
GB4009	4009	GB	SOIL PHYSICS	l1_176c_hydraprobe_wat030a	soil water content	%	15 minute	15 minute	12/29/04	2004-12-29	2004-12-29	1/27/17	2017-01-27	2017-01-27	12	Seyfried	SAS V9			1	point	Open	Soil	MeasSoilCover, MeasSoilChem, MeasSoilPhys, MeasSoilBiol	soil moisture	Soil Physics				Natural Resources, Earth and Environmental Sciences	geoscientificInformation	no
GB4010	4010	GB	SOIL PHYSICS	l1_176c_hydraprobe_wat052a	soil water content	%	15 minute	15 minute	12/29/04	2004-12-29	2004-12-29	1/27/17	2017-01-27	2017-01-27	12	Seyfried	SAS V9			1	point	Open	Soil	MeasSoilCover, MeasSoilChem, MeasSoilPhys, MeasSoilBiol	soil moisture	Soil Physics				Natural Resources, Earth and Environmental Sciences	geoscientificInformation	no
GB4011	4011	GB	SOIL PHYSICS	l1_176c_hydraprobe_wat078a	soil water content	%	15 minute	15 minute	12/29/04	2004-12-29	2004-12-29	1/27/17	2017-01-27	2017-01-27	12	Seyfried	SAS V9			1	point	Open	Soil	MeasSoilCover, MeasSoilChem, MeasSoilPhys, MeasSoilBiol	soil moisture	Soil Physics				Natural Resources, Earth and Environmental Sciences	geoscientificInformation	no
GB4012	4012	GB	SOIL PHYSICS	l1_176c_hydraprobe_wat097a	soil water content	%	15 minute	15 minute	12/29/04	2004-12-29	2004-12-29	1/27/17	2017-01-27	2017-01-27	12	Seyfried	SAS V9			1	point	Open	Soil	MeasSoilCover, MeasSoilChem, MeasSoilPhys, MeasSoilBiol	soil moisture	Soil Physics				Natural Resources, Earth and Environmental Sciences	geoscientificInformation	no
GB4013	4013	GB	SOIL PHYSICS	hourly_098b_soiltemperature_stm010e	soil temperature	°C	1 hour	1 hour	10/6/89	1989-10-06	1989-10-06	12/7/01	2001-12-07	2001-12-07	12	Seyfried	SAS V9			1	point	Open	Soil	MeasSoilCover, MeasSoilChem, MeasSoilPhys, MeasSoilBiol	soil temperature	Soil Physics				Natural Resources, Earth and Environmental Sciences	geoscientificInformation	no
GB4014	4014	GB	SOIL PHYSICS	hourly_138j10_soiltemperature_stm005	soil temperature	°C	1 hour	1 hour	2/3/84	1984-02-03	1984-02-03	9/24/96	1996-09-24	1996-09-24	13	Seyfried	SAS V9			1	point	Open	Soil	MeasSoilCover, MeasSoilChem, MeasSoilPhys, MeasSoilBiol	soil temperature	Soil Physics				Natural Resources, Earth and Environmental Sciences	geoscientificInformation	no
GB4015	4015	GB	SOIL PHYSICS	hourly_138j10_soiltemperature_stm010	soil temperature	°C	1 hour	1 hour	2/3/84	1984-02-03	1984-02-03	9/24/96	1996-09-24	1996-09-24	13	Seyfried	SAS V9			1	point	Open	Soil	MeasSoilCover, MeasSoilChem, MeasSoilPhys, MeasSoilBiol	soil temperature	Soil Physics				Natural Resources, Earth and Environmental Sciences	geoscientificInformation	no
GB4016	4016	GB	SOIL PHYSICS	hourly_138j10_soiltemperature_stm015	soil temperature	°C	1 hour	1 hour	2/3/84	1984-02-03	1984-02-03	9/24/96	1996-09-24	1996-09-24	13	Seyfried	SAS V9			1	point	Open	Soil	MeasSoilCover, MeasSoilChem, MeasSoilPhys, MeasSoilBiol	soil temperature	Soil Physics				Natural Resources, Earth and Environmental Sciences	geoscientificInformation	no
GB4017	4017	GB	SOIL PHYSICS	hourly_138j10_soiltemperature_stm020	soil temperature	°C	1 hour	1 hour	2/3/84	1984-02-03	1984-02-03	9/24/96	1996-09-24	1996-09-24	13	Seyfried	SAS V9			1	point	Open	Soil	MeasSoilCover, MeasSoilChem, MeasSoilPhys, MeasSoilBiol	soil temperature	Soil Physics				Natural Resources, Earth and Environmental Sciences	geoscientificInformation	no
GB4018	4018	GB	SOIL PHYSICS	hourly_138j10_soiltemperature_stm030	soil temperature	°C	1 hour	1 hour	2/3/84	1984-02-03	1984-02-03	9/24/96	1996-09-24	1996-09-24	13	Seyfried	SAS V9			1	point	Open	Soil	MeasSoilCover, MeasSoilChem, MeasSoilPhys, MeasSoilBiol	soil temperature	Soil Physics				Natural Resources, Earth and Environmental Sciences	geoscientificInformation	no
GB4019	4019	GB	SOIL PHYSICS	hourly_098b_soiltemperature_stm060d	soil temperature	°C	1 hour	1 hour	10/6/89	1989-10-06	1989-10-06	9/15/03	2003-09-15	2003-09-15	14	Seyfried	SAS V9			1	point	Open	Soil	MeasSoilCover, MeasSoilChem, MeasSoilPhys, MeasSoilBiol	soil temperature	Soil Physics				Natural Resources, Earth and Environmental Sciences	geoscientificInformation	no
GB4020	4020	GB	SOIL PHYSICS	hourly_138f06_soiltemperature_stm010wa	soil temperature	°C	1 hour	1 hour	10/1/03	2003-10-01	2003-10-01	1/7/19	2019-01-07	2019-01-07	15	Seyfried	SAS V9			1	point	Open	Soil	MeasSoilCover, MeasSoilChem, MeasSoilPhys, MeasSoilBiol	soil temperature	Soil Physics				Natural Resources, Earth and Environmental Sciences	geoscientificInformation	no
GB4021	4021	GB	SOIL PHYSICS	hourly_138f06_soiltemperature_stm010wh	soil temperature	°C	1 hour	1 hour	10/1/03	2003-10-01	2003-10-01	1/7/19	2019-01-07	2019-01-07	15	Seyfried	SAS V9			1	point	Open	Soil	MeasSoilCover, MeasSoilChem, MeasSoilPhys, MeasSoilBiol	soil temperature	Soil Physics				Natural Resources, Earth and Environmental Sciences	geoscientificInformation	no
GB4022	4022	GB	SOIL PHYSICS	hourly_138f06_soiltemperature_stm030wa	soil temperature	°C	1 hour	1 hour	10/1/03	2003-10-01	2003-10-01	1/7/19	2019-01-07	2019-01-07	15	Seyfried	SAS V9			1	point	Open	Soil	MeasSoilCover, MeasSoilChem, MeasSoilPhys, MeasSoilBiol	soil temperature	Soil Physics				Natural Resources, Earth and Environmental Sciences	geoscientificInformation	no
GB4023	4023	GB	SOIL PHYSICS	hourly_138f06_soiltemperature_stm030wh	soil temperature	°C	1 hour	1 hour	10/1/03	2003-10-01	2003-10-01	1/7/19	2019-01-07	2019-01-07	15	Seyfried	SAS V9			1	point	Open	Soil	MeasSoilCover, MeasSoilChem, MeasSoilPhys, MeasSoilBiol	soil temperature	Soil Physics				Natural Resources, Earth and Environmental Sciences	geoscientificInformation	no
GB4024	4024	GB	SOIL PHYSICS	hourly_138f06_soiltemperature_stm060wa	soil temperature	°C	1 hour	1 hour	10/1/03	2003-10-01	2003-10-01	1/7/19	2019-01-07	2019-01-07	15	Seyfried	SAS V9			1	point	Open	Soil	MeasSoilCover, MeasSoilChem, MeasSoilPhys, MeasSoilBiol	soil temperature	Soil Physics				Natural Resources, Earth and Environmental Sciences	geoscientificInformation	no
GB4025	4025	GB	SOIL PHYSICS	hourly_138f06_soiltemperature_stm060wh	soil temperature	°C	1 hour	1 hour	10/1/03	2003-10-01	2003-10-01	1/7/19	2019-01-07	2019-01-07	15	Seyfried	SAS V9			1	point	Open	Soil	MeasSoilCover, MeasSoilChem, MeasSoilPhys, MeasSoilBiol	soil temperature	Soil Physics				Natural Resources, Earth and Environmental Sciences	geoscientificInformation	no
GB4026	4026	GB	SOIL PHYSICS	hourly_138f06_soiltemperature_stm090wa	soil temperature	°C	1 hour	1 hour	10/1/03	2003-10-01	2003-10-01	1/7/19	2019-01-07	2019-01-07	15	Seyfried	SAS V9			1	point	Open	Soil	MeasSoilCover, MeasSoilChem, MeasSoilPhys, MeasSoilBiol	soil temperature	Soil Physics				Natural Resources, Earth and Environmental Sciences	geoscientificInformation	no
GB4027	4027	GB	SOIL PHYSICS	hourly_138f06_soiltemperature_stm090wh	soil temperature	°C	1 hour	1 hour	10/1/03	2003-10-01	2003-10-01	1/7/19	2019-01-07	2019-01-07	15	Seyfried	SAS V9			1	point	Open	Soil	MeasSoilCover, MeasSoilChem, MeasSoilPhys, MeasSoilBiol	soil temperature	Soil Physics				Natural Resources, Earth and Environmental Sciences	geoscientificInformation	no
GB4028	4028	GB	SOIL PHYSICS	hourly_138f06_soiltemperature_stm120wa	soil temperature	°C	1 hour	1 hour	10/1/03	2003-10-01	2003-10-01	1/7/19	2019-01-07	2019-01-07	15	Seyfried	SAS V9			1	point	Open	Soil	MeasSoilCover, MeasSoilChem, MeasSoilPhys, MeasSoilBiol	soil temperature	Soil Physics				Natural Resources, Earth and Environmental Sciences	geoscientificInformation	no
GB4029	4029	GB	SOIL PHYSICS	hourly_138f06_soiltemperature_stm120wh	soil temperature	°C	1 hour	1 hour	10/1/03	2003-10-01	2003-10-01	1/7/19	2019-01-07	2019-01-07	15	Seyfried	SAS V9			1	point	Open	Soil	MeasSoilCover, MeasSoilChem, MeasSoilPhys, MeasSoilBiol	soil temperature	Soil Physics				Natural Resources, Earth and Environmental Sciences	geoscientificInformation	no
GB4030	4030	GB	SOIL PHYSICS	hourly_138f06_soiltemperature_stm150wa	soil temperature	°C	1 hour	1 hour	10/1/03	2003-10-01	2003-10-01	1/7/19	2019-01-07	2019-01-07	15	Seyfried	SAS V9			1	point	Open	Soil	MeasSoilCover, MeasSoilChem, MeasSoilPhys, MeasSoilBiol	soil temperature	Soil Physics				Natural Resources, Earth and Environmental Sciences	geoscientificInformation	no
GB4031	4031	GB	SOIL PHYSICS	hourly_138f06_soiltemperature_stm150wh	soil temperature	°C	1 hour	1 hour	10/1/03	2003-10-01	2003-10-01	1/7/19	2019-01-07	2019-01-07	15	Seyfried	SAS V9			1	point	Open	Soil	MeasSoilCover, MeasSoilChem, MeasSoilPhys, MeasSoilBiol	soil temperature	Soil Physics				Natural Resources, Earth and Environmental Sciences	geoscientificInformation	no
GB4032	4032	GB	SOIL PHYSICS	hourly_138f06_soiltemperature_stm180wa	soil temperature	°C	1 hour	1 hour	10/1/03	2003-10-01	2003-10-01	1/7/19	2019-01-07	2019-01-07	15	Seyfried	SAS V9			1	point	Open	Soil	MeasSoilCover, MeasSoilChem, MeasSoilPhys, MeasSoilBiol	soil temperature	Soil Physics				Natural Resources, Earth and Environmental Sciences	geoscientificInformation	no
GB4033	4033	GB	SOIL PHYSICS	hourly_138f06_soiltemperature_stm210wa	soil temperature	°C	1 hour	1 hour	10/1/03	2003-10-01	2003-10-01	1/7/19	2019-01-07	2019-01-07	15	Seyfried	SAS V9			1	point	Open	Soil	MeasSoilCover, MeasSoilChem, MeasSoilPhys, MeasSoilBiol	soil temperature	Soil Physics				Natural Resources, Earth and Environmental Sciences	geoscientificInformation	no
GB4034	4034	GB	SOIL PHYSICS	hourly_138f06_soiltemperature_stm010wla	soil temperature	°C	1 hour	1 hour	10/1/03	2003-10-01	2003-10-01	1/31/19	2019-01-31	2019-01-31	15	Seyfried	SAS V9			1	point	Open	Soil	MeasSoilCover, MeasSoilChem, MeasSoilPhys, MeasSoilBiol	soil temperature	Soil Physics				Natural Resources, Earth and Environmental Sciences	geoscientificInformation	no
GB4035	4035	GB	SOIL PHYSICS	hourly_138f06_soiltemperature_stm030wla	soil temperature	°C	1 hour	1 hour	10/1/03	2003-10-01	2003-10-01	1/31/19	2019-01-31	2019-01-31	15	Seyfried	SAS V9			1	point	Open	Soil	MeasSoilCover, MeasSoilChem, MeasSoilPhys, MeasSoilBiol	soil temperature	Soil Physics				Natural Resources, Earth and Environmental Sciences	geoscientificInformation	no
GB4036	4036	GB	SOIL PHYSICS	hourly_138f06_soiltemperature_stm060wla	soil temperature	°C	1 hour	1 hour	10/1/03	2003-10-01	2003-10-01	1/31/19	2019-01-31	2019-01-31	15	Seyfried	SAS V9			1	point	Open	Soil	MeasSoilCover, MeasSoilChem, MeasSoilPhys, MeasSoilBiol	soil temperature	Soil Physics				Natural Resources, Earth and Environmental Sciences	geoscientificInformation	no
GB4037	4037	GB	SOIL PHYSICS	hourly_138f06_soiltemperature_stm090wla	soil temperature	°C	1 hour	1 hour	10/1/03	2003-10-01	2003-10-01	1/31/19	2019-01-31	2019-01-31	15	Seyfried	SAS V9			1	point	Open	Soil	MeasSoilCover, MeasSoilChem, MeasSoilPhys, MeasSoilBiol	soil temperature	Soil Physics				Natural Resources, Earth and Environmental Sciences	geoscientificInformation	no
GB4038	4038	GB	SOIL PHYSICS	hourly_098b_soiltemperature_stm040d	soil temperature	°C	1 hour	1 hour	10/6/89	1989-10-06	1989-10-06	2/11/05	2005-02-11	2005-02-11	15	Seyfried	SAS V9			1	point	Open	Soil	MeasSoilCover, MeasSoilChem, MeasSoilPhys, MeasSoilBiol	soil temperature	Soil Physics				Natural Resources, Earth and Environmental Sciences	geoscientificInformation	no
GB4039	4039	GB	SOIL PHYSICS	hourly_098b_soiltemperature_stm050d	soil temperature	°C	1 hour	1 hour	10/6/89	1989-10-06	1989-10-06	2/11/05	2005-02-11	2005-02-11	15	Seyfried	SAS V9			1	point	Open	Soil	MeasSoilCover, MeasSoilChem, MeasSoilPhys, MeasSoilBiol	soil temperature	Soil Physics				Natural Resources, Earth and Environmental Sciences	geoscientificInformation	no
GB4040	4040	GB	SOIL PHYSICS	hourly_rmsp2_soiltemperature_stm023	soil temperature	°C	1 hour	1 hour	1/1/99	1999-01-01	1999-01-01	10/8/14	2014-10-08	2014-10-08	16	Seyfried	SAS V9			1	point	Open	Soil	MeasSoilCover, MeasSoilChem, MeasSoilPhys, MeasSoilBiol	soil temperature	Soil Physics				Natural Resources, Earth and Environmental Sciences	geoscientificInformation	no
GB4041	4041	GB	SOIL PHYSICS	hourly_rmsp2_soiltemperature_stm030	soil temperature	°C	1 hour	1 hour	1/1/99	1999-01-01	1999-01-01	10/8/14	2014-10-08	2014-10-08	16	Seyfried	SAS V9			1	point	Open	Soil	MeasSoilCover, MeasSoilChem, MeasSoilPhys, MeasSoilBiol	soil temperature	Soil Physics				Natural Resources, Earth and Environmental Sciences	geoscientificInformation	no
GB4042	4042	GB	SOIL PHYSICS	hourly_rmsp2_soiltemperature_stm074a	soil temperature	°C	1 hour	1 hour	1/1/99	1999-01-01	1999-01-01	10/8/14	2014-10-08	2014-10-08	16	Seyfried	SAS V9			1	point	Open	Soil	MeasSoilCover, MeasSoilChem, MeasSoilPhys, MeasSoilBiol	soil temperature	Soil Physics				Natural Resources, Earth and Environmental Sciences	geoscientificInformation	no
GB4043	4043	GB	SOIL PHYSICS	hourly_rmsp2_soiltemperature_stm074b	soil temperature	°C	1 hour	1 hour	1/1/99	1999-01-01	1999-01-01	10/8/14	2014-10-08	2014-10-08	16	Seyfried	SAS V9			1	point	Open	Soil	MeasSoilCover, MeasSoilChem, MeasSoilPhys, MeasSoilBiol	soil temperature	Soil Physics				Natural Resources, Earth and Environmental Sciences	geoscientificInformation	no
GB4044	4044	GB	SOIL PHYSICS	hourly_rmsp2_soiltemperature_stm081a	soil temperature	°C	1 hour	1 hour	1/1/99	1999-01-01	1999-01-01	10/8/14	2014-10-08	2014-10-08	16	Seyfried	SAS V9			1	point	Open	Soil	MeasSoilCover, MeasSoilChem, MeasSoilPhys, MeasSoilBiol	soil temperature	Soil Physics				Natural Resources, Earth and Environmental Sciences	geoscientificInformation	no
GB4045	4045	GB	SOIL PHYSICS	hourly_rmsp2_soiltemperature_stm081b	soil temperature	°C	1 hour	1 hour	1/1/99	1999-01-01	1999-01-01	10/8/14	2014-10-08	2014-10-08	16	Seyfried	SAS V9			1	point	Open	Soil	MeasSoilCover, MeasSoilChem, MeasSoilPhys, MeasSoilBiol	soil temperature	Soil Physics				Natural Resources, Earth and Environmental Sciences	geoscientificInformation	no
GB4046	4046	GB	SOIL PHYSICS	hourly_rmsp2_soiltemperature_stm112	soil temperature	°C	1 hour	1 hour	1/1/99	1999-01-01	1999-01-01	10/8/14	2014-10-08	2014-10-08	16	Seyfried	SAS V9			1	point	Open	Soil	MeasSoilCover, MeasSoilChem, MeasSoilPhys, MeasSoilBiol	soil temperature	Soil Physics				Natural Resources, Earth and Environmental Sciences	geoscientificInformation	no
GB4047	4047	GB	SOIL PHYSICS	hourly_rmsp2_soiltemperature_stm119	soil temperature	°C	1 hour	1 hour	1/1/99	1999-01-01	1999-01-01	10/8/14	2014-10-08	2014-10-08	16	Seyfried	SAS V9			1	point	Open	Soil	MeasSoilCover, MeasSoilChem, MeasSoilPhys, MeasSoilBiol	soil temperature	Soil Physics				Natural Resources, Earth and Environmental Sciences	geoscientificInformation	no
GB4048	4048	GB	SOIL PHYSICS	l1_098c_hydraprobe_wat005	soil water content	%	15 minute	15 minute	2/8/02	2002-02-08	2002-02-08	2/18/18	2018-02-18	2018-02-18	16	Seyfried	SAS V9			1	point	Open	Soil	MeasSoilCover, MeasSoilChem, MeasSoilPhys, MeasSoilBiol	soil moisture	Soil Physics				Natural Resources, Earth and Environmental Sciences	geoscientificInformation	no
GB4049	4049	GB	SOIL PHYSICS	l1_145_hydraprobe_wat005	soil water content	%	15 minute	15 minute	1/2/02	2002-01-02	2002-01-02	2/18/18	2018-02-18	2018-02-18	16	Seyfried	SAS V9			1	point	Open	Soil	MeasSoilCover, MeasSoilChem, MeasSoilPhys, MeasSoilBiol	soil moisture	Soil Physics				Natural Resources, Earth and Environmental Sciences	geoscientificInformation	no
GB4050	4050	GB	SOIL PHYSICS	l1_176_hydraprobe_wat005	soil water content	%	15 minute	15 minute	1/2/02	2002-01-02	2002-01-02	2/18/18	2018-02-18	2018-02-18	16	Seyfried	SAS V9			1	point	Open	Soil	MeasSoilCover, MeasSoilChem, MeasSoilPhys, MeasSoilBiol	soil moisture	Soil Physics				Natural Resources, Earth and Environmental Sciences	geoscientificInformation	no
GB4051	4051	GB	SOIL PHYSICS	l1_13803_hydraprobe_wat005	soil water content	%	15 minute	15 minute	12/13/01	2001-12-13	2001-12-13	2/18/18	2018-02-18	2018-02-18	16	Seyfried	SAS V9			1	point	Open	Soil	MeasSoilCover, MeasSoilChem, MeasSoilPhys, MeasSoilBiol	soil moisture	Soil Physics				Natural Resources, Earth and Environmental Sciences	geoscientificInformation	no
GB4052	4052	GB	SOIL PHYSICS	l1_174_hydraprobe_wat005	soil water content	%	15 minute	15 minute	11/22/01	2001-11-22	2001-11-22	2/18/18	2018-02-18	2018-02-18	16	Seyfried	SAS V9			1	point	Open	Soil	MeasSoilCover, MeasSoilChem, MeasSoilPhys, MeasSoilBiol	soil moisture	Soil Physics				Natural Resources, Earth and Environmental Sciences	geoscientificInformation	no
GB4053	4053	GB	SOIL PHYSICS	l1_031_hydraprobe_wat005	soil water content	%	15 minute	15 minute	11/7/01	2001-11-07	2001-11-07	2/15/18	2018-02-15	2018-02-15	16	Seyfried	SAS V9			1	point	Open	Soil	MeasSoilCover, MeasSoilChem, MeasSoilPhys, MeasSoilBiol	soil moisture	Soil Physics				Natural Resources, Earth and Environmental Sciences	geoscientificInformation	no
GB4054	4054	GB	SOIL PHYSICS	l1_012_hydraprobe_wat005	soil water content	%	15 minute	15 minute	11/7/01	2001-11-07	2001-11-07	2/17/18	2018-02-17	2018-02-17	16	Seyfried	SAS V9			1	point	Open	Soil	MeasSoilCover, MeasSoilChem, MeasSoilPhys, MeasSoilBiol	soil moisture	Soil Physics				Natural Resources, Earth and Environmental Sciences	geoscientificInformation	no
GB4055	4055	GB	SOIL PHYSICS	l1_049_hydraprobe_wat005	soil water content	%	15 minute	15 minute	10/24/01	2001-10-24	2001-10-24	2/18/18	2018-02-18	2018-02-18	16	Seyfried	SAS V9			1	point	Open	Soil	MeasSoilCover, MeasSoilChem, MeasSoilPhys, MeasSoilBiol	soil moisture	Soil Physics				Natural Resources, Earth and Environmental Sciences	geoscientificInformation	no
GB4056	4056	GB	SOIL PHYSICS	l1_167_hydraprobe_wat005	soil water content	%	15 minute	15 minute	10/11/01	2001-10-11	2001-10-11	2/18/18	2018-02-18	2018-02-18	16	Seyfried	SAS V9			1	point	Open	Soil	MeasSoilCover, MeasSoilChem, MeasSoilPhys, MeasSoilBiol	soil moisture	Soil Physics				Natural Resources, Earth and Environmental Sciences	geoscientificInformation	no
GB4057	4057	GB	SOIL PHYSICS	l1_163_hydraprobe_wat005	soil water content	%	15 minute	15 minute	10/2/01	2001-10-02	2001-10-02	2/18/18	2018-02-18	2018-02-18	16	Seyfried	SAS V9			1	point	Open	Soil	MeasSoilCover, MeasSoilChem, MeasSoilPhys, MeasSoilBiol	soil moisture	Soil Physics				Natural Resources, Earth and Environmental Sciences	geoscientificInformation	no
GB4058	4058	GB	SOIL PHYSICS	l1_144_hydraprobe_wat005	soil water content	%	15 minute	15 minute	9/20/01	2001-09-20	2001-09-20	2/18/18	2018-02-18	2018-02-18	16	Seyfried	SAS V9			1	point	Open	Soil	MeasSoilCover, MeasSoilChem, MeasSoilPhys, MeasSoilBiol	soil moisture	Soil Physics				Natural Resources, Earth and Environmental Sciences	geoscientificInformation	no
GB4059	4059	GB	SOIL PHYSICS	hourly_076_soiltemperature_stm002_5	soil temperature	°C	1 hour	1 hour	12/22/77	1977-12-22	1977-12-22	6/7/94	1994-06-07	1994-06-07	16	Seyfried	SAS V9			1	point	Open	Soil	MeasSoilCover, MeasSoilChem, MeasSoilPhys, MeasSoilBiol	soil temperature	Soil Physics				Natural Resources, Earth and Environmental Sciences	geoscientificInformation	no
GB4060	4060	GB	SOIL PHYSICS	hourly_076_soiltemperature_stm015	soil temperature	°C	1 hour	1 hour	12/22/77	1977-12-22	1977-12-22	6/7/94	1994-06-07	1994-06-07	16	Seyfried	SAS V9			1	point	Open	Soil	MeasSoilCover, MeasSoilChem, MeasSoilPhys, MeasSoilBiol	soil temperature	Soil Physics				Natural Resources, Earth and Environmental Sciences	geoscientificInformation	no
GB4061	4061	GB	SOIL PHYSICS	hourly_076_soiltemperature_stm070	soil temperature	°C	1 hour	1 hour	12/22/77	1977-12-22	1977-12-22	6/7/94	1994-06-07	1994-06-07	16	Seyfried	SAS V9			1	point	Open	Soil	MeasSoilCover, MeasSoilChem, MeasSoilPhys, MeasSoilBiol	soil temperature	Soil Physics				Natural Resources, Earth and Environmental Sciences	geoscientificInformation	no
GB4062	4062	GB	SOIL PHYSICS	hourly_098b_soiltemperature_stm005a	soil temperature	°C	1 hour	1 hour	10/6/89	1989-10-06	1989-10-06	3/24/08	2008-03-24	2008-03-24	18	Seyfried	SAS V9			1	point	Open	Soil	MeasSoilCover, MeasSoilChem, MeasSoilPhys, MeasSoilBiol	soil temperature	Soil Physics				Natural Resources, Earth and Environmental Sciences	geoscientificInformation	no
GB4063	4063	GB	SOIL PHYSICS	hourly_098b_soiltemperature_stm005b	soil temperature	°C	1 hour	1 hour	10/6/89	1989-10-06	1989-10-06	3/24/08	2008-03-24	2008-03-24	18	Seyfried	SAS V9			1	point	Open	Soil	MeasSoilCover, MeasSoilChem, MeasSoilPhys, MeasSoilBiol	soil temperature	Soil Physics				Natural Resources, Earth and Environmental Sciences	geoscientificInformation	no
GB4064	4064	GB	SOIL PHYSICS	hourly_098b_soiltemperature_stm005cc	soil temperature	°C	1 hour	1 hour	10/6/89	1989-10-06	1989-10-06	3/24/08	2008-03-24	2008-03-24	18	Seyfried	SAS V9			1	point	Open	Soil	MeasSoilCover, MeasSoilChem, MeasSoilPhys, MeasSoilBiol	soil temperature	Soil Physics				Natural Resources, Earth and Environmental Sciences	geoscientificInformation	no
GB4065	4065	GB	SOIL PHYSICS	hourly_098b_soiltemperature_stm005cg	soil temperature	°C	1 hour	1 hour	10/6/89	1989-10-06	1989-10-06	3/24/08	2008-03-24	2008-03-24	18	Seyfried	SAS V9			1	point	Open	Soil	MeasSoilCover, MeasSoilChem, MeasSoilPhys, MeasSoilBiol	soil temperature	Soil Physics				Natural Resources, Earth and Environmental Sciences	geoscientificInformation	no
GB4066	4066	GB	SOIL PHYSICS	hourly_098b_soiltemperature_stm005cv	soil temperature	°C	1 hour	1 hour	10/6/89	1989-10-06	1989-10-06	3/24/08	2008-03-24	2008-03-24	18	Seyfried	SAS V9			1	point	Open	Soil	MeasSoilCover, MeasSoilChem, MeasSoilPhys, MeasSoilBiol	soil temperature	Soil Physics				Natural Resources, Earth and Environmental Sciences	geoscientificInformation	no
GB4067	4067	GB	SOIL PHYSICS	hourly_098b_soiltemperature_stm005d	soil temperature	°C	1 hour	1 hour	10/6/89	1989-10-06	1989-10-06	3/24/08	2008-03-24	2008-03-24	18	Seyfried	SAS V9			1	point	Open	Soil	MeasSoilCover, MeasSoilChem, MeasSoilPhys, MeasSoilBiol	soil temperature	Soil Physics				Natural Resources, Earth and Environmental Sciences	geoscientificInformation	no
GB4068	4068	GB	SOIL PHYSICS	hourly_098b_soiltemperature_stm005fg	soil temperature	°C	1 hour	1 hour	10/6/89	1989-10-06	1989-10-06	3/24/08	2008-03-24	2008-03-24	18	Seyfried	SAS V9			1	point	Open	Soil	MeasSoilCover, MeasSoilChem, MeasSoilPhys, MeasSoilBiol	soil temperature	Soil Physics				Natural Resources, Earth and Environmental Sciences	geoscientificInformation	no
GB4069	4069	GB	SOIL PHYSICS	hourly_098b_soiltemperature_stm005fv	soil temperature	°C	1 hour	1 hour	10/6/89	1989-10-06	1989-10-06	3/24/08	2008-03-24	2008-03-24	18	Seyfried	SAS V9			1	point	Open	Soil	MeasSoilCover, MeasSoilChem, MeasSoilPhys, MeasSoilBiol	soil temperature	Soil Physics				Natural Resources, Earth and Environmental Sciences	geoscientificInformation	no
GB4070	4070	GB	SOIL PHYSICS	hourly_098b_soiltemperature_stm010a	soil temperature	°C	1 hour	1 hour	10/6/89	1989-10-06	1989-10-06	3/24/08	2008-03-24	2008-03-24	18	Seyfried	SAS V9			1	point	Open	Soil	MeasSoilCover, MeasSoilChem, MeasSoilPhys, MeasSoilBiol	soil temperature	Soil Physics				Natural Resources, Earth and Environmental Sciences	geoscientificInformation	no
GB4071	4071	GB	SOIL PHYSICS	hourly_098b_soiltemperature_stm010b	soil temperature	°C	1 hour	1 hour	10/6/89	1989-10-06	1989-10-06	3/24/08	2008-03-24	2008-03-24	18	Seyfried	SAS V9			1	point	Open	Soil	MeasSoilCover, MeasSoilChem, MeasSoilPhys, MeasSoilBiol	soil temperature	Soil Physics				Natural Resources, Earth and Environmental Sciences	geoscientificInformation	no
GB4072	4072	GB	SOIL PHYSICS	hourly_098b_soiltemperature_stm010cc	soil temperature	°C	1 hour	1 hour	10/6/89	1989-10-06	1989-10-06	3/24/08	2008-03-24	2008-03-24	18	Seyfried	SAS V9			1	point	Open	Soil	MeasSoilCover, MeasSoilChem, MeasSoilPhys, MeasSoilBiol	soil temperature	Soil Physics				Natural Resources, Earth and Environmental Sciences	geoscientificInformation	no
GB4073	4073	GB	SOIL PHYSICS	hourly_098b_soiltemperature_stm010cg	soil temperature	°C	1 hour	1 hour	10/6/89	1989-10-06	1989-10-06	3/24/08	2008-03-24	2008-03-24	18	Seyfried	SAS V9			1	point	Open	Soil	MeasSoilCover, MeasSoilChem, MeasSoilPhys, MeasSoilBiol	soil temperature	Soil Physics				Natural Resources, Earth and Environmental Sciences	geoscientificInformation	no
GB4074	4074	GB	SOIL PHYSICS	hourly_098b_soiltemperature_stm010cv	soil temperature	°C	1 hour	1 hour	10/6/89	1989-10-06	1989-10-06	3/24/08	2008-03-24	2008-03-24	18	Seyfried	SAS V9			1	point	Open	Soil	MeasSoilCover, MeasSoilChem, MeasSoilPhys, MeasSoilBiol	soil temperature	Soil Physics				Natural Resources, Earth and Environmental Sciences	geoscientificInformation	no
GB4075	4075	GB	SOIL PHYSICS	hourly_098b_soiltemperature_stm010d	soil temperature	°C	1 hour	1 hour	10/6/89	1989-10-06	1989-10-06	3/24/08	2008-03-24	2008-03-24	18	Seyfried	SAS V9			1	point	Open	Soil	MeasSoilCover, MeasSoilChem, MeasSoilPhys, MeasSoilBiol	soil temperature	Soil Physics				Natural Resources, Earth and Environmental Sciences	geoscientificInformation	no
GB4076	4076	GB	SOIL PHYSICS	hourly_098b_soiltemperature_stm010fv	soil temperature	°C	1 hour	1 hour	10/6/89	1989-10-06	1989-10-06	3/24/08	2008-03-24	2008-03-24	18	Seyfried	SAS V9			1	point	Open	Soil	MeasSoilCover, MeasSoilChem, MeasSoilPhys, MeasSoilBiol	soil temperature	Soil Physics				Natural Resources, Earth and Environmental Sciences	geoscientificInformation	no
GB4077	4077	GB	SOIL PHYSICS	hourly_098b_soiltemperature_stm020a	soil temperature	°C	1 hour	1 hour	10/6/89	1989-10-06	1989-10-06	3/24/08	2008-03-24	2008-03-24	18	Seyfried	SAS V9			1	point	Open	Soil	MeasSoilCover, MeasSoilChem, MeasSoilPhys, MeasSoilBiol	soil temperature	Soil Physics				Natural Resources, Earth and Environmental Sciences	geoscientificInformation	no
GB4078	4078	GB	SOIL PHYSICS	hourly_098b_soiltemperature_stm020b	soil temperature	°C	1 hour	1 hour	10/6/89	1989-10-06	1989-10-06	3/24/08	2008-03-24	2008-03-24	18	Seyfried	SAS V9			1	point	Open	Soil	MeasSoilCover, MeasSoilChem, MeasSoilPhys, MeasSoilBiol	soil temperature	Soil Physics				Natural Resources, Earth and Environmental Sciences	geoscientificInformation	no
GB4079	4079	GB	SOIL PHYSICS	hourly_098b_soiltemperature_stm020d	soil temperature	°C	1 hour	1 hour	10/6/89	1989-10-06	1989-10-06	3/24/08	2008-03-24	2008-03-24	18	Seyfried	SAS V9			1	point	Open	Soil	MeasSoilCover, MeasSoilChem, MeasSoilPhys, MeasSoilBiol	soil temperature	Soil Physics				Natural Resources, Earth and Environmental Sciences	geoscientificInformation	no
GB4080	4080	GB	SOIL PHYSICS	hourly_098b_soiltemperature_stm020e	soil temperature	°C	1 hour	1 hour	10/6/89	1989-10-06	1989-10-06	3/24/08	2008-03-24	2008-03-24	18	Seyfried	SAS V9			1	point	Open	Soil	MeasSoilCover, MeasSoilChem, MeasSoilPhys, MeasSoilBiol	soil temperature	Soil Physics				Natural Resources, Earth and Environmental Sciences	geoscientificInformation	no
GB4081	4081	GB	SOIL PHYSICS	hourly_098b_soiltemperature_stm030a	soil temperature	°C	1 hour	1 hour	10/6/89	1989-10-06	1989-10-06	3/24/08	2008-03-24	2008-03-24	18	Seyfried	SAS V9			1	point	Open	Soil	MeasSoilCover, MeasSoilChem, MeasSoilPhys, MeasSoilBiol	soil temperature	Soil Physics				Natural Resources, Earth and Environmental Sciences	geoscientificInformation	no
GB4082	4082	GB	SOIL PHYSICS	hourly_098b_soiltemperature_stm030b	soil temperature	°C	1 hour	1 hour	10/6/89	1989-10-06	1989-10-06	3/24/08	2008-03-24	2008-03-24	18	Seyfried	SAS V9			1	point	Open	Soil	MeasSoilCover, MeasSoilChem, MeasSoilPhys, MeasSoilBiol	soil temperature	Soil Physics				Natural Resources, Earth and Environmental Sciences	geoscientificInformation	no
GB4083	4083	GB	SOIL PHYSICS	hourly_098b_soiltemperature_stm030d	soil temperature	°C	1 hour	1 hour	10/6/89	1989-10-06	1989-10-06	3/24/08	2008-03-24	2008-03-24	18	Seyfried	SAS V9			1	point	Open	Soil	MeasSoilCover, MeasSoilChem, MeasSoilPhys, MeasSoilBiol	soil temperature	Soil Physics				Natural Resources, Earth and Environmental Sciences	geoscientificInformation	no
GB4084	4084	GB	SOIL PHYSICS	hourly_098b_soiltemperature_stm030e	soil temperature	°C	1 hour	1 hour	10/6/89	1989-10-06	1989-10-06	3/24/08	2008-03-24	2008-03-24	18	Seyfried	SAS V9			1	point	Open	Soil	MeasSoilCover, MeasSoilChem, MeasSoilPhys, MeasSoilBiol	soil temperature	Soil Physics				Natural Resources, Earth and Environmental Sciences	geoscientificInformation	no
GB4085	4085	GB	SOIL PHYSICS	hourly_098b_soiltemperature_stm040a	soil temperature	°C	1 hour	1 hour	10/6/89	1989-10-06	1989-10-06	3/24/08	2008-03-24	2008-03-24	18	Seyfried	SAS V9			1	point	Open	Soil	MeasSoilCover, MeasSoilChem, MeasSoilPhys, MeasSoilBiol	soil temperature	Soil Physics				Natural Resources, Earth and Environmental Sciences	geoscientificInformation	no
GB4086	4086	GB	SOIL PHYSICS	hourly_098b_soiltemperature_stm040b	soil temperature	°C	1 hour	1 hour	10/6/89	1989-10-06	1989-10-06	3/24/08	2008-03-24	2008-03-24	18	Seyfried	SAS V9			1	point	Open	Soil	MeasSoilCover, MeasSoilChem, MeasSoilPhys, MeasSoilBiol	soil temperature	Soil Physics				Natural Resources, Earth and Environmental Sciences	geoscientificInformation	no
GB4087	4087	GB	SOIL PHYSICS	hourly_098b_soiltemperature_stm040e	soil temperature	°C	1 hour	1 hour	10/6/89	1989-10-06	1989-10-06	3/24/08	2008-03-24	2008-03-24	18	Seyfried	SAS V9			1	point	Open	Soil	MeasSoilCover, MeasSoilChem, MeasSoilPhys, MeasSoilBiol	soil temperature	Soil Physics				Natural Resources, Earth and Environmental Sciences	geoscientificInformation	no
GB4088	4088	GB	SOIL PHYSICS	hourly_098b_soiltemperature_stm050a	soil temperature	°C	1 hour	1 hour	10/6/89	1989-10-06	1989-10-06	3/24/08	2008-03-24	2008-03-24	18	Seyfried	SAS V9			1	point	Open	Soil	MeasSoilCover, MeasSoilChem, MeasSoilPhys, MeasSoilBiol	soil temperature	Soil Physics				Natural Resources, Earth and Environmental Sciences	geoscientificInformation	no
GB4089	4089	GB	SOIL PHYSICS	hourly_098b_soiltemperature_stm050b	soil temperature	°C	1 hour	1 hour	10/6/89	1989-10-06	1989-10-06	3/24/08	2008-03-24	2008-03-24	18	Seyfried	SAS V9			1	point	Open	Soil	MeasSoilCover, MeasSoilChem, MeasSoilPhys, MeasSoilBiol	soil temperature	Soil Physics				Natural Resources, Earth and Environmental Sciences	geoscientificInformation	no
GB4090	4090	GB	SOIL PHYSICS	hourly_098b_soiltemperature_stm050e	soil temperature	°C	1 hour	1 hour	10/6/89	1989-10-06	1989-10-06	3/24/08	2008-03-24	2008-03-24	18	Seyfried	SAS V9			1	point	Open	Soil	MeasSoilCover, MeasSoilChem, MeasSoilPhys, MeasSoilBiol	soil temperature	Soil Physics				Natural Resources, Earth and Environmental Sciences	geoscientificInformation	no
GB4091	4091	GB	SOIL PHYSICS	hourly_098b_soiltemperature_stm060a	soil temperature	°C	1 hour	1 hour	10/6/89	1989-10-06	1989-10-06	3/24/08	2008-03-24	2008-03-24	18	Seyfried	SAS V9			1	point	Open	Soil	MeasSoilCover, MeasSoilChem, MeasSoilPhys, MeasSoilBiol	soil temperature	Soil Physics				Natural Resources, Earth and Environmental Sciences	geoscientificInformation	no
GB4092	4092	GB	SOIL PHYSICS	hourly_098b_soiltemperature_stm060b	soil temperature	°C	1 hour	1 hour	10/6/89	1989-10-06	1989-10-06	3/24/08	2008-03-24	2008-03-24	18	Seyfried	SAS V9			1	point	Open	Soil	MeasSoilCover, MeasSoilChem, MeasSoilPhys, MeasSoilBiol	soil temperature	Soil Physics				Natural Resources, Earth and Environmental Sciences	geoscientificInformation	no
GB4093	4093	GB	SOIL PHYSICS	hourly_098b_soiltemperature_stm060e	soil temperature	°C	1 hour	1 hour	10/6/89	1989-10-06	1989-10-06	3/24/08	2008-03-24	2008-03-24	18	Seyfried	SAS V9			1	point	Open	Soil	MeasSoilCover, MeasSoilChem, MeasSoilPhys, MeasSoilBiol	soil temperature	Soil Physics				Natural Resources, Earth and Environmental Sciences	geoscientificInformation	no
GB4094	4094	GB	SOIL PHYSICS	hourly_rmsp_soiltemperature_stm015	soil temperature	°C	1 hour	1 hour	10/24/90	1990-10-24	1990-10-24	10/8/14	2014-10-08	2014-10-08	24	Seyfried	SAS V9			1	point	Open	Soil	MeasSoilCover, MeasSoilChem, MeasSoilPhys, MeasSoilBiol	soil temperature	Soil Physics				Natural Resources, Earth and Environmental Sciences	geoscientificInformation	no
GB4095	4095	GB	SOIL PHYSICS	hourly_rmsp_soiltemperature_stm030	soil temperature	°C	1 hour	1 hour	10/24/90	1990-10-24	1990-10-24	10/8/14	2014-10-08	2014-10-08	24	Seyfried	SAS V9			1	point	Open	Soil	MeasSoilCover, MeasSoilChem, MeasSoilPhys, MeasSoilBiol	soil temperature	Soil Physics				Natural Resources, Earth and Environmental Sciences	geoscientificInformation	no
GB4096	4096	GB	SOIL PHYSICS	hourly_rmsp_soiltemperature_stm045	soil temperature	°C	1 hour	1 hour	10/24/90	1990-10-24	1990-10-24	10/8/14	2014-10-08	2014-10-08	24	Seyfried	SAS V9			1	point	Open	Soil	MeasSoilCover, MeasSoilChem, MeasSoilPhys, MeasSoilBiol	soil temperature	Soil Physics				Natural Resources, Earth and Environmental Sciences	geoscientificInformation	no
GB4097	4097	GB	SOIL PHYSICS	hourly_076_soiltemperature_stm120	soil temperature	°C	1 hour	1 hour	6/7/94	1994-06-07	1994-06-07	1/31/19	2019-01-31	2019-01-31	25	Seyfried	SAS V9			1	point	Open	Soil	MeasSoilCover, MeasSoilChem, MeasSoilPhys, MeasSoilBiol	soil temperature	Soil Physics				Natural Resources, Earth and Environmental Sciences	geoscientificInformation	no
GB4098	4098	GB	SOIL PHYSICS	hourly_076_soiltemperature_stm180	soil temperature	°C	1 hour	1 hour	6/7/94	1994-06-07	1994-06-07	1/31/19	2019-01-31	2019-01-31	25	Seyfried	SAS V9			1	point	Open	Soil	MeasSoilCover, MeasSoilChem, MeasSoilPhys, MeasSoilBiol	soil temperature	Soil Physics				Natural Resources, Earth and Environmental Sciences	geoscientificInformation	no
GB4099	4099	GB	SOIL PHYSICS	hourly_098_soiltemperature_stm020	soil temperature	°C	1 hour	1 hour	9/27/90	1990-09-27	1990-09-27	1/31/19	2019-01-31	2019-01-31	28	Seyfried	SAS V9			1	point	Open	Soil	MeasSoilCover, MeasSoilChem, MeasSoilPhys, MeasSoilBiol	soil temperature	Soil Physics				Natural Resources, Earth and Environmental Sciences	geoscientificInformation	no
GB4100	4100	GB	SOIL PHYSICS	hourly_098_soiltemperature_stm040	soil temperature	°C	1 hour	1 hour	9/27/90	1990-09-27	1990-09-27	1/31/19	2019-01-31	2019-01-31	28	Seyfried	SAS V9			1	point	Open	Soil	MeasSoilCover, MeasSoilChem, MeasSoilPhys, MeasSoilBiol	soil temperature	Soil Physics				Natural Resources, Earth and Environmental Sciences	geoscientificInformation	no
GB4101	4101	GB	SOIL PHYSICS	hourly_098_soiltemperature_stm050	soil temperature	°C	1 hour	1 hour	9/27/90	1990-09-27	1990-09-27	1/31/19	2019-01-31	2019-01-31	28	Seyfried	SAS V9			1	point	Open	Soil	MeasSoilCover, MeasSoilChem, MeasSoilPhys, MeasSoilBiol	soil temperature	Soil Physics				Natural Resources, Earth and Environmental Sciences	geoscientificInformation	no
GB4102	4102	GB	SOIL PHYSICS	hourly_076_soiltemperature_stm040	soil temperature	°C	1 hour	1 hour	12/22/77	1977-12-22	1977-12-22	5/2/06	2006-05-02	2006-05-02	28	Seyfried	SAS V9			1	point	Open	Soil	MeasSoilCover, MeasSoilChem, MeasSoilPhys, MeasSoilBiol	soil temperature	Soil Physics				Natural Resources, Earth and Environmental Sciences	geoscientificInformation	no
GB4103	4103	GB	SOIL PHYSICS	hourly_127_soiltemperature_stm005	soil temperature	°C	1 hour	1 hour	9/19/90	1990-09-19	1990-09-19	1/31/19	2019-01-31	2019-01-31	28	Seyfried	SAS V9			1	point	Open	Soil	MeasSoilCover, MeasSoilChem, MeasSoilPhys, MeasSoilBiol	soil temperature	Soil Physics				Natural Resources, Earth and Environmental Sciences	geoscientificInformation	no
GB4104	4104	GB	SOIL PHYSICS	hourly_127_soiltemperature_stm020	soil temperature	°C	1 hour	1 hour	9/19/90	1990-09-19	1990-09-19	1/31/19	2019-01-31	2019-01-31	28	Seyfried	SAS V9			1	point	Open	Soil	MeasSoilCover, MeasSoilChem, MeasSoilPhys, MeasSoilBiol	soil temperature	Soil Physics				Natural Resources, Earth and Environmental Sciences	geoscientificInformation	no
GB4105	4105	GB	SOIL PHYSICS	hourly_127_soiltemperature_stm040	soil temperature	°C	1 hour	1 hour	9/19/90	1990-09-19	1990-09-19	1/31/19	2019-01-31	2019-01-31	28	Seyfried	SAS V9			1	point	Open	Soil	MeasSoilCover, MeasSoilChem, MeasSoilPhys, MeasSoilBiol	soil temperature	Soil Physics				Natural Resources, Earth and Environmental Sciences	geoscientificInformation	no
GB4106	4106	GB	SOIL PHYSICS	hourly_127_soiltemperature_stm050	soil temperature	°C	1 hour	1 hour	9/19/90	1990-09-19	1990-09-19	1/31/19	2019-01-31	2019-01-31	28	Seyfried	SAS V9			1	point	Open	Soil	MeasSoilCover, MeasSoilChem, MeasSoilPhys, MeasSoilBiol	soil temperature	Soil Physics				Natural Resources, Earth and Environmental Sciences	geoscientificInformation	no
GB4107	4107	GB	SOIL PHYSICS	hourly_176_soiltemperature_stm005	soil temperature	°C	1 hour	1 hour	8/27/90	1990-08-27	1990-08-27	1/30/19	2019-01-30	2019-01-30	28	Seyfried	SAS V9			1	point	Open	Soil	MeasSoilCover, MeasSoilChem, MeasSoilPhys, MeasSoilBiol	soil temperature	Soil Physics				Natural Resources, Earth and Environmental Sciences	geoscientificInformation	no
GB4108	4108	GB	SOIL PHYSICS	hourly_176_soiltemperature_stm020	soil temperature	°C	1 hour	1 hour	8/27/90	1990-08-27	1990-08-27	1/30/19	2019-01-30	2019-01-30	28	Seyfried	SAS V9			1	point	Open	Soil	MeasSoilCover, MeasSoilChem, MeasSoilPhys, MeasSoilBiol	soil temperature	Soil Physics				Natural Resources, Earth and Environmental Sciences	geoscientificInformation	no
GB4109	4109	GB	SOIL PHYSICS	hourly_176_soiltemperature_stm040	soil temperature	°C	1 hour	1 hour	8/27/90	1990-08-27	1990-08-27	1/30/19	2019-01-30	2019-01-30	28	Seyfried	SAS V9			1	point	Open	Soil	MeasSoilCover, MeasSoilChem, MeasSoilPhys, MeasSoilBiol	soil temperature	Soil Physics				Natural Resources, Earth and Environmental Sciences	geoscientificInformation	no
GB4110	4110	GB	SOIL PHYSICS	hourly_176_soiltemperature_stm050	soil temperature	°C	1 hour	1 hour	8/27/90	1990-08-27	1990-08-27	1/30/19	2019-01-30	2019-01-30	28	Seyfried	SAS V9			1	point	Open	Soil	MeasSoilCover, MeasSoilChem, MeasSoilPhys, MeasSoilBiol	soil temperature	Soil Physics				Natural Resources, Earth and Environmental Sciences	geoscientificInformation	no
GB4111	4111	GB	SOIL PHYSICS	hourly_057_soiltemperature_stm020	soil temperature	°C	1 hour	1 hour	8/7/90	1990-08-07	1990-08-07	1/31/19	2019-01-31	2019-01-31	29	Seyfried	SAS V9			1	point	Open	Soil	MeasSoilCover, MeasSoilChem, MeasSoilPhys, MeasSoilBiol	soil temperature	Soil Physics				Natural Resources, Earth and Environmental Sciences	geoscientificInformation	no
GB4112	4112	GB	SOIL PHYSICS	hourly_057_soiltemperature_stm040	soil temperature	°C	1 hour	1 hour	8/7/90	1990-08-07	1990-08-07	1/31/19	2019-01-31	2019-01-31	29	Seyfried	SAS V9			1	point	Open	Soil	MeasSoilCover, MeasSoilChem, MeasSoilPhys, MeasSoilBiol	soil temperature	Soil Physics				Natural Resources, Earth and Environmental Sciences	geoscientificInformation	no
GB4113	4113	GB	SOIL PHYSICS	hourly_057_soiltemperature_stm050	soil temperature	°C	1 hour	1 hour	8/7/90	1990-08-07	1990-08-07	1/31/19	2019-01-31	2019-01-31	29	Seyfried	SAS V9			1	point	Open	Soil	MeasSoilCover, MeasSoilChem, MeasSoilPhys, MeasSoilBiol	soil temperature	Soil Physics				Natural Resources, Earth and Environmental Sciences	geoscientificInformation	no
GB4114	4114	GB	SOIL PHYSICS	hourly_076_soiltemperature_stm060	soil temperature	°C	1 hour	1 hour	8/2/85	1985-08-02	1985-08-02	1/31/19	2019-01-31	2019-01-31	34	Seyfried	SAS V9			1	point	Open	Soil	MeasSoilCover, MeasSoilChem, MeasSoilPhys, MeasSoilBiol	soil temperature	Soil Physics				Natural Resources, Earth and Environmental Sciences	geoscientificInformation	no
GB4115	4115	GB	SOIL PHYSICS	hourly_076_soiltemperature_stm090	soil temperature	°C	1 hour	1 hour	8/2/85	1985-08-02	1985-08-02	1/31/19	2019-01-31	2019-01-31	34	Seyfried	SAS V9			1	point	Open	Soil	MeasSoilCover, MeasSoilChem, MeasSoilPhys, MeasSoilBiol	soil temperature	Soil Physics				Natural Resources, Earth and Environmental Sciences	geoscientificInformation	no
GB4116	4116	GB	SOIL PHYSICS	hourly_098_soiltemperature_stm005	soil temperature	°C	1 hour	1 hour	6/14/85	1985-06-14	1985-06-14	1/31/19	2019-01-31	2019-01-31	34	Seyfried	SAS V9			1	point	Open	Soil	MeasSoilCover, MeasSoilChem, MeasSoilPhys, MeasSoilBiol	soil temperature	Soil Physics				Natural Resources, Earth and Environmental Sciences	geoscientificInformation	no
GB4117	4117	GB	SOIL PHYSICS	hourly_098_soiltemperature_stm180	soil temperature	°C	1 hour	1 hour	6/14/85	1985-06-14	1985-06-14	1/31/19	2019-01-31	2019-01-31	34	Seyfried	SAS V9			1	point	Open	Soil	MeasSoilCover, MeasSoilChem, MeasSoilPhys, MeasSoilBiol	soil temperature	Soil Physics				Natural Resources, Earth and Environmental Sciences	geoscientificInformation	no
GB4118	4118	GB	SOIL PHYSICS	hourly_098_soiltemperature_stm010	soil temperature	°C	1 hour	1 hour	11/5/81	1981-11-05	1981-11-05	1/31/19	2019-01-31	2019-01-31	37	Seyfried	SAS V9			1	point	Open	Soil	MeasSoilCover, MeasSoilChem, MeasSoilPhys, MeasSoilBiol	soil temperature	Soil Physics				Natural Resources, Earth and Environmental Sciences	geoscientificInformation	no
GB4119	4119	GB	SOIL PHYSICS	hourly_098_soiltemperature_stm030	soil temperature	°C	1 hour	1 hour	11/5/81	1981-11-05	1981-11-05	1/31/19	2019-01-31	2019-01-31	37	Seyfried	SAS V9			1	point	Open	Soil	MeasSoilCover, MeasSoilChem, MeasSoilPhys, MeasSoilBiol	soil temperature	Soil Physics				Natural Resources, Earth and Environmental Sciences	geoscientificInformation	no
GB4120	4120	GB	SOIL PHYSICS	hourly_098_soiltemperature_stm060	soil temperature	°C	1 hour	1 hour	11/5/81	1981-11-05	1981-11-05	1/31/19	2019-01-31	2019-01-31	37	Seyfried	SAS V9			1	point	Open	Soil	MeasSoilCover, MeasSoilChem, MeasSoilPhys, MeasSoilBiol	soil temperature	Soil Physics				Natural Resources, Earth and Environmental Sciences	geoscientificInformation	no
GB4121	4121	GB	SOIL PHYSICS	hourly_098_soiltemperature_stm090	soil temperature	°C	1 hour	1 hour	11/5/81	1981-11-05	1981-11-05	1/31/19	2019-01-31	2019-01-31	37	Seyfried	SAS V9			1	point	Open	Soil	MeasSoilCover, MeasSoilChem, MeasSoilPhys, MeasSoilBiol	soil temperature	Soil Physics				Natural Resources, Earth and Environmental Sciences	geoscientificInformation	no
GB4122	4122	GB	SOIL PHYSICS	hourly_098_soiltemperature_stm120	soil temperature	°C	1 hour	1 hour	11/5/81	1981-11-05	1981-11-05	1/31/19	2019-01-31	2019-01-31	37	Seyfried	SAS V9			1	point	Open	Soil	MeasSoilCover, MeasSoilChem, MeasSoilPhys, MeasSoilBiol	soil temperature	Soil Physics				Natural Resources, Earth and Environmental Sciences	geoscientificInformation	no
GB4123	4123	GB	SOIL PHYSICS	hourly_176_soiltemperature_stm010	soil temperature	°C	1 hour	1 hour	10/14/81	1981-10-14	1981-10-14	1/30/19	2019-01-30	2019-01-30	37	Seyfried	SAS V9			1	point	Open	Soil	MeasSoilCover, MeasSoilChem, MeasSoilPhys, MeasSoilBiol	soil temperature	Soil Physics				Natural Resources, Earth and Environmental Sciences	geoscientificInformation	no
GB4124	4124	GB	SOIL PHYSICS	hourly_176_soiltemperature_stm030	soil temperature	°C	1 hour	1 hour	10/14/81	1981-10-14	1981-10-14	1/30/19	2019-01-30	2019-01-30	37	Seyfried	SAS V9			1	point	Open	Soil	MeasSoilCover, MeasSoilChem, MeasSoilPhys, MeasSoilBiol	soil temperature	Soil Physics				Natural Resources, Earth and Environmental Sciences	geoscientificInformation	no
GB4125	4125	GB	SOIL PHYSICS	hourly_176_soiltemperature_stm060	soil temperature	°C	1 hour	1 hour	10/14/81	1981-10-14	1981-10-14	1/30/19	2019-01-30	2019-01-30	37	Seyfried	SAS V9			1	point	Open	Soil	MeasSoilCover, MeasSoilChem, MeasSoilPhys, MeasSoilBiol	soil temperature	Soil Physics				Natural Resources, Earth and Environmental Sciences	geoscientificInformation	no
GB4126	4126	GB	SOIL PHYSICS	hourly_176_soiltemperature_stm090	soil temperature	°C	1 hour	1 hour	10/14/81	1981-10-14	1981-10-14	1/30/19	2019-01-30	2019-01-30	37	Seyfried	SAS V9			1	point	Open	Soil	MeasSoilCover, MeasSoilChem, MeasSoilPhys, MeasSoilBiol	soil temperature	Soil Physics				Natural Resources, Earth and Environmental Sciences	geoscientificInformation	no
GB4127	4127	GB	SOIL PHYSICS	hourly_176_soiltemperature_stm120	soil temperature	°C	1 hour	1 hour	10/14/81	1981-10-14	1981-10-14	1/30/19	2019-01-30	2019-01-30	37	Seyfried	SAS V9			1	point	Open	Soil	MeasSoilCover, MeasSoilChem, MeasSoilPhys, MeasSoilBiol	soil temperature	Soil Physics				Natural Resources, Earth and Environmental Sciences	geoscientificInformation	no
GB4128	4128	GB	SOIL PHYSICS	hourly_176_soiltemperature_stm180	soil temperature	°C	1 hour	1 hour	10/14/81	1981-10-14	1981-10-14	1/30/19	2019-01-30	2019-01-30	37	Seyfried	SAS V9			1	point	Open	Soil	MeasSoilCover, MeasSoilChem, MeasSoilPhys, MeasSoilBiol	soil temperature	Soil Physics				Natural Resources, Earth and Environmental Sciences	geoscientificInformation	no
GB4129	4129	GB	SOIL PHYSICS	hourly_127_soiltemperature_stm010	soil temperature	°C	1 hour	1 hour	10/13/81	1981-10-13	1981-10-13	1/31/19	2019-01-31	2019-01-31	37	Seyfried	SAS V9			1	point	Open	Soil	MeasSoilCover, MeasSoilChem, MeasSoilPhys, MeasSoilBiol	soil temperature	Soil Physics				Natural Resources, Earth and Environmental Sciences	geoscientificInformation	no
GB4130	4130	GB	SOIL PHYSICS	hourly_127_soiltemperature_stm030	soil temperature	°C	1 hour	1 hour	10/13/81	1981-10-13	1981-10-13	1/31/19	2019-01-31	2019-01-31	37	Seyfried	SAS V9			1	point	Open	Soil	MeasSoilCover, MeasSoilChem, MeasSoilPhys, MeasSoilBiol	soil temperature	Soil Physics				Natural Resources, Earth and Environmental Sciences	geoscientificInformation	no
GB4131	4131	GB	SOIL PHYSICS	hourly_127_soiltemperature_stm060	soil temperature	°C	1 hour	1 hour	10/13/81	1981-10-13	1981-10-13	1/31/19	2019-01-31	2019-01-31	37	Seyfried	SAS V9			1	point	Open	Soil	MeasSoilCover, MeasSoilChem, MeasSoilPhys, MeasSoilBiol	soil temperature	Soil Physics				Natural Resources, Earth and Environmental Sciences	geoscientificInformation	no
GB4132	4132	GB	SOIL PHYSICS	hourly_127_soiltemperature_stm090	soil temperature	°C	1 hour	1 hour	10/13/81	1981-10-13	1981-10-13	1/31/19	2019-01-31	2019-01-31	37	Seyfried	SAS V9			1	point	Open	Soil	MeasSoilCover, MeasSoilChem, MeasSoilPhys, MeasSoilBiol	soil temperature	Soil Physics				Natural Resources, Earth and Environmental Sciences	geoscientificInformation	no
GB4133	4133	GB	SOIL PHYSICS	hourly_127_soiltemperature_stm120	soil temperature	°C	1 hour	1 hour	10/13/81	1981-10-13	1981-10-13	1/31/19	2019-01-31	2019-01-31	37	Seyfried	SAS V9			1	point	Open	Soil	MeasSoilCover, MeasSoilChem, MeasSoilPhys, MeasSoilBiol	soil temperature	Soil Physics				Natural Resources, Earth and Environmental Sciences	geoscientificInformation	no
GB4134	4134	GB	SOIL PHYSICS	hourly_127_soiltemperature_stm180	soil temperature	°C	1 hour	1 hour	10/13/81	1981-10-13	1981-10-13	1/31/19	2019-01-31	2019-01-31	37	Seyfried	SAS V9			1	point	Open	Soil	MeasSoilCover, MeasSoilChem, MeasSoilPhys, MeasSoilBiol	soil temperature	Soil Physics				Natural Resources, Earth and Environmental Sciences	geoscientificInformation	no
GB4135	4135	GB	SOIL PHYSICS	hourly_057_soiltemperature_stm010	soil temperature	°C	1 hour	1 hour	3/27/81	1981-03-27	1981-03-27	1/31/19	2019-01-31	2019-01-31	38	Seyfried	SAS V9			1	point	Open	Soil	MeasSoilCover, MeasSoilChem, MeasSoilPhys, MeasSoilBiol	soil temperature	Soil Physics				Natural Resources, Earth and Environmental Sciences	geoscientificInformation	no
GB4136	4136	GB	SOIL PHYSICS	hourly_057_soiltemperature_stm030	soil temperature	°C	1 hour	1 hour	3/27/81	1981-03-27	1981-03-27	1/31/19	2019-01-31	2019-01-31	38	Seyfried	SAS V9			1	point	Open	Soil	MeasSoilCover, MeasSoilChem, MeasSoilPhys, MeasSoilBiol	soil temperature	Soil Physics				Natural Resources, Earth and Environmental Sciences	geoscientificInformation	no
GB4137	4137	GB	SOIL PHYSICS	hourly_057_soiltemperature_stm060	soil temperature	°C	1 hour	1 hour	3/27/81	1981-03-27	1981-03-27	1/31/19	2019-01-31	2019-01-31	38	Seyfried	SAS V9			1	point	Open	Soil	MeasSoilCover, MeasSoilChem, MeasSoilPhys, MeasSoilBiol	soil temperature	Soil Physics				Natural Resources, Earth and Environmental Sciences	geoscientificInformation	no
GB4138	4138	GB	SOIL PHYSICS	hourly_057_soiltemperature_stm090	soil temperature	°C	1 hour	1 hour	3/27/81	1981-03-27	1981-03-27	1/31/19	2019-01-31	2019-01-31	38	Seyfried	SAS V9			1	point	Open	Soil	MeasSoilCover, MeasSoilChem, MeasSoilPhys, MeasSoilBiol	soil temperature	Soil Physics				Natural Resources, Earth and Environmental Sciences	geoscientificInformation	no
GB4139	4139	GB	SOIL PHYSICS	hourly_057_soiltemperature_stm120	soil temperature	°C	1 hour	1 hour	3/27/81	1981-03-27	1981-03-27	1/31/19	2019-01-31	2019-01-31	38	Seyfried	SAS V9			1	point	Open	Soil	MeasSoilCover, MeasSoilChem, MeasSoilPhys, MeasSoilBiol	soil temperature	Soil Physics				Natural Resources, Earth and Environmental Sciences	geoscientificInformation	no
GB4140	4140	GB	SOIL PHYSICS	hourly_057_soiltemperature_stm180	soil temperature	°C	1 hour	1 hour	3/27/81	1981-03-27	1981-03-27	1/31/19	2019-01-31	2019-01-31	38	Seyfried	SAS V9			1	point	Open	Soil	MeasSoilCover, MeasSoilChem, MeasSoilPhys, MeasSoilBiol	soil temperature	Soil Physics				Natural Resources, Earth and Environmental Sciences	geoscientificInformation	no
GB4141	4141	GB	SOIL PHYSICS	hourly_076_soiltemperature_stm005	soil temperature	°C	1 hour	1 hour	12/22/77	1977-12-22	1977-12-22	1/31/19	2019-01-31	2019-01-31	41	Seyfried	SAS V9			1	point	Open	Soil	MeasSoilCover, MeasSoilChem, MeasSoilPhys, MeasSoilBiol	soil temperature	Soil Physics				Natural Resources, Earth and Environmental Sciences	geoscientificInformation	no
GB4142	4142	GB	SOIL PHYSICS	hourly_076_soiltemperature_stm010	soil temperature	°C	1 hour	1 hour	12/22/77	1977-12-22	1977-12-22	1/31/19	2019-01-31	2019-01-31	41	Seyfried	SAS V9			1	point	Open	Soil	MeasSoilCover, MeasSoilChem, MeasSoilPhys, MeasSoilBiol	soil temperature	Soil Physics				Natural Resources, Earth and Environmental Sciences	geoscientificInformation	no
GB4143	4143	GB	SOIL PHYSICS	hourly_076_soiltemperature_stm020	soil temperature	°C	1 hour	1 hour	12/22/77	1977-12-22	1977-12-22	1/31/19	2019-01-31	2019-01-31	41	Seyfried	SAS V9			1	point	Open	Soil	MeasSoilCover, MeasSoilChem, MeasSoilPhys, MeasSoilBiol	soil temperature	Soil Physics				Natural Resources, Earth and Environmental Sciences	geoscientificInformation	no
GB4144	4144	GB	SOIL PHYSICS	hourly_076_soiltemperature_stm030	soil temperature	°C	1 hour	1 hour	12/22/77	1977-12-22	1977-12-22	1/31/19	2019-01-31	2019-01-31	41	Seyfried	SAS V9			1	point	Open	Soil	MeasSoilCover, MeasSoilChem, MeasSoilPhys, MeasSoilBiol	soil temperature	Soil Physics				Natural Resources, Earth and Environmental Sciences	geoscientificInformation	no
GB4145	4145	GB	VEGETATION	gb_ltar_mbs_yyyymmdd_hhmm_rgb	vegetation phenology repeat images	RGB Image	30 minute	30 minute	10/17/18	2018-10-17	2018-10-17					Clark	local image store			1	field of view	Open	Vegetation	new ecology	PhenoCam	Vegetation				Natural Resources, Earth and Environmental Sciences	biota	no
GB4146	4146	GB	VEGETATION	gb_ltar_mbs_yyyymmdd_hhmm_ir	vegetation phenology repeat images	IR Image	30 minute	30 minute	10/17/18	2018-10-17	2018-10-17					Clark	local image store			1	field of view	Open	Vegetation	new ecology	PhenoCam	Vegetation				Natural Resources, Earth and Environmental Sciences	biota	no
GB4147	4147	GB	VEGETATION	gb_ltar_wbs_yyyymmdd_hhmm_rgb	vegetation phenology repeat images	RGB Image	30 minute	30 minute	5/18/17	2017-05-18	2017-05-18					Clark	local image store	Phenocam Network Web Site	arsgreatbasinltar098	1	field of view	Open	Vegetation	new ecology	PhenoCam	Vegetation				Natural Resources, Earth and Environmental Sciences	biota	no
GB4148	4148	GB	VEGETATION	gb_ltar_wbs_yyyymmdd_hhmm_ir	vegetation phenology repeat images	IR Image	30 minute	30 minute	5/18/17	2017-05-18	2017-05-18					Clark	local image store	Phenocam Network Web Site	arsgreatbasinltar098	1	field of view	Open	Vegetation	new ecology	PhenoCam	Vegetation				Natural Resources, Earth and Environmental Sciences	biota	no
GB4149	4149	GB	VEGETATION	los	nadir vegetation images	RGB Image	annual	1 year	2017	2017	2017-01-01					Clark	local image store			15	plot	Closed	Vegetation	new ecology	PhenoCam					Natural Resources, Earth and Environmental Sciences	biota	no
GB4150	4150	GB	VEGETATION	wbs	nadir vegetation images	RGB Image	annual	1 year	2017	2017	2017-01-01					Clark	local image store			15	plot	Closed	Vegetation	new ecology	PhenoCam					Natural Resources, Earth and Environmental Sciences	biota	no
GB4151	4151	GB	VEGETATION	mbs	nadir vegetation images	RGB Image	annual	1 year	2017	2017	2017-01-01					Clark	local image store			15	plot	Closed	Vegetation	new ecology	PhenoCam					Natural Resources, Earth and Environmental Sciences	biota	no
GB4152	4152	GB	VEGETATION	los	plant frequency		annual	1 year	2016	2016	2016-01-01					Clark	Excel Spreadsheets			15	plot	Closed	Vegetation	new ecology	species richness	Biodiversity				Natural Resources, Earth and Environmental Sciences	biota	no
GB4153	4153	GB	VEGETATION	wbs	plant frequency		annual	1 year	2016	2016	2016-01-01					Clark	Excel Spreadsheets			15	plot	Closed	Vegetation	new ecology	species richness	Biodiversity				Natural Resources, Earth and Environmental Sciences	biota	no
GB4154	4154	GB	VEGETATION	mbs	plant frequency		annual	1 year	2016	2016	2016-01-01					Clark	Excel Spreadsheets			15	plot	Closed	Vegetation	new ecology	species richness	Biodiversity				Natural Resources, Earth and Environmental Sciences	biota	no
GB4155	4155	GB	VEGETATION	los	plant canopy cover		annual	1 year	2015	2015	2015-01-01					Clark	Excel Spreadsheets			15	plot	Closed	Vegetation	MeasGrazingPlants, MeasResidueMgt, MeasHarvestFraction	Ground cover, vegetated, none, mean or single measurement, fraction of land area	Vegetation				Natural Resources, Earth and Environmental Sciences	biota	no
GB4156	4156	GB	VEGETATION	los	plant leaf area index		annual	1 year	2015	2015	2015-01-01					Clark	Excel Spreadsheets			15	plot	Closed	Vegetation	MeasGrazingPlants, MeasResidueMgt, MeasHarvestFraction	Leaf area index, live, none, mean or single measurement, fraction of land area	Vegetation				Natural Resources, Earth and Environmental Sciences	biota	no
GB4157	4157	GB	VEGETATION	los	peak standing biomass		annual	1 year	2015	2015	2015-01-01					Clark	Excel Spreadsheets			15	plot	Closed	Vegetation	MeasGrazingPlants, MeasResidueMgt, MeasHarvestFraction	Biomass, aboveground live, plant tissue, mean or single measurement	Vegetation				Natural Resources, Earth and Environmental Sciences	biota	no
GB4158	4158	GB	VEGETATION	los	ground cover		annual	1 year	2015	2015	2015-01-01					Clark	Excel Spreadsheets			15	plot	Closed	Vegetation	MeasGrazingPlants, MeasResidueMgt, MeasHarvestFraction	Ground cover, vegetated, none, mean or single measurement, fraction of land area	Vegetation				Natural Resources, Earth and Environmental Sciences	biota	no
GB4159	4159	GB	VEGETATION	los	shrub dimensions		annual	1 year	2015	2015	2015-01-01					Clark	Excel Spreadsheets			15	plot	Closed	Vegetation	new ecology	Shrub dimensions	Vegetation				Natural Resources, Earth and Environmental Sciences	biota	no
GB4160	4160	GB	VEGETATION	wbs	plant canopy cover		annual	1 year	2015	2015	2015-01-01					Clark	Excel Spreadsheets			15	plot	Closed	Vegetation	MeasGrazingPlants, MeasResidueMgt, MeasHarvestFraction	Ground cover, vegetated, none, mean or single measurement, fraction of land area	Vegetation				Natural Resources, Earth and Environmental Sciences	biota	no
GB4161	4161	GB	VEGETATION	wbs	plant leaf area index		annual	1 year	2015	2015	2015-01-01					Clark	Excel Spreadsheets			15	plot	Closed	Vegetation	MeasGrazingPlants, MeasResidueMgt, MeasHarvestFraction	Leaf area index, live, none, mean or single measurement, fraction of land area	Vegetation				Natural Resources, Earth and Environmental Sciences	biota	no
GB4162	4162	GB	VEGETATION	wbs	peak standing biomass		annual	1 year	2015	2015	2015-01-01					Clark	Excel Spreadsheets			15	plot	Closed	Vegetation	MeasGrazingPlants, MeasResidueMgt, MeasHarvestFraction	Biomass, aboveground live, plant tissue, mean or single measurement	Vegetation				Natural Resources, Earth and Environmental Sciences	biota	no
GB4163	4163	GB	VEGETATION	wbs	ground cover		annual	1 year	2015	2015	2015-01-01					Clark	Excel Spreadsheets			15	plot	Closed	Vegetation	MeasGrazingPlants, MeasResidueMgt, MeasHarvestFraction	Ground cover, vegetated, none, mean or single measurement, fraction of land area	Vegetation				Natural Resources, Earth and Environmental Sciences	biota	no
GB4164	4164	GB	VEGETATION	wbs	shrub dimensions		annual	1 year	2015	2015	2015-01-01					Clark	Excel Spreadsheets			15	plot	Closed	Vegetation	new ecology	Shrub dimensions	Vegetation				Natural Resources, Earth and Environmental Sciences	biota	no
GB4165	4165	GB	VEGETATION	mbs	plant canopy cover		annual	1 year	2015	2015	2015-01-01					Clark	Excel Spreadsheets			15	plot	Closed	Vegetation	MeasGrazingPlants, MeasResidueMgt, MeasHarvestFraction	Ground cover, vegetated, none, mean or single measurement, fraction of land area	Vegetation				Natural Resources, Earth and Environmental Sciences	biota	no
GB4166	4166	GB	VEGETATION	mbs	plant leaf area index		annual	1 year	2015	2015	2015-01-01					Clark	Excel Spreadsheets			15	plot	Closed	Vegetation	MeasGrazingPlants, MeasResidueMgt, MeasHarvestFraction	Leaf area index, live, none, mean or single measurement, fraction of land area	Vegetation				Natural Resources, Earth and Environmental Sciences	biota	no
GB4167	4167	GB	VEGETATION	mbs	peak standing biomass		annual	1 year	2015	2015	2015-01-01					Clark	Excel Spreadsheets			15	plot	Closed	Vegetation	MeasGrazingPlants, MeasResidueMgt, MeasHarvestFraction	Biomass, aboveground live, plant tissue, mean or single measurement	Vegetation				Natural Resources, Earth and Environmental Sciences	biota	no
GB4168	4168	GB	VEGETATION	mbs	ground cover		annual	1 year	2015	2015	2015-01-01					Clark	Excel Spreadsheets			15	plot	Closed	Vegetation	MeasGrazingPlants, MeasResidueMgt, MeasHarvestFraction	Ground cover, vegetated, none, mean or single measurement, fraction of land area	Vegetation				Natural Resources, Earth and Environmental Sciences	biota	no
GB4169	4169	GB	VEGETATION	mbs	shrub dimensions		annual	1 year	2015	2015	2015-01-01					Clark	Excel Spreadsheets			15	plot	Closed	Vegetation	new ecology	Shrub dimensions	Vegetation				Natural Resources, Earth and Environmental Sciences	biota	no
GB4170	4170	GB	HYDROLOGY	bkpt15min_046_streamflow_sedconc	suspended sediment concentration	mg/l	sporadic		3/2/88	1988-03-02	1988-03-02	5/23/88	1988-05-23	1988-05-23	1	Pierson	SAS V9			1	point	Open	Water Quality	STEWARDS						Natural Resources, Earth and Environmental Sciences	inlandWaters	
GB4171	4171	GB	HYDROLOGY	bkpt15min_125b_streamflow_msconc	suspended sediment concentration	mg/l	sporadic		2/10/05	2005-02-10	2005-02-10	7/6/16	2016-07-06	2016-07-06	11	Pierson	SAS V9			1	point	Open	Water Quality	STEWARDS						Natural Resources, Earth and Environmental Sciences	inlandWaters	
GB4172	4172	GB	HYDROLOGY	bkpt15min_125b_streamflow_pumpconc	suspended sediment concentration	mg/l	sporadic		1/5/05	2005-01-05	2005-01-05	7/5/16	2016-07-05	2016-07-05	12	Pierson	SAS V9			1	point	Open	Water Quality	STEWARDS						Natural Resources, Earth and Environmental Sciences	inlandWaters	
GB4173	4173	GB	HYDROLOGY	bkpt15min_125b_streamflow_handconc	suspended sediment concentration	mg/l	sporadic		1/10/05	2005-01-10	2005-01-10	12/13/16	2016-12-13	2016-12-13	12	Pierson	SAS V9			1	point	Open	Water Quality	STEWARDS						Natural Resources, Earth and Environmental Sciences	inlandWaters	
GB4174	4174	GB	HYDROLOGY	bkpt15min_135_streamflow_handconc	suspended sediment concentration	mg/l	sporadic		1/10/05	2005-01-10	2005-01-10	12/13/16	2016-12-13	2016-12-13	12	Pierson	SAS V9			1	point	Open	Water Quality	STEWARDS						Natural Resources, Earth and Environmental Sciences	inlandWaters	
GB4175	4175	GB	HYDROLOGY	bkpt15min_135_streamflow_msconc	suspended sediment concentration	mg/l	sporadic		2/2/00	2000-02-02	2000-02-02	5/26/16	2016-05-26	2016-05-26	16	Pierson	SAS V9			1	point	Open	Water Quality	STEWARDS						Natural Resources, Earth and Environmental Sciences	inlandWaters	
GB4176	4176	GB	HYDROLOGY	bkpt15min_135_streamflow_pumpconc	suspended sediment concentration	mg/l	sporadic		11/18/99	1999-11-18	1999-11-18	5/26/16	2016-05-26	2016-05-26	17	Pierson	SAS V9			1	point	Open	Water Quality	STEWARDS						Natural Resources, Earth and Environmental Sciences	inlandWaters	
GB4177	4177	GB	HYDROLOGY	bkpt15min_036_streamflow_est_sedconc	suspended sediment concentration	mg/l	sporadic		1/21/67	1967-01-21	1967-01-21	6/6/86	1986-06-06	1986-06-06	19	Pierson	SAS V9			1	point	Open	Water Quality	STEWARDS						Natural Resources, Earth and Environmental Sciences	inlandWaters	
GB4178	4178	GB	HYDROLOGY	bkpt15min_036_streamflow_msconc	suspended sediment concentration	mg/l	sporadic		1/2/97	1997-01-02	1997-01-02	5/26/16	2016-05-26	2016-05-26	19	Pierson	SAS V9			1	point	Open	Water Quality	STEWARDS						Natural Resources, Earth and Environmental Sciences	inlandWaters	
GB4179	4179	GB	HYDROLOGY	bkpt15min_166_streamflow_msconc	suspended sediment concentration	mg/l	sporadic		3/18/97	1997-03-18	1997-03-18	12/15/16	2016-12-15	2016-12-15	20	Pierson	SAS V9			1	point	Open	Water Quality	STEWARDS						Natural Resources, Earth and Environmental Sciences	inlandWaters	
GB4180	4180	GB	HYDROLOGY	bkpt15min_116b_streamflow_msconc	suspended sediment concentration	mg/l	sporadic		1/15/98	1998-01-15	1998-01-15	5/17/18	2018-05-17	2018-05-17	20	Pierson	SAS V9			1	point	Open	Water Quality	STEWARDS						Natural Resources, Earth and Environmental Sciences	inlandWaters	
GB4181	4181	GB	HYDROLOGY	bkpt15min_166_streamflow_handconc	suspended sediment concentration	mg/l	sporadic		2/1/95	1995-02-01	1995-02-01	11/30/16	2016-11-30	2016-11-30	22	Pierson	SAS V9			1	point	Open	Water Quality	STEWARDS						Natural Resources, Earth and Environmental Sciences	inlandWaters	
GB4182	4182	GB	HYDROLOGY	bkpt15min_036_streamflow_handconc	suspended sediment concentration	mg/l	sporadic		1/19/95	1995-01-19	1995-01-19	12/13/16	2016-12-13	2016-12-13	22	Pierson	SAS V9			1	point	Open	Water Quality	STEWARDS						Natural Resources, Earth and Environmental Sciences	inlandWaters	
GB4183	4183	GB	HYDROLOGY	bkpt15min_036_streamflow_pumpconc	suspended sediment concentration	mg/l	sporadic		2/26/94	1994-02-26	1994-02-26	5/25/16	2016-05-25	2016-05-25	22	Pierson	SAS V9			1	point	Open	Water Quality	STEWARDS						Natural Resources, Earth and Environmental Sciences	inlandWaters	
GB4184	4184	GB	HYDROLOGY	bkpt15min_166_streamflow_pumpconc	suspended sediment concentration	mg/l	sporadic		4/21/94	1994-04-21	1994-04-21	12/29/16	2016-12-29	2016-12-29	23	Pierson	SAS V9			1	point	Open	Water Quality	STEWARDS						Natural Resources, Earth and Environmental Sciences	inlandWaters	
GB4185	4185	GB	HYDROLOGY	bkpt15min_116b_streamflow_handconc	suspended sediment concentration	mg/l	sporadic		1/19/95	1995-01-19	1995-01-19	5/31/18	2018-05-31	2018-05-31	23	Pierson	SAS V9			1	point	Open	Water Quality	STEWARDS						Natural Resources, Earth and Environmental Sciences	inlandWaters	
GB4186	4186	GB	HYDROLOGY	bkpt15min_116b_streamflow_pumpconc	suspended sediment concentration	mg/l	sporadic		4/15/94	1994-04-15	1994-04-15	5/26/18	2018-05-26	2018-05-26	24	Pierson	SAS V9			1	point	Open	Water Quality	STEWARDS						Natural Resources, Earth and Environmental Sciences	inlandWaters	
GB4187	4187	GB	HYDROLOGY	bkpt15min_036_streamflow_sedconc	suspended sediment concentration	mg/l	sporadic		1/28/65	1965-01-28	1965-01-28	7/24/93	1993-07-24	1993-07-24	29	Pierson	SAS V9			1	point	Open	Water Quality	STEWARDS						Natural Resources, Earth and Environmental Sciences	inlandWaters	