ID	RowID	LTARSite.Code	Category	DataSetVariableName	AttributeDescription	Units	TemporalResolution	TemporalResolutionStandard	StartDate	StartDateStandard	StartDateAgCROS	EndDate	EndDateStandard	EndDateAgCros	DateDif_yrs	ResponsiblePersons	StorageFormat	URLdataAccess	LocationIDoutsideNetwork	SpatialRepeats	SpatialDescription	PublicAccess	Network.Category	AgCROS.Table	AgCROS.VarName	NALT.Keywords	subsite	Repo.Name	Model.Name	NALT.Subject	ISO.Topic	Common.Experiment
																																
UMRB5989	5989	UMRB - St. Paul	LAND-ATMOSPHERE FLUXES (EC)	USTAR	Friction velocity	m/s	30 minute	30 minute	1/1/2017	2017-01-01	2017-01-01	present	now	2019-12-31	3	C. Winker	.csv	Ameriflux	North Site: US-Ro6  South Site: US-Ro5	1	North Site: I18N, Rosemount, MN  South Site: I18S, Rosemount, MN	Open	Eddy Covariance	AmeriFlux	unresolved	Meteorology, Eddy Covariance				Research, Technology and Engineering	climatologyMeteorologyAtmosphere	yes
UMRB5990	5990	UMRB - St. Paul	LAND-ATMOSPHERE FLUXES (EC)	NEE	Net Ecosystem Exchange	umol/m^2/s	30 minute	30 minute	1/1/2017	2017-01-01	2017-01-01	present	now	2019-12-31	3	C. Winker	.csv	Ameriflux	North Site: US-Ro6  South Site: US-Ro5	1	North Site: I18N, Rosemount, MN  South Site: I18S, Rosemount, MN	Open	Eddy Covariance	AmeriFlux	unresolved	Meteorology, Eddy Covariance				Research, Technology and Engineering	climatologyMeteorologyAtmosphere	yes
UMRB5991	5991	UMRB - St. Paul	LAND-ATMOSPHERE FLUXES (EC)	FC	Carbon Dioxide (CO2) turbulent flux	umol/m^2/s	30 minute	30 minute	1/1/2017	2017-01-01	2017-01-01	present	now	2019-12-31	3	C. Winker	.csv	Ameriflux	North Site: US-Ro6  South Site: US-Ro5	1	North Site: I18N, Rosemount, MN  South Site: I18S, Rosemount, MN	Open	Eddy Covariance	AmeriFlux	unresolved	Meteorology, Eddy Covariance				Research, Technology and Engineering	climatologyMeteorologyAtmosphere	yes
UMRB5992	5992	UMRB - St. Paul	LAND-ATMOSPHERE FLUXES (EC)	SC	CO2 storage flux	umol/m^2/s	30 minute	30 minute	1/1/2017	2017-01-01	2017-01-01	present	now	2019-12-31	3	C. Winker	.csv	Ameriflux	North Site: US-Ro6  South Site: US-Ro5	1	North Site: I18N, Rosemount, MN  South Site: I18S, Rosemount, MN	Open	Eddy Covariance	AmeriFlux	unresolved	Meteorology, Eddy Covariance				Research, Technology and Engineering	climatologyMeteorologyAtmosphere	yes
UMRB5993	5993	UMRB - St. Paul	LAND-ATMOSPHERE FLUXES (EC)	H	Sensible heat turbulent flux	W/m^2	30 minute	30 minute	1/1/2017	2017-01-01	2017-01-01	present	now	2019-12-31	3	C. Winker	.csv	Ameriflux	North Site: US-Ro6  South Site: US-Ro5	1	North Site: I18N, Rosemount, MN  South Site: I18S, Rosemount, MN	Open	Eddy Covariance	AmeriFlux	unresolved	Meteorology, Eddy Covariance				Research, Technology and Engineering	climatologyMeteorologyAtmosphere	yes
UMRB5994	5994	UMRB - St. Paul	LAND-ATMOSPHERE FLUXES (EC)	SH	Heat storage flux in the air	W/m^2	30 minute	30 minute	1/1/2017	2017-01-01	2017-01-01	present	now	2019-12-31	3	C. Winker	.csv	Ameriflux	North Site: US-Ro6  South Site: US-Ro5	1	North Site: I18N, Rosemount, MN  South Site: I18S, Rosemount, MN	Open	Eddy Covariance	AmeriFlux	unresolved	Meteorology, Eddy Covariance				Research, Technology and Engineering	climatologyMeteorologyAtmosphere	yes
UMRB5995	5995	UMRB - St. Paul	LAND-ATMOSPHERE FLUXES (EC)	LE	Latent heat turbulent flux	W/m^2	30 minute	30 minute	1/1/2017	2017-01-01	2017-01-01	present	now	2019-12-31	3	C. Winker	.csv	Ameriflux	North Site: US-Ro6  South Site: US-Ro5	1	North Site: I18N, Rosemount, MN  South Site: I18S, Rosemount, MN	Open	Eddy Covariance	AmeriFlux	unresolved	Meteorology, Eddy Covariance				Research, Technology and Engineering	climatologyMeteorologyAtmosphere	yes
UMRB5996	5996	UMRB - St. Paul	LAND-ATMOSPHERE FLUXES (EC)	SLE	Latent heat storage flux	W/m^2	30 minute	30 minute	1/1/2017	2017-01-01	2017-01-01	present	now	2019-12-31	3	C. Winker	.csv	Ameriflux	North Site: US-Ro6  South Site: US-Ro5	1	North Site: I18N, Rosemount, MN  South Site: I18S, Rosemount, MN	Open	Eddy Covariance	AmeriFlux	unresolved	Meteorology, Eddy Covariance				Research, Technology and Engineering	climatologyMeteorologyAtmosphere	yes
UMRB5997	5997	UMRB - St. Paul	LAND-ATMOSPHERE FLUXES (EC)	CO2	Carbon Dioxide (CO2) mole fraction in wet air	umol/mol	30 minute	30 minute	1/1/2017	2017-01-01	2017-01-01	present	now	2019-12-31	3	C. Winker	.csv	Ameriflux	North Site: US-Ro6  South Site: US-Ro5	1	North Site: I18N, Rosemount, MN  South Site: I18S, Rosemount, MN	Open	Eddy Covariance	AmeriFlux	unresolved	Meteorology, Eddy Covariance				Research, Technology and Engineering	climatologyMeteorologyAtmosphere	yes
UMRB5998	5998	UMRB - St. Paul	LAND-ATMOSPHERE FLUXES (EC)	H2O	Water (H2O) vapor mole fraction	mmol/mol	30 minute	30 minute	1/1/2017	2017-01-01	2017-01-01	present	now	2019-12-31	3	C. Winker	.csv	Ameriflux	North Site: US-Ro6  South Site: US-Ro5	1	North Site: I18N, Rosemount, MN  South Site: I18S, Rosemount, MN	Open	Eddy Covariance	AmeriFlux	unresolved	Meteorology, Eddy Covariance				Research, Technology and Engineering	climatologyMeteorologyAtmosphere	yes
UMRB5999	5999	UMRB - St. Paul	LAND-ATMOSPHERE FLUXES (EC)	ZL	Monin-Obukhov Stability	adimensional	30 minute	30 minute	1/1/2017	2017-01-01	2017-01-01	present	now	2019-12-31	3	C. Winker	.csv	Ameriflux	North Site: US-Ro6  South Site: US-Ro5	1	North Site: I18N, Rosemount, MN  South Site: I18S, Rosemount, MN	Open	Eddy Covariance	AmeriFlux	unresolved	Meteorology, Eddy Covariance				Research, Technology and Engineering	climatologyMeteorologyAtmosphere	yes
UMRB6000	6000	UMRB - St. Paul	LAND-ATMOSPHERE FLUXES (EC)	NEE_F	Gapfilled Net Ecosystem Exchange	umol/m^2/s	30 minute	30 minute	1/1/2017	2017-01-01	2017-01-01	present	now	2019-12-31	3	C. Winker	.csv	Ameriflux	North Site: US-Ro6  South Site: US-Ro5	1	North Site: I18N, Rosemount, MN  South Site: I18S, Rosemount, MN	Open	Eddy Covariance	AmeriFlux	unresolved	Meteorology, Eddy Covariance				Research, Technology and Engineering	climatologyMeteorologyAtmosphere	yes
UMRB6001	6001	UMRB - St. Paul	LAND-ATMOSPHERE FLUXES (EC)	RECO	Ecosystem Respiration	umol/m^2/s	30 minute	30 minute	1/1/2017	2017-01-01	2017-01-01	present	now	2019-12-31	3	C. Winker	.csv	Ameriflux	North Site: US-Ro6  South Site: US-Ro5	1	North Site: I18N, Rosemount, MN  South Site: I18S, Rosemount, MN	Open	Eddy Covariance	AmeriFlux	unresolved	Meteorology, Eddy Covariance				Research, Technology and Engineering	climatologyMeteorologyAtmosphere	yes
UMRB6002	6002	UMRB - St. Paul	LAND-ATMOSPHERE FLUXES (EC)	GPP	Gross Primary Productivity	umol/m^2/s	30 minute	30 minute	1/1/2017	2017-01-01	2017-01-01	present	now	2019-12-31	3	C. Winker	.csv	Ameriflux	North Site: US-Ro6  South Site: US-Ro5	1	North Site: I18N, Rosemount, MN  South Site: I18S, Rosemount, MN	Open	Eddy Covariance	AmeriFlux	unresolved	Meteorology, Eddy Covariance				Research, Technology and Engineering	climatologyMeteorologyAtmosphere	yes
UMRB6003	6003	UMRB - St. Paul	LAND-ATMOSPHERE FLUXES (EC)	LE_F	Gapfilled Latent heat turbulent flux	W/m^2	30 minute	30 minute	1/1/2017	2017-01-01	2017-01-01	present	now	2019-12-31	3	C. Winker	.csv	Ameriflux	North Site: US-Ro6  South Site: US-Ro5	1	North Site: I18N, Rosemount, MN  South Site: I18S, Rosemount, MN	Open	Eddy Covariance	AmeriFlux	unresolved	Meteorology, Eddy Covariance				Research, Technology and Engineering	climatologyMeteorologyAtmosphere	yes
UMRB6004	6004	UMRB - St. Paul	LAND-ATMOSPHERE FLUXES (EC)	TA	Air temperature	deg C	30 minute	30 minute	1/1/2017	2017-01-01	2017-01-01	present	now	2019-12-31	3	C. Winker	.csv	Ameriflux	North Site: US-Ro6  South Site: US-Ro5	1	North Site: I18N, Rosemount, MN  South Site: I18S, Rosemount, MN	Open	Eddy Covariance	AmeriFlux	avg temp	Meteorology, Eddy Covariance				Research, Technology and Engineering	climatologyMeteorologyAtmosphere	yes
UMRB6005	6005	UMRB - St. Paul	LAND-ATMOSPHERE FLUXES (EC)	G	Soil heat flux	W/m^2	30 minute	30 minute	1/1/2017	2017-01-01	2017-01-01	present	now	2019-12-31	3	C. Winker	.csv	Ameriflux	North Site: US-Ro6  South Site: US-Ro5	1	North Site: I18N, Rosemount, MN  South Site: I18S, Rosemount, MN	Open	Eddy Covariance	AmeriFlux	unresolved	Meteorology, Eddy Covariance				Research, Technology and Engineering	climatologyMeteorologyAtmosphere	yes
UMRB6006	6006	UMRB - St. Paul	LAND-ATMOSPHERE FLUXES (EC)	TS_1_1_1	Soil temperature	deg C	30 minute	30 minute	1/1/2017	2017-01-01	2017-01-01	present	now	2019-12-31	3	C. Winker	.csv	Ameriflux	North Site: US-Ro6  South Site: US-Ro5	1	North Site: I18N, Rosemount, MN  South Site: I18S, Rosemount, MN	Open	Eddy Covariance	AmeriFlux	unresolved	Meteorology, Eddy Covariance				Research, Technology and Engineering	climatologyMeteorologyAtmosphere	yes
UMRB6007	6007	UMRB - St. Paul	LAND-ATMOSPHERE FLUXES (EC)	TS_1_2_1	Soil temperature	deg C	30 minute	30 minute	1/1/2017	2017-01-01	2017-01-01	present	now	2019-12-31	3	C. Winker	.csv	Ameriflux	North Site: US-Ro6  South Site: US-Ro5	1	North Site: I18N, Rosemount, MN  South Site: I18S, Rosemount, MN	Open	Eddy Covariance	AmeriFlux	unresolved	Meteorology, Eddy Covariance				Research, Technology and Engineering	climatologyMeteorologyAtmosphere	yes
UMRB6008	6008	UMRB - St. Paul	LAND-ATMOSPHERE FLUXES (EC)	TS_1_3_1	Soil temperature	deg C	30 minute	30 minute	1/1/2017	2017-01-01	2017-01-01	present	now	2019-12-31	3	C. Winker	.csv	Ameriflux	North Site: US-Ro6  South Site: US-Ro5	1	North Site: I18N, Rosemount, MN  South Site: I18S, Rosemount, MN	Open	Eddy Covariance	AmeriFlux	unresolved	Meteorology, Eddy Covariance				Research, Technology and Engineering	climatologyMeteorologyAtmosphere	yes
UMRB6009	6009	UMRB - St. Paul	LAND-ATMOSPHERE FLUXES (EC)	TS_1_4_1	Soil temperature	deg C	30 minute	30 minute	1/1/2017	2017-01-01	2017-01-01	present	now	2019-12-31	3	C. Winker	.csv	Ameriflux	North Site: US-Ro6  South Site: US-Ro5	1	North Site: I18N, Rosemount, MN  South Site: I18S, Rosemount, MN	Open	Eddy Covariance	AmeriFlux	unresolved	Meteorology, Eddy Covariance				Research, Technology and Engineering	climatologyMeteorologyAtmosphere	yes
UMRB6010	6010	UMRB - St. Paul	LAND-ATMOSPHERE FLUXES (EC)	NETRAD	Net radiation	W/m^2	30 minute	30 minute	1/1/2017	2017-01-01	2017-01-01	present	now	2019-12-31	3	C. Winker	.csv	Ameriflux	North Site: US-Ro6  South Site: US-Ro5	1	North Site: I18N, Rosemount, MN  South Site: I18S, Rosemount, MN	Open	Eddy Covariance	AmeriFlux	unresolved	Meteorology, Eddy Covariance				Research, Technology and Engineering	climatologyMeteorologyAtmosphere	yes
UMRB6011	6011	UMRB - St. Paul	LAND-ATMOSPHERE FLUXES (EC)	RH	Relative humidity	%	30 minute	30 minute	1/1/2017	2017-01-01	2017-01-01	present	now	2019-12-31	3	C. Winker	.csv	Ameriflux	North Site: US-Ro6  South Site: US-Ro5	1	North Site: I18N, Rosemount, MN  South Site: I18S, Rosemount, MN	Open	Eddy Covariance	AmeriFlux	unresolved	Meteorology, Eddy Covariance				Research, Technology and Engineering	climatologyMeteorologyAtmosphere	yes
UMRB6012	6012	UMRB - St. Paul	LAND-ATMOSPHERE FLUXES (EC)	P	Precipitation	mm	30 minute	30 minute	1/1/2017	2017-01-01	2017-01-01	present	now	2019-12-31	3	C. Winker	.csv	Ameriflux	North Site: US-Ro6  South Site: US-Ro5	1	North Site: I18N, Rosemount, MN  South Site: I18S, Rosemount, MN	Open	Eddy Covariance	AmeriFlux	unresolved	Meteorology, Eddy Covariance				Research, Technology and Engineering	climatologyMeteorologyAtmosphere	yes
UMRB6013	6013	UMRB - St. Paul	LAND-ATMOSPHERE FLUXES (EC)	VPD	Vapor pressure deficit	hpa	30 minute	30 minute	1/1/2017	2017-01-01	2017-01-01	present	now	2019-12-31	3	C. Winker	.csv	Ameriflux	North Site: US-Ro6  South Site: US-Ro5	1	North Site: I18N, Rosemount, MN  South Site: I18S, Rosemount, MN	Open	Eddy Covariance	AmeriFlux	unresolved	Meteorology, Eddy Covariance				Research, Technology and Engineering	climatologyMeteorologyAtmosphere	yes
UMRB6014	6014	UMRB - St. Paul	LAND-ATMOSPHERE FLUXES (EC)	WS	Wind speed	m/s	30 minute	30 minute	1/1/2017	2017-01-01	2017-01-01	present	now	2019-12-31	3	C. Winker	.csv	Ameriflux	North Site: US-Ro6  South Site: US-Ro5	1	North Site: I18N, Rosemount, MN  South Site: I18S, Rosemount, MN	Open	Eddy Covariance	AmeriFlux	Wind speed, air, daily, mean	Meteorology, Eddy Covariance				Research, Technology and Engineering	climatologyMeteorologyAtmosphere	yes
UMRB6015	6015	UMRB - St. Paul	LAND-ATMOSPHERE FLUXES (EC)	SW_IN	Shortwave radiation, incoming	W/m^2	30 minute	30 minute	1/1/2017	2017-01-01	2017-01-01	present	now	2019-12-31	3	C. Winker	.csv	Ameriflux	North Site: US-Ro6  South Site: US-Ro5	1	North Site: I18N, Rosemount, MN  South Site: I18S, Rosemount, MN	Open	Eddy Covariance	AmeriFlux	ave_incoming_shortwave radiation	Meteorology, Eddy Covariance				Research, Technology and Engineering	climatologyMeteorologyAtmosphere	yes
UMRB6016	6016	UMRB - St. Paul	LAND-ATMOSPHERE FLUXES (EC)	SW_OUT	Shortwave radiation, outgoing	W/m^2	30 minute	30 minute	1/1/2017	2017-01-01	2017-01-01	present	now	2019-12-31	3	C. Winker	.csv	Ameriflux	North Site: US-Ro6  South Site: US-Ro5	1	North Site: I18N, Rosemount, MN  South Site: I18S, Rosemount, MN	Open	Eddy Covariance	AmeriFlux	ave_outgoing_shortwave radiation	Meteorology, Eddy Covariance				Research, Technology and Engineering	climatologyMeteorologyAtmosphere	yes
UMRB6017	6017	UMRB - St. Paul	LAND-ATMOSPHERE FLUXES (EC)	LW_IN	Longwave radiation, incoming	W/m^2	30 minute	30 minute	1/1/2017	2017-01-01	2017-01-01	present	now	2019-12-31	3	C. Winker	.csv	Ameriflux	North Site: US-Ro6  South Site: US-Ro5	1	North Site: I18N, Rosemount, MN  South Site: I18S, Rosemount, MN	Open	Eddy Covariance	AmeriFlux	ave_incoming_longwave radiation	Meteorology, Eddy Covariance				Research, Technology and Engineering	climatologyMeteorologyAtmosphere	yes
UMRB6018	6018	UMRB - St. Paul	LAND-ATMOSPHERE FLUXES (EC)	LW_OUT	Longwave radiation, outgoing	W/m^2	30 minute	30 minute	1/1/2017	2017-01-01	2017-01-01	present	now	2019-12-31	3	C. Winker	.csv	Ameriflux	North Site: US-Ro6  South Site: US-Ro5	1	North Site: I18N, Rosemount, MN  South Site: I18S, Rosemount, MN	Open	Eddy Covariance	AmeriFlux	ave_outgoing_longwave radiation	Meteorology, Eddy Covariance				Research, Technology and Engineering	climatologyMeteorologyAtmosphere	yes
UMRB6019	6019	UMRB - St. Paul	LAND-ATMOSPHERE FLUXES (EC)	WD	Wind direction	decimal degrees	30 minute	30 minute	1/1/2017	2017-01-01	2017-01-01	present	now	2019-12-31	3	C. Winker	.csv	Ameriflux	North Site: US-Ro6  South Site: US-Ro5	1	North Site: I18N, Rosemount, MN  South Site: I18S, Rosemount, MN	Open	Eddy Covariance	AmeriFlux	Wind direction air, daily, mean	Meteorology, Eddy Covariance				Research, Technology and Engineering	climatologyMeteorologyAtmosphere	yes
UMRB6020	6020	UMRB - St. Paul	LAND-ATMOSPHERE FLUXES (EC)	PPFD_IN	Photosynthetic photon flux density, incoming	umol/m^2/s	30 minute	30 minute	1/1/2017	2017-01-01	2017-01-01	present	now	2019-12-31	3	C. Winker	.csv	Ameriflux	North Site: US-Ro6  South Site: US-Ro5	1	North Site: I18N, Rosemount, MN  South Site: I18S, Rosemount, MN	Open	Eddy Covariance	AmeriFlux	unresolved	Meteorology, Eddy Covariance				Research, Technology and Engineering	climatologyMeteorologyAtmosphere	yes
UMRB6021	6021	UMRB - St. Paul	LAND-ATMOSPHERE FLUXES (EC)	PA	Atmospheric pressure	kPa	30 minute	30 minute	1/1/2017	2017-01-01	2017-01-01	present	now	2019-12-31	3	C. Winker	.csv	Ameriflux	North Site: US-Ro6  South Site: US-Ro5	1	North Site: I18N, Rosemount, MN  South Site: I18S, Rosemount, MN	Open	Eddy Covariance	AmeriFlux	Pressure	Meteorology, Eddy Covariance				Research, Technology and Engineering	climatologyMeteorologyAtmosphere	yes
UMRB6022	6022	UMRB - St. Paul	LAND-ATMOSPHERE FLUXES (EC)	T_CANOPY	Temperature of the canopy	deg C	30 minute	30 minute	1/1/2017	2017-01-01	2017-01-01	present	now	2019-12-31	3	C. Winker	.csv	Ameriflux	North Site: US-Ro6  South Site: US-Ro5	1	North Site: I18N, Rosemount, MN  South Site: I18S, Rosemount, MN	Open	Eddy Covariance	AmeriFlux	unresolved	Meteorology, Eddy Covariance				Research, Technology and Engineering	climatologyMeteorologyAtmosphere	yes
UMRB6023	6023	UMRB - St. Paul	LAND-ATMOSPHERE FLUXES (EC)	ALB	Albedo	%	30 minute	30 minute	1/1/2017	2017-01-01	2017-01-01	present	now	2019-12-31	3	C. Winker	.csv	Ameriflux	North Site: US-Ro6  South Site: US-Ro5	1	North Site: I18N, Rosemount, MN  South Site: I18S, Rosemount, MN	Open	Eddy Covariance	AmeriFlux	Albedo	Meteorology, Eddy Covariance				Research, Technology and Engineering	climatologyMeteorologyAtmosphere	yes
UMRB6024	6024	UMRB - St. Paul	LAND-ATMOSPHERE FLUXES (EC)	SWC	Soil water content (volumetric)	%	30 minute	30 minute	1/1/2017	2017-01-01	2017-01-01	present	now	2019-12-31	3	C. Winker	.csv	Ameriflux	North Site: US-Ro6  South Site: US-Ro5	1	North Site: I18N, Rosemount, MN  South Site: I18S, Rosemount, MN	Open	Eddy Covariance	AmeriFlux	unresolved	Meteorology, Eddy Covariance				Research, Technology and Engineering	climatologyMeteorologyAtmosphere	yes
UMRB6025	6025	UMRB - St. Paul	METEOROLOGY	Air Temperature	Air Temperature	Deg C	15 minute	15 minute	10/5/2015	2015-10-05	2015-10-05	present	now	2019-12-31	4	C. Winker	NAL LTAR Data Portal	NAL LTAR Data Portal	UMRB - St. Paul - 000	1	Prairie, Rosemount, MN	Open	Meteorology	WeatherDaily, WeatherStation	Temperature, air, daily, mean					Natural Resources, Earth and Environmental Sciences	climatologyMeteorologyAtmosphere	yes
UMRB6026	6026	UMRB - St. Paul	METEOROLOGY	Air Pressure	Air Pressure	kPa	15 minute	15 minute	10/5/2015	2015-10-05	2015-10-05	present	now	2019-12-31	4	C. Winker	NAL LTAR Data Portal	NAL LTAR Data Portal	UMRB - St. Paul - 000	1	Prairie, Rosemount, MN	Open	Meteorology	WeatherDaily, WeatherStation	Pressure					Natural Resources, Earth and Environmental Sciences	climatologyMeteorologyAtmosphere	yes
UMRB6027	6027	UMRB - St. Paul	METEOROLOGY	Incoming longwave radiation	Incoming longwave radiation	W/m2	15 minute	15 minute	10/5/2015	2015-10-05	2015-10-05	present	now	2019-12-31	4	C. Winker	NAL LTAR Data Portal	NAL LTAR Data Portal	UMRB - St. Paul - 000	1	Prairie, Rosemount, MN	Open	Meteorology	WeatherDaily, WeatherStation	ave_incoming_longwave radiation					Natural Resources, Earth and Environmental Sciences	climatologyMeteorologyAtmosphere	yes
UMRB6028	6028	UMRB - St. Paul	METEOROLOGY	Incoming shortwave radiation	Incoming shortwave radiation	W/m2	15 minute	15 minute	10/5/2015	2015-10-05	2015-10-05	present	now	2019-12-31	4	C. Winker	NAL LTAR Data Portal	NAL LTAR Data Portal	UMRB - St. Paul - 000	1	Prairie, Rosemount, MN	Open	Meteorology	WeatherDaily, WeatherStation	ave_incoming_shortwave radiation					Natural Resources, Earth and Environmental Sciences	climatologyMeteorologyAtmosphere	yes
UMRB6029	6029	UMRB - St. Paul	METEOROLOGY	Photosynthetically Active Radiation	Photosynthetically Active Radiation, PAR	µmol/m2/s	15 minute	15 minute	10/5/2015	2015-10-05	2015-10-05	present	now	2019-12-31	4	C. Winker	NAL LTAR Data Portal	NAL LTAR Data Portal	UMRB - St. Paul - 000	1	Prairie, Rosemount, MN	Open	Meteorology	WeatherDaily, WeatherStation	Photosynthetically active radiation					Natural Resources, Earth and Environmental Sciences	climatologyMeteorologyAtmosphere	yes
UMRB6030	6030	UMRB - St. Paul	METEOROLOGY	Relative Humidity	Relative Humidity	%	15 minute	15 minute	10/5/2015	2015-10-05	2015-10-05	present	now	2019-12-31	4	C. Winker	NAL LTAR Data Portal	NAL LTAR Data Portal	UMRB - St. Paul - 000	1	Prairie, Rosemount, MN	Open	Meteorology	WeatherDaily, WeatherStation	Relative humidity, air, daily, mean					Natural Resources, Earth and Environmental Sciences	climatologyMeteorologyAtmosphere	yes
UMRB6031	6031	UMRB - St. Paul	METEOROLOGY	Wind Speed	Wind Speed	m/s	15 minute	15 minute	10/5/2015	2015-10-05	2015-10-05	present	now	2019-12-31	4	C. Winker	NAL LTAR Data Portal	NAL LTAR Data Portal	UMRB - St. Paul - 000	1	Prairie, Rosemount, MN	Open	Meteorology	WeatherDaily, WeatherStation	Wind speed, air, daily, mean					Natural Resources, Earth and Environmental Sciences	climatologyMeteorologyAtmosphere	yes
UMRB6032	6032	UMRB - St. Paul	METEOROLOGY	Wind Direction	Wind Direction	Deg	15 minute	15 minute	10/5/2015	2015-10-05	2015-10-05	present	now	2019-12-31	4	C. Winker	NAL LTAR Data Portal	NAL LTAR Data Portal	UMRB - St. Paul - 000	1	Prairie, Rosemount, MN	Open	Meteorology	WeatherDaily, WeatherStation	Wind direction air, daily, mean					Natural Resources, Earth and Environmental Sciences	climatologyMeteorologyAtmosphere	yes
UMRB6033	6033	UMRB - St. Paul	METEOROLOGY	Precipitation	Precipitation	mm	15 minute	15 minute	10/5/2015	2015-10-05	2015-10-05	present	now	2019-12-31	4	C. Winker	NAL LTAR Data Portal	NAL LTAR Data Portal	UMRB - St. Paul - 000	1	Prairie, Rosemount, MN	Open	Meteorology	WeatherDaily, WeatherStation	Precipitation, total, no media, daily					Natural Resources, Earth and Environmental Sciences	climatologyMeteorologyAtmosphere	yes
UMRB6034	6034	UMRB - St. Paul	VEGETATION	Phenocam	Phenocam, IR, RGB, Images, Business As Usual	jpg	30 minute	30 minute	1/13/2017	2017-01-13	2017-01-13	present	now	2019-12-31	3	C. Winker	Phenocam Network Web Site	Phenocam Network Web Site	rosemountconv	1	I18S, Rosemount, MN	Open	Vegetation	new ecology	PhenoCam	Vegetation				Natural Resources, Earth and Environmental Sciences	biota	yes
UMRB6035	6035	UMRB - St. Paul	VEGETATION	Phenocam	Phenocam, IR, RGB, Images, Aspirational	jpg	30 minute	30 minute	1/13/2017	2017-01-13	2017-01-13	present	now	2019-12-31	3	C. Winker	Phenocam Network Web Site	Phenocam Network Web Site	rosemountcons	1	I18N, Rosemount, MN	Open	Vegetation	new ecology	PhenoCam	Vegetation				Natural Resources, Earth and Environmental Sciences	biota	yes
UMRB6036	6036	UMRB - St. Paul	VEGETATION	Phenocam	Phenocam, IR, RGB, Images, Aspirational, Restored Prairie	jpg	30 minute	30 minute	10/2/2015	2015-10-02	2015-10-02	present	now	2019-12-31	4	C. Winker	Phenocam Network Web Site	Phenocam Network Web Site	rosemountnprs	1	Prairie, Rosemount, MN	Open	Vegetation	new ecology	PhenoCam	Vegetation				Natural Resources, Earth and Environmental Sciences	biota	yes
UMRB6037	6037	UMRB-Morris	Eddy Covariance	Hs	flux system, raw data	W/m^2	15 minute	15 minute	6/9/2017	2017-06-09	2017-06-09	present	now	2019-12-31	3	C. Wente	Spreadsheet	local network		1	"Morris MN sites 1 and 2"	Open	Eddy Covariance	AmeriFlux		Meteorology, Eddy Covariance				Research, Technology and Engineering	climatologyMeteorologyAtmosphere	yes
UMRB6038	6038	UMRB-Morris	Eddy Covariance	tau	flux system, raw data	kg/(m s^2)	15 minute	15 minute	6/9/2017	2017-06-09	2017-06-09	present	now	2019-12-31	3	C. Wente	Spreadsheet	local network		1	"Morris MN sites 1 and 2"	Open	Eddy Covariance	AmeriFlux		Meteorology, Eddy Covariance				Research, Technology and Engineering	climatologyMeteorologyAtmosphere	yes
UMRB6039	6039	UMRB-Morris	Eddy Covariance	u_star	flux system, raw data	m/s	15 minute	15 minute	6/9/2017	2017-06-09	2017-06-09	present	now	2019-12-31	3	C. Wente	Spreadsheet	local network		1	"Morris MN sites 1 and 2"	Open	Eddy Covariance	AmeriFlux		Meteorology, Eddy Covariance				Research, Technology and Engineering	climatologyMeteorologyAtmosphere	yes
UMRB6040	6040	UMRB-Morris	Eddy Covariance	Ts_stdev	flux system, raw data	C	15 minute	15 minute	6/9/2017	2017-06-09	2017-06-09	present	now	2019-12-31	3	C. Wente	Spreadsheet	local network		1	"Morris MN sites 1 and 2"	Open	Eddy Covariance	AmeriFlux		Meteorology, Eddy Covariance				Research, Technology and Engineering	climatologyMeteorologyAtmosphere	yes
UMRB6041	6041	UMRB-Morris	Eddy Covariance	Ts_Ux_cov	flux system, raw data	C m/s	15 minute	15 minute	6/9/2017	2017-06-09	2017-06-09	present	now	2019-12-31	3	C. Wente	Spreadsheet	local network		1	"Morris MN sites 1 and 2"	Open	Eddy Covariance	AmeriFlux		Meteorology, Eddy Covariance				Research, Technology and Engineering	climatologyMeteorologyAtmosphere	yes
UMRB6042	6042	UMRB-Morris	Eddy Covariance	Ts_Uy_cov	flux system, raw data	C m/s	15 minute	15 minute	6/9/2017	2017-06-09	2017-06-09	present	now	2019-12-31	3	C. Wente	Spreadsheet	local network		1	"Morris MN sites 1 and 2"	Open	Eddy Covariance	AmeriFlux		Meteorology, Eddy Covariance				Research, Technology and Engineering	climatologyMeteorologyAtmosphere	yes
UMRB6043	6043	UMRB-Morris	Eddy Covariance	Ts_Uz_cov	flux system, raw data	C m/s	15 minute	15 minute	6/9/2017	2017-06-09	2017-06-09	present	now	2019-12-31	3	C. Wente	Spreadsheet	local network		1	"Morris MN sites 1 and 2"	Open	Eddy Covariance	AmeriFlux		Meteorology, Eddy Covariance				Research, Technology and Engineering	climatologyMeteorologyAtmosphere	yes
UMRB6044	6044	UMRB-Morris	Eddy Covariance	Ux_stdev	flux system, raw data	m/s	15 minute	15 minute	6/9/2017	2017-06-09	2017-06-09	present	now	2019-12-31	3	C. Wente	Spreadsheet	local network		1	"Morris MN sites 1 and 2"	Open	Eddy Covariance	AmeriFlux		Meteorology, Eddy Covariance				Research, Technology and Engineering	climatologyMeteorologyAtmosphere	yes
UMRB6045	6045	UMRB-Morris	Eddy Covariance	Ux_Uy_cov	flux system, raw data	(m/s)^2	15 minute	15 minute	6/9/2017	2017-06-09	2017-06-09	present	now	2019-12-31	3	C. Wente	Spreadsheet	local network		1	"Morris MN sites 1 and 2"	Open	Eddy Covariance	AmeriFlux		Meteorology, Eddy Covariance				Research, Technology and Engineering	climatologyMeteorologyAtmosphere	yes
UMRB6046	6046	UMRB-Morris	Eddy Covariance	Ux_Uz_cov	flux system, raw data	(m/s)^2	15 minute	15 minute	6/9/2017	2017-06-09	2017-06-09	present	now	2019-12-31	3	C. Wente	Spreadsheet	local network		1	"Morris MN sites 1 and 2"	Open	Eddy Covariance	AmeriFlux		Meteorology, Eddy Covariance				Research, Technology and Engineering	climatologyMeteorologyAtmosphere	yes
UMRB6047	6047	UMRB-Morris	Eddy Covariance	Uy_stdev	flux system, raw data	m/s	15 minute	15 minute	6/9/2017	2017-06-09	2017-06-09	present	now	2019-12-31	3	C. Wente	Spreadsheet	local network		1	"Morris MN sites 1 and 2"	Open	Eddy Covariance	AmeriFlux		Meteorology, Eddy Covariance				Research, Technology and Engineering	climatologyMeteorologyAtmosphere	yes
UMRB6048	6048	UMRB-Morris	Eddy Covariance	Uy_Uz_cov	flux system, raw data	(m/s)^2	15 minute	15 minute	6/9/2017	2017-06-09	2017-06-09	present	now	2019-12-31	3	C. Wente	Spreadsheet	local network		1	"Morris MN sites 1 and 2"	Open	Eddy Covariance	AmeriFlux		Meteorology, Eddy Covariance				Research, Technology and Engineering	climatologyMeteorologyAtmosphere	yes
UMRB6049	6049	UMRB-Morris	Eddy Covariance	Uz_stdev	flux system, raw data	m/s	15 minute	15 minute	6/9/2017	2017-06-09	2017-06-09	present	now	2019-12-31	3	C. Wente	Spreadsheet	local network		1	"Morris MN sites 1 and 2"	Open	Eddy Covariance	AmeriFlux		Meteorology, Eddy Covariance				Research, Technology and Engineering	climatologyMeteorologyAtmosphere	yes
UMRB6050	6050	UMRB-Morris	Eddy Covariance	wnd_spd	flux system, raw data	m/s	15 minute	15 minute	6/9/2017	2017-06-09	2017-06-09	present	now	2019-12-31	3	C. Wente	Spreadsheet	local network		1	"Morris MN sites 1 and 2"	Open	Eddy Covariance	AmeriFlux		Meteorology, Eddy Covariance				Research, Technology and Engineering	climatologyMeteorologyAtmosphere	yes
UMRB6051	6051	UMRB-Morris	Eddy Covariance	rslt_wnd_spd	flux system, raw data	m/s	15 minute	15 minute	6/9/2017	2017-06-09	2017-06-09	present	now	2019-12-31	3	C. Wente	Spreadsheet	local network		1	"Morris MN sites 1 and 2"	Open	Eddy Covariance	AmeriFlux		Meteorology, Eddy Covariance				Research, Technology and Engineering	climatologyMeteorologyAtmosphere	yes
UMRB6052	6052	UMRB-Morris	Eddy Covariance	wnd_dir_sonic	flux system, raw data	degrees	15 minute	15 minute	6/9/2017	2017-06-09	2017-06-09	present	now	2019-12-31	3	C. Wente	Spreadsheet	local network		1	"Morris MN sites 1 and 2"	Open	Eddy Covariance	AmeriFlux		Meteorology, Eddy Covariance				Research, Technology and Engineering	climatologyMeteorologyAtmosphere	yes
UMRB6053	6053	UMRB-Morris	Eddy Covariance	std_wnd_dir	flux system, raw data	degrees	15 minute	15 minute	6/9/2017	2017-06-09	2017-06-09	present	now	2019-12-31	3	C. Wente	Spreadsheet	local network		1	"Morris MN sites 1 and 2"	Open	Eddy Covariance	AmeriFlux		Meteorology, Eddy Covariance				Research, Technology and Engineering	climatologyMeteorologyAtmosphere	yes
UMRB6054	6054	UMRB-Morris	Eddy Covariance	wnd_dir_compass	flux system, raw data	degrees	15 minute	15 minute	6/9/2017	2017-06-09	2017-06-09	present	now	2019-12-31	3	C. Wente	Spreadsheet	local network		1	"Morris MN sites 1 and 2"	Open	Eddy Covariance	AmeriFlux		Meteorology, Eddy Covariance				Research, Technology and Engineering	climatologyMeteorologyAtmosphere	yes
UMRB6055	6055	UMRB-Morris	Eddy Covariance	Ux_Avg	flux system, raw data	m/s	15 minute	15 minute	6/9/2017	2017-06-09	2017-06-09	present	now	2019-12-31	3	C. Wente	Spreadsheet	local network		1	"Morris MN sites 1 and 2"	Open	Eddy Covariance	AmeriFlux		Meteorology, Eddy Covariance				Research, Technology and Engineering	climatologyMeteorologyAtmosphere	yes
UMRB6056	6056	UMRB-Morris	Eddy Covariance	Uy_Avg	flux system, raw data	m/s	15 minute	15 minute	6/9/2017	2017-06-09	2017-06-09	present	now	2019-12-31	3	C. Wente	Spreadsheet	local network		1	"Morris MN sites 1 and 2"	Open	Eddy Covariance	AmeriFlux		Meteorology, Eddy Covariance				Research, Technology and Engineering	climatologyMeteorologyAtmosphere	yes
UMRB6057	6057	UMRB-Morris	Eddy Covariance	Uz_Avg	flux system, raw data	m/s	15 minute	15 minute	6/9/2017	2017-06-09	2017-06-09	present	now	2019-12-31	3	C. Wente	Spreadsheet	local network		1	"Morris MN sites 1 and 2"	Open	Eddy Covariance	AmeriFlux		Meteorology, Eddy Covariance				Research, Technology and Engineering	climatologyMeteorologyAtmosphere	yes
UMRB6058	6058	UMRB-Morris	Eddy Covariance	Ts_Avg	flux system, raw data	C	15 minute	15 minute	6/9/2017	2017-06-09	2017-06-09	present	now	2019-12-31	3	C. Wente	Spreadsheet	local network		1	"Morris MN sites 1 and 2"	Open	Eddy Covariance	AmeriFlux		Meteorology, Eddy Covariance				Research, Technology and Engineering	climatologyMeteorologyAtmosphere	yes
UMRB6059	6059	UMRB-Morris	Eddy Covariance	sonic_azimuth	flux system, raw data	degrees	15 minute	15 minute	6/9/2017	2017-06-09	2017-06-09	present	now	2019-12-31	3	C. Wente	Spreadsheet	local network		1	"Morris MN sites 1 and 2"	Open	Eddy Covariance	AmeriFlux		Meteorology, Eddy Covariance				Research, Technology and Engineering	climatologyMeteorologyAtmosphere	yes
UMRB6060	6060	UMRB-Morris	Eddy Covariance	sonic_samples_Tot	flux system, raw data	samples	15 minute	15 minute	6/9/2017	2017-06-09	2017-06-09	present	now	2019-12-31	3	C. Wente	Spreadsheet	local network		1	"Morris MN sites 1 and 2"	Open	Eddy Covariance	AmeriFlux		Meteorology, Eddy Covariance				Research, Technology and Engineering	climatologyMeteorologyAtmosphere	yes
UMRB6061	6061	UMRB-Morris	Eddy Covariance	Fc_wpl	flux system, raw data	mg/(m^2 s)	15 minute	15 minute	6/9/2017	2017-06-09	2017-06-09	present	now	2019-12-31	3	C. Wente	Spreadsheet	local network		1	"Morris MN sites 1 and 2"	Open	Eddy Covariance	AmeriFlux		Meteorology, Eddy Covariance				Research, Technology and Engineering	climatologyMeteorologyAtmosphere	yes
UMRB6062	6062	UMRB-Morris	Eddy Covariance	LE_wpl	flux system, raw data	W/m^2	15 minute	15 minute	6/9/2017	2017-06-09	2017-06-09	present	now	2019-12-31	3	C. Wente	Spreadsheet	local network		1	"Morris MN sites 1 and 2"	Open	Eddy Covariance	AmeriFlux		Meteorology, Eddy Covariance				Research, Technology and Engineering	climatologyMeteorologyAtmosphere	yes
UMRB6063	6063	UMRB-Morris	Eddy Covariance	Hc	flux system, raw data	W/m^2	15 minute	15 minute	6/9/2017	2017-06-09	2017-06-09	present	now	2019-12-31	3	C. Wente	Spreadsheet	local network		1	"Morris MN sites 1 and 2"	Open	Eddy Covariance	AmeriFlux		Meteorology, Eddy Covariance				Research, Technology and Engineering	climatologyMeteorologyAtmosphere	yes
UMRB6064	6064	UMRB-Morris	Eddy Covariance	CO2_stdev	flux system, raw data	mg/m^3	15 minute	15 minute	6/9/2017	2017-06-09	2017-06-09	present	now	2019-12-31	3	C. Wente	Spreadsheet	local network		1	"Morris MN sites 1 and 2"	Open	Eddy Covariance	AmeriFlux		Meteorology, Eddy Covariance				Research, Technology and Engineering	climatologyMeteorologyAtmosphere	yes
UMRB6065	6065	UMRB-Morris	Eddy Covariance	CO2_Ux_cov	flux system, raw data	mg/(m^2 s)	15 minute	15 minute	6/9/2017	2017-06-09	2017-06-09	present	now	2019-12-31	3	C. Wente	Spreadsheet	local network		1	"Morris MN sites 1 and 2"	Open	Eddy Covariance	AmeriFlux		Meteorology, Eddy Covariance				Research, Technology and Engineering	climatologyMeteorologyAtmosphere	yes
UMRB6066	6066	UMRB-Morris	Eddy Covariance	CO2_Uy_cov	flux system, raw data	mg/(m^2 s)	15 minute	15 minute	6/9/2017	2017-06-09	2017-06-09	present	now	2019-12-31	3	C. Wente	Spreadsheet	local network		1	"Morris MN sites 1 and 2"	Open	Eddy Covariance	AmeriFlux		Meteorology, Eddy Covariance				Research, Technology and Engineering	climatologyMeteorologyAtmosphere	yes
UMRB6067	6067	UMRB-Morris	Eddy Covariance	CO2_Uz_cov	flux system, raw data	mg/(m^2 s)	15 minute	15 minute	6/9/2017	2017-06-09	2017-06-09	present	now	2019-12-31	3	C. Wente	Spreadsheet	local network		1	"Morris MN sites 1 and 2"	Open	Eddy Covariance	AmeriFlux		Meteorology, Eddy Covariance				Research, Technology and Engineering	climatologyMeteorologyAtmosphere	yes
UMRB6068	6068	UMRB-Morris	Eddy Covariance	H2O_Ux_cov	flux system, raw data	g/(m^2 s)	15 minute	15 minute	6/9/2017	2017-06-09	2017-06-09	present	now	2019-12-31	3	C. Wente	Spreadsheet	local network		1	"Morris MN sites 1 and 2"	Open	Eddy Covariance	AmeriFlux		Meteorology, Eddy Covariance				Research, Technology and Engineering	climatologyMeteorologyAtmosphere	yes
UMRB6069	6069	UMRB-Morris	Eddy Covariance	H2O_Uy_cov	flux system, raw data	g/(m^2 s)	15 minute	15 minute	6/9/2017	2017-06-09	2017-06-09	present	now	2019-12-31	3	C. Wente	Spreadsheet	local network		1	"Morris MN sites 1 and 2"	Open	Eddy Covariance	AmeriFlux		Meteorology, Eddy Covariance				Research, Technology and Engineering	climatologyMeteorologyAtmosphere	yes
UMRB6070	6070	UMRB-Morris	Eddy Covariance	H2O_Uz_cov	flux system, raw data	g/(m^2 s)	15 minute	15 minute	6/9/2017	2017-06-09	2017-06-09	present	now	2019-12-31	3	C. Wente	Spreadsheet	local network		1	"Morris MN sites 1 and 2"	Open	Eddy Covariance	AmeriFlux		Meteorology, Eddy Covariance				Research, Technology and Engineering	climatologyMeteorologyAtmosphere	yes
UMRB6071	6071	UMRB-Morris	Eddy Covariance	Tc_stdev	flux system, raw data	C	15 minute	15 minute	6/9/2017	2017-06-09	2017-06-09	present	now	2019-12-31	3	C. Wente	Spreadsheet	local network		1	"Morris MN sites 1 and 2"	Open	Eddy Covariance	AmeriFlux		Meteorology, Eddy Covariance				Research, Technology and Engineering	climatologyMeteorologyAtmosphere	yes
UMRB6072	6072	UMRB-Morris	Eddy Covariance	Tc_Ux_cov	flux system, raw data	C m/s	15 minute	15 minute	6/9/2017	2017-06-09	2017-06-09	present	now	2019-12-31	3	C. Wente	Spreadsheet	local network		1	"Morris MN sites 1 and 2"	Open	Eddy Covariance	AmeriFlux		Meteorology, Eddy Covariance				Research, Technology and Engineering	climatologyMeteorologyAtmosphere	yes
UMRB6073	6073	UMRB-Morris	Eddy Covariance	Tc_Uy_cov	flux system, raw data	C m/s	15 minute	15 minute	6/9/2017	2017-06-09	2017-06-09	present	now	2019-12-31	3	C. Wente	Spreadsheet	local network		1	"Morris MN sites 1 and 2"	Open	Eddy Covariance	AmeriFlux		Meteorology, Eddy Covariance				Research, Technology and Engineering	climatologyMeteorologyAtmosphere	yes
UMRB6074	6074	UMRB-Morris	Eddy Covariance	Tc_Uz_cov	flux system, raw data	C m/s	15 minute	15 minute	6/9/2017	2017-06-09	2017-06-09	present	now	2019-12-31	3	C. Wente	Spreadsheet	local network		1	"Morris MN sites 1 and 2"	Open	Eddy Covariance	AmeriFlux		Meteorology, Eddy Covariance				Research, Technology and Engineering	climatologyMeteorologyAtmosphere	yes
UMRB6075	6075	UMRB-Morris	Eddy Covariance	CO2_mean	flux system, raw data	mg/m^3	15 minute	15 minute	6/9/2017	2017-06-09	2017-06-09	present	now	2019-12-31	3	C. Wente	Spreadsheet	local network		1	"Morris MN sites 1 and 2"	Open	Eddy Covariance	AmeriFlux		Meteorology, Eddy Covariance				Research, Technology and Engineering	climatologyMeteorologyAtmosphere	yes
UMRB6076	6076	UMRB-Morris	Eddy Covariance	H2O_mean	flux system, raw data	g/m^3	15 minute	15 minute	6/9/2017	2017-06-09	2017-06-09	present	now	2019-12-31	3	C. Wente	Spreadsheet	local network		1	"Morris MN sites 1 and 2"	Open	Eddy Covariance	AmeriFlux		Meteorology, Eddy Covariance				Research, Technology and Engineering	climatologyMeteorologyAtmosphere	yes
UMRB6077	6077	UMRB-Morris	Eddy Covariance	amb_press_mean	flux system, raw data, barametric pressure	kPa	15 minute	15 minute	6/9/2017	2017-06-09	2017-06-09	present	now	2019-12-31	3	C. Wente	Spreadsheet	local network		1	"Morris MN sites 1 and 2"	Open	Eddy Covariance	AmeriFlux		Meteorology, Eddy Covariance				Research, Technology and Engineering	climatologyMeteorologyAtmosphere	yes
UMRB6078	6078	UMRB-Morris	Eddy Covariance	Tc_mean	flux system, raw data	C	15 minute	15 minute	6/9/2017	2017-06-09	2017-06-09	present	now	2019-12-31	3	C. Wente	Spreadsheet	local network		1	"Morris MN sites 1 and 2"	Open	Eddy Covariance	AmeriFlux		Meteorology, Eddy Covariance				Research, Technology and Engineering	climatologyMeteorologyAtmosphere	yes
UMRB6079	6079	UMRB-Morris	Eddy Covariance	rho_a_mean	flux system, raw data	kg/m^3	15 minute	15 minute	6/9/2017	2017-06-09	2017-06-09	present	now	2019-12-31	3	C. Wente	Spreadsheet	local network		1	"Morris MN sites 1 and 2"	Open	Eddy Covariance	AmeriFlux		Meteorology, Eddy Covariance				Research, Technology and Engineering	climatologyMeteorologyAtmosphere	yes
UMRB6080	6080	UMRB-Morris	Eddy Covariance	Fc_irga	flux system, raw data	mg/(m^2 s)	15 minute	15 minute	6/9/2017	2017-06-09	2017-06-09	present	now	2019-12-31	3	C. Wente	Spreadsheet	local network		1	"Morris MN sites 1 and 2"	Open	Eddy Covariance	AmeriFlux		Meteorology, Eddy Covariance				Research, Technology and Engineering	climatologyMeteorologyAtmosphere	yes
UMRB6081	6081	UMRB-Morris	Eddy Covariance	LE_irga	flux system, raw data	W/m^2	15 minute	15 minute	6/9/2017	2017-06-09	2017-06-09	present	now	2019-12-31	3	C. Wente	Spreadsheet	local network		1	"Morris MN sites 1 and 2"	Open	Eddy Covariance	AmeriFlux		Meteorology, Eddy Covariance				Research, Technology and Engineering	climatologyMeteorologyAtmosphere	yes
UMRB6082	6082	UMRB-Morris	Eddy Covariance	CO2_wpl_LE	flux system, raw data	mg/(m^2 s)	15 minute	15 minute	6/9/2017	2017-06-09	2017-06-09	present	now	2019-12-31	3	C. Wente	Spreadsheet	local network		1	"Morris MN sites 1 and 2"	Open	Eddy Covariance	AmeriFlux		Meteorology, Eddy Covariance				Research, Technology and Engineering	climatologyMeteorologyAtmosphere	yes
UMRB6083	6083	UMRB-Morris	Eddy Covariance	CO2_wpl_H	flux system, raw data	mg/(m^2 s)	15 minute	15 minute	6/9/2017	2017-06-09	2017-06-09	present	now	2019-12-31	3	C. Wente	Spreadsheet	local network		1	"Morris MN sites 1 and 2"	Open	Eddy Covariance	AmeriFlux		Meteorology, Eddy Covariance				Research, Technology and Engineering	climatologyMeteorologyAtmosphere	yes
UMRB6084	6084	UMRB-Morris	Eddy Covariance	H2O_wpl_LE	flux system, raw data	W/m^2	15 minute	15 minute	6/9/2017	2017-06-09	2017-06-09	present	now	2019-12-31	3	C. Wente	Spreadsheet	local network		1	"Morris MN sites 1 and 2"	Open	Eddy Covariance	AmeriFlux		Meteorology, Eddy Covariance				Research, Technology and Engineering	climatologyMeteorologyAtmosphere	yes
UMRB6085	6085	UMRB-Morris	Eddy Covariance	H2O_wpl_H	flux system, raw data	W/m^2	15 minute	15 minute	6/9/2017	2017-06-09	2017-06-09	present	now	2019-12-31	3	C. Wente	Spreadsheet	local network		1	"Morris MN sites 1 and 2"	Open	Eddy Covariance	AmeriFlux		Meteorology, Eddy Covariance				Research, Technology and Engineering	climatologyMeteorologyAtmosphere	yes
UMRB6086	6086	UMRB-Morris	Eddy Covariance	irga_samples_Tot	flux system, raw data	samples	15 minute	15 minute	6/9/2017	2017-06-09	2017-06-09	present	now	2019-12-31	3	C. Wente	Spreadsheet	local network		1	"Morris MN sites 1 and 2"	Open	Eddy Covariance	AmeriFlux		Meteorology, Eddy Covariance				Research, Technology and Engineering	climatologyMeteorologyAtmosphere	yes
UMRB6087	6087	UMRB-Morris	Eddy Covariance	CO2_sig_strgth_mean	flux system, raw data	arb	15 minute	15 minute	6/9/2017	2017-06-09	2017-06-09	present	now	2019-12-31	3	C. Wente	Spreadsheet	local network		1	"Morris MN sites 1 and 2"	Open	Eddy Covariance	AmeriFlux		Meteorology, Eddy Covariance				Research, Technology and Engineering	climatologyMeteorologyAtmosphere	yes
UMRB6088	6088	UMRB-Morris	Eddy Covariance	H2O_sig_strgth_mean	flux system, raw data	arb	15 minute	15 minute	6/9/2017	2017-06-09	2017-06-09	present	now	2019-12-31	3	C. Wente	Spreadsheet	local network		1	"Morris MN sites 1 and 2"	Open	Eddy Covariance	AmeriFlux		Meteorology, Eddy Covariance				Research, Technology and Engineering	climatologyMeteorologyAtmosphere	yes
UMRB6089	6089	UMRB-Morris	Eddy Covariance	h2o_hmp_Avg	flux system, raw data	g/m^3	15 minute	15 minute	6/9/2017	2017-06-09	2017-06-09	present	now	2019-12-31	3	C. Wente	Spreadsheet	local network		1	"Morris MN sites 1 and 2"	Open	Eddy Covariance	AmeriFlux		Meteorology, Eddy Covariance				Research, Technology and Engineering	climatologyMeteorologyAtmosphere	yes
UMRB6090	6090	UMRB-Morris	Eddy Covariance	T_hmp_Avg	flux system, raw data	C	15 minute	15 minute	6/9/2017	2017-06-09	2017-06-09	present	now	2019-12-31	3	C. Wente	Spreadsheet	local network		1	"Morris MN sites 1 and 2"	Open	Eddy Covariance	AmeriFlux		Meteorology, Eddy Covariance				Research, Technology and Engineering	climatologyMeteorologyAtmosphere	yes
UMRB6091	6091	UMRB-Morris	Eddy Covariance	RH_hmp_Avg	flux system, raw data	fraction	15 minute	15 minute	6/9/2017	2017-06-09	2017-06-09	present	now	2019-12-31	3	C. Wente	Spreadsheet	local network		1	"Morris MN sites 1 and 2"	Open	Eddy Covariance	AmeriFlux		Meteorology, Eddy Covariance				Research, Technology and Engineering	climatologyMeteorologyAtmosphere	yes
UMRB6092	6092	UMRB-Morris	Eddy Covariance	e_hmp_Avg	flux system, raw data	kPa	15 minute	15 minute	6/9/2017	2017-06-09	2017-06-09	present	now	2019-12-31	3	C. Wente	Spreadsheet	local network		1	"Morris MN sites 1 and 2"	Open	Eddy Covariance	AmeriFlux		Meteorology, Eddy Covariance				Research, Technology and Engineering	climatologyMeteorologyAtmosphere	yes
UMRB6093	6093	UMRB-Morris	Eddy Covariance	e_sat_hmp_Avg	flux system, raw data		15 minute	15 minute	6/9/2017	2017-06-09	2017-06-09	present	now	2019-12-31	3	C. Wente	Spreadsheet	local network		1	"Morris MN sites 1 and 2"	Open	Eddy Covariance	AmeriFlux		Meteorology, Eddy Covariance				Research, Technology and Engineering	climatologyMeteorologyAtmosphere	yes
UMRB6094	6094	UMRB-Morris	Eddy Covariance	SW_In_Avg	flux system, raw data	W/m^2	15 minute	15 minute	6/9/2017	2017-06-09	2017-06-09	present	now	2019-12-31	3	C. Wente	Spreadsheet	local network		1	"Morris MN sites 1 and 2"	Open	Eddy Covariance	AmeriFlux		Meteorology, Eddy Covariance				Research, Technology and Engineering	climatologyMeteorologyAtmosphere	yes
UMRB6095	6095	UMRB-Morris	Eddy Covariance	SW_Out_Avg	flux system, raw data	W/m^2	15 minute	15 minute	6/9/2017	2017-06-09	2017-06-09	present	now	2019-12-31	3	C. Wente	Spreadsheet	local network		1	"Morris MN sites 1 and 2"	Open	Eddy Covariance	AmeriFlux		Meteorology, Eddy Covariance				Research, Technology and Engineering	climatologyMeteorologyAtmosphere	yes
UMRB6096	6096	UMRB-Morris	Eddy Covariance	LW_In_Avg	flux system, raw data	W/m^2	15 minute	15 minute	6/9/2017	2017-06-09	2017-06-09	present	now	2019-12-31	3	C. Wente	Spreadsheet	local network		1	"Morris MN sites 1 and 2"	Open	Eddy Covariance	AmeriFlux		Meteorology, Eddy Covariance				Research, Technology and Engineering	climatologyMeteorologyAtmosphere	yes
UMRB6097	6097	UMRB-Morris	Eddy Covariance	LW_Out_Avg	flux system, raw data	W/m^2	15 minute	15 minute	6/9/2017	2017-06-09	2017-06-09	present	now	2019-12-31	3	C. Wente	Spreadsheet	local network		1	"Morris MN sites 1 and 2"	Open	Eddy Covariance	AmeriFlux		Meteorology, Eddy Covariance				Research, Technology and Engineering	climatologyMeteorologyAtmosphere	yes
UMRB6098	6098	UMRB-Morris	Eddy Covariance	LW_In_TC_Avg	flux system, raw data	W/m^2	15 minute	15 minute	6/9/2017	2017-06-09	2017-06-09	present	now	2019-12-31	3	C. Wente	Spreadsheet	local network		1	"Morris MN sites 1 and 2"	Open	Eddy Covariance	AmeriFlux		Meteorology, Eddy Covariance				Research, Technology and Engineering	climatologyMeteorologyAtmosphere	yes
UMRB6099	6099	UMRB-Morris	Eddy Covariance	LW_Out_TC_Avg	flux system, raw data	W/m^2	15 minute	15 minute	6/9/2017	2017-06-09	2017-06-09	present	now	2019-12-31	3	C. Wente	Spreadsheet	local network		1	"Morris MN sites 1 and 2"	Open	Eddy Covariance	AmeriFlux		Meteorology, Eddy Covariance				Research, Technology and Engineering	climatologyMeteorologyAtmosphere	yes
UMRB6100	6100	UMRB-Morris	Eddy Covariance	Rn_short_Avg	flux system, raw data	W/m^2	15 minute	15 minute	6/9/2017	2017-06-09	2017-06-09	present	now	2019-12-31	3	C. Wente	Spreadsheet	local network		1	"Morris MN sites 1 and 2"	Open	Eddy Covariance	AmeriFlux		Meteorology, Eddy Covariance				Research, Technology and Engineering	climatologyMeteorologyAtmosphere	yes
UMRB6101	6101	UMRB-Morris	Eddy Covariance	Rn_long_Avg	flux system, raw data	W/m^2	15 minute	15 minute	6/9/2017	2017-06-09	2017-06-09	present	now	2019-12-31	3	C. Wente	Spreadsheet	local network		1	"Morris MN sites 1 and 2"	Open	Eddy Covariance	AmeriFlux		Meteorology, Eddy Covariance				Research, Technology and Engineering	climatologyMeteorologyAtmosphere	yes
UMRB6102	6102	UMRB-Morris	Eddy Covariance	Rn_total_Avg	flux system, raw data	W/m^2	15 minute	15 minute	6/9/2017	2017-06-09	2017-06-09	present	now	2019-12-31	3	C. Wente	Spreadsheet	local network		1	"Morris MN sites 1 and 2"	Open	Eddy Covariance	AmeriFlux		Meteorology, Eddy Covariance				Research, Technology and Engineering	climatologyMeteorologyAtmosphere	yes
UMRB6103	6103	UMRB-Morris	Eddy Covariance	Albedo_Avg	flux system, raw data	W/m^2	15 minute	15 minute	6/9/2017	2017-06-09	2017-06-09	present	now	2019-12-31	3	C. Wente	Spreadsheet	local network		1	"Morris MN sites 1 and 2"	Open	Eddy Covariance	AmeriFlux		Meteorology, Eddy Covariance				Research, Technology and Engineering	climatologyMeteorologyAtmosphere	yes
UMRB6104	6104	UMRB-Morris	Eddy Covariance	NR_TempC_Avg	flux system, raw data	C	15 minute	15 minute	6/9/2017	2017-06-09	2017-06-09	present	now	2019-12-31	3	C. Wente	Spreadsheet	local network		1	"Morris MN sites 1 and 2"	Open	Eddy Covariance	AmeriFlux		Meteorology, Eddy Covariance				Research, Technology and Engineering	climatologyMeteorologyAtmosphere	yes
UMRB6105	6105	UMRB-Morris	Eddy Covariance	Rain_Tot	flux system, raw data, rainfall	mm	15 minute	15 minute	6/9/2017	2017-06-09	2017-06-09	present	now	2019-12-31	3	C. Wente	Spreadsheet	local network		1	"Morris MN sites 1 and 2"	Open	Eddy Covariance	AmeriFlux		Meteorology, Eddy Covariance				Research, Technology and Engineering	climatologyMeteorologyAtmosphere	yes
UMRB6106	6106	UMRB-Morris	Eddy Covariance	PAR_Den_Avg	flux system, raw data, solar	umol/s/m^2	15 minute	15 minute	6/9/2017	2017-06-09	2017-06-09	present	now	2019-12-31	3	C. Wente	Spreadsheet	local network		1	"Morris MN sites 1 and 2"	Open	Eddy Covariance	AmeriFlux		Meteorology, Eddy Covariance				Research, Technology and Engineering	climatologyMeteorologyAtmosphere	yes
UMRB6107	6107	UMRB-Morris	Eddy Covariance	PAR_Tot_Tot	flux system, raw data, solar	mmol/m^2	15 minute	15 minute	6/9/2017	2017-06-09	2017-06-09	present	now	2019-12-31	3	C. Wente	Spreadsheet	local network		1	"Morris MN sites 1 and 2"	Open	Eddy Covariance	AmeriFlux		Meteorology, Eddy Covariance				Research, Technology and Engineering	climatologyMeteorologyAtmosphere	yes
UMRB6108	6108	UMRB-Morris	Eddy Covariance	TargTempC_Avg	flux system, raw data		15 minute	15 minute	6/9/2017	2017-06-09	2017-06-09	present	now	2019-12-31	3	C. Wente	Spreadsheet	local network		1	"Morris MN sites 1 and 2"	Open	Eddy Covariance	AmeriFlux		Meteorology, Eddy Covariance				Research, Technology and Engineering	climatologyMeteorologyAtmosphere	yes
UMRB6109	6109	UMRB-Morris	Eddy Covariance	SHF1_Avg	flux system, raw data, soil heat flux	W/m^2	15 minute	15 minute	6/9/2017	2017-06-09	2017-06-09	present	now	2019-12-31	3	C. Wente	Spreadsheet	local network		1	"Morris MN sites 1 and 2"	Open	Eddy Covariance	AmeriFlux		Meteorology, Eddy Covariance				Research, Technology and Engineering	climatologyMeteorologyAtmosphere	yes
UMRB6110	6110	UMRB-Morris	Eddy Covariance	SHF2_Avg	flux system, raw data, soil heat flux	W/m^2	15 minute	15 minute	6/9/2017	2017-06-09	2017-06-09	present	now	2019-12-31	3	C. Wente	Spreadsheet	local network		1	"Morris MN sites 1 and 2"	Open	Eddy Covariance	AmeriFlux		Meteorology, Eddy Covariance				Research, Technology and Engineering	climatologyMeteorologyAtmosphere	yes
UMRB6111	6111	UMRB-Morris	Eddy Covariance	SoilTC1_Avg	flux system, raw data, soil temperatures	C	15 minute	15 minute	6/9/2017	2017-06-09	2017-06-09	present	now	2019-12-31	3	C. Wente	Spreadsheet	local network		1	"Morris MN sites 1 and 2"	Open	Eddy Covariance	AmeriFlux		Meteorology, Eddy Covariance				Research, Technology and Engineering	climatologyMeteorologyAtmosphere	yes
UMRB6112	6112	UMRB-Morris	Eddy Covariance	SoilTC2_Avg	flux system, raw data, soil temperatures	C	15 minute	15 minute	6/9/2017	2017-06-09	2017-06-09	present	now	2019-12-31	3	C. Wente	Spreadsheet	local network		1	"Morris MN sites 1 and 2"	Open	Eddy Covariance	AmeriFlux		Meteorology, Eddy Covariance				Research, Technology and Engineering	climatologyMeteorologyAtmosphere	yes
UMRB6113	6113	UMRB-Morris	Eddy Covariance	SoilTC3_Avg	flux system, raw data, soil temperatures	C	15 minute	15 minute	6/9/2017	2017-06-09	2017-06-09	present	now	2019-12-31	3	C. Wente	Spreadsheet	local network		1	"Morris MN sites 1 and 2"	Open	Eddy Covariance	AmeriFlux		Meteorology, Eddy Covariance				Research, Technology and Engineering	climatologyMeteorologyAtmosphere	yes
UMRB6114	6114	UMRB-Morris	Eddy Covariance	SoilTC4_Avg	flux system, raw data, soil temperatures	C	15 minute	15 minute	6/9/2017	2017-06-09	2017-06-09	present	now	2019-12-31	3	C. Wente	Spreadsheet	local network		1	"Morris MN sites 1 and 2"	Open	Eddy Covariance	AmeriFlux		Meteorology, Eddy Covariance				Research, Technology and Engineering	climatologyMeteorologyAtmosphere	yes
UMRB6115	6115	UMRB-Morris	Eddy Covariance	soil_water_T_Avg(1)	flux system, raw data, soil moisture	frac_v_wtr	15 minute	15 minute	6/9/2017	2017-06-09	2017-06-09	present	now	2019-12-31	3	C. Wente	Spreadsheet	local network		1	"Morris MN sites 1 and 2"	Open	Eddy Covariance	AmeriFlux		Meteorology, Eddy Covariance				Research, Technology and Engineering	climatologyMeteorologyAtmosphere	yes
UMRB6116	6116	UMRB-Morris	Eddy Covariance	soil_water_T_Avg(2)	flux system, raw data, soil moisture	frac_v_wtr	15 minute	15 minute	6/9/2017	2017-06-09	2017-06-09	present	now	2019-12-31	3	C. Wente	Spreadsheet	local network		1	"Morris MN sites 1 and 2"	Open	Eddy Covariance	AmeriFlux		Meteorology, Eddy Covariance				Research, Technology and Engineering	climatologyMeteorologyAtmosphere	yes
UMRB6117	6117	UMRB-Morris	Eddy Covariance	cs616_wcr_Avg(1)	flux system, raw data	uSeconds	15 minute	15 minute	6/9/2017	2017-06-09	2017-06-09	present	now	2019-12-31	3	C. Wente	Spreadsheet	local network		1	"Morris MN sites 1 and 2"	Open	Eddy Covariance	AmeriFlux		Meteorology, Eddy Covariance				Research, Technology and Engineering	climatologyMeteorologyAtmosphere	yes
UMRB6118	6118	UMRB-Morris	Eddy Covariance	cs616_wcr_Avg(2)	flux system, raw data	uSeconds	15 minute	15 minute	6/9/2017	2017-06-09	2017-06-09	present	now	2019-12-31	3	C. Wente	Spreadsheet	local network		1	"Morris MN sites 1 and 2"	Open	Eddy Covariance	AmeriFlux		Meteorology, Eddy Covariance				Research, Technology and Engineering	climatologyMeteorologyAtmosphere	yes
UMRB6119	6119	UMRB-Morris	Eddy Covariance	slowsequence_Tot	flux system, raw data	samples	15 minute	15 minute	6/9/2017	2017-06-09	2017-06-09	present	now	2019-12-31	3	C. Wente	Spreadsheet	local network		1	"Morris MN sites 1 and 2"	Open	Eddy Covariance	AmeriFlux		Meteorology, Eddy Covariance				Research, Technology and Engineering	climatologyMeteorologyAtmosphere	yes
UMRB6120	6120	UMRB-Morris	Meteorology	AirTemperature	weather station, air temperature	C	15 minute	15 minute	9/1/2015	2015-09-01	2015-09-01	present	now	2019-12-31	4	S. Wagner	.csv	https://ltar.nal.usda.gov/ltar/met/index	UMRB-Morris-000	1	Swan Lake Research Farm	Open	Meteorology	WeatherDaily, WeatherStation	Temperature, air, daily, mean	Meteorology		NAL Met Data Dashboard		Natural Resources, Earth and Environmental Sciences	climatologyMeteorologyAtmosphere	yes
UMRB6121	6121	UMRB-Morris	Meteorology	Wind Speed	weather station, wind speed	m/s	15 minute	15 minute	9/1/2015	2015-09-01	2015-09-01	present	now	2019-12-31	4	S. Wagner	.csv	https://ltar.nal.usda.gov/ltar/met/index	UMRB-Morris-000	1	Swan Lake Research Farm	Open	Meteorology	WeatherDaily, WeatherStation	Wind speed, air, daily, mean	Meteorology		NAL Met Data Dashboard		Natural Resources, Earth and Environmental Sciences	climatologyMeteorologyAtmosphere	yes
UMRB6122	6122	UMRB-Morris	Meteorology	Wind Direction	weather station, wind direction	degrees	15 minute	15 minute	9/1/2015	2015-09-01	2015-09-01	present	now	2019-12-31	4	S. Wagner	.csv	https://ltar.nal.usda.gov/ltar/met/index	UMRB-Morris-000	1	Swan Lake Research Farm	Open	Meteorology	WeatherDaily, WeatherStation	Wind direction air, daily, mean	Meteorology		NAL Met Data Dashboard		Natural Resources, Earth and Environmental Sciences	climatologyMeteorologyAtmosphere	yes
UMRB6123	6123	UMRB-Morris	Meteorology	Relative Humidity	weather station, RH	%	15 minute	15 minute	9/1/2015	2015-09-01	2015-09-01	present	now	2019-12-31	4	S. Wagner	.csv	https://ltar.nal.usda.gov/ltar/met/index	UMRB-Morris-000	1	Swan Lake Research Farm	Open	Meteorology	WeatherDaily, WeatherStation	Relative humidity, air, daily, mean	Meteorology		NAL Met Data Dashboard		Natural Resources, Earth and Environmental Sciences	climatologyMeteorologyAtmosphere	yes
UMRB6124	6124	UMRB-Morris	Meteorology	Precipitation	weather station, Rainfall, all weather precipitation	mm	15 minute	15 minute	9/1/2015	2015-09-01	2015-09-01	present	now	2019-12-31	4	S. Wagner	.csv	https://ltar.nal.usda.gov/ltar/met/index	UMRB-Morris-000	1	Swan Lake Research Farm	Open	Meteorology	WeatherDaily, WeatherStation	Precipitation, total, no media, daily	Meteorology		NAL Met Data Dashboard		Natural Resources, Earth and Environmental Sciences	climatologyMeteorologyAtmosphere	yes
UMRB6125	6125	UMRB-Morris	Meteorology	Air Pressure	weather station, barometric pressure	kPa	15 minute	15 minute	9/1/2015	2015-09-01	2015-09-01	present	now	2019-12-31	4	S. Wagner	.csv	https://ltar.nal.usda.gov/ltar/met/index	UMRB-Morris-000	1	Swan Lake Research Farm	Open	Meteorology	WeatherDaily, WeatherStation	Pressure	Meteorology		NAL Met Data Dashboard		Natural Resources, Earth and Environmental Sciences	climatologyMeteorologyAtmosphere	yes
UMRB6126	6126	UMRB-Morris	Meteorology	Solar Radiation (PAR)	weather station, solar radiation, photosynthetic active radiation	umol/s/m^2	15 minute	15 minute	9/1/2015	2015-09-01	2015-09-01	present	now	2019-12-31	4	S. Wagner	.csv	https://ltar.nal.usda.gov/ltar/met/index	UMRB-Morris-000	1	Swan Lake Research Farm	Open	Meteorology	WeatherDaily, WeatherStation	Photosynthetically active radiation	Meteorology		NAL Met Data Dashboard		Natural Resources, Earth and Environmental Sciences	climatologyMeteorologyAtmosphere	yes
UMRB6127	6127	UMRB-Morris	Phenocam	RBG	Phenocam, RGB, images, Plot Scale	jpg	30 minute	30 minute	10/2/2015	2015-10-02	2015-10-02	present	now	2019-12-31	4	S. Wagner	.jpg	https://phenocam.sr.unh.edu/webcam/sites/arsmnswanlake1/	arsmnswanlake1	1	Swan Lake Research Farm	Open	Phenology	new ecology	PhenoCam					Natural Resources, Earth and Environmental Sciences	biota	yes
UMRB6128	6128	UMRB-Morris	Phenocam	IR	Phenocam, IR, images, Plot Scale	jpg	30 minute	30 minute	10/2/2015	2015-10-02	2015-10-02	present	now	2019-12-31	4	S. Wagner	.jpg	https://phenocam.sr.unh.edu/webcam/sites/arsmnswanlake1_IR/	arsmnswanlake1	1	Swan Lake Research Farm	Open	Phenology	new ecology	PhenoCam					Natural Resources, Earth and Environmental Sciences	biota	yes
UMRB6129	6129	UMRB-Morris	Phenocam Continous	RBG	Phenocam, RGB, images, Business As Usual	jpg	30 minute	30 minute	7/25/2017	2017-07-25	2017-07-25	present	now	2019-12-31	2	C. Wente	.jpg	https://phenocam.sr.unh.edu/webcam/sites/arsmorris1/	arsmorris1	1	arsmorris1	Open	Phenology	new ecology	PhenoCam					Natural Resources, Earth and Environmental Sciences	biota	yes
UMRB6130	6130	UMRB-Morris	Phenocam Continous	IR	Phenocam, IR, images, Business As Usual	jpg	30 minute	30 minute	7/25/2017	2017-07-25	2017-07-25	present	now	2019-12-31	2	C. Wente	.jpg	https://phenocam.sr.unh.edu/webcam/sites/arsmorris1_IR/	arsmorris1	1	arsmorris1	Open	Phenology	new ecology	PhenoCam					Natural Resources, Earth and Environmental Sciences	biota	yes
UMRB6131	6131	UMRB-Morris	Phenocam Continous	RBG	Phenocam, RGB, images, Aspirational	jpg	30 minute	30 minute	7/25/2017	2017-07-25	2017-07-25	present	now	2019-12-31	2	C. Wente	.jpg	https://phenocam.sr.unh.edu/webcam/sites/arsmorris2/	arsmorris2	1	arsmorris2	Open	Phenology	new ecology	PhenoCam					Natural Resources, Earth and Environmental Sciences	biota	yes
UMRB6132	6132	UMRB-Morris	Phenocam Continous	IR	Phenocam, IR, images, Aspirational	jpg	30 minute	30 minute	7/25/2017	2017-07-25	2017-07-25	present	now	2019-12-31	2	C. Wente	.jpg	https://phenocam.sr.unh.edu/webcam/sites/arsmorris2_IR/	arsmorris2	1	arsmorris2	Open	Phenology	new ecology	PhenoCam					Natural Resources, Earth and Environmental Sciences	biota	yes
UMRB6133	6133	UMRB-Morris	Soil Sampling Mineral Analysis 2016	NH4-N	soil analysis, fertility, mineral	ppm	Annual	1 year	11/8/2016	2016-11-08	2016-11-08					C. Wente	Spreadsheet	local network		1	"Morris MN sites 1 and 2"	Open	Soil	MeasSoilCover, MeasSoilChem, MeasSoilPhys, MeasSoilBiol	Ammonium nitrogen, soil	Soil, Soil Chemistry				Natural Resources, Earth and Environmental Sciences	geoscientificInformation	yes
UMRB6134	6134	UMRB-Morris	Soil Sampling Mineral Analysis 2016	NO3-N	soil analysis, fertility, mineral	ppm	Annual	1 year	11/8/2016	2016-11-08	2016-11-08					C. Wente	Spreadsheet	local network		1	"Morris MN sites 1 and 2"	Open	Soil	MeasSoilCover, MeasSoilChem, MeasSoilPhys, MeasSoilBiol	Nitrate nitrogen, soil	Soil, Soil Chemistry				Natural Resources, Earth and Environmental Sciences	geoscientificInformation	yes
UMRB6135	6135	UMRB-Morris	Soil Sampling Mineral Analysis 2016	K	soil analysis, fertility, mineral	ppm	Annual	1 year	11/8/2016	2016-11-08	2016-11-08					C. Wente	Spreadsheet	local network		1	"Morris MN sites 1 and 2"	Open	Soil	MeasSoilCover, MeasSoilChem, MeasSoilPhys, MeasSoilBiol	Potassium, soil	Soil, Soil Chemistry				Natural Resources, Earth and Environmental Sciences	geoscientificInformation	yes
UMRB6136	6136	UMRB-Morris	Soil Sampling Mineral Analysis 2016	Olsen-P	soil analysis, fertility, mineral	ppm	Annual	1 year	11/8/2016	2016-11-08	2016-11-08					C. Wente	Spreadsheet	local network		1	"Morris MN sites 1 and 2"	Open	Soil	MeasSoilCover, MeasSoilChem, MeasSoilPhys, MeasSoilBiol	Phosphorus, soil	Soil, Soil Chemistry				Natural Resources, Earth and Environmental Sciences	geoscientificInformation	yes
UMRB6137	6137	UMRB-Morris	Soil Sampling Mineral Analysis 2016	%N	soil analysis, fertility, mineral	%	Annual	1 year	11/8/2016	2016-11-08	2016-11-08					C. Wente	Spreadsheet	local network		1	"Morris MN sites 1 and 2"	Open	Soil	MeasSoilCover, MeasSoilChem, MeasSoilPhys, MeasSoilBiol	Total soil nitrogen, soil, mean or single measurement	Soil, Soil Chemistry				Natural Resources, Earth and Environmental Sciences	geoscientificInformation	yes
UMRB6138	6138	UMRB-Morris	Soil Sampling Mineral Analysis 2016	%C	soil analysis, fertility, mineral	%	Annual	1 year	11/8/2016	2016-11-08	2016-11-08					C. Wente	Spreadsheet	local network		1	"Morris MN sites 1 and 2"	Open	Soil	MeasSoilCover, MeasSoilChem, MeasSoilPhys, MeasSoilBiol	Total soil carbon, soil, mean or single measurement	Soil, Soil Chemistry				Natural Resources, Earth and Environmental Sciences	geoscientificInformation	yes
UMRB6139	6139	UMRB-Morris	Soil Sampling Mineral Analysis 2016	%IC	soil analysis, fertility, mineral	%	Annual	1 year	11/8/2016	2016-11-08	2016-11-08					C. Wente	Spreadsheet	local network		1	"Morris MN sites 1 and 2"	Open	Soil	MeasSoilCover, MeasSoilChem, MeasSoilPhys, MeasSoilBiol	Inorganic soil carbon, soil, mean or single measurement	Soil, Soil Chemistry				Natural Resources, Earth and Environmental Sciences	geoscientificInformation	yes
UMRB6140	6140	UMRB-Morris	Soil Sampling Mineral Analysis 2016	%OC	soil analysis, fertility, mineral	%	Annual	1 year	11/8/2016	2016-11-08	2016-11-08					C. Wente	Spreadsheet	local network		1	"Morris MN sites 1 and 2"	Open	Soil	MeasSoilCover, MeasSoilChem, MeasSoilPhys, MeasSoilBiol	Organic soil carbon, soil, mean or single measurement	Soil, Soil Chemistry				Natural Resources, Earth and Environmental Sciences	geoscientificInformation	yes
UMRB6141	6141	UMRB-Morris	Soil Sampling Mineral Analysis 2016	Al 237.312	soil analysis, fertility, mineral	ppm	Annual	1 year	11/8/2016	2016-11-08	2016-11-08					C. Wente	Spreadsheet	local network		1	"Morris MN sites 1 and 2"	Open	Soil	MeasSoilCover, MeasSoilChem, MeasSoilPhys, MeasSoilBiol	Aluminum, soil	Soil, Soil Chemistry				Natural Resources, Earth and Environmental Sciences	geoscientificInformation	yes
UMRB6142	6142	UMRB-Morris	Soil Sampling Mineral Analysis 2016	Al 394.401	soil analysis, fertility, mineral	ppm	Annual	1 year	11/8/2016	2016-11-08	2016-11-08					C. Wente	Spreadsheet	local network		1	"Morris MN sites 1 and 2"	Open	Soil	MeasSoilCover, MeasSoilChem, MeasSoilPhys, MeasSoilBiol	Aluminum, soil	Soil, Soil Chemistry				Natural Resources, Earth and Environmental Sciences	geoscientificInformation	yes
UMRB6143	6143	UMRB-Morris	Soil Sampling Mineral Analysis 2016	As 188.980	soil analysis, fertility, mineral	ppm	Annual	1 year	11/8/2016	2016-11-08	2016-11-08					C. Wente	Spreadsheet	local network		1	"Morris MN sites 1 and 2"	Open	Soil	MeasSoilCover, MeasSoilChem, MeasSoilPhys, MeasSoilBiol	Mineral associated carbon, soil, mean or single measurement	Soil, Soil Chemistry				Natural Resources, Earth and Environmental Sciences	geoscientificInformation	yes
UMRB6144	6144	UMRB-Morris	Soil Sampling Mineral Analysis 2016	B 249.772	soil analysis, fertility, mineral	ppm	Annual	1 year	11/8/2016	2016-11-08	2016-11-08					C. Wente	Spreadsheet	local network		1	"Morris MN sites 1 and 2"	Open	Soil	MeasSoilCover, MeasSoilChem, MeasSoilPhys, MeasSoilBiol	Boron, soil	Soil, Soil Chemistry				Natural Resources, Earth and Environmental Sciences	geoscientificInformation	yes
UMRB6145	6145	UMRB-Morris	Soil Sampling Mineral Analysis 2016	Ba 455.403	soil analysis, fertility, mineral	ppm	Annual	1 year	11/8/2016	2016-11-08	2016-11-08					C. Wente	Spreadsheet	local network		1	"Morris MN sites 1 and 2"	Open	Soil	MeasSoilCover, MeasSoilChem, MeasSoilPhys, MeasSoilBiol	Ba 455.403	Soil, Soil Chemistry				Natural Resources, Earth and Environmental Sciences	geoscientificInformation	yes
UMRB6146	6146	UMRB-Morris	Soil Sampling Mineral Analysis 2016	Be 313.107	soil analysis, fertility, mineral	ppm	Annual	1 year	11/8/2016	2016-11-08	2016-11-08					C. Wente	Spreadsheet	local network		1	"Morris MN sites 1 and 2"	Open	Soil	MeasSoilCover, MeasSoilChem, MeasSoilPhys, MeasSoilBiol	Beryllium-7, soil	Soil, Soil Chemistry				Natural Resources, Earth and Environmental Sciences	geoscientificInformation	yes
UMRB6147	6147	UMRB-Morris	Soil Sampling Mineral Analysis 2016	Ca 422.673	soil analysis, fertility, mineral	ppm	Annual	1 year	11/8/2016	2016-11-08	2016-11-08					C. Wente	Spreadsheet	local network		1	"Morris MN sites 1 and 2"	Open	Soil	MeasSoilCover, MeasSoilChem, MeasSoilPhys, MeasSoilBiol	Calcium, soil	Soil, Soil Chemistry				Natural Resources, Earth and Environmental Sciences	geoscientificInformation	yes
UMRB6148	6148	UMRB-Morris	Soil Sampling Mineral Analysis 2016	Cd 214.439	soil analysis, fertility, mineral	ppm	Annual	1 year	11/8/2016	2016-11-08	2016-11-08					C. Wente	Spreadsheet	local network		1	"Morris MN sites 1 and 2"	Open	Soil	MeasSoilCover, MeasSoilChem, MeasSoilPhys, MeasSoilBiol	cadmium, soil	Soil, Soil Chemistry				Natural Resources, Earth and Environmental Sciences	geoscientificInformation	yes
UMRB6149	6149	UMRB-Morris	Soil Sampling Mineral Analysis 2016	Co 238.892	soil analysis, fertility, mineral	ppm	Annual	1 year	11/8/2016	2016-11-08	2016-11-08					C. Wente	Spreadsheet	local network		1	"Morris MN sites 1 and 2"	Open	Soil	MeasSoilCover, MeasSoilChem, MeasSoilPhys, MeasSoilBiol	cobalt, soil	Soil, Soil Chemistry				Natural Resources, Earth and Environmental Sciences	geoscientificInformation	yes
UMRB6150	6150	UMRB-Morris	Soil Sampling Mineral Analysis 2016	Cr 267.716	soil analysis, fertility, mineral	ppm	Annual	1 year	11/8/2016	2016-11-08	2016-11-08					C. Wente	Spreadsheet	local network		1	"Morris MN sites 1 and 2"	Open	Soil	MeasSoilCover, MeasSoilChem, MeasSoilPhys, MeasSoilBiol	chromium, soil	Soil, Soil Chemistry				Natural Resources, Earth and Environmental Sciences	geoscientificInformation	yes
UMRB6151	6151	UMRB-Morris	Soil Sampling Mineral Analysis 2016	Cu 324.754	soil analysis, fertility, mineral	ppm	Annual	1 year	11/8/2016	2016-11-08	2016-11-08					C. Wente	Spreadsheet	local network		1	"Morris MN sites 1 and 2"	Open	Soil	MeasSoilCover, MeasSoilChem, MeasSoilPhys, MeasSoilBiol	Copper, soil	Soil, Soil Chemistry				Natural Resources, Earth and Environmental Sciences	geoscientificInformation	yes
UMRB6152	6152	UMRB-Morris	Soil Sampling Mineral Analysis 2016	Fe 259.940	soil analysis, fertility, mineral	ppm	Annual	1 year	11/8/2016	2016-11-08	2016-11-08					C. Wente	Spreadsheet	local network		1	"Morris MN sites 1 and 2"	Open	Soil	MeasSoilCover, MeasSoilChem, MeasSoilPhys, MeasSoilBiol	Iron, soil	Soil, Soil Chemistry				Natural Resources, Earth and Environmental Sciences	geoscientificInformation	yes
UMRB6153	6153	UMRB-Morris	Soil Sampling Mineral Analysis 2016	K 766.491	soil analysis, fertility, mineral	ppm	Annual	1 year	11/8/2016	2016-11-08	2016-11-08					C. Wente	Spreadsheet	local network		1	"Morris MN sites 1 and 2"	Open	Soil	MeasSoilCover, MeasSoilChem, MeasSoilPhys, MeasSoilBiol	Potassium, soil	Soil, Soil Chemistry				Natural Resources, Earth and Environmental Sciences	geoscientificInformation	yes
UMRB6154	6154	UMRB-Morris	Soil Sampling Mineral Analysis 2016	Li 670.783	soil analysis, fertility, mineral	ppm	Annual	1 year	11/8/2016	2016-11-08	2016-11-08					C. Wente	Spreadsheet	local network		1	"Morris MN sites 1 and 2"	Open	Soil	MeasSoilCover, MeasSoilChem, MeasSoilPhys, MeasSoilBiol	lithium, soil	Soil, Soil Chemistry				Natural Resources, Earth and Environmental Sciences	geoscientificInformation	yes
UMRB6155	6155	UMRB-Morris	Soil Sampling Mineral Analysis 2016	Mg 285.213	soil analysis, fertility, mineral	ppm	Annual	1 year	11/8/2016	2016-11-08	2016-11-08					C. Wente	Spreadsheet	local network		1	"Morris MN sites 1 and 2"	Open	Soil	MeasSoilCover, MeasSoilChem, MeasSoilPhys, MeasSoilBiol	Magnesium, soil	Soil, Soil Chemistry				Natural Resources, Earth and Environmental Sciences	geoscientificInformation	yes
UMRB6156	6156	UMRB-Morris	Soil Sampling Mineral Analysis 2016	Mn 257.610	soil analysis, fertility, mineral	ppm	Annual	1 year	11/8/2016	2016-11-08	2016-11-08					C. Wente	Spreadsheet	local network		1	"Morris MN sites 1 and 2"	Open	Soil	MeasSoilCover, MeasSoilChem, MeasSoilPhys, MeasSoilBiol	Mangenese, soil	Soil, Soil Chemistry				Natural Resources, Earth and Environmental Sciences	geoscientificInformation	yes
UMRB6157	6157	UMRB-Morris	Soil Sampling Mineral Analysis 2016	Mo 202.032	soil analysis, fertility, mineral	ppm	Annual	1 year	11/8/2016	2016-11-08	2016-11-08					C. Wente	Spreadsheet	local network		1	"Morris MN sites 1 and 2"	Open	Soil	MeasSoilCover, MeasSoilChem, MeasSoilPhys, MeasSoilBiol	molybdenum, soil	Soil, Soil Chemistry				Natural Resources, Earth and Environmental Sciences	geoscientificInformation	yes
UMRB6158	6158	UMRB-Morris	Soil Sampling Mineral Analysis 2016	Na 588.995	soil analysis, fertility, mineral	ppm	Annual	1 year	11/8/2016	2016-11-08	2016-11-08					C. Wente	Spreadsheet	local network		1	"Morris MN sites 1 and 2"	Open	Soil	MeasSoilCover, MeasSoilChem, MeasSoilPhys, MeasSoilBiol	Sodium, soil	Soil, Soil Chemistry				Natural Resources, Earth and Environmental Sciences	geoscientificInformation	yes
UMRB6159	6159	UMRB-Morris	Soil Sampling Mineral Analysis 2016	Ni 231.604	soil analysis, fertility, mineral	ppm	Annual	1 year	11/8/2016	2016-11-08	2016-11-08					C. Wente	Spreadsheet	local network		1	"Morris MN sites 1 and 2"	Open	Soil	MeasSoilCover, MeasSoilChem, MeasSoilPhys, MeasSoilBiol	chromium, soil	Soil, Soil Chemistry				Natural Resources, Earth and Environmental Sciences	geoscientificInformation	yes
UMRB6160	6160	UMRB-Morris	Soil Sampling Mineral Analysis 2016	P 177.434	soil analysis, fertility, mineral	ppm	Annual	1 year	11/8/2016	2016-11-08	2016-11-08					C. Wente	Spreadsheet	local network		1	"Morris MN sites 1 and 2"	Open	Soil	MeasSoilCover, MeasSoilChem, MeasSoilPhys, MeasSoilBiol	Phosphorus, soil	Soil, Soil Chemistry				Natural Resources, Earth and Environmental Sciences	geoscientificInformation	yes
UMRB6161	6161	UMRB-Morris	Soil Sampling Mineral Analysis 2016	P 213.618	soil analysis, fertility, mineral	ppm	Annual	1 year	11/8/2016	2016-11-08	2016-11-08					C. Wente	Spreadsheet	local network		1	"Morris MN sites 1 and 2"	Open	Soil	MeasSoilCover, MeasSoilChem, MeasSoilPhys, MeasSoilBiol	Phosphorus, soil	Soil, Soil Chemistry				Natural Resources, Earth and Environmental Sciences	geoscientificInformation	yes
UMRB6162	6162	UMRB-Morris	Soil Sampling Mineral Analysis 2016	Pb 220.353	soil analysis, fertility, mineral	ppm	Annual	1 year	11/8/2016	2016-11-08	2016-11-08					C. Wente	Spreadsheet	local network		1	"Morris MN sites 1 and 2"	Open	Soil	MeasSoilCover, MeasSoilChem, MeasSoilPhys, MeasSoilBiol	Lead-210, soil	Soil, Soil Chemistry				Natural Resources, Earth and Environmental Sciences	geoscientificInformation	yes
UMRB6163	6163	UMRB-Morris	Soil Sampling Mineral Analysis 2016	Rb 780.026	soil analysis, fertility, mineral	ppm	Annual	1 year	11/8/2016	2016-11-08	2016-11-08					C. Wente	Spreadsheet	local network		1	"Morris MN sites 1 and 2"	Open	Soil	MeasSoilCover, MeasSoilChem, MeasSoilPhys, MeasSoilBiol	rubidium, soil	Soil, Soil Chemistry				Natural Resources, Earth and Environmental Sciences	geoscientificInformation	yes
UMRB6164	6164	UMRB-Morris	Soil Sampling Mineral Analysis 2016	S 180.669	soil analysis, fertility, mineral	ppm	Annual	1 year	11/8/2016	2016-11-08	2016-11-08					C. Wente	Spreadsheet	local network		1	"Morris MN sites 1 and 2"	Open	Soil	MeasSoilCover, MeasSoilChem, MeasSoilPhys, MeasSoilBiol	Sulfate, soil	Soil, Soil Chemistry				Natural Resources, Earth and Environmental Sciences	geoscientificInformation	yes
UMRB6165	6165	UMRB-Morris	Soil Sampling Mineral Analysis 2016	S 181.972	soil analysis, fertility, mineral	ppm	Annual	1 year	11/8/2016	2016-11-08	2016-11-08					C. Wente	Spreadsheet	local network		1	"Morris MN sites 1 and 2"	Open	Soil	MeasSoilCover, MeasSoilChem, MeasSoilPhys, MeasSoilBiol	Sulfate, soil	Soil, Soil Chemistry				Natural Resources, Earth and Environmental Sciences	geoscientificInformation	yes
UMRB6166	6166	UMRB-Morris	Soil Sampling Mineral Analysis 2016	Se 196.026	soil analysis, fertility, mineral	ppm	Annual	1 year	11/8/2016	2016-11-08	2016-11-08					C. Wente	Spreadsheet	local network		1	"Morris MN sites 1 and 2"	Open	Soil	MeasSoilCover, MeasSoilChem, MeasSoilPhys, MeasSoilBiol	selenium, soil	Soil, Soil Chemistry				Natural Resources, Earth and Environmental Sciences	geoscientificInformation	yes
UMRB6167	6167	UMRB-Morris	Soil Sampling Mineral Analysis 2016	Si 251.611	soil analysis, fertility, mineral	ppm	Annual	1 year	11/8/2016	2016-11-08	2016-11-08					C. Wente	Spreadsheet	local network		1	"Morris MN sites 1 and 2"	Open	Soil	MeasSoilCover, MeasSoilChem, MeasSoilPhys, MeasSoilBiol	silicon, soil	Soil, Soil Chemistry				Natural Resources, Earth and Environmental Sciences	geoscientificInformation	yes
UMRB6168	6168	UMRB-Morris	Soil Sampling Mineral Analysis 2016	Sr 407.771	soil analysis, fertility, mineral	ppm	Annual	1 year	11/8/2016	2016-11-08	2016-11-08					C. Wente	Spreadsheet	local network		1	"Morris MN sites 1 and 2"	Open	Soil	MeasSoilCover, MeasSoilChem, MeasSoilPhys, MeasSoilBiol	strontium, soil	Soil, Soil Chemistry				Natural Resources, Earth and Environmental Sciences	geoscientificInformation	yes
UMRB6169	6169	UMRB-Morris	Soil Sampling Mineral Analysis 2016	Ti 336.122	soil analysis, fertility, mineral	ppm	Annual	1 year	11/8/2016	2016-11-08	2016-11-08					C. Wente	Spreadsheet	local network		1	"Morris MN sites 1 and 2"	Open	Soil	MeasSoilCover, MeasSoilChem, MeasSoilPhys, MeasSoilBiol	tellurium, soil	Soil, Soil Chemistry				Natural Resources, Earth and Environmental Sciences	geoscientificInformation	yes
UMRB6170	6170	UMRB-Morris	Soil Sampling Mineral Analysis 2016	V 292.401	soil analysis, fertility, mineral	ppm	Annual	1 year	11/8/2016	2016-11-08	2016-11-08					C. Wente	Spreadsheet	local network		1	"Morris MN sites 1 and 2"	Open	Soil	MeasSoilCover, MeasSoilChem, MeasSoilPhys, MeasSoilBiol	vanadium, soil	Soil, Soil Chemistry				Natural Resources, Earth and Environmental Sciences	geoscientificInformation	yes
UMRB6171	6171	UMRB-Morris	Soil Sampling Mineral Analysis 2016	Zn 206.200	soil analysis, fertility, mineral	ppm	Annual	1 year	11/8/2016	2016-11-08	2016-11-08					C. Wente	Spreadsheet	local network		1	"Morris MN sites 1 and 2"	Open	Soil	MeasSoilCover, MeasSoilChem, MeasSoilPhys, MeasSoilBiol	Zinc, soil	Soil, Soil Chemistry				Natural Resources, Earth and Environmental Sciences	geoscientificInformation	yes
UMRB6172	6172	UMRB-Morris	Soil Sampling Mineral Analysis 2017	NH4-N	soil analysis, physical	ppm	Annual	1 year	10/17/2017	2017-10-17	2017-10-17	10/24/2017	2017-10-24	2017-10-24	1	C. Wente	Spreadsheet	local network		1	"Morris MN sites 1 and 2"	Open	Soil	MeasSoilCover, MeasSoilChem, MeasSoilPhys, MeasSoilBiol	Ammonium nitrogen, soil	Soil, Soil Chemistry				Natural Resources, Earth and Environmental Sciences	geoscientificInformation	yes
UMRB6173	6173	UMRB-Morris	Soil Sampling Mineral Analysis 2017	NO3-N	soil analysis, physical	ppm	Annual	1 year	10/17/2017	2017-10-17	2017-10-17	10/24/2017	2017-10-24	2017-10-24	1	C. Wente	Spreadsheet	local network		1	"Morris MN sites 1 and 2"	Open	Soil	MeasSoilCover, MeasSoilChem, MeasSoilPhys, MeasSoilBiol	Nitrate nitrogen, soil	Soil, Soil Chemistry				Natural Resources, Earth and Environmental Sciences	geoscientificInformation	yes
UMRB6174	6174	UMRB-Morris	Soil Sampling Mineral Analysis 2017	K	soil analysis, physical	ppm	Annual	1 year	10/17/2017	2017-10-17	2017-10-17	10/24/2017	2017-10-24	2017-10-24	1	C. Wente	Spreadsheet	local network		1	"Morris MN sites 1 and 2"	Open	Soil	MeasSoilCover, MeasSoilChem, MeasSoilPhys, MeasSoilBiol	Potassium, soil	Soil, Soil Chemistry				Natural Resources, Earth and Environmental Sciences	geoscientificInformation	yes
UMRB6175	6175	UMRB-Morris	Soil Sampling Mineral Analysis 2017	Olsen-P	soil analysis, physical	ppm	Annual	1 year	10/17/2017	2017-10-17	2017-10-17	10/24/2017	2017-10-24	2017-10-24	1	C. Wente	Spreadsheet	local network		1	"Morris MN sites 1 and 2"	Open	Soil	MeasSoilCover, MeasSoilChem, MeasSoilPhys, MeasSoilBiol	Phosphorus, soil	Soil, Soil Chemistry				Natural Resources, Earth and Environmental Sciences	geoscientificInformation	yes
UMRB6176	6176	UMRB-Morris	Soil Sampling Physical Analysis 2016	Gravemetric (%)	soil analysis, physical	%	Annual	1 year	11/8/2016	2016-11-08	2016-11-08					C. Wente	Spreadsheet	local network		1	"Morris MN sites 1 and 2"	Open	Soil	MeasSoilCover, MeasSoilChem, MeasSoilPhys, MeasSoilBiol	soil moisture	Soil, Soil Chemistry				Natural Resources, Earth and Environmental Sciences	geoscientificInformation	yes
UMRB6177	6177	UMRB-Morris	Soil Sampling Physical Analysis 2016	Bulk Density (g/cm3)	soil analysis, physical	g/cm3	Annual	1 year	11/8/2016	2016-11-08	2016-11-08					C. Wente	Spreadsheet	local network		1	"Morris MN sites 1 and 2"	Open	Soil	MeasSoilCover, MeasSoilChem, MeasSoilPhys, MeasSoilBiol	Bulk density, soil	Soil, Soil Chemistry				Natural Resources, Earth and Environmental Sciences	geoscientificInformation	yes
UMRB6178	6178	UMRB-Morris	Soil Sampling Physical Analysis 2016	Sand %	soil analysis, physical	%	Annual	1 year	11/8/2016	2016-11-08	2016-11-08					C. Wente	Spreadsheet	local network		1	"Morris MN sites 1 and 2"	Open	Soil	MeasSoilCover, MeasSoilChem, MeasSoilPhys, MeasSoilBiol	Sand, soil	Soil, Soil Chemistry				Natural Resources, Earth and Environmental Sciences	geoscientificInformation	yes
UMRB6179	6179	UMRB-Morris	Soil Sampling Physical Analysis 2016	Clay %	soil analysis, physical	%	Annual	1 year	11/8/2016	2016-11-08	2016-11-08					C. Wente	Spreadsheet	local network		1	"Morris MN sites 1 and 2"	Open	Soil	MeasSoilCover, MeasSoilChem, MeasSoilPhys, MeasSoilBiol	Clay, soil	Soil, Soil Chemistry				Natural Resources, Earth and Environmental Sciences	geoscientificInformation	yes
UMRB6180	6180	UMRB-Morris	Soil Sampling Physical Analysis 2016	Silt %	soil analysis, physical	%	Annual	1 year	11/8/2016	2016-11-08	2016-11-08					C. Wente	Spreadsheet	local network		1	"Morris MN sites 1 and 2"	Open	Soil	MeasSoilCover, MeasSoilChem, MeasSoilPhys, MeasSoilBiol	Silt, soil	Soil, Soil Chemistry				Natural Resources, Earth and Environmental Sciences	geoscientificInformation	yes
UMRB6181	6181	UMRB-Morris	Soil Sampling Physical Analysis 2017	Gravemetric (%)	soil analysis, physical	%	Annual	1 year	10/17/2017	2017-10-17	2017-10-17	10/24/2017	2017-10-24	2017-10-24	1	C. Wente	Spreadsheet	local network		1	"Morris MN sites 1 and 2"	Open	Soil	MeasSoilCover, MeasSoilChem, MeasSoilPhys, MeasSoilBiol	soil moisture	Soil, Soil Chemistry				Natural Resources, Earth and Environmental Sciences	geoscientificInformation	yes
UMRB6182	6182	UMRB-Morris	Soil Sampling Physical Analysis 2017	Bulk Density (g/cm3)	soil analysis, physical	g/cm3	Annual	1 year	10/17/2017	2017-10-17	2017-10-17	10/24/2017	2017-10-24	2017-10-24	1	C. Wente	Spreadsheet	local network		1	"Morris MN sites 1 and 2"	Open	Soil	MeasSoilCover, MeasSoilChem, MeasSoilPhys, MeasSoilBiol	Bulk density, soil	Soil, Soil Chemistry				Natural Resources, Earth and Environmental Sciences	geoscientificInformation	yes
UMRB9001	9001	UMRB-Ames	Eddy Covariance	Hs	Sensible heat flux-uncorrected	W/m^2	15 Minute		2015			Present				M. Cryder	Excel	Local (South Fork/Coles)		2	South Fork and Coles Fields, IA 	Closed	Meteorology, Eddy Covariance					AmeriFlux	NA			yes
UMRB9002	9002	UMRB-Ames	Eddy Covariance	tau	Wind sheer stress	kg/(m s^2)	15 Minute		2015			Present				M. Cryder	Excel	Local (South Fork/Coles)		2	South Fork and Coles Fields, IA 	Closed	Meteorology, Eddy Covariance					AmeriFlux	NA			yes
UMRB9003	9003	UMRB-Ames	Eddy Covariance	u_star	Friction velocity	m/s	15 Minute		2015			Present				M. Cryder	Excel	Local (South Fork/Coles)		2	South Fork and Coles Fields, IA 	Closed	Meteorology, Eddy Covariance					AmeriFlux	NA			yes
UMRB9004	9004	UMRB-Ames	Eddy Covariance	Ts_stdev	Standard deviation sonic temperature	C^2	15 Minute		2015			Present				M. Cryder	Excel	Local (South Fork/Coles)		2	South Fork and Coles Fields, IA 	Closed	Meteorology, Eddy Covariance					AmeriFlux	NA			yes
UMRB9005	9005	UMRB-Ames	Eddy Covariance	Ts_Ux_cov	Covariance sonic temp & x wind component	m C/s	15 Minute		2015			Present				M. Cryder	Excel	Local (South Fork/Coles)		2	South Fork and Coles Fields, IA 	Closed	Meteorology, Eddy Covariance					AmeriFlux	NA			yes
UMRB9006	9006	UMRB-Ames	Eddy Covariance	Ts_Uy_cov	Covariance sonic temp & y wind component	m C/s	15 Minute		2015			Present				M. Cryder	Excel	Local (South Fork/Coles)		2	South Fork and Coles Fields, IA 	Closed	Meteorology, Eddy Covariance					AmeriFlux	NA			yes
UMRB9007	9007	UMRB-Ames	Eddy Covariance	Ts_Uz_cov	Covariance sonic temp & vertical velocity	m C/s	15 Minute		2015			Present				M. Cryder	Excel	Local (South Fork/Coles)		2	South Fork and Coles Fields, IA 	Closed	Meteorology, Eddy Covariance					AmeriFlux	NA			yes
UMRB9008	9008	UMRB-Ames	Eddy Covariance	Ux_stdev	Standard deviation x wind component	(m/s)^2	15 Minute		2015			Present				M. Cryder	Excel	Local (South Fork/Coles)		2	South Fork and Coles Fields, IA 	Closed	Meteorology, Eddy Covariance					AmeriFlux	NA			yes
UMRB9009	9009	UMRB-Ames	Eddy Covariance	Ux_Uy_cov	Covariance x  & y wind component	(m/s)^2	15 Minute		2015			Present				M. Cryder	Excel	Local (South Fork/Coles)		2	South Fork and Coles Fields, IA 	Closed	Meteorology, Eddy Covariance					AmeriFlux	NA			yes
UMRB9010	9010	UMRB-Ames	Eddy Covariance	Ux_Uz_cov	Covariance x  wind component & vertical velocity	(m/s)^2	15 Minute		2015			Present				M. Cryder	Excel	Local (South Fork/Coles)		2	South Fork and Coles Fields, IA 	Closed	Meteorology, Eddy Covariance					AmeriFlux	NA			yes
UMRB9011	9011	UMRB-Ames	Eddy Covariance	Uy_stdev	Standard deviation y wind component	(m/s)^2	15 Minute		2015			Present				M. Cryder	Excel	Local (South Fork/Coles)		2	South Fork and Coles Fields, IA 	Closed	Meteorology, Eddy Covariance					AmeriFlux	NA			yes
UMRB9012	9012	UMRB-Ames	Eddy Covariance	Uy_Uz_cov	Covariance y  wind component & vertical velocity	(m/s)^2	15 Minute		2015			Present				M. Cryder	Excel	Local (South Fork/Coles)		2	South Fork and Coles Fields, IA 	Closed	Meteorology, Eddy Covariance					AmeriFlux	NA			yes
UMRB9013	9013	UMRB-Ames	Eddy Covariance	Uz_stdev	Standard deviation vertical velocity	(m/s)^2	15 Minute		2015			Present				M. Cryder	Excel	Local (South Fork/Coles)		2	South Fork and Coles Fields, IA 	Closed	Meteorology, Eddy Covariance					AmeriFlux	NA			yes
UMRB9014	9014	UMRB-Ames	Eddy Covariance	wnd_spd	Average wind speed	m/s	15 Minute		2015			Present				M. Cryder	Excel	Local (South Fork/Coles)		2	South Fork and Coles Fields, IA 	Closed	Meteorology, Eddy Covariance					AmeriFlux	NA			yes
UMRB9015	9015	UMRB-Ames	Eddy Covariance	rslt_wnd_spd	Average wind resultant speed	m/s	15 Minute		2015			Present				M. Cryder	Excel	Local (South Fork/Coles)		2	South Fork and Coles Fields, IA 	Closed	Meteorology, Eddy Covariance					AmeriFlux	NA			yes
UMRB9016	9016	UMRB-Ames	Eddy Covariance	wnd_dir_sonic	Sonic wind direction	degrees	15 Minute		2015			Present				M. Cryder	Excel	Local (South Fork/Coles)		2	South Fork and Coles Fields, IA 	Closed	Meteorology, Eddy Covariance					AmeriFlux	NA			yes
UMRB9017	9017	UMRB-Ames	Eddy Covariance	std_wnd_dir	Standard deviation wind direction	degrees	15 Minute		2015			Present				M. Cryder	Excel	Local (South Fork/Coles)		2	South Fork and Coles Fields, IA 	Closed	Meteorology, Eddy Covariance					AmeriFlux	NA			yes
UMRB9018	9018	UMRB-Ames	Eddy Covariance	wnd_dir_compass	Compass wind direction	degrees	15 Minute		2015			Present				M. Cryder	Excel	Local (South Fork/Coles)		2	South Fork and Coles Fields, IA 	Closed	Meteorology, Eddy Covariance					AmeriFlux	NA			yes
UMRB9019	9019	UMRB-Ames	Eddy Covariance	Ux_Avg	Average wind speed E-W direction (x component)	m/s	15 Minute		2015			Present				M. Cryder	Excel	Local (South Fork/Coles)		2	South Fork and Coles Fields, IA 	Closed	Meteorology, Eddy Covariance					AmeriFlux	NA			yes
UMRB9020	9020	UMRB-Ames	Eddy Covariance	Uy_Avg	Average wind speed N-S direction (y component)	m/s	15 Minute		2015			Present				M. Cryder	Excel	Local (South Fork/Coles)		2	South Fork and Coles Fields, IA 	Closed	Meteorology, Eddy Covariance					AmeriFlux	NA			yes
UMRB9021	9021	UMRB-Ames	Eddy Covariance	Uz_Avg	Average wind speed vertical direction (z component)	m/s	15 Minute		2015			Present				M. Cryder	Excel	Local (South Fork/Coles)		2	South Fork and Coles Fields, IA 	Closed	Meteorology, Eddy Covariance					AmeriFlux	NA			yes
UMRB9022	9022	UMRB-Ames	Eddy Covariance	Ts_Avg	Average sonic temperature	C	15 Minute		2015			Present				M. Cryder	Excel	Local (South Fork/Coles)		2	South Fork and Coles Fields, IA 	Closed	Meteorology, Eddy Covariance					AmeriFlux	NA			yes
UMRB9023	9023	UMRB-Ames	Eddy Covariance	sonic_azimuth	Direction of sonic	degrees	15 Minute		2015			Present				M. Cryder	Excel	Local (South Fork/Coles)		2	South Fork and Coles Fields, IA 	Closed	Meteorology, Eddy Covariance					AmeriFlux	NA			yes
UMRB9024	9024	UMRB-Ames	Eddy Covariance	Fc_wpl	CO2 flux, WPL corrected	mg/(m s^2)	15 Minute		2015			Present				M. Cryder	Excel	Local (South Fork/Coles)		2	South Fork and Coles Fields, IA 	Closed	Meteorology, Eddy Covariance					AmeriFlux	NA			yes
UMRB9025	9025	UMRB-Ames	Eddy Covariance	LE_wpl	Latent heat, WPL corrected	W/m^2	15 Minute		2015			Present				M. Cryder	Excel	Local (South Fork/Coles)		2	South Fork and Coles Fields, IA 	Closed	Meteorology, Eddy Covariance					AmeriFlux	NA			yes
UMRB9026	9026	UMRB-Ames	Eddy Covariance	Hc	Sensible heat flux - corrected for water vapor	W/m^2	15 Minute		2015			Present				M. Cryder	Excel	Local (South Fork/Coles)		2	South Fork and Coles Fields, IA 	Closed	Meteorology, Eddy Covariance					AmeriFlux	NA			yes
UMRB9027	9027	UMRB-Ames	Eddy Covariance	CO2_stdev	Standard deviation CO2 concentration	(mg/m^3)^2	15 Minute		2015			Present				M. Cryder	Excel	Local (South Fork/Coles)		2	South Fork and Coles Fields, IA 	Closed	Meteorology, Eddy Covariance					AmeriFlux	NA			yes
UMRB9028	9028	UMRB-Ames	Eddy Covariance	CO2_Ux_cov	Covariance x  wind component &  CO2 concentration	mg/(m^2 s)	15 Minute		2015			Present				M. Cryder	Excel	Local (South Fork/Coles)		2	South Fork and Coles Fields, IA 	Closed	Meteorology, Eddy Covariance					AmeriFlux	NA			yes
UMRB9029	9029	UMRB-Ames	Eddy Covariance	CO2_Uy_cov	Covariance y  wind component &  CO2 concentration	mg/(m^2 s)	15 Minute		2015			Present				M. Cryder	Excel	Local (South Fork/Coles)		2	South Fork and Coles Fields, IA 	Closed	Meteorology, Eddy Covariance					AmeriFlux	NA			yes
UMRB9030	9030	UMRB-Ames	Eddy Covariance	CO2_Uz_cov	Covariance wind speed vertical direction &  CO2 concentration	mg/(m^2 s)	15 Minute		2015			Present				M. Cryder	Excel	Local (South Fork/Coles)		2	South Fork and Coles Fields, IA 	Closed	Meteorology, Eddy Covariance					AmeriFlux	NA			yes
UMRB9031	9031	UMRB-Ames	Eddy Covariance	H2O_stdev	Standard deviation H2O concentration	(g/m^3)^2	15 Minute		2015			Present				M. Cryder	Excel	Local (South Fork/Coles)		2	South Fork and Coles Fields, IA 	Closed	Meteorology, Eddy Covariance					AmeriFlux	NA			yes
UMRB9032	9032	UMRB-Ames	Eddy Covariance	H2O_Ux_cov	Covariance x  wind component &  H2O concentration	g/(m^2 s)	15 Minute		2015			Present				M. Cryder	Excel	Local (South Fork/Coles)		2	South Fork and Coles Fields, IA 	Closed	Meteorology, Eddy Covariance					AmeriFlux	NA			yes
UMRB9033	9033	UMRB-Ames	Eddy Covariance	H2O_Uy_cov	Covariance y  wind component &  H2O concentration	g/(m^2 s)	15 Minute		2015			Present				M. Cryder	Excel	Local (South Fork/Coles)		2	South Fork and Coles Fields, IA 	Closed	Meteorology, Eddy Covariance					AmeriFlux	NA			yes
UMRB9034	9034	UMRB-Ames	Eddy Covariance	H2O_Uz_cov	Covariance wind speed vertical direction &  CO2 concentration	g/(m^2 s)	15 Minute		2015			Present				M. Cryder	Excel	Local (South Fork/Coles)		2	South Fork and Coles Fields, IA 	Closed	Meteorology, Eddy Covariance					AmeriFlux	NA			yes
UMRB9035	9035	UMRB-Ames	Eddy Covariance	Tc_stdev	Standard deviation sonic temperature - corrected for water vapor 	C	15 Minute		2015			Present				M. Cryder	Excel	Local (South Fork/Coles)		2	South Fork and Coles Fields, IA 	Closed	Meteorology, Eddy Covariance					AmeriFlux	NA			yes
UMRB9036	9036	UMRB-Ames	Eddy Covariance	Tc_Ux_cov	Covariance sonic temp & x wind component - corrected for water vapor 	C m/s	15 Minute		2015			Present				M. Cryder	Excel	Local (South Fork/Coles)		2	South Fork and Coles Fields, IA 	Closed	Meteorology, Eddy Covariance					AmeriFlux	NA			yes
UMRB9037	9037	UMRB-Ames	Eddy Covariance	Tc_Uy_cov	Covariance sonic temp & y wind component - corrected for water vapor 	C m/s	15 Minute		2015			Present				M. Cryder	Excel	Local (South Fork/Coles)		2	South Fork and Coles Fields, IA 	Closed	Meteorology, Eddy Covariance					AmeriFlux	NA			yes
UMRB9038	9038	UMRB-Ames	Eddy Covariance	Tc_Uz_cov	Covariance sonic temp & vertical velocity - corrected for water vapor 	C m/s	15 Minute		2015			Present				M. Cryder	Excel	Local (South Fork/Coles)		2	South Fork and Coles Fields, IA 	Closed	Meteorology, Eddy Covariance					AmeriFlux	NA			yes
UMRB9039	9039	UMRB-Ames	Eddy Covariance	CO2_mean	Average CO2 concentration	mg/m^3	15 Minute		2015			Present				M. Cryder	Excel	Local (South Fork/Coles)		2	South Fork and Coles Fields, IA 	Closed	Meteorology, Eddy Covariance					AmeriFlux	NA			yes
UMRB9040	9040	UMRB-Ames	Eddy Covariance	H2O_mean	Average water vapor density	g/m^3	15 Minute		2015			Present				M. Cryder	Excel	Local (South Fork/Coles)		2	South Fork and Coles Fields, IA 	Closed	Meteorology, Eddy Covariance					AmeriFlux	NA			yes
UMRB9041	9041	UMRB-Ames	Eddy Covariance	amb_press_mean	Barometric air pressure	kPa	15 Minute		2015			Present				M. Cryder	Excel	Local (South Fork/Coles)		2	South Fork and Coles Fields, IA 	Closed	Meteorology, Eddy Covariance					AmeriFlux	NA			yes
UMRB9042	9042	UMRB-Ames	Eddy Covariance	Tc_mean	Average sonic temperature - corrected for water vapor 	C	15 Minute		2015			Present				M. Cryder	Excel	Local (South Fork/Coles)		2	South Fork and Coles Fields, IA 	Closed	Meteorology, Eddy Covariance					AmeriFlux	NA			yes
UMRB9043	9043	UMRB-Ames	Eddy Covariance	rho_a_mean	Air density	kg/m^3	15 Minute		2015			Present				M. Cryder	Excel	Local (South Fork/Coles)		2	South Fork and Coles Fields, IA 	Closed	Meteorology, Eddy Covariance					AmeriFlux	NA			yes
UMRB9044	9044	UMRB-Ames	Eddy Covariance	Fc_irga	Raw CO2 flux (same as cov_Uz_co2)	mg/(m^2s)	15 Minute		2015			Present				M. Cryder	Excel	Local (South Fork/Coles)		2	South Fork and Coles Fields, IA 	Closed	Meteorology, Eddy Covariance					AmeriFlux	NA			yes
UMRB9045	9045	UMRB-Ames	Eddy Covariance	LE_irga	Raw latent heat flux	W/m^2	15 Minute		2015			Present				M. Cryder	Excel	Local (South Fork/Coles)		2	South Fork and Coles Fields, IA 	Closed	Meteorology, Eddy Covariance					AmeriFlux	NA			yes
UMRB9046	9046	UMRB-Ames	Eddy Covariance	CO2_wpl_LE	CO2 WPL correction for LE	mg/(m^2 s)	15 Minute		2015			Present				M. Cryder	Excel	Local (South Fork/Coles)		2	South Fork and Coles Fields, IA 	Closed	Meteorology, Eddy Covariance					AmeriFlux	NA			yes
UMRB9047	9047	UMRB-Ames	Eddy Covariance	CO2_wpl_H	CO2 WPL correction for H	mg/(m^2 s)	15 Minute		2015			Present				M. Cryder	Excel	Local (South Fork/Coles)		2	South Fork and Coles Fields, IA 	Closed	Meteorology, Eddy Covariance					AmeriFlux	NA			yes
UMRB9048	9048	UMRB-Ames	Eddy Covariance	H2O_wpl_LE	H2O WPL correction for LE	W/m^2	15 Minute		2015			Present				M. Cryder	Excel	Local (South Fork/Coles)		2	South Fork and Coles Fields, IA 	Closed	Meteorology, Eddy Covariance					AmeriFlux	NA			yes
UMRB9049	9049	UMRB-Ames	Eddy Covariance	H2O_wpl_H	H2O WPL correction for H	W/m^2	15 Minute		2015			Present				M. Cryder	Excel	Local (South Fork/Coles)		2	South Fork and Coles Fields, IA 	Closed	Meteorology, Eddy Covariance					AmeriFlux	NA			yes
UMRB9050	9050	UMRB-Ames	Eddy Covariance	h2o_hmp_Avg	Vapor density	g/m^3	15 Minute		2015			Present				M. Cryder	Excel	Local (South Fork/Coles)		2	South Fork and Coles Fields, IA 	Closed	Meteorology, Eddy Covariance					AmeriFlux	NA			yes
UMRB9051	9051	UMRB-Ames	Eddy Covariance	T_hmp_Avg	Air temperature	C	15 Minute		2015			Present				M. Cryder	Excel	Local (South Fork/Coles)		2	South Fork and Coles Fields, IA 	Closed	Meteorology, Eddy Covariance					AmeriFlux	NA			yes
UMRB9052	9052	UMRB-Ames	Eddy Covariance	RH_hmp_Avg	Relative humidity	fraction	15 Minute		2015			Present				M. Cryder	Excel	Local (South Fork/Coles)		2	South Fork and Coles Fields, IA 	Closed	Meteorology, Eddy Covariance					AmeriFlux	NA			yes
UMRB9053	9053	UMRB-Ames	Eddy Covariance	e_hmp_Avg	Actual vapor pressure	kPa	15 Minute		2015			Present				M. Cryder	Excel	Local (South Fork/Coles)		2	South Fork and Coles Fields, IA 	Closed	Meteorology, Eddy Covariance					AmeriFlux	NA			yes
UMRB9054	9054	UMRB-Ames	Eddy Covariance	e_sat_hmp_Avg	Saturated vapor pressure	kPa	15 Minute		2015			Present				M. Cryder	Excel	Local (South Fork/Coles)		2	South Fork and Coles Fields, IA 	Closed	Meteorology, Eddy Covariance					AmeriFlux	NA			yes
UMRB9055	9055	UMRB-Ames	Eddy Covariance	VPD	Vapor pressure deficit	kPa	15 Minute		2015			Present				M. Cryder	Excel	Local (South Fork/Coles)		2	South Fork and Coles Fields, IA 	Closed	Meteorology, Eddy Covariance					AmeriFlux	NA			yes
UMRB9056	9056	UMRB-Ames	Eddy Covariance	Rain_Tot	Precipitation	mm	15 Minute		2015			Present				M. Cryder	Excel	Local (South Fork/Coles)		2	South Fork and Coles Fields, IA 	Closed	Meteorology, Eddy Covariance					AmeriFlux	NA			yes
UMRB9057	9057	UMRB-Ames	Eddy Covariance	SW_In_Avg	Incoming shortwave radiation	W/m^2	15 Minute		2015			Present				M. Cryder	Excel	Local (South Fork/Coles)		2	South Fork and Coles Fields, IA 	Closed	Meteorology, Eddy Covariance					AmeriFlux	NA			yes
UMRB9058	9058	UMRB-Ames	Eddy Covariance	SW_Out_Avg	Outgoing shortwave radiation	W/m^2	15 Minute		2015			Present				M. Cryder	Excel	Local (South Fork/Coles)		2	South Fork and Coles Fields, IA 	Closed	Meteorology, Eddy Covariance					AmeriFlux	NA			yes
UMRB9059	9059	UMRB-Ames	Eddy Covariance	LW_In_Avg	Incoming longwave radiation	W/m^2	15 Minute		2015			Present				M. Cryder	Excel	Local (South Fork/Coles)		2	South Fork and Coles Fields, IA 	Closed	Meteorology, Eddy Covariance					AmeriFlux	NA			yes
UMRB9060	9060	UMRB-Ames	Eddy Covariance	LW_Out_Avg	Outgoing longwave radiation	W/m^2	15 Minute		2015			Present				M. Cryder	Excel	Local (South Fork/Coles)		2	South Fork and Coles Fields, IA 	Closed	Meteorology, Eddy Covariance					AmeriFlux	NA			yes
UMRB9061	9061	UMRB-Ames	Eddy Covariance	LW_In_TC_Avg	Incoming longwave radiation - panel temp corrected	W/m^2	15 Minute		2015			Present				M. Cryder	Excel	Local (South Fork/Coles)		2	South Fork and Coles Fields, IA 	Closed	Meteorology, Eddy Covariance					AmeriFlux	NA			yes
UMRB9062	9062	UMRB-Ames	Eddy Covariance	LW_Out_TC_Avg	Outgoing longwave radiation -  panel temp corrected	W/m^2	15 Minute		2015			Present				M. Cryder	Excel	Local (South Fork/Coles)		2	South Fork and Coles Fields, IA 	Closed	Meteorology, Eddy Covariance					AmeriFlux	NA			yes
UMRB9063	9063	UMRB-Ames	Eddy Covariance	Rn_short_Avg	Net shortwave radiation	W/m^2	15 Minute		2015			Present				M. Cryder	Excel	Local (South Fork/Coles)		2	South Fork and Coles Fields, IA 	Closed	Meteorology, Eddy Covariance					AmeriFlux	NA			yes
UMRB9064	9064	UMRB-Ames	Eddy Covariance	Rn_long_Avg	Net longwave radiation	W/m^2	15 Minute		2015			Present				M. Cryder	Excel	Local (South Fork/Coles)		2	South Fork and Coles Fields, IA 	Closed	Meteorology, Eddy Covariance					AmeriFlux	NA			yes
UMRB9065	9065	UMRB-Ames	Eddy Covariance	Rn_total_Avg	Total net radiation	W/m^2	15 Minute		2015			Present				M. Cryder	Excel	Local (South Fork/Coles)		2	South Fork and Coles Fields, IA 	Closed	Meteorology, Eddy Covariance					AmeriFlux	NA			yes
UMRB9066	9066	UMRB-Ames	Eddy Covariance	Albedo_Avg	Albedo	W/m^2	15 Minute		2015			Present				M. Cryder	Excel	Local (South Fork/Coles)		2	South Fork and Coles Fields, IA 	Closed	Meteorology, Eddy Covariance					AmeriFlux	NA			yes
UMRB9067	9067	UMRB-Ames	Eddy Covariance	NR_TempC_Avg	Panel temperature	C	15 Minute		2015			Present				M. Cryder	Excel	Local (South Fork/Coles)		2	South Fork and Coles Fields, IA 	Closed	Meteorology, Eddy Covariance					AmeriFlux	NA			yes
UMRB9068	9068	UMRB-Ames	Eddy Covariance	IRT_can_Avg	Canopy temperature	C	15 Minute		2015			Present				M. Cryder	Excel	Local (South Fork/Coles)		2	South Fork and Coles Fields, IA 	Closed	Meteorology, Eddy Covariance					AmeriFlux	NA			yes
UMRB9069	9069	UMRB-Ames	Eddy Covariance	IRT_cb_Avg	IRT body temperature	C	15 Minute		2015			Present				M. Cryder	Excel	Local (South Fork/Coles)		2	South Fork and Coles Fields, IA 	Closed	Meteorology, Eddy Covariance					AmeriFlux	NA			yes
UMRB9070	9070	UMRB-Ames	Eddy Covariance	SHF1_Avg	Soil heat flux measured in the crop row at 6 cm 	W/m^2	15 Minute		2015			Present				M. Cryder	Excel	Local (South Fork/Coles)		2	South Fork and Coles Fields, IA 	Closed	Meteorology, Eddy Covariance					AmeriFlux	NA			yes
UMRB9071	9071	UMRB-Ames	Eddy Covariance	SHF2_Avg	Soil heat flux measured between the crop row at 6 cm  	W/m^2	15 Minute		2015			Present				M. Cryder	Excel	Local (South Fork/Coles)		2	South Fork and Coles Fields, IA 	Closed	Meteorology, Eddy Covariance					AmeriFlux	NA			yes
UMRB9072	9072	UMRB-Ames	Eddy Covariance	SoilTC1_Avg	Soil temperature measured in the crop row at 2 cm	C	15 Minute		2015			Present				M. Cryder	Excel	Local (South Fork/Coles)		2	South Fork and Coles Fields, IA 	Closed	Meteorology, Eddy Covariance					AmeriFlux	NA			yes
UMRB9073	9073	UMRB-Ames	Eddy Covariance	SoilTC2_Avg	Soil temperature measured in the crop row at 4 cm  	C	15 Minute		2015			Present				M. Cryder	Excel	Local (South Fork/Coles)		2	South Fork and Coles Fields, IA 	Closed	Meteorology, Eddy Covariance					AmeriFlux	NA			yes
UMRB9074	9074	UMRB-Ames	Eddy Covariance	SoilTC3_Avg	Soil temperature measured between the crop row at 2 cm	C	15 Minute		2015			Present				M. Cryder	Excel	Local (South Fork/Coles)		2	South Fork and Coles Fields, IA 	Closed	Meteorology, Eddy Covariance					AmeriFlux	NA			yes
UMRB9075	9075	UMRB-Ames	Eddy Covariance	SoilTC4_Avg	Soil temperature measured between the crop row at 4 cm	C	15 Minute		2015			Present				M. Cryder	Excel	Local (South Fork/Coles)		2	South Fork and Coles Fields, IA 	Closed	Meteorology, Eddy Covariance					AmeriFlux	NA			yes
UMRB9076	9076	UMRB-Ames	Eddy Covariance	Hydra_V1	Hydra probe voltage output for soil moisture calculations	mV or V	15 Minute		2015			Present				M. Cryder	Excel	Local (South Fork/Coles)		2	South Fork and Coles Fields, IA 	Closed	Meteorology, Eddy Covariance					AmeriFlux	NA			yes
UMRB9077	9077	UMRB-Ames	Eddy Covariance	Hydra_V2	Hydra probe voltage output for soil moisture calculations	mV or V	15 Minute		2015			Present				M. Cryder	Excel	Local (South Fork/Coles)		2	South Fork and Coles Fields, IA 	Closed	Meteorology, Eddy Covariance					AmeriFlux	NA			yes
UMRB9078	9078	UMRB-Ames	Eddy Covariance	Hydra_V3	Hydra probe voltage output for soil moisture calculations	mV or V	15 Minute		2015			Present				M. Cryder	Excel	Local (South Fork/Coles)		2	South Fork and Coles Fields, IA 	Closed	Meteorology, Eddy Covariance					AmeriFlux	NA			yes
UMRB9079	9079	UMRB-Ames	Eddy Covariance	Hydra_V4	Hydra probe voltage output for soil temperature calculations	mV or V	15 Minute		2015			Present				M. Cryder	Excel	Local (South Fork/Coles)		2	South Fork and Coles Fields, IA 	Closed	Meteorology, Eddy Covariance					AmeriFlux	NA			yes
UMRB9080	9080	UMRB-Ames	Eddy Covariance	Soil_T1.5	Soil temperature at 5 cm (1/4 of the row); LTAR site raw file: Hydra_Temp	C	15 Minute		2015			Present				M. Cryder	Excel	Local (South Fork/Coles)		2	South Fork and Coles Fields, IA 	Closed	Meteorology, Eddy Covariance					AmeriFlux	NA			yes
UMRB9081	9081	UMRB-Ames	Eddy Covariance	SWC1.5	Soil moisture at 5 cm (1/4 of the row); LTAR site raw file: Hydra_VWC	m^3/m^3	15 Minute		2015			Present				M. Cryder	Excel	Local (South Fork/Coles)		2	South Fork and Coles Fields, IA 	Closed	Meteorology, Eddy Covariance					AmeriFlux	NA			yes
UMRB9082	9082	UMRB-Ames	Eddy Covariance	Hs	Sensible heat flux-uncorrected	W/m^2	15 Minute		2001			Present				M. Cryder	Excel	Local, Ameriflux	US-Br1, US-Br2, US-Br3	3	Brooks Field, Ames, IA	Open	Meteorology, Eddy Covariance					AmeriFlux	NA			yes
UMRB9083	9083	UMRB-Ames	Eddy Covariance	tau	Wind sheer stress	kg/(m s^2)	15 Minute		2001			Present				M. Cryder	Excel	Local, Ameriflux	US-Br1, US-Br2, US-Br3	3	Brooks Field, Ames, IA	Open	Meteorology, Eddy Covariance					AmeriFlux	NA			yes
UMRB9084	9084	UMRB-Ames	Eddy Covariance	u_star	Friction velocity	m/s	15 Minute		2001			Present				M. Cryder	Excel	Local, Ameriflux	US-Br1, US-Br2, US-Br3	3	Brooks Field, Ames, IA	Open	Meteorology, Eddy Covariance					AmeriFlux	NA			yes
